FMID,MarketName,Website,Website_1,Facebook,Facebook_1,Twitter,Twitter_1,Youtube,Youtube_1,OtherMedia,OtherMedia_1,Season1Date,Season1Date_Start,Season1Date_End,Season1Time,Season1Time 1,Season1Time 2,Season1Time 3,Season1Time 4,Season1Time 5,Season1Time 6,Season1Time 7,Season2Date,Season2Date 1,Season2Date 2,Season2Time,Season2Time 1,Season2Time 2,Season2Time 3,Season2Time 4,Season2Time 5,Season2Time 6,Season2Time 7,Season3Date 1,Season3Date 2,Season3Time,Season3Time 1,Season3Time 2,Season3Time 3,Season3Time 4,Season3Time 5,Season3Time 6,Season4Date,Season4Date 1,Season4Date 2,Season4Time,Season4Time 1,Season4Time 2
1012063,Caledonia Farmers Market Association - Danville,https://sites.google.com/site/caledoniafarmersmarket/,https://sites.google.com/site/caledoniafarmersmarket/,https://www.facebook.com/Danville.VT.Farmers.Market/,https://www.facebook.com/Danville.VT.Farmers.Market/,,,,,,,06/08/2016 to 10/12/2016,2016-06-08,2016-10-12,Wed: 9:00 AM-1:00 PM;,Wed: 9:00 AM-1:00 PM,,,,,,,,,,,,,,,,,,,,,,,,,,,,,,,,
1011871,Stearns Homestead Farmers Market,http://Stearnshomestead.com,http://Stearnshomestead.com,,,,,,,,,06/25/2016 to 10/01/2016,2016-06-25,2016-10-01,Sat: 9:00 AM-1:00 PM;,Sat: 9:00 AM-1:00 PM,,,,,,,,,,,,,,,,,,,,,,,,,,,,,,,,
1011878,100 Mile Market,http://www.pfcmarkets.com,http://www.pfcmarkets.com,https://www.facebook.com/100MileMarket/?fref=ts,https://www.facebook.com/100MileMarket/?fref=ts,,,,,https://www.instagram.com/100milemarket/,https://www.instagram.com/100milemarket/,05/04/2016 to 10/12/2016,2016-05-04,2016-10-12,Wed: 3:00 PM-7:00 PM;,Wed: 3:00 PM-7:00 PM,,,,,,,,,,,,,,,,,,,,,,,,,,,,,,,,
1009364,106 S. Main Street Farmers Market,http://thetownofsixmile.wordpress.com/,http://thetownofsixmile.wordpress.com/,,,,,,,,,,,,,,,,,,,,,,,,,,,,,,,,,,,,,,,,,,,,,
1010691,10th Steet Community Farmers Market,,,,,,,,,http://agrimissouri.com/mo-grown/grodetail.php?type=mo-grown&ID=275,http://agrimissouri.com/mo-grown/grodetail.php?type=mo-grown&ID=275,04/02/2014 to 11/30/2014,2014-04-02,2014-11-30,Wed: 3:00 PM-6:00 PM;Sat: 8:00 AM-1:00 PM;,Wed: 3:00 PM-6:00 PM,Sat: 8:00 AM-1:00 PM,,,,,,,,,,,,,,,,,,,,,,,,,,,,,,,
1002454,112st Madison Avenue,,,,,,,,,,,July to November,2010-07-01,2010-11-30,Tue:8:00 am - 5:00 pm;Sat:8:00 am - 8:00 pm;,Tue:8:00 am - 5:00 pm,Sat:8:00 am - 8:00 pm,,,,,,,,,,,,,,,,,,,,,,,,,,,,,,,
1011100,12 South Farmers Market,http://www.12southfarmersmarket.com,http://www.12southfarmersmarket.com,12_South_Farmers_Market,,@12southfrmsmkt,@12southfrmsmkt,,,@12southfrmsmkt,@12southfrmsmkt,05/05/2015 to 10/27/2015,2015-05-05,2015-10-27,Tue: 3:30 PM-6:30 PM;,Tue: 3:30 PM-6:30 PM,,,,,,,,,,,,,,,,,,,,,,,,,,,,,,,,
1009845,125th Street Fresh Connect Farmers Market,http://www.125thStreetFarmersMarket.com,http://www.125thStreetFarmersMarket.com,https://www.facebook.com/125thStreetFarmersMarket,https://www.facebook.com/125thStreetFarmersMarket,https://twitter.com/FarmMarket125th,https://twitter.com/FarmMarket125th,,,Instagram--> 125thStreetFarmersMarket,Instagram--> 125thStreetFarmersMarket,06/10/2014 to 11/25/2014,2014-06-10,2014-11-25,Tue: 10:00 AM-7:00 PM;,Tue: 10:00 AM-7:00 PM,,,,,,,,,,,,,,,,,,,,,,,,,,,,,,,,
1005586,12th And Brandywine Urban Farm Market,,,https://www.facebook.com/pages/12th-Brandywine-Urban-Farm-Community-Garden/253769448091860,https://www.facebook.com/pages/12th-Brandywine-Urban-Farm-Community-Garden/253769448091860,,,,,https://www.facebook.com/delawareurbanfarmcoalition,https://www.facebook.com/delawareurbanfarmcoalition,05/16/2014 to 10/17/2014,2014-05-16,2014-10-17,Fri: 8:00 AM-11:00 AM;,Fri: 8:00 AM-11:00 AM,,,,,,,,,,,,,,,,,,,,,,,,,,,,,,,,
1008071,14Andu Farmers Market,,,https://www.facebook.com/14UFarmersMarket,https://www.facebook.com/14UFarmersMarket,https://twitter.com/14UFarmersMkt,https://twitter.com/14UFarmersMkt,,,,,05/03/2014 to 11/22/2014,2014-05-03,2014-11-22,Sat: 9:00 AM-1:00 PM;,Sat: 9:00 AM-1:00 PM,,,,,,,,,,,,,,,,,,,,,,,,,,,,,,,,
1012710,14th And Kennedy Street Farmers Market,,,https://www.facebook.com/14KennnedyFarmersMarket/,https://www.facebook.com/14KennnedyFarmersMarket/,14KenFM,,,,instagram:14kenfm,instagram:14kenfm,04/09/2016 to 11/19/2016,2016-04-09,2016-11-19,Sat: 9:00 AM-1:00 PM;,Sat: 9:00 AM-1:00 PM,,,,,,,,,,,,,,,,,,,,,,,,,,,,,,,,
1010284,175th Street Greenmarket,http://www.grownyc.org/ourmarkets,http://www.grownyc.org/ourmarkets,,,,,,,,,06/26/2014 to 11/20/2014,2014-06-26,2014-11-20,Thu: 8:00 AM-5:00 PM;,Thu: 8:00 AM-5:00 PM,,,,,,,,,,,,,,,,,,,,,,,,,,,,,,,,
1003877,17th Ave Market,http://www.iatp.org/minimarkets,http://www.iatp.org/minimarkets,,,,,,,,,June to September,2010-06-01,2010-09-30,Wed:3:00 PM - 7:00 PM;,Wed:3:00 PM - 7:00 PM,,,,,,,,,,,,,,,,,,,,,,,,,,,,,,,,
1002619,17th Street Farmers Market,http://www.17thstreetfarmersmarket.com,http://www.17thstreetfarmersmarket.com,,,,,,,,,,,,,,,,,,,,,,,,,,,,,,,,,,,,,,,,,,,,,
1010968,18th And Christian Farmers Market,http://thefoodtrust.org/farmers-markets/market/18th-Christian,http://thefoodtrust.org/farmers-markets/market/18th-Christian,,,,,,,,,06/01/2015 to 11/15/2015,2015-06-01,2015-11-15,Thu: 3:00 PM-7:00 PM;,Thu: 3:00 PM-7:00 PM,,,,,,,,,,,,,,,,,,,,,,,,,,,,,,,,
1009994,18th Street Farmers Market,,,https://www.facebook.com/ScottsbluffFarmersMarket,https://www.facebook.com/ScottsbluffFarmersMarket,,,,,,,06/07/2014 to 09/27/2014,2014-06-07,2014-09-27,Sat: 8:00 AM-11:00 AM;,Sat: 8:00 AM-11:00 AM,,,,,,,,,,,,,,,,,,,,,,,,,,,,,,,,
1010376,18th Street Farmers Market,,,https://www.facebook.com/groups/631614906915563/,https://www.facebook.com/groups/631614906915563/,,,,,,,05/14/2016 to 10/01/2016,2016-05-14,2016-10-01,Sat: 8:00 AM-12:00 PM;,Sat: 8:00 AM-12:00 PM,,,,,,,,,,,,,,,,,,,,,,,,,,,,,,,,
1012790,19/27 Community Farmers Market,,,https://www.facebook.com/1927-Community-Farmers-Market-1505265436358960/,https://www.facebook.com/1927-Community-Farmers-Market-1505265436358960/,,,,,,,09/03/2016 to 06/24/2017,2016-09-03,2017-06-24,Sat: 8:30 AM-1:00 PM;,Sat: 8:30 AM-1:00 PM,,,,,,,09/02/2017 to 06/30/2018,9/2/17, 06/30/2018,Sat: 8:30 AM-1:00 PM;,Sat: 8:30 AM-1:00 PM,,,,,,,,,,,,,,,,,,,,,
1012158,21 Acres Farm Market,http://21acres.org,http://21acres.org,https://www.facebook.com/21Acres/,https://www.facebook.com/21Acres/,@21acres,@21acres,21AcresCenter's channel,,Instagram @21acres,http://www.instagram.com/21acres,01/01/2016 to 12/31/2016,2016-01-01,2016-12-31,Wed: 11:00 AM-6:00 PM;Thu: 11:00 AM-6:00 PM;Fri: 11:00 AM-6:00 PM;Sat: 11:00 AM-6:00 PM;,Wed: 11:00 AM-6:00 PM,Thu: 11:00 AM-6:00 PM,Fri: 11:00 AM-6:00 PM,Sat: 11:00 AM-6:00 PM,,,,,,,,,,,,,,,,,,,,,,,,,,,,,
1010873,21st Street Farmers Market,,,,,,,,,,,06/05/2015 to 10/30/2015,2015-06-05,2015-10-30,Fri: 7:30 AM-12:00 PM;,Fri: 7:30 AM-12:00 PM,,,,,,,,,,,,,,,,,,,,,,,,,,,,,,,,
1005309,22nd And Tasker Farmers Market,http://thefoodtrust.org/farmers-markets/market/22nd-tasker,http://thefoodtrust.org/farmers-markets/market/22nd-tasker,,,,,,,,,06/01/2015 to 11/01/2015,2015-06-01,2015-11-01,Tue: 2:00 PM-6:00 PM;,Tue: 2:00 PM-6:00 PM,,,,,,,,,,,,,,,,,,,,,,,,,,,,,,,,
1000709,22nd Annual Highlands Business Partnership Farmers Market,http://www.highlandsnj.com,http://www.highlandsnj.com,https://www.facebook.com/pages/Highlands-Business-Partnership-Highlands-NJ/165486543524770,https://www.facebook.com/pages/Highlands-Business-Partnership-Highlands-NJ/165486543524770,,,,,,,06/25/2016 to 11/05/2016,2016-06-25,2016-11-05,Sat: 8:30 AM-2:00 PM;,Sat: 8:30 AM-2:00 PM,,,,,,,,,,,,,,,,,,,,,,,,,,,,,,,,
1011881,25th Street Market - North Logan At The Library Summer 2016,http://northloganmarket.com,http://northloganmarket.com,25th Street Market - North Logan at the Library,,,,,,Instagram: north logan market (25th Street Market),Instagram: north logan market  (25th Street Market),05/07/2016 to 10/15/2016,2016-05-07,2016-10-15,Sun: 9:00 AM-1:00 PM;,Sun: 9:00 AM-1:00 PM,,,,,,,,,,,,,,,,,,,,,,,,,,,,,,,,
1010966,26th And Allegheny,http://thefoodtrust.org/farmers-markets/market/26th-Allegheny,http://thefoodtrust.org/farmers-markets/market/26th-Allegheny,,,,,,,,,06/01/2015 to 11/15/2015,2015-06-01,2015-11-15,Wed: 1:00 PM-5:00 PM;,Wed: 1:00 PM-5:00 PM,,,,,,,,,,,,,,,,,,,,,,,,,,,,,,,,
1005299,29th And Wharton Farmers Market,http://thefoodtrust.org/farmers-markets/market/29th-wharton,http://thefoodtrust.org/farmers-markets/market/29th-wharton,,,,,,,,,06/01/2015 to 11/15/2015,2015-06-01,2015-11-15,Tue: 2:00 PM-6:00 PM;,Tue: 2:00 PM-6:00 PM,,,,,,,,,,,,,,,,,,,,,,,,,,,,,,,,
1010994,2nd Street Farmers Market,http://secondstageAmherst.org,http://secondstageAmherst.org,second stage of AMherst,,,,,,,,05/05/2016 to 09/01/2016,2016-05-05,2016-09-01,Thu: 3:30 PM-6:30 PM;,Thu: 3:30 PM-6:30 PM,,,,,,,,,,,,,,,,,,,,,,,,,,,,,,,,
1009959,2nd Street Market - Five Rivers Metropark,http://www.metroparks.org,http://www.metroparks.org,https://www.facebook.com/2ndStreetMarket/,https://www.facebook.com/2ndStreetMarket/,,,,,,,01/01/2016 to 12/31/2016,2016-01-01,2016-12-31,Thu: 11:00 AM-3:00 PM;Fri: 11:00 AM-3:00 PM;Sat: 8:00 AM-3:00 PM;,Thu: 11:00 AM-3:00 PM,Fri: 11:00 AM-3:00 PM,Sat: 8:00 AM-3:00 PM,,,,,,,,,,,,,,,,,,,,,,,,,,,,,,
1004950,3 French Hens French Country Market,http://www.3frenchhensmarket.blogspot.com,http://www.3frenchhensmarket.blogspot.com,https://www.facebook.com/pages/3-French-Hens-French-Country-Market/422352511143508,https://www.facebook.com/pages/3-French-Hens-French-Country-Market/422352511143508,,,,,,,05/10/2014 to 10/11/2014,2014-05-10,2014-10-11,Sat: 8:00 AM-2:00 PM;,Sat: 8:00 AM-2:00 PM,,,,,,,11/14/2014 to 11/15/2014,11/14/14, 11/15/2014,Fri: 4:30 PM-10:00 PM;Sat: 9:00 AM-3:00 PM;,Fri: 4:30 PM-10:00 PM,Sat: 9:00 AM-3:00 PM,,,,,,,,,,,,,,,,,,,,
1010775,30a Farmers Market,,,https://www.facebook.com/30aFarmersMarket?ref=hl,https://www.facebook.com/30aFarmersMarket?ref=hl,,,,,,,01/18/2015 to 01/05/2020,2015-01-18,2020-01-05,Sun: 9:00 AM-1:00 PM;,Sun: 9:00 AM-1:00 PM,,,,,,,,,,,,,,,,,,,,,,,,,,,,,,,,
1012342,31 And Main Farmers Market At Campus Town,http://www.31mainfarmersmarket.com/,http://www.31mainfarmersmarket.com/,https://www.facebook.com/31mainfarmersmarket/,https://www.facebook.com/31mainfarmersmarket/,https://twitter.com/31MainFarmMarkt,https://twitter.com/31MainFarmMarkt,,,https://instagram.com/31MainFarmersMarket,https://instagram.com/31MainFarmersMarket,06/12/2016 to 10/30/2016,2016-06-12,2016-10-30,Sun: 10:00 AM-2:00 PM;,Sun: 10:00 AM-2:00 PM,,,,,,,,,,,,,,,,,,,,,,,,,,,,,,,,
1005636,32nd Street/waverly Farmers Market,http://www.32ndstreetmarket.org,http://www.32ndstreetmarket.org,https://www.facebook.com/pages/Baltimores-32nd-Street-Farmers-Market/194872083921466?sk=wall,https://www.facebook.com/pages/Baltimores-32nd-Street-Farmers-Market/194872083921466?sk=wall,,,,,,,01/01/2013 to 12/31/2013,2013-01-01,2013-12-31,Sat: 7:00 AM-12:00 PM;,Sat: 7:00 AM-12:00 PM,,,,,,,,,,,,,,,,,,,,,,,,,,,,,,,,
1005310,33rd And Diamond Farmers Market,http://thefoodtrust.org/farmers-markets/market/33rd-diamond,http://thefoodtrust.org/farmers-markets/market/33rd-diamond,,,,,,,,,06/01/2015 to 11/01/2015,2015-06-01,2015-11-01,Thu: 2:00 PM-6:00 PM;,Thu: 2:00 PM-6:00 PM,,,,,,,,,,,,,,,,,,,,,,,,,,,,,,,,
1012784,38th And Meridian Farmers Market,http://www.meridianfarmersmarket.org,http://www.meridianfarmersmarket.org,https://www.facebook.com/38th-Meridian-Farmers-Market-501761683311307,https://www.facebook.com/38th-Meridian-Farmers-Market-501761683311307,,,,,,,06/02/2016 to 09/29/2016,2016-06-02,2016-09-29,Thu: 4:00 PM-6:30 PM;,Thu: 4:00 PM-6:30 PM,,,,,,,,,,,,,,,,,,,,,,,,,,,,,,,,
1012280,39 North Marketplace,http://www.39northdowntown.com,http://www.39northdowntown.com,39 North,,39North Downtown,,,,,,06/09/2016 to 08/18/2016,2016-06-09,2016-08-18,Thu: 4:00 PM-9:00 PM;,Thu: 4:00 PM-9:00 PM,,,,,,,,,,,,,,,,,,,,,,,,,,,,,,,,
1004414,3rd And Curry St. Farmers Market,http://www.carsonfarmersmarket.com,http://www.carsonfarmersmarket.com,,,,,,,,,June to September,2010-06-01,2010-09-30,Sat:8:30 AM - 1:30 PM;,Sat:8:30 AM - 1:30 PM,,,,,,,,,,,,,,,,,,,,,,,,,,,,,,,,
1011213,441 Ministries Farm Stand,,,,,,,,,,,,,,Tue: 3:00 PM-7:00 PM;,Tue: 3:00 PM-7:00 PM,,,,,,,,,,,,,,,,,,,,,,,,,,,,,,,,
1010965,4th And Lehigh Farmers Market,http://thefoodtrust.org/farmers-markets/market/fairhill-square,http://thefoodtrust.org/farmers-markets/market/fairhill-square,,,,,,,,,06/01/2015 to 11/22/2015,2015-06-01,2015-11-22,Tue: 1:00 PM-5:00 PM;,Tue: 1:00 PM-5:00 PM,,,,,,,,,,,,,,,,,,,,,,,,,,,,,,,,
1006234,4th Street Farmers Market,http://www.4thstreetfarmersmarket.com,http://www.4thstreetfarmersmarket.com,,,,,,,,,,,,,,,,,,,,,,,,,,,,,,,,,,,,,,,,,,,,,
1006494,52 And Shadeland Avenue Farmers Market,,,,,,,,,,,,,,,,,,,,,,,,,,,,,,,,,,,,,,,,,,,,,,,
1005304,52nd And Haverford Farmers Market,http://thefoodtrust.org/farmers-markets/market/52nd-haverford,http://thefoodtrust.org/farmers-markets/market/52nd-haverford,,,,,,,,,06/01/2015 to 11/15/2015,2015-06-01,2015-11-15,Wed: 1:00 PM-5:00 PM;,Wed: 1:00 PM-5:00 PM,,,,,,,,,,,,,,,,,,,,,,,,,,,,,,,,
1000060,57th Street Greenmarket,http://www.grownyc.org,http://www.grownyc.org,https://www.facebook.com/ManhattanGreenmarkets,https://www.facebook.com/ManhattanGreenmarkets,,,,,,,04/20/2013 to 12/21/2013,2013-04-20,2013-12-21,Wed: 8:00 AM-5:00 PM;Sat: 8:00 AM-5:00 PM;,Wed: 8:00 AM-5:00 PM,Sat: 8:00 AM-5:00 PM,,,,,,,,,,,,,,,,,,,,,,,,,,,,,,,
1005306,58th And Chester Farmers Market,http://thefoodtrust.org/farmers-markets/market/58th-chester,http://thefoodtrust.org/farmers-markets/market/58th-chester,,,,,,,,,06/01/2015 to 11/01/2015,2015-06-01,2015-11-01,Wed: 2:00 PM-6:00 PM;,Wed: 2:00 PM-6:00 PM,,,,,,,,,,,,,,,,,,,,,,,,,,,,,,,,
1011895,61st Street Farmers Market,http://www.experimentalstation.org/market,http://www.experimentalstation.org/market,http://www.facebook.com/61stStreetFarmersMarket/,http://www.facebook.com/61stStreetFarmersMarket/,http://twitter.com/61market,http://twitter.com/61market,,,http://www.instagram.com/61market/,http://www.instagram.com/61market/,05/14/2016 to 10/29/2016,2016-05-14,2016-10-29,Sat: 9:00 AM-2:00 PM;,Sat: 9:00 AM-2:00 PM,,,,,,,11/05/2016 to 12/31/2016,11/5/16, 12/31/2016,Sat: 9:00 AM-2:00 PM;,Sat: 9:00 AM-2:00 PM,,,,,,,,,,,,,,,,,,,,,
1010386,6th Ave Farmers Market,http://www.tacomafarmersmarket.com,http://www.tacomafarmersmarket.com,https://www.facebook.com/TacomaFarmersMarket,https://www.facebook.com/TacomaFarmersMarket,,,,,,,05/06/2014 to 09/30/2014,2014-05-06,2014-09-30,Tue: 3:00 PM-7:00 PM;,Tue: 3:00 PM-7:00 PM,,,,,,,,,,,,,,,,,,,,,,,,,,,,,,,,
1012500,6th Street Market In Downtown Tempe,http://arizonacommunityfarmersmarkets.com,http://arizonacommunityfarmersmarkets.com,www.facebook.com/6thstmarket/,,,,,,www.instagram.com/6thstmarket/,www.instagram.com/6thstmarket/,10/02/2016 to 05/28/2017,2016-10-02,2017-05-28,Sun: 9:00 AM-1:00 PM;,Sun: 9:00 AM-1:00 PM,,,,,,,,,,,,,,,,,,,,,,,,,,,,,,,,
1000061,79th Street Greenmarket,http://www.grownyc.org,http://www.grownyc.org,https://www.facebook.com/ManhattanGreenmarkets,https://www.facebook.com/ManhattanGreenmarkets,,,,,,,01/01/2013 to 12/31/2013,2013-01-01,2013-12-31,Sun: 8:00 AM-5:00 PM;,Sun: 8:00 AM-5:00 PM,,,,,,,,,,,,,,,,,,,,,,,,,,,,,,,,
1000062,82nd Street Greenmarket,http://www.grownyc.org,http://www.grownyc.org,https://www.facebook.com/ManhattanGreenmarkets,https://www.facebook.com/ManhattanGreenmarkets,,,,,,,01/01/2013 to 12/31/2013,2013-01-01,2013-12-31,Sat: 9:00 AM-2:30 PM;,Sat: 9:00 AM-2:30 PM,,,,,,,,,,,,,,,,,,,,,,,,,,,,,,,,
1008391,84 West Farmers Market (dothan),,,,,,,,,,,06/06/2013 to 08/08/2013,2013-06-06,2013-08-08,Thu: 3:00 PM-6:00 PM;,Thu: 3:00 PM-6:00 PM,,,,,,,,,,,,,,,,,,,,,,,,,,,,,,,,
1001961,8th Avenue City Farmers Market,,,,,,,,,,,May to October,2010-05-01,2010-10-31,Tue:4:00 PM - 6:00 PM;Sat:7:30 AM - 12:00 PM;,Tue:4:00 PM - 6:00 PM,Sat:7:30 AM - 12:00 PM,,,,,,,,,,,,,,,,,,,,,,,,,,,,,,,
1000063,92nd Street Greenmarket,http://www.grownyc.org,http://www.grownyc.org,https://www.facebook.com/ManhattanGreenmarkets,https://www.facebook.com/ManhattanGreenmarkets,,,,,,,06/23/2013 to 11/24/2013,2013-06-23,2013-11-24,Sun: 9:00 AM-4:00 PM;,Sun: 9:00 AM-4:00 PM,,,,,,,,,,,,,,,,,,,,,,,,,,,,,,,,
1000064,97th Street Greenmarket,http://www.grownyc.org,http://www.grownyc.org,https://www.facebook.com/ManhattanGreenmarkets,https://www.facebook.com/ManhattanGreenmarkets,,,,,,,01/01/2013 to 12/31/2013,2013-01-01,2013-12-31,Fri: 8:00 AM-2:00 PM;,Fri: 8:00 AM-2:00 PM,,,,,,,,,,,,,,,,,,,,,,,,,,,,,,,,
1011989,9th And Grand Farmers Market,http://Farmtoforkks.com,http://Farmtoforkks.com,,,,,,,,,05/10/2016 to 09/27/2016,2016-05-10,2016-09-27,Tue: 4:00 PM-7:00 PM;,Tue: 4:00 PM-7:00 PM,,,,,,,,,,,,,,,,,,,,,,,,,,,,,,,,
1000986,9th West Farmers Market/peoples Market,http://www.9thwestfarmersmarket.org,http://www.9thwestfarmersmarket.org,https://www.facebook.com/9thwestfarmersmarket,https://www.facebook.com/9thwestfarmersmarket,https://twitter.com/peoplesmarket,https://twitter.com/peoplesmarket,,,,,05/12/2013 to 10/20/2013,2013-05-12,2013-10-20,Sun: 9:00 AM-2:00 PM;,Sun: 9:00 AM-2:00 PM,,,,,,,06/26/2016 to 08/01/2016,6/26/16, 08/01/2016,,,,,,,,,,,,,,,,,,,,,,,
1010617,A + Organic Farmers Market,http://organicgrowndirect.com/,http://organicgrowndirect.com/,https://www.facebook.com/OrganicProduceDelivery,https://www.facebook.com/OrganicProduceDelivery,https://twitter.com/OrganicGrownDr,https://twitter.com/OrganicGrownDr,http://www.youtube.com/user/OrganicGrownDirect,http://www.youtube.com/user/OrganicGrownDirect,http://organicgrowndirect.com/shop,http://organicgrowndirect.com/shop,,,,,,,,,,,,,,,,,,,,,,,,,,,,,,,,,,,,,
1001683,A Better Choice Bakery And Market,,,https://www.facebook.com/nottinghamfarmersmarket,https://www.facebook.com/nottinghamfarmersmarket,,,,,,,January to December,2010-01-01,2010-12-31,Mon:12:00 PM - 5:00 PM;Tue:12:00 PM - 5:00 PM;Wed:12:00 PM - 5:00 PM;Thu:12:00 PM - 5:00 PM;Fri:12:00 PM - 5:00 PM;Sat:10:00 AM - 5:00 PM;sun:12:00 PM - 5:00 PM;,Mon:12:00 PM - 5:00 PM,Tue:12:00 PM - 5:00 PM,Wed:12:00 PM - 5:00 PM,Thu:12:00 PM - 5:00 PM,Fri:12:00 PM - 5:00 PM,Sat:10:00 AM - 5:00 PM,sun:12:00 PM - 5:00 PM,,,,,,,,,,,,,,,,,,,,,,,,,,
1009004,A Growers Market,,,,,,,,,,,01/01/2014 to 12/31/2014,2014-01-01,2014-12-31,Wed: 3:00 PM-6:30 PM;,Wed: 3:00 PM-6:30 PM,,,,,,,,,,,,,,,,,,,,,,,,,,,,,,,,
1001887,Aaffa Community Farmers Market,,,https://www.facebook.com/pages/Anderson-Area-Farm-Food-Association/431344110224404,https://www.facebook.com/pages/Anderson-Area-Farm-Food-Association/431344110224404,,,,,,,05/06/2014 to 09/23/2014,2014-05-06,2014-09-23,Tue: 5:00 PM-8:00 PM;,Tue: 5:00 PM-8:00 PM,,,,,,,,,,,,,,,,,,,,,,,,,,,,,,,,
1007585,Aamc Farmerss Market,,,,,,,,,,,,,,,,,,,,,,,,,,,,,,,,,,,,,,,,,,,,,,,
1004573,Abbeville Farmers Market,,,,,,,,,,,06/06/2013 to 10/04/2013,2013-06-06,2013-10-04,Thu: 4:00 PM-8:00 PM;Fri: 7:00 AM-12:00 PM;,Thu: 4:00 PM-8:00 PM,Fri: 7:00 AM-12:00 PM,,,,,,,,,,,,,,,,,,,,,,,,,,,,,,,
1009028,Abbeville Farmers Market,,,https://www.facebook.com/pages/Abbeville-Farmers-Market/234180039938887,https://www.facebook.com/pages/Abbeville-Farmers-Market/234180039938887,,,,,,,06/06/2014 to 07/25/2014,2014-06-06,2014-07-25,Fri: 3:00 PM-6:00 PM;,Fri: 3:00 PM-6:00 PM,,,,,,,,,,,,,,,,,,,,,,,,,,,,,,,,
1004598,Abbotsford Farmers Market,,,,,,,,,,,May to October,2010-05-01,2010-10-31,Tue:1:30 PM - 5:30 PM;,Tue:1:30 PM - 5:30 PM,,,,,,,,,,,,,,,,,,,,,,,,,,,,,,,,
1003865,Abbott Northwestern Farmers Market,http://www.iatp.org/minimarkets,http://www.iatp.org/minimarkets,,,,,,,,,,,,,,,,,,,,,,,,,,,,,,,,,,,,,,,,,,,,,
1002947,Aberdeen Farmers Market,http://www.dakotaflavor.com/category.asp?catid=12,http://www.dakotaflavor.com/category.asp?catid=12,,,,,,,,,,,,,,,,,,,,,,,,,,,,,,,,,,,,,,,,,,,,,
1004031,Abilene Farmers Market,,,,,,,,,,,,,,,,,,,,,,,,,,,,,,,,,,,,,,,,,,,,,,,
1010487,Abingdon Farmers Market,http://www.abingdonfarmersmarket.com,http://www.abingdonfarmersmarket.com,https://www.facebook.com/abingdonfarmersmarket,https://www.facebook.com/abingdonfarmersmarket,,,,,,,04/16/2016 to 11/22/2016,2016-04-16,2016-11-22,Tue: 3pm-6pm;Sat: 8am-1pm;,Tue: 3pm-6pm,Sat: 8am-1pm,,,,,,11/26/2016 to 12/24/2016,11/26/16, 12/24/2016,Sat: 10:00 AM-12:00 PM;,Sat: 10:00 AM-12:00 PM,,,,,,,1/2/16, 04/09/2016,Sat: 10:00 AM-12:00 PM;,Sat: 10:00 AM-12:00 PM,,,,,,,,,,,
1000065,Abingdon Square Greenmarket,http://www.grownyc.org,http://www.grownyc.org,https://www.facebook.com/ManhattanGreenmarkets,https://www.facebook.com/ManhattanGreenmarkets,,,,,,,01/01/2013 to 12/31/2013,2013-01-01,2013-12-31,Sat: 8:00 AM-2:00 PM;,Sat: 8:00 AM-2:00 PM,,,,,,,,,,,,,,,,,,,,,,,,,,,,,,,,
1006988,Abington,http://www.abingtonsage.com,http://www.abingtonsage.com,,,,,,,,,07/13/2013 to 09/21/2013,2013-07-13,2013-09-21,Sat: 9:00 AM-12:00 PM;,Sat: 9:00 AM-12:00 PM,,,,,,,,,,,,,,,,,,,,,,,,,,,,,,,,
1007070,Abington Farmers Market,,,,,,,,,,,,,,,,,,,,,,,,,,,,,,,,,,,,,,,,,,,,,,,
1011313,Abita Springs Farmers Market,,,https://www.facebook.com/pages/Abita-Springs-Farmers-Market/480144062040727,https://www.facebook.com/pages/Abita-Springs-Farmers-Market/480144062040727,,,,,,,01/01/2016 to 12/01/2016,2016-01-01,2016-12-01,Sun: 12:00 AM-4:00 PM;,Sun: 12:00 AM-4:00 PM,,,,,,,,,,,,,,,,,,,,,,,,,,,,,,,,
1004762,Abq Uptown Growers Market,http://www.abquptowngrowersmarket.org,http://www.abquptowngrowersmarket.org,,,,,,,,,10/25/2014 to,2014-10-25,,Sat: 7:00 AM-12:00 PM;,Sat: 7:00 AM-12:00 PM,,,,,,,,,,,,,,,,,,,,,,,,,,,,,,,,
1009543,Abv Farm Market,http://www.appleblossomvillage.com/,http://www.appleblossomvillage.com/,https://www.facebook.com/pages/Apple-Blossom-Village/105223639518965,https://www.facebook.com/pages/Apple-Blossom-Village/105223639518965,,,,,,,,,,,,,,,,,,,,,,,,,,,,,,,,,,,,,,,,,,,
1002108,Acadia Farmers Market In Town Hill,,,www.Facebook.com/AcadiaFarmersMarket,,,,,,,,,,,,,,,,,,,,,,,,,,,,,,,,,,,,,,,,,,,,
1007575,Acadiana Farmers Market,,,,,,,,,,,,,,,,,,,,,,,,,,,,,,,,,,,,,,,,,,,,,,,
1005122,Ace Farmers Market,,,,,,,,,,,,,,,,,,,,,,,,,,,,,,,,,,,,,,,,,,,,,,,
1008461,Acme Ranch Truck Patch,http://agrimissouri.com/mo-grown/grodetail.php?type=mo-grown&ID=1877,http://agrimissouri.com/mo-grown/grodetail.php?type=mo-grown&ID=1877,,,,,,,,,,,,Mon: 9:00 AM-5:00 PM;Tue: 9:00 AM-5:00 PM;Wed: 9:00 AM-5:00 PM;Thu: 9:00 AM-5:00 PM;Fri: 9:00 AM-5:00 PM;Sat: 9:00 AM-5:00 PM;,Mon: 9:00 AM-5:00 PM,Tue: 9:00 AM-5:00 PM,Wed: 9:00 AM-5:00 PM,Thu: 9:00 AM-5:00 PM,Fri: 9:00 AM-5:00 PM,Sat: 9:00 AM-5:00 PM,,,,,,,,,,,,,,,,,,,,,,,,,,,
1011180,Acreage Green Market,http://Www.AcreageGreenMarket.com,http://Www.AcreageGreenMarket.com,https://www.facebook.com/AcreageGreenmarket,https://www.facebook.com/AcreageGreenmarket,,,,,,,05/31/2015 to 05/29/2016,2015-05-31,2016-05-29,Sun: 9:00 AM-2:00 PM;,Sun: 9:00 AM-2:00 PM,,,,,,,6/7/15,6/7/15,,Sun: 9:00 AM-1:00 PM;,Sun: 9:00 AM-1:00 PM,,,,,,,,,,,,,,,,,,,,,
1003469,Acton-boxborough Farmers Market,http://www.ABFarmersMarket.org,http://www.ABFarmersMarket.org,,,,,,,,,"June 19, 2012 to October 21, 2012",2012-06-19,2012-10-21,sun:10:00 AM - 1:00 PM;,sun:10:00 AM - 1:00 PM,,,,,,,,,,,,,,,,,,,,,,,,,,,,,,,,
1003112,Acushnet Farmers Market,http://www.acushnetfarmersmarket.com,http://www.acushnetfarmersmarket.com,https://www.facebook.com/pages/Acushnet-Farmers-Market/104135469618299,https://www.facebook.com/pages/Acushnet-Farmers-Market/104135469618299,https://twitter.com/eventsonthefarm,https://twitter.com/eventsonthefarm,,,http://instagram.com/Acushnetfarmersmarket,http://instagram.com/Acushnetfarmersmarket,06/04/2016 to 09/24/2016,2016-06-04,2016-09-24,Sat: 9:00 AM-1:00 PM;,Sat: 9:00 AM-1:00 PM,,,,,,,,,,,,,,,,,,,,,,,,,,,,,,,,
1007519,Acworth Farmers Market,,,,,,,,,,,,,,,,,,,,,,,,,,,,,,,,,,,,,,,,,,,,,,,
1001393,Ada Farmers Market,,,,,,,,,,,04/01/2010 to 11/31/2010,2010-04-01,,Wed: 7:00 AM-;Sat: 7:00 AM-;,Wed: 7:00 AM-,Sat: 7:00 AM-,,,,,,,,,,,,,,,,,,,,,,,,,,,,,,,
1001083,Ada Farmers Market,http://www.adafarmersmarket.com,http://www.adafarmersmarket.com,https://www.facebook.com/adafarmersmarket,https://www.facebook.com/adafarmersmarket,https://twitter.com/AdaFarmersMkt,https://twitter.com/AdaFarmersMkt,,,,,06/09/2015 to 10/27/2015,2015-06-09,2015-10-27,Tue: 11:00 AM-4:00 PM;,Tue: 11:00 AM-4:00 PM,,,,,,,,,,,,,,,,,,,,,,,,,,,,,,,,
1006969,Adairco Farmers Market,,,,,,,,,,,,,,,,,,,,,,,,,,,,,,,,,,,,,,,,,,,,,,,
1010467,Adairsville Farmers Market,http://www.adairsvillefarmersmarket.com,http://www.adairsvillefarmersmarket.com,Adairsville Farmers Market,,,,,,,,06/07/2014 to 09/27/2014,2014-06-07,2014-09-27,Sun: 8:00 AM-11:30 PM;,Sun: 8:00 AM-11:30 PM,,,,,,,,,,,,,,,,,,,,,,,,,,,,,,,,
1011322,Adams County Farmers Market Association (pa),http://www.acfarmersmarkets.org,http://www.acfarmersmarkets.org,,,,,,,,,5/19/16,2016-05-19,,Thu: 2:00 PM-6:00 PM;,Thu: 2:00 PM-6:00 PM,,,,,,,,,,,,,,,,,,,,,,,,,,,,,,,,
1011328,Adams County Farmers Market Association (pa),http://www.acfarmersmarkets.org,http://www.acfarmersmarkets.org,,,,,,,Instagram: adamscountyfarmfresh,Instagram: adamscountyfarmfresh,05/01/2016 to 10/01/2016,2016-05-01,2016-10-01,Sat: 9:00 AM-2:00 PM;,Sat: 9:00 AM-2:00 PM,,,,,,,,,,,,,,,,,,,,,,,,,,,,,,,,
1010354,Adams Farmers And Artisans Market,,,https://www.facebook.com/Adams.Farmers.Market,https://www.facebook.com/Adams.Farmers.Market,,,,,,,07/13/2014 to 09/14/2014,2014-07-13,2014-09-14,Sun: 11:00 AM-2:00 PM;,Sun: 11:00 AM-2:00 PM,,,,,,,,,,,,,,,,,,,,,,,,,,,,,,,,
1008006,Adams Morgan Farmers Market,http://www.lickingcreekbendfarm.com,http://www.lickingcreekbendfarm.com,https://www.facebook.com/NeedmoreVeggies/timeline,https://www.facebook.com/NeedmoreVeggies/timeline,,,,,https://www.instagram.com/lickingcreekbendfarm/,https://www.instagram.com/lickingcreekbendfarm/,06/01/2016 to 12/24/2016,2016-06-01,2016-12-24,Sat: 8:00 AM-1:00 PM;,Sat: 8:00 AM-1:00 PM,,,,,,,,,,,,,,,,,,,,,,,,,,,,,,,,
1008961,Adaptations Fresh Feast,http://www.adaptationsaloha.com,http://www.adaptationsaloha.com,https://www.facebook.com/adaptationsaloha,https://www.facebook.com/adaptationsaloha,https://twitter.com/MaureenDatta,https://twitter.com/MaureenDatta,,,http://instagram.com/adaptationskona,http://instagram.com/adaptationskona,01/01/2013 to 12/31/2013,2013-01-01,2013-12-31,Mon: 8:00 AM-4:00 PM;Tue: 8:00 AM-4:00 PM;Wed: 8:00 AM-4:00 PM;Thu: 8:00 AM-4:00 PM;Fri: 8:00 AM-4:00 PM;Sun: 12:00 PM-4:00 PM;,Mon: 8:00 AM-4:00 PM,Tue: 8:00 AM-4:00 PM,Wed: 8:00 AM-4:00 PM,Thu: 8:00 AM-4:00 PM,Fri: 8:00 AM-4:00 PM,Sun: 12:00 PM-4:00 PM,,,,,,,,,,,,,,,,,,,,,,,,,,,
1005109,Added Value Farm Stand At Governors Island,,,,,,,,,,,,,,,,,,,,,,,,,,,,,,,,,,,,,,,,,,,,,,,
1002464,Addison Farmers Market,,,,,,,,,,,,,,,,,,,,,,,,,,,,,,,,,,,,,,,,,,,,,,,
1005741,Adel Farmers Market,,,,,,,,,,,,,,,,,,,,,,,,,,,,,,,,,,,,,,,,,,,,,,,
1005272,Adelanto Stadium Farmers Market,,,,,,,,,,,,,,,,,,,,,,,,,,,,,,,,,,,,,,,,,,,,,,,
1012288,Adrian Farmers Market,,,,,,,,,,,05/07/2016 to 10/29/2016,2016-05-07,2016-10-29,Sat: 9:00 AM-1:00 PM;,Sat: 9:00 AM-1:00 PM,,,,,,,,,,,,,,,,,,,,,,,,,,,,,,,,
1011214,Aenon Baptist Church Farm Stand,,,,,,,,,,,,,,Wed: 11:00 AM-2:00 PM;,Wed: 11:00 AM-2:00 PM,,,,,,,,,,,,,,,,,,,,,,,,,,,,,,,,
1008667,Afton Village Farmers Market,http://www.piedmont-farmersmarket.com,,,,,,,,,,01/01/2013 to 12/31/2013,2013-01-01,2013-12-31,Thu: 4:00 PM-7:00 PM;,Thu: 4:00 PM-7:00 PM,,,,,,,,,,,,,,,,,,,,,,,,,,,,,,,,
1007586,Agh Wellness Committee Farmers Market,,,,,,,,,,,,,,,,,,,,,,,,,,,,,,,,,,,,,,,,,,,,,,,
1012233,Agricenter International Farmers Market,http://www.agricenter.org/farmers-market/,http://www.agricenter.org/farmers-market/,https://www.facebook.com/farmersmarketmemphis/,https://www.facebook.com/farmersmarketmemphis/,https://twitter.com/Agricenter_Intl,https://twitter.com/Agricenter_Intl,,,https://www.instagram.com/agricenterinternational/,https://www.instagram.com/agricenterinternational/,05/02/2016 to 10/01/2016,2016-05-02,2016-10-01,Mon: 7:30 AM-5:30 PM;Tue: 7:30 AM-5:30 PM;Wed: 7:30 AM-5:30 PM;Thu: 7:30 AM-5:30 PM;Fri: 7:30 AM-5:30 PM;Sat: 7:00 AM-5:30 PM;,Mon: 7:30 AM-5:30 PM,Tue: 7:30 AM-5:30 PM,Wed: 7:30 AM-5:30 PM,Thu: 7:30 AM-5:30 PM,Fri: 7:30 AM-5:30 PM,Sat: 7:00 AM-5:30 PM,,,,,,,,,,,,,,,,,,,,,,,,,,,
1003562,Agritopia Farm Stand,http://www.thefarmatagritopia.com,http://www.thefarmatagritopia.com,https://www.facebook.com/TheFarmAtAgritopia,https://www.facebook.com/TheFarmAtAgritopia,https://twitter.com/AgritopiaFarm,https://twitter.com/AgritopiaFarm,,,https://instagram.com/agritopiafarm/,https://instagram.com/agritopiafarm/,01/01/2015 to 12/31/2015,2015-01-01,2015-12-31,,,,,,,,,,,,,,,,,,,,,,,,,,,,,,,,,,
1011830,Ahwatukee Farmers Market,,,,,,,,,,,,,,Sun: 9:00 AM-1:00 PM;,Sun: 9:00 AM-1:00 PM,,,,,,,06/05/2016 to 09/25/2016,6/5/16, 09/25/2016,Sun: 8:00 AM-11:00 AM;,Sun: 8:00 AM-11:00 AM,,,,,,,,,,,,,,,,,,,,,
1000212,Aiken County Farmers Market,http://www.VisitAikenSC.com,http://www.VisitAikenSC.com,,,,,,,,,,,,,,,,,,,,,,,,,,,,,,,,,,,,,,,,,,,,,
1008054,Airport Farmers And Flea Market,,,https://www.facebook.com/pages/Airport-Farmers-and-Flea-Market/,https://www.facebook.com/pages/Airport-Farmers-and-Flea-Market/,,,,,,,01/01/2015 to 12/31/2015,2015-01-01,2015-12-31,Sat: 8:00 AM-3:00 PM;Sun: 8:00 AM-3:00 PM;,Sat: 8:00 AM-3:00 PM,Sun: 8:00 AM-3:00 PM,,,,,,,,,,,,,,,,,,,,,,,,,,,,,,,
1007542,Akebono Farmers’ Market,,,,,,,,,,,,,,,,,,,,,,,,,,,,,,,,,,,,,,,,,,,,,,,
1011967,Akers Of Strawberries,http://Www.akersofstrawberries.com,http://Www.akersofstrawberries.com,www.facebook.com/AkersofStrawberries,,,,,,,,03/15/2016 to 07/31/2016,2016-03-15,2016-07-31,Mon: 9:00 AM-5:00 PM;Tue: 9:00 AM-5:00 PM;Wed: 9:00 AM-5:00 PM;Thu: 9:00 AM-5:00 PM;Fri: 9:00 AM-5:00 PM;Sat: 9:00 AM-5:00 PM;Sun: 12:00 PM-5:00 PM;,Mon: 9:00 AM-5:00 PM,Tue: 9:00 AM-5:00 PM,Wed: 9:00 AM-5:00 PM,Thu: 9:00 AM-5:00 PM,Fri: 9:00 AM-5:00 PM,Sat: 9:00 AM-5:00 PM,Sun: 12:00 PM-5:00 PM,09/29/2016 to 11/06/2016,9/29/16, 11/06/2016,Thu: 9:00 AM-5:00 PM;Fri: 9:00 AM-11:00 PM;Sat: 9:00 AM-11:00 PM;Sun: 6:00 PM-;,Thu: 9:00 AM-5:00 PM,Fri: 9:00 AM-11:00 PM,Sat: 9:00 AM-11:00 PM,Sun: 6:00 PM-,,,,1/1/16, 12/31/2016,Mon: 7:00 AM-5:00 PM;Tue: 7:00 AM-5:00 PM;Wed: 7:00 AM-5:00 PM;Thu: 7:00 AM-5:00 PM;Fri: 7:00 AM-5:00 PM;Sat: 7:00 AM-2:00 PM;,Mon: 7:00 AM-5:00 PM,Tue: 7:00 AM-5:00 PM,Wed: 7:00 AM-5:00 PM,Thu: 7:00 AM-5:00 PM,Fri: 7:00 AM-5:00 PM,Sat: 7:00 AM-2:00 PM,,,,,,
1001801,Akron Farmers Market,,,,,,,,,,,,,,,,,,,,,,,,,,,,,,,,,,,,,,,,,,,,,,,
1005061,Akwesasne Farmers Market,,,,,,,,,,,,,,,,,,,,,,,,,,,,,,,,,,,,,,,,,,,,,,,
1004086,Alabama Gulf Coast Market,,,,,,,,,,,10/04/2014 to 07/25/2015,2014-10-04,2015-07-25,Sat: 8:00 AM-12:00 PM;,Sat: 8:00 AM-12:00 PM,,,,,,,,,,,,,,,,,,,,,,,,,,,,,,,,
1008612,Alachua County Farmers Market,http://www.441market.com,http://www.441market.com,https://www.facebook.com/441acfmarket,https://www.facebook.com/441acfmarket,,,,,http://pinterest.com/441market,http://pinterest.com/441market,01/01/2013 to 12/31/2013,2013-01-01,2013-12-31,Sun: 8:30 AM-1:00 PM;,Sun: 8:30 AM-1:00 PM,,,,,,,,,,,,,,,,,,,,,,,,,,,,,,,,
1006312,Alamance County Farmers Market,,,,,,,,,,,,,,,,,,,,,,,,,,,,,,,,,,,,,,,,,,,,,,,
1009019,Alameda Farmers Market,http://www.pcfma.com,http://www.pcfma.com,https://www.facebook.com/AlamedaFarmersMarket,https://www.facebook.com/AlamedaFarmersMarket,,,,,,,01/01/2013 to 12/31/2013,2013-01-01,2013-12-31,Tue: 9:00 AM-1:00 PM;Sat: 9:00 AM-1:00 PM;,Tue: 9:00 AM-1:00 PM,Sat: 9:00 AM-1:00 PM,,,,,,,,,,,,,,,,,,,,,,,,,,,,,,,
1004846,Alamo Farmers Market,,,,,,,,,,,05/21/2013 to,2013-05-21,,Tue: 10:00 AM-5:00 PM;Wed: 10:00 AM-5:00 PM;Thu: 10:00 AM-5:00 PM;Fri: 10:00 AM-5:00 PM;Sat: 10:00 AM-5:00 PM;Sun: -5:00 PM;,Tue: 10:00 AM-5:00 PM,Wed: 10:00 AM-5:00 PM,Thu: 10:00 AM-5:00 PM,Fri: 10:00 AM-5:00 PM,Sat: 10:00 AM-5:00 PM,Sun: -5:00 PM,,,,,,,,,,,,,,,,,,,,,,,,,,,
1011033,Alamogordo Farmers Market -downtown,http://www.localharvest.org/alamogordo-farmers-market-in-historic-downtown-M37997,http://www.localharvest.org/alamogordo-farmers-market-in-historic-downtown-M37997,https://www.facebook.com/AlamogordoFarmersMarket/,https://www.facebook.com/AlamogordoFarmersMarket/,,,,,,,06/04/2016 to 10/29/2016,2016-06-04,2016-10-29,Sat: 9:00 AM-11:00 AM;,Sat: 9:00 AM-11:00 AM,,,,,,,07/06/2016 to 09/28/2016,7/6/16, 09/28/2016,Wed: 5:00 PM-6:00 PM;,Wed: 5:00 PM-6:00 PM,,,,,,,,,,,,,,,,,,,,,
1004789,Alamogordo Otero County Farmers Market,http://farmersmarketsnm.org/Shoppers/FindMarket/find.php,http://farmersmarketsnm.org/Shoppers/FindMarket/find.php,,,,,,,http://www.localharvest.org/alamogordo-otero-county-farmers-produce-and-craft-market-alamogord-farmers-market-M2737,http://www.localharvest.org/alamogordo-otero-county-farmers-produce-and-craft-market-alamogord-farmers-market-M2737,01/04/2014 to 12/20/2014,2014-01-04,2014-12-20,Sat: 8:30 AM-12:00 PM;,Sat: 8:30 AM-12:00 PM,,,,,,,,,,,,,,,,,,,,,,,,,,,,,,,,
1004070,Alamosa Farmers Market,http://www.alamosafarmersmarket.org,http://www.alamosafarmersmarket.org,https://www.facebook.com/pages/Alamosa-Farmers-Market/104375596315429?fref=ts,https://www.facebook.com/pages/Alamosa-Farmers-Market/104375596315429?fref=ts,,,,,,,07/11/2015 to 10/10/2015,2015-07-11,2015-10-10,Sat: 8:00 AM-1:00 PM;,Sat: 8:00 AM-1:00 PM,,,,,,,,,,,,,,,,,,,,,,,,,,,,,,,,
1004425,Albany Downtown Farmers Market,http://www.eastbaker.net,http://www.eastbaker.net,,,,,,,,,May to December,2010-05-01,2010-12-31,Sat:8:00 AM - 2:00 PM;,Sat:8:00 AM - 2:00 PM,,,,,,,,,,,,,,,,,,,,,,,,,,,,,,,,
1002175,Albany Farmers Market,http://www.locallygrown.org,http://www.locallygrown.org,https://www.facebook.com/Corvallis.Albany.Farmers.Markets,https://www.facebook.com/Corvallis.Albany.Farmers.Markets,https://twitter.com/RebeccaCAFM,https://twitter.com/RebeccaCAFM,,,https://www.flickr.com/photos/50026834@N04/sets/,https://www.flickr.com/photos/50026834@N04/sets/,04/16/2016 to 11/19/2016,2016-04-16,2016-11-19,Sat: 9:00 AM-1:00 PM;,Sat: 9:00 AM-1:00 PM,,,,,,,,,,,,,,,,,,,,,,,,,,,,,,,,
1011108,Albert Lea Farmers Market,http://albertleafarmersmarket.com,http://albertleafarmersmarket.com,Albert Lea Farmers Market,,,,,,,,05/13/2015 to 10/31/2015,2015-05-13,2015-10-31,Wed: 4:00 PM-6:00 PM;,Wed: 4:00 PM-6:00 PM,,,,,,,,,,,,,,,,,,,,,,,,,,,,,,,,
1003118,Alberta Farmers Market,,,,,,,,,,,,,,,,,,,,,,,,,,,,,,,,,,,,,,,,,,,,,,,
1004886,Alberta Farmers Market,,,,,,,,,,,,,,,,,,,,,,,,,,,,,,,,,,,,,,,,,,,,,,,
1010559,Albion Farmers Market,http://greateralbionchamber.org,http://greateralbionchamber.org,,,,,,,,,05/03/2014 to 10/25/2014,2014-05-03,2014-10-25,Wed: 8:30 AM-1:00 PM;Sat: 8:30 AM-1:00 PM;,Wed: 8:30 AM-1:00 PM,Sat: 8:30 AM-1:00 PM,,,,,,,,,,,,,,,,,,,,,,,,,,,,,,,
1010407,Albuquerque Downtown Growers Market,http://DowntownGrowers.com,http://DowntownGrowers.com,https://www.facebook.com/downtowngrowers?focus_composer=true&ref_type=bookmark,https://www.facebook.com/downtowngrowers?focus_composer=true&ref_type=bookmark,,,,,,,05/17/2014 to 11/08/2014,2014-05-17,2014-11-08,Sat: 7:00 AM-12:00 PM;,Sat: 7:00 AM-12:00 PM,,,,,,,,,,,,,,,,,,,,,,,,,,,,,,,,
1004761,Albuquerque Northeast Farmers Market,http://www.abqnemarket.org,http://www.abqnemarket.org,https://www.facebook.com/abqnemarket?fref=ts,https://www.facebook.com/abqnemarket?fref=ts,,,,,www.FarmersMarketsNM.org,www.FarmersMarketsNM.org,06/03/2014 to 09/30/2014,2014-06-03,2014-09-30,Tue: 3:00 PM-6:00 PM;,Tue: 3:00 PM-6:00 PM,,,,,,,,,,,,,,,,,,,,,,,,,,,,,,,,
1007016,Albuquerque Va Growers Market,,,,,,,,,,,,,,,,,,,,,,,,,,,,,,,,,,,,,,,,,,,,,,,
1002222,Alcona Farmers Market,http://www.alconalocalfoods.org,http://www.alconalocalfoods.org,,,,,,,,,June to September,2010-06-01,2010-09-30,Sat:10:00 AM - 1:00 PM;,Sat:10:00 AM - 1:00 PM,,,,,,,April to May,April , May,Sat:10:00 am - 1:00 pm;,Sat:10:00 am - 1:00 pm,,,,,,,Oc,ber to November,Sat:10:00 am - 1:00 pm;,Sat:10:00 am - 1:00 pm,,,,,,,,,,,
1008252,Alderson Farmers Market,http://www.aldersonmarket.org,http://www.aldersonmarket.org,https://www.facebook.com/aldersonfood,https://www.facebook.com/aldersonfood,,,,,,,,,,Sat: 8:00 AM-12:30 PM;,Sat: 8:00 AM-12:30 PM,,,,,,,,,,,,,,,,,,,,,,,,,,,,,,,,
1003236,Aldrich Arena Farmers Market,http://www.stpaulfarmersmarket.com,http://www.stpaulfarmersmarket.com,,,,,,,,,,,,,,,,,,,,,,,,,,,,,,,,,,,,,,,,,,,,,
1011910,Aledo Farmers Market,http://www.aledo-texas.com,http://www.aledo-texas.com,City of Aledo,,,,,,,,04/18/2016 to,2016-04-18,,Mon: 3:00 PM-6:00 PM;,Mon: 3:00 PM-6:00 PM,,,,,,,,,,,,,,,,,,,,,,,,,,,,,,,,
1010597,Alexander County Farmers Market,,,,,,,,,,,06/14/2014 to 09/13/2014,2014-06-14,2014-09-13,Sat: 8:00 AM-12:00 PM;,Sat: 8:00 AM-12:00 PM,,,,,,,,,,,,,,,,,,,,,,,,,,,,,,,,
1000519,Alexandria Bay Farmers Market,http://www.visitalexbay.org,http://www.visitalexbay.org,https://www.facebook.com/pages/Alexandria-Bay-Chamber-of-Commerce/82504121853,https://www.facebook.com/pages/Alexandria-Bay-Chamber-of-Commerce/82504121853,,,,,,,05/23/2014 to 09/19/2014,2014-05-23,2014-09-19,Fri: 9:00 AM-3:00 PM;,Fri: 9:00 AM-3:00 PM,,,,,,,,,,,,,,,,,,,,,,,,,,,,,,,,
1007366,Alexandria Farmers Market,http://www.mfma.org/alexandria,http://www.mfma.org/alexandria,,,,,,,,,05/10/2014 to 10/25/2014,2014-05-10,2014-10-25,Sat: 9:00 AM-12:00 PM;,Sat: 9:00 AM-12:00 PM,,,,,,,06/01/2014 to 10/28/2014,6/1/14, 10/28/2014,Tue: 9:00 AM-12:00 PM;,Tue: 9:00 AM-12:00 PM,,,,,,,6/1/14, 10/30/2014,Thu: 3:00 PM-6:00 PM;,Thu: 3:00 PM-6:00 PM,,,,,,,,,,,
1011196,Alfred Farmers Market,https://www.alfredfarmersmarket.com,https://www.alfredfarmersmarket.com,https://www.facebook.com/Alfredfarmersmarket,https://www.facebook.com/Alfredfarmersmarket,,,,,,,07/10/2016 to 10/30/2016,2016-07-10,2016-10-30,Sun: 11:00 AM-3:00 PM;,Sun: 11:00 AM-3:00 PM,,,,,,,,,,,,,,,,,,,,,,,,,,,,,,,,
1007217,Algoma Farm Market,,,,,,,,,,,,,,,,,,,,,,,,,,,,,,,,,,,,,,,,,,,,,,,
1001300,Algonquin Farmers Market,,,,,,,,,,,,,,,,,,,,,,,,,,,,,,,,,,,,,,,,,,,,,,,
1007528,Alii Garden Market Place,,,,,,,,,,,,,,,,,,,,,,,,,,,,,,,,,,,,,,,,,,,,,,,
1008835,Alisal Certified Farmers Market,http://www.everyonesharvest.org,http://www.everyonesharvest.org,https://www.facebook.com/EveryonesHarvest,https://www.facebook.com/EveryonesHarvest,,,,,,,06/28/2016 to 10/11/2016,2016-06-28,2016-10-11,Tue: 11:00 AM-4:00 PM;,Tue: 11:00 AM-4:00 PM,,,,,,,,,,,,,,,,,,,,,,,,,,,,,,,,
1005548,All Locally Grown Produce,http://www.teenaspridecsa.com,http://www.teenaspridecsa.com,https://www.facebook.com/teenaspridecsa,https://www.facebook.com/teenaspridecsa,https://twitter.com/teenaspridecsa,https://twitter.com/teenaspridecsa,,,,,11/01/2016 to 04/01/2017,2016-11-01,2017-04-01,Sun: 1:00 AM-4:00 AM;,Sun: 1:00 AM-4:00 AM,,,,,,,,,,,,,,,,,,,,,,,,,,,,,,,,
1011735,All Natural And Certified Organic Farmer Market (hope Farm),http://www.hopeforsfs.org,http://www.hopeforsfs.org,Facebook.com/HOPESFS,,,,,,,,10/01/2016 to 07/01/2017,2016-10-01,2017-07-01,Mon: 10:00 AM-6:00 PM;Thu: 10:00 AM-6:00 PM;Fri: 10:00 AM-6:00 PM;Sat: 1:00 PM-6:00 PM;,Mon: 10:00 AM-6:00 PM,Thu: 10:00 AM-6:00 PM,Fri: 10:00 AM-6:00 PM,Sat: 1:00 PM-6:00 PM,,,,,,,,,,,,,,,,,,,,,,,,,,,,,
1010096,All Saints Farmers Market,,,https://www.facebook.com/allsaintsfarmersmarket,https://www.facebook.com/allsaintsfarmersmarket,,,,,,,05/04/2014 to 10/26/2014,2014-05-04,2014-10-26,Sun: 12:00 PM-4:00 PM;,Sun: 12:00 PM-4:00 PM,,,,,,,,,,,,,,,,,,,,,,,,,,,,,,,,
1000268,All-local Farmers Market,http://www.stateplate.org,http://www.stateplate.org,,,,,,,,,,,,,,,,,,,,,,,,,,,,,,,,,,,,,,,,,,,,,
1000168,All-local Farmers Market 2,http://www.localharvest.org,http://www.localharvest.org,,,,,,,,,,,,,,,,,,,,,,,,,,,,,,,,,,,,,,,,,,,,,
1001962,Allamakee Farmers Market,,,,,,,,,,,06/06/2016 to 10/03/2016,2016-06-06,2016-10-03,Mon: 3:30 AM-6:00 AM;,Mon: 3:30 AM-6:00 AM,,,,,,,,,,,,,,,,,,,,,,,,,,,,,,,,
1002717,Allegan Farmers Market,,,https://www.facebook.com/Allegan-Farmers-Market-146878898707147/,https://www.facebook.com/Allegan-Farmers-Market-146878898707147/,,,,,,,05/05/2016 to 10/27/2016,2016-05-05,2016-10-27,Thu: 8:00 AM-2:00 PM;,Thu: 8:00 AM-2:00 PM,,,,,,,,,,,,,,,,,,,,,,,,,,,,,,,,
1008262,Alleghany Farmers Market,http://www.alleghanyfarmersmarket.com,http://www.alleghanyfarmersmarket.com,https://www.facebook.com/pages/Alleghany-Farmers-Market/102331033194610,https://www.facebook.com/pages/Alleghany-Farmers-Market/102331033194610,,,,,,,05/11/2013 to 10/12/2013,2013-05-11,2013-10-12,Sat: 9:00 AM-1:00 PM;,Sat: 9:00 AM-1:00 PM,,,,,,,,,,,,,,,,,,,,,,,,,,,,,,,,
1002836,Allen County Farmers Market,,,,,,,,,,,April to October,2010-04-01,2010-10-31,Thu:5:30 PM - 7:00 PM;,Thu:5:30 PM - 7:00 PM,,,,,,,,,,,,,,,,,,,,,,,,,,,,,,,,
1011777,Allen Farmers Market,http://www.allenmarketplace.org/farmers-market/,http://www.allenmarketplace.org/farmers-market/,https://www.facebook.com/AllenStreetFarmersMarket/,https://www.facebook.com/AllenStreetFarmersMarket/,,,,,,,10/21/2015 to 05/11/2016,2015-10-21,2016-05-11,Wed: 3:00 PM-6:30 PM;,Wed: 3:00 PM-6:30 PM,,,,,,,05/18/2016 to 10/19/2016,5/18/16, 10/19/2016,Wed: 2:30 PM-7:00 PM;,Wed: 2:30 PM-7:00 PM,,,,,,,,,,,,,,,,,,,,,
1007413,Allendale County Farmers Market,,,,,,,,,,,,,,,,,,,,,,,,,,,,,,,,,,,,,,,,,,,,,,,
1007716,Allentown Farigrounds Farmers Market,http://www.fairgroundsfarmersmkt.com,http://www.fairgroundsfarmersmkt.com,,,,,,,,,,,,,,,,,,,,,,,,,,,,,,,,,,,,,,,,,,,,,
1007083,Allentown Turnpike Plaza Farmers Market,,,,,,,,,,,,,,,,,,,,,,,,,,,,,,,,,,,,,,,,,,,,,,,
1002964,Alliance Farmers Market,,,,,,,,,,,,,,,,,,,,,,,,,,,,,,,,,,,,,,,,,,,,,,,
1005675,Alliance Farmers Market,http://www.alliancefarmersmarket.com,http://www.alliancefarmersmarket.com,https://www.facebook.com/alliancefarmersmarket,https://www.facebook.com/alliancefarmersmarket,,,,,,,06/15/2013 to 10/12/2013,2013-06-15,2013-10-12,Sat: 9:00 AM-12:00 PM;,Sat: 9:00 AM-12:00 PM,,,,,,,,,,,,,,,,,,,,,,,,,,,,,,,,
1006739,Alliance For The Arts Greenmarket,http://www.artinlee.org,http://www.artinlee.org,https://www.facebook.com/pages/Alliance-for-the-Arts-GreenMarket/224616377554765,https://www.facebook.com/pages/Alliance-for-the-Arts-GreenMarket/224616377554765,,,,,,,,,,Sat: 9:00 AM-1:00 PM;,Sat: 9:00 AM-1:00 PM,,,,,,,,,,,,,,,,,,,,,,,,,,,,,,,,
1002683,Allston Farmers Market,http://www.dining.harvard.edu/flp/ag_market.html,http://www.dining.harvard.edu/flp/ag_market.html,,,,,,,,,06/01/2012 to 10/31/2012,2012-06-01,2012-10-31,,,,,,,,,,,,,,,,,,,,,,,,,,,,,,,,,,
1005134,Allston Village Farmers Market,http://www.allstonbrightoncdc.org/,http://www.allstonbrightoncdc.org/,https://www.facebook.com/AllstonVillageFarmersMarket,https://www.facebook.com/AllstonVillageFarmersMarket,https://twitter.com/AVFarmersMarket,https://twitter.com/AVFarmersMarket,,,,,05/18/2013 to 10/26/2013,2013-05-18,2013-10-26,Sat: 11:00 AM-3:00 PM;,Sat: 11:00 AM-3:00 PM,,,,,,,,,,,,,,,,,,,,,,,,,,,,,,,,
1006816,Alma Farmers Market,,,,,,,,,,,,,,,,,,,,,,,,,,,,,,,,,,,,,,,,,,,,,,,
1002250,Alma Farmers Market,,,,,,,,,,,05/04/2013 to 10/31/2013,2013-05-04,2013-10-31,Wed: 7:00 AM-1:00 PM;Sat: 7:00 AM-1:00 PM;,Wed: 7:00 AM-1:00 PM,Sat: 7:00 AM-1:00 PM,,,,,,,,,,,,,,,,,,,,,,,,,,,,,,,
1007836,Almont Farmers Market,http://www.almontfarmersmarket.com,http://www.almontfarmersmarket.com,,,,,,,,,,,,,,,,,,,,,,,,,,,,,,,,,,,,,,,,,,,,,
1012389,Aloha Community Farmers Market,http://www.alohacommunityfarmersmarket.org,http://www.alohacommunityfarmersmarket.org,https://www.facebook.com/Aloha-Community-Farmers-Market-913645008655691/,https://www.facebook.com/Aloha-Community-Farmers-Market-913645008655691/,@AlohaFarmMarket,@AlohaFarmMarket,,,Instagram: Aloha Community Farmers' Market,Instagram: Aloha Community Farmers' Market,05/05/2016 to 09/29/2016,2016-05-05,2016-09-29,Thu: 3:00 PM-7:30 PM;,Thu: 3:00 PM-7:30 PM,,,,,,,,,,,,,,,,,,,,,,,,,,,,,,,,
1010476,Alpena Farmers Market,http://alpenafarmersmarket.org,http://alpenafarmersmarket.org,Friends of the Alpena Farmers Market,,,,,,,,01/01/2014 to 12/31/2014,2014-01-01,2014-12-31,Wed: 8:00 AM-1:00 PM;Sat: 8:00 AM-1:00 PM;,Wed: 8:00 AM-1:00 PM,Sat: 8:00 AM-1:00 PM,,,,,,,,,,,,,,,,,,,,,,,,,,,,,,,
1005447,Alpha Nursery Farmers Market,http://www.alpha-nursery.com,http://www.alpha-nursery.com,,,,,,,,,06/19/2013 to 09/28/2013,2013-06-19,2013-09-28,Wed: 10:00 AM-5:00 PM;,Wed: 10:00 AM-5:00 PM,,,,,,,,,,,,,,,,,,,,,,,,,,,,,,,,
1009792,Alsip Farmers Market,http://www.alsipparks.org,http://www.alsipparks.org,,,,,,,,,06/10/2014 to 10/14/2014,2014-06-10,2014-10-14,Tue: 3:00 PM-7:00 PM;,Tue: 3:00 PM-7:00 PM,,,,,,,,,,,,,,,,,,,,,,,,,,,,,,,,
1009998,Altadena Farmers Market,http://www.altadenafarmersmarket.com,http://www.altadenafarmersmarket.com,https://www.facebook.com/AltadenaFarmersMarket,https://www.facebook.com/AltadenaFarmersMarket,https://twitter.com/AltadenaFM,https://twitter.com/AltadenaFM,,,http://altadenafm.tumblr.com,http://altadenafm.tumblr.com,01/08/2014 to 03/05/2014,2014-01-08,2014-03-05,Wed: 3:00 PM-7:00 PM;,Wed: 3:00 PM-7:00 PM,,,,,,,03/12/2014 to 11/05/2014,3/12/14, 11/05/2014,Wed: 4:00 PM-8:00 PM;,Wed: 4:00 PM-8:00 PM,,,,,,,11/12/14, 12/31/2014,Wed: 3:00 PM-7:00 PM;,Wed: 3:00 PM-7:00 PM,,,,,,,,,,,
1004383,Altamont Farmers Market,,,,,,,,,,,07/01/2011 to 09/31/2011,2011-07-01,,Mon: 11:00 AM-6:00 PM;Tue: 11:00 AM-6:00 PM;Thu: 11:00 AM-6:00 PM;Fri: 11:00 AM-6:00 PM;Sat: 10:00 AM-2:00 PM;Sun: 10:00 AM-2:00 PM;,Mon: 11:00 AM-6:00 PM,Tue: 11:00 AM-6:00 PM,Thu: 11:00 AM-6:00 PM,Fri: 11:00 AM-6:00 PM,Sat: 10:00 AM-2:00 PM,Sun: 10:00 AM-2:00 PM,,,,,,,,,,,,,,,,,,,,,,,,,,,
1000357,Altavista Farmers Market,http://www.ci.altavista.va.us,http://www.ci.altavista.va.us,,,,,,,,,,,,,,,,,,,,,,,,,,,,,,,,,,,,,,,,,,,,,
1006749,Alton Farmers And Artisans Market,http://www.DowntownAlton.com,http://www.DowntownAlton.com,https://www.facebook.com/AltonFarmersMarket,https://www.facebook.com/AltonFarmersMarket,,,,,,,06/07/2014 to 10/18/2014,2014-06-07,2014-10-18,Wed: 4:00 PM-7:00 PM;Sat: 8:00 AM-12:00 PM;,Wed: 4:00 PM-7:00 PM,Sat: 8:00 AM-12:00 PM,,,,,,,,,,,,,,,,,,,,,,,,,,,,,,,
1004154,Altoona Farmers Market,,,,,,,,,,,,,,,,,,,,,,,,,,,,,,,,,,,,,,,,,,,,,,,
1001100,Altus Farmers Market,,,,,,,,,,,June to October,2010-06-01,2010-10-31,Tue:5:00 pm - 8:00 pm;Fri:5:00 pm - 8:00 pm;,Tue:5:00 pm - 8:00 pm,Fri:5:00 pm - 8:00 pm,,,,,,,,,,,,,,,,,,,,,,,,,,,,,,,
1011421,Alum Rock Village Farmers Market,http://www.pcfma.org,http://www.pcfma.org,www.facebook.com/AlumRockVillageFarmersMarket,,www.twitter.com/PacCoastFarmers,,,,,,01/01/2015 to 12/31/2015,2015-01-01,2015-12-31,Sun: 8:00 AM-1:00 PM;,Sun: 8:00 AM-1:00 PM,,,,,,,,,,,,,,,,,,,,,,,,,,,,,,,,
1001733,Alva Farmers Market,,,,,,,,,,,,,,,,,,,,,,,,,,,,,,,,,,,,,,,,,,,,,,,
1005644,Amador Farmers Market-- Jackson,http://www.amadorfarmersmarket.com,http://www.amadorfarmersmarket.com,,,,,,,,,06/07/2015 to 10/01/2015,2015-06-07,2015-10-01,Sun: 9:00 AM-12:00 PM;,Sun: 9:00 AM-12:00 PM,,,,,,,,,,,,,,,,,,,,,,,,,,,,,,,,
1005645,Amador Farmers Market-- Pine Grove,http://www.amadorfarmersmarket.com,http://www.amadorfarmersmarket.com,,,,,,,,,06/03/2015 to 10/01/2015,2015-06-03,2015-10-01,Wed: 3:00 PM-6:00 PM;,Wed: 3:00 PM-6:00 PM,,,,,,,,,,,,,,,,,,,,,,,,,,,,,,,,
1005646,Amador Farmers Market-- Sutter Creek,http://www.amadorfarmersmarket.com,http://www.amadorfarmersmarket.com,,,,,,,,,06/13/2015 to 10/01/2015,2015-06-13,2015-10-01,Sat: 9:00 AM-12:00 PM;,Sat: 9:00 AM-12:00 PM,,,,,,,,,,,,,,,,,,,,,,,,,,,,,,,,
1001826,Ambridge Farmers Market,,,,,,,,,,,,,,,,,,,,,,,,,,,,,,,,,,,,,,,,,,,,,,,
1008321,Amelia Barter Town Farmers Market,http://www.Ameliamarket.org,http://www.Ameliamarket.org,https://www.facebook.com/AmeliaBarterTown,https://www.facebook.com/AmeliaBarterTown,,,,,,,04/01/2014 to 09/30/2014,2014-04-01,2014-09-30,Tue: 4:00 AM-7:00 PM;,Tue: 4:00 AM-7:00 PM,,,,,,,,,,,,,,,,,,,,,,,,,,,,,,,,
1008399,Amelia Farmers Market,http://www.ameliafarmersmarket.com,http://www.ameliafarmersmarket.com,https://www.facebook.com/AmeliaFarmersMarket,https://www.facebook.com/AmeliaFarmersMarket,,,,,,,01/01/2013 to 12/31/2013,2013-01-01,2013-12-31,Sat: 9:00 AM-1:00 PM;,Sat: 9:00 AM-1:00 PM,,,,,,,,,,,,,,,,,,,,,,,,,,,,,,,,
1006373,Amenia Farmers Market,,,,,,,,,,,,,,,,,,,,,,,,,,,,,,,,,,,,,,,,,,,,,,,
1001367,American National Bank Downtown Farmers Market Festival,,,,,,,,,,,,,,,,,,,,,,,,,,,,,,,,,,,,,,,,,,,,,,,
1005946,Amerisafe Downtown Pavilion And Farmers Market,http://www.cityofderidder.org,http://www.cityofderidder.org,,,,,,,,,,,,,,,,,,,,,,,,,,,,,,,,,,,,,,,,,,,,,
1005188,Amery Farmers Market,,,,,,,,,,,June to October,2010-06-01,2010-10-31,Mon:3:00 PM - 6:00 PM;,Mon:3:00 PM - 6:00 PM,,,,,,,,,,,,,,,,,,,,,,,,,,,,,,,,
1011171,Ames Main Street Farmers Market,http://www.amesmainsteetfarmersmarket.com,http://www.amesmainsteetfarmersmarket.com,Ames Main Street Farmers' Market,,,,,,,,05/02/2015 to 10/31/2015,2015-05-02,2015-10-31,Sun: 8:00 AM-12:30 PM;,Sun: 8:00 AM-12:30 PM,,,,,,,,,,,,,,,,,,,,,,,,,,,,,,,,
1000284,Amherst Farmers Market,http://www.AmherstFarmersMarket.com,http://www.AmherstFarmersMarket.com,https://www.facebook.com/pages/Amherst-Farmers-Market/112695142075630,https://www.facebook.com/pages/Amherst-Farmers-Market/112695142075630,,,,,,,04/18/2015 to 11/21/2015,2015-04-18,2015-11-21,Sat: 8:00 AM-1:30 PM;,Sat: 8:00 AM-1:30 PM,,,,,,,,,,,,,,,,,,,,,,,,,,,,,,,,
1006748,Amherst Wednesday Market At Kendrick Park,http://www.kendrickparkmarket.com,http://www.kendrickparkmarket.com,https://www.facebook.com/pages/Wednesday-Market-at-Kendrick-Park/210000299034343,https://www.facebook.com/pages/Wednesday-Market-at-Kendrick-Park/210000299034343,,,,,,,05/07/2014 to 10/15/2014,2014-05-07,2014-10-15,Wed: 2:00 PM-6:00 PM;,Wed: 2:00 PM-6:00 PM,,,,,,,,,,,,,,,,,,,,,,,,,,,,,,,,
1009833,Amherst Winter Farmers Market,http://www.amherstwintermarket.com,http://www.amherstwintermarket.com,https://www.facebook.com/pages/Amherst-Winter-Farmers-Market/107328206002708,https://www.facebook.com/pages/Amherst-Winter-Farmers-Market/107328206002708,,,,,,,12/06/2014 to 03/28/2015,2014-12-06,2015-03-28,Sat: 10:00 AM-2:00 PM;,Sat: 10:00 AM-2:00 PM,,,,,,,,,,,,,,,,,,,,,,,,,,,,,,,,
1001135,Amma Farmers Market,,,,,,,,,,,07/12/2013 to 09/20/2013,2013-07-12,2013-09-20,Fri: 2:00 PM-6:00 PM;,Fri: 2:00 PM-6:00 PM,,,,,,,,,,,,,,,,,,,,,,,,,,,,,,,,
1010105,Amqui Station Farmers Market,http://www.amquistation.org/farmers-market,http://www.amquistation.org/farmers-market,https://www.facebook.com/AmquiStation,https://www.facebook.com/AmquiStation,https://twitter.com/amquistation,https://twitter.com/amquistation,,,http://instagram.com/amquistation,http://instagram.com/amquistation,05/04/2014 to 08/30/2015,2014-05-04,2015-08-30,Sun: 12:00 PM-3:00 PM;,Sun: 12:00 PM-3:00 PM,,,,,,,,,,,,,,,,,,,,,,,,,,,,,,,,
1011670,Amsterdam Saturday Farmers/crafters Market,http://amsterdamfarmersmarket.wordpress.com,http://amsterdamfarmersmarket.wordpress.com,Amsterdam Saturday Farmers/Crafters Market,,@BenWallach1,@BenWallach1,,,Yelp Amsterdam Saturday Farmers/Crafters Market,Yelp Amsterdam Saturday Farmers/Crafters Market,05/28/2016 to 10/15/2016,2016-05-28,2016-10-15,Sat: 10:00 AM-2:00 PM;,Sat: 10:00 AM-2:00 PM,,,,,,,,,,,,,,,,,,,,,,,,,,,,,,,,
1012157,Anaconda Community Market,http://www.anacondacommunityfoundation.org/anaconda-community-market.html,http://www.anacondacommunityfoundation.org/anaconda-community-market.html,https://www.facebook.com/groups/478915098830452/,https://www.facebook.com/groups/478915098830452/,,,,,,,07/12/2016 to 09/13/2016,2016-07-12,2016-09-13,Tue: 4:00 PM-7:00 PM;,Tue: 4:00 PM-7:00 PM,,,,,,,,,,,,,,,,,,,,,,,,,,,,,,,,
1005944,Anacortes Farmers Market,http://www.anacortesfarmersmarket.org,http://www.anacortesfarmersmarket.org,https://www.facebook.com/AnacortesFarmersMarket,https://www.facebook.com/AnacortesFarmersMarket,,,,,,,05/07/2016 to 10/29/2016,2016-05-07,2016-10-29,Sat: 9:00 AM-2:00 PM;,Sat: 9:00 AM-2:00 PM,,,,,,,11/19/2016 to 11/20/2016,11/19/16, 11/20/2016,Sat: 10:00 AM-4:00 PM;Sun: 10:00 AM-4:00 PM;,Sat: 10:00 AM-4:00 PM,Sun: 10:00 AM-4:00 PM,,,,,,1/9/16, 04/09/2016,Sat: 9:00 AM-2:00 PM;,Sat: 9:00 AM-2:00 PM,,,,,,,,,,,
1001105,Anamoose Market In The Park,,,https://www.facebook.com/AnamooseMarketInThePark,https://www.facebook.com/AnamooseMarketInThePark,,,,,,,07/07/2014 to 09/08/2014,2014-07-07,2014-09-08,Mon: 6:00 PM-8:00 PM;,Mon: 6:00 PM-8:00 PM,,,,,,,,,,,,,,,,,,,,,,,,,,,,,,,,
1003055,Anamosa Farmers Market,,,,,,,,,,,,,,,,,,,,,,,,,,,,,,,,,,,,,,,,,,,,,,,
1007258,Anchorage Farmers Market,http://www.anchoragefarmersmarket.org,http://www.anchoragefarmersmarket.org,,,,,,,,,05/03/2014 to 10/11/2014,2014-05-03,2014-10-11,Sat: 9:00 AM-2:00 PM;,Sat: 9:00 AM-2:00 PM,,,,,,,,,,,,,,,,,,,,,,,,,,,,,,,,
1002640,Anchorage Market And Festival,http://www.anchoragemarkets.com,http://www.anchoragemarkets.com,,,,,,,,,May to September,2010-05-01,2010-09-30,Sat:10:00 am - 6:00 pm;sun:10:00 am - 6:00 pm;,Sat:10:00 am - 6:00 pm,sun:10:00 am - 6:00 pm,,,,,,,,,,,,,,,,,,,,,,,,,,,,,,,
1010883,Anderson City Market,http://www.andersoncitymarket.org/,http://www.andersoncitymarket.org/,https://www.facebook.com/AndersonCityFarmersMarket,https://www.facebook.com/AndersonCityFarmersMarket,,,,,,,05/09/2015 to 10/17/2015,2015-05-09,2015-10-17,Sat: 9:00 AM-1:00 PM;,Sat: 9:00 AM-1:00 PM,,,,,,,,,,,,,,,,,,,,,,,,,,,,,,,,
1008251,Anderson County Farmers Market,http://andersoncountysc.org/web/Farmers_00.asp,http://andersoncountysc.org/web/Farmers_00.asp,https://www.facebook.com/andersoncountyfarmersmarket,https://www.facebook.com/andersoncountyfarmersmarket,,,,,,,05/03/2014 to 05/31/2014,2014-05-03,2014-05-31,Sat: 10:00 AM-2:00 PM;,Sat: 10:00 AM-2:00 PM,,,,,,,06/03/2014 to,6/3/14,,Tue: 8:00 AM-1:00 PM;Thu: 8:00 AM-1:00 PM;Sat: 8:00 AM-1:00 PM;,Tue: 8:00 AM-1:00 PM,Thu: 8:00 AM-1:00 PM,Sat: 8:00 AM-1:00 PM,,,,,11/29/14, 12/20/2014,Sat: 10:00 AM-2:00 PM;,Sat: 10:00 AM-2:00 PM,,,,,,,,,,,
1008727,Anderson County Farmers Market,,,https://www.facebook.com/AndersonCoFarmersMarket,https://www.facebook.com/AndersonCoFarmersMarket,,,,,,,04/18/2014 to 10/26/2014,2014-04-18,2014-10-26,Fri: 11:00 AM-6:00 PM;Sat: 9:00 AM-5:00 PM;Sun: 12:00 PM-4:00 PM;,Fri: 11:00 AM-6:00 PM,Sat: 9:00 AM-5:00 PM,Sun: 12:00 PM-4:00 PM,,,,,,,,,,,,,,,,,,,,,,,,,,,,,,
1000971,Anderson Farm Market,,,,,,,,,,,,,,,,,,,,,,,,,,,,,,,,,,,,,,,,,,,,,,,
1004991,Anderson Farmers Market,http://www.andersonfarmersmarket.org,http://www.andersonfarmersmarket.org,,,,,,,,,04/09/2016 to 11/19/2016,2016-04-09,2016-11-19,Sat: 9:00 AM-1:00 PM;,Sat: 9:00 AM-1:00 PM,,,,,,,,,,,,,,,,,,,,,,,,,,,,,,,,
1002089,Anderson Happy Valley Farmers Market,,,,,,,,,,,,,,,,,,,,,,,,,,,,,,,,,,,,,,,,,,,,,,,
1003516,Andersonville Farmers Market,http://www.andersonville.org,http://www.andersonville.org,https://www.facebook.com/andersonville?ref=bookmarks,https://www.facebook.com/andersonville?ref=bookmarks,,,,,,,05/20/2015 to 09/02/2015,2015-05-20,2015-09-02,Wed: 3:00 PM-8:00 PM;,Wed: 3:00 PM-8:00 PM,,,,,,,09/09/2015 to 10/14/2015,9/9/15, 10/14/2015,Wed: 3:00 PM-7:00 PM;,Wed: 3:00 PM-7:00 PM,,,,,,,,,,,,,,,,,,,,,
1007647,Andover Farmers Market,,,,,,,,,,,"May 1, 2012 to October 30, 2012",2012-05-01,2012-10-30,Tue:2:30 PM - 6:30 PM;,Tue:2:30 PM - 6:30 PM,,,,,,,,,,,,,,,,,,,,,,,,,,,,,,,,
1012040,Andover Farmers Market,http://www.andoverhistorical.org/andover-farmers-market,http://www.andoverhistorical.org/andover-farmers-market,https://www.facebook.com/andoverfarmersmarket/?ref=aymt_homepage_panel,https://www.facebook.com/andoverfarmersmarket/?ref=aymt_homepage_panel,,,,,,,06/18/2016 to 10/08/2016,2016-06-18,2016-10-08,Sat: 10:00 AM-2:00 PM;,Sat: 10:00 AM-2:00 PM,,,,,,,,,,,,,,,,,,,,,,,,,,,,,,,,
1000287,Andrews Farmers Market,http://www.andrewsfarmersmarket.com,http://www.andrewsfarmersmarket.com,,,,,,,,,,,,,,,,,,,,,,,,,,,,,,,,,,,,,,,,,,,,,
1006378,Angelica Farmers Market,http://www.localharvest.org/angelica-farmers-market-M23451,http://www.localharvest.org/angelica-farmers-market-M23451,https://www.facebook.com/AngelicaFarmersMarket,https://www.facebook.com/AngelicaFarmersMarket,,,,,,,06/11/2016 to 09/24/2016,2016-06-11,2016-09-24,Sat: 9:00 AM-1:00 PM;,Sat: 9:00 AM-1:00 PM,,,,,,,,,,,,,,,,,,,,,,,,,,,,,,,,
1010280,Angelina County Farmers Market,http://visitlufkin.com/ShopDine/FarmersMarket/,http://visitlufkin.com/ShopDine/FarmersMarket/,https://www.facebook.com/angelinacountyfarmmarket/settings?tab=public&section=web_address,https://www.facebook.com/angelinacountyfarmmarket/settings?tab=public&section=web_address,,,,,,,01/01/2014 to 12/31/2014,2014-01-01,2014-12-31,Mon: 9:00 AM-5:30 PM;Tue: 9:00 AM-5:30 PM;Wed: 9:00 AM-5:30 PM;Thu: 9:00 AM-5:30 PM;Fri: 9:00 AM-5:30 PM;Sat: 9:00 AM-4:00 PM;Sun: 11:00 AM-3:00 PM;,Mon: 9:00 AM-5:30 PM,Tue: 9:00 AM-5:30 PM,Wed: 9:00 AM-5:30 PM,Thu: 9:00 AM-5:30 PM,Fri: 9:00 AM-5:30 PM,Sat: 9:00 AM-4:00 PM,Sun: 11:00 AM-3:00 PM,,,,,,,,,,,,,,,,,,,,,,,,,,
1006268,Angels Camp Farmers Market-fresh Fridays,http://www.angelscampbusiness.com/events/fresh-fridays/,http://www.angelscampbusiness.com/events/fresh-fridays/,,,,,,,,,June to October,2010-06-01,2010-10-31,Fri:5:00 PM - 8:00 PM;,Fri:5:00 PM - 8:00 PM,,,,,,,,,,,,,,,,,,,,,,,,,,,,,,,,
1010223,Ann Arbor Farmers Market,http://www.a2gov.org/market,http://www.a2gov.org/market,https://www.facebook.com/a2market,https://www.facebook.com/a2market,https://twitter.com/a2market,https://twitter.com/a2market,,,,,01/01/2014 to 12/31/2014,2014-01-01,2014-12-31,Wed: 7:00 AM-3:00 PM;Sat: 7:00 AM-3:00 PM;,Wed: 7:00 AM-3:00 PM,Sat: 7:00 AM-3:00 PM,,,,,,06/01/2014 to 10/01/2014,6/1/14, 10/01/2014,Wed: 4:00 PM-8:00 PM;,Wed: 4:00 PM-8:00 PM,,,,,,,5/1/14, 12/01/2014,Wed: 7:00 AM-3:00 PM;Sat: 7:00 AM-3:00 PM;,Wed: 7:00 AM-3:00 PM,Sat: 7:00 AM-3:00 PM,,,,,,,,,,
1010380,Anna House Farm Stand,http://www.childcarenassau.org,http://www.childcarenassau.org,www.facebook.com/longislandfarmtopreschool,,,,,,,,06/23/2015 to 09/22/2015,2015-06-23,2015-09-22,Tue: 10:00 AM-2:00 PM;,Tue: 10:00 AM-2:00 PM,,,,,,,,,,,,,,,,,,,,,,,,,,,,,,,,
1001782,Anna/union County Farmers Market,,,,,,,,,,,,,,,,,,,,,,,,,,,,,,,,,,,,,,,,,,,,,,,
1012588,Annandale Farmers Market,http://www.fairfaxcounty.gov/parks/farmersmarkets/annandalemkt.htm,http://www.fairfaxcounty.gov/parks/farmersmarkets/annandalemkt.htm,,,,,,,,,,,,Thu: 8:00 AM-12:00 PM;,Thu: 8:00 AM-12:00 PM,,,,,,,,,,,,,,,,,,,,,,,,,,,,,,,,
1006800,Annapolis Freshfarm Market,http://www.freshfarmmarkets.org/markets/annapolis.html,http://www.freshfarmmarkets.org/markets/annapolis.html,,,,,,,,,May to November,2010-05-01,2010-11-30,sun:8:30 AM - 12:00 PM;,sun:8:30 AM - 12:00 PM,,,,,,,,,,,,,,,,,,,,,,,,,,,,,,,,
1001142,Anne Arundel County Farmers Market (riva),http://www.aacofarmersmarket.com/,http://www.aacofarmersmarket.com/,"Anne Arundel County Farmers Market, INC",,,,,,,,04/02/2016 to 12/24/2016,2016-04-02,2016-12-24,Sat: 7:00 AM-12:00 PM;,Sat: 7:00 AM-12:00 PM,,,,,,,01/01/2016 to 12/18/2016,1/1/16, 12/18/2016,Sun: 10:00 AM-2:00 PM;,Sun: 10:00 AM-2:00 PM,,,,,,,,,,,,,,,,,,,,,
1004881,Anne Heyliger Vegetable Market,,,,,,,,,,,,,,,,,,,,,,,,,,,,,,,,,,,,,,,,,,,,,,,
1001465,Anoka County Growers Association/ Anoka Market,,,,,,,,,,,July to October,2010-07-01,2010-10-31,Thu:2:00 PM - 5:00 PM;,Thu:2:00 PM - 5:00 PM,,,,,,,,,,,,,,,,,,,,,,,,,,,,,,,,
1007646,Anoka County Growers/ St. Timothy Church Blaine,,,,,,,,,,,July to October,2010-07-01,2010-10-31,Tue:2:00 PM - 5:30 PM;Sat:7:00 AM - 12:00 PM;,Tue:2:00 PM - 5:30 PM,Sat:7:00 AM - 12:00 PM,,,,,,June to June,June , June,Sat:7:00 AM - 12:00 PM;,Sat:7:00 AM - 12:00 PM,,,,,,,,,,,,,,,,,,,,,
1007636,Anoka County Growers/immaculate Conception Church,,,,,,,,,,,,,,,,,,,,,,,,,,,,,,,,,,,,,,,,,,,,,,,
1000306,Anselma Farmers And Artisans Market,,,https://www.facebook.com/anselmamarket,https://www.facebook.com/anselmamarket,,,,,,,May to August,2010-05-01,2010-08-31,Wed:2:00 PM - 6:00 PM;,Wed:2:00 PM - 6:00 PM,,,,,,,,,,,,,,,,,,,,,,,,,,,,,,,,
1000405,Anson County Farmers Market,,,,,,,,,,,June to November,2010-06-01,2010-11-30,Wed:7:00 AM - 1:00 PM;Sat:7:00 AM - 1:00 PM;,Wed:7:00 AM - 1:00 PM,Sat:7:00 AM - 1:00 PM,,,,,,,,,,,,,,,,,,,,,,,,,,,,,,,
1011248,Antelope Valley Winery Farmers Market,http://www.avwinery.com,http://www.avwinery.com,,,,,,,,,05/30/2015 to 11/28/2015,2015-05-30,2015-11-28,Sat: 9:00 AM-12:00 PM;,Sat: 9:00 AM-12:00 PM,,,,,,,,,,,,,,,,,,,,,,,,,,,,,,,,
1012651,Anthem Farmers Market,http://www.arizonacommunityfarmersmarkets.com/FM_Anthem.html,http://www.arizonacommunityfarmersmarkets.com/FM_Anthem.html,ww.facebook.com/Anthem-Farmers-Market-608872579141231/,,Anthemfm1,,,,,,10/02/2016 to 05/28/2017,2016-10-02,2017-05-28,Sun: 9:00 AM-1:00 PM;,Sun: 9:00 AM-1:00 PM,,,,,,,,,,,,,,,,,,,,,,,,,,,,,,,,
1000434,Anthony Farmers Market,,,,,,,,,,,06/01/2013 to 10/01/2013,2013-06-01,2013-10-01,Sat: 7:30 AM-9:30 AM;,Sat: 7:30 AM-9:30 AM,,,,,,,,,,,,,,,,,,,,,,,,,,,,,,,,
1004557,"Antigo Farmers Market, Inc.",http://www.antigomarket.com,http://www.antigomarket.com,https://www.facebook.com/AntigoFarmersMarketInc,https://www.facebook.com/AntigoFarmersMarketInc,,,,,,,06/06/2015 to 10/03/2015,2015-06-06,2015-10-03,Sat: 8:00 AM-12:00 PM;,Sat: 8:00 AM-12:00 PM,,,,,,,,,,,,,,,,,,,,,,,,,,,,,,,,
1011109,Apex Farmers Market,http://www.apexfarmersmarket.com,http://www.apexfarmersmarket.com,https://www.facebook.com/apexfarmersmarket,https://www.facebook.com/apexfarmersmarket,,,,,,,04/18/2015 to 10/17/2015,2015-04-18,2015-10-17,Sat: 8:30 AM-12:30 PM;,Sat: 8:30 AM-12:30 PM,,,,,,,,,,,,,,,,,,,,,,,,,,,,,,,,
1011158,"Appalachian (newport) Farmers Market, Cocke County Tn",,,Newport Farmers Market or Appalachian Farmers Market,,,,,,,,05/18/2016 to 10/12/2016,2016-05-18,2016-10-12,Wed: 10:00 AM-2:00 PM;,Wed: 10:00 AM-2:00 PM,,,,,,,,,,,,,,,,,,,,,,,,,,,,,,,,
1005207,Appalachian Farmers Market,http://www.appfarmersmarket.com,http://www.appfarmersmarket.com,,,,,,,,,June to October,2010-06-01,2010-10-31,,,,,,,,,May to May,May , May,Sat:7:00 AM - 12:00 PM;,Sat:7:00 AM - 12:00 PM,,,,,,,,,,,,,,,,,,,,,
1000683,Apple Country Farmers Market,http://www.applecountryorchards.com,http://www.applecountryorchards.com,,,,,,,,,June to September,2010-06-01,2010-09-30,Mon:9:00 AM - 5:30 PM;Tue:9:00 AM - 5:30 PM;Wed:9:00 AM - 5:30 PM;Thu:9:00 AM - 5:30 PM;Fri:9:00 AM - 5:30 PM;Sat:9:00 AM - 5:30 PM;,Mon:9:00 AM - 5:30 PM,Tue:9:00 AM - 5:30 PM,Wed:9:00 AM - 5:30 PM,Thu:9:00 AM - 5:30 PM,Fri:9:00 AM - 5:30 PM,Sat:9:00 AM - 5:30 PM,,,,,,,,,,,,,,,,,,,,,,,,,,,
1000685,Apple Country Farmers Market,http://www.applecountryorchards.com,http://www.applecountryorchards.com,,,,,,,,,January to December,2010-01-01,2010-12-31,Mon:9:00 AM - 6:00 PM;Tue:9:00 AM - 6:00 PM;Wed:9:00 AM - 6:00 PM;Thu:9:00 AM - 6:00 PM;Fri:9:00 AM - 6:00 PM;Sat:9:00 AM - 6:00 PM;sun:9:00 AM - 4:00 PM;,Mon:9:00 AM - 6:00 PM,Tue:9:00 AM - 6:00 PM,Wed:9:00 AM - 6:00 PM,Thu:9:00 AM - 6:00 PM,Fri:9:00 AM - 6:00 PM,Sat:9:00 AM - 6:00 PM,sun:9:00 AM - 4:00 PM,,,,,,,,,,,,,,,,,,,,,,,,,,
1006889,Apple Valley Farmers Market,,,,,,,,,,,,,,,,,,,,,,,,,,,,,,,,,,,,,,,,,,,,,,,
1012562,Appleton Area Farmers Market,,,,,,,,,,,06/08/2016 to 08/31/2016,2016-06-08,2016-08-31,Wed: 8:00 AM-12:00 PM;,Wed: 8:00 AM-12:00 PM,,,,,,,09/07/2016 to 10/12/2016,9/7/16, 10/12/2016,Wed: 9:00 AM-1:00 PM;,Wed: 9:00 AM-1:00 PM,,,,,,,,,,,,,,,,,,,,,
1000431,Appleton Downtown Farm Market,http://www.appletondowntown.org,http://www.appletondowntown.org,www.facebook.com/downtownappletonfarmmarket,,,,,,,,06/18/2016 to 10/29/2016,2016-06-18,2016-10-29,Sat: 8:00 AM-12:30 PM;,Sat: 8:00 AM-12:30 PM,,,,,,,,,,,,,,,,,,,,,,,,,,,,,,,,
1009687,Aptos Farmers Market At Cabrillo College,http://www.montereybayfarmers.org,http://www.montereybayfarmers.org,https://www.facebook.com/pages/Monterey-Bay-Certified-Farmers-Markets/112446802152723,https://www.facebook.com/pages/Monterey-Bay-Certified-Farmers-Markets/112446802152723,https://twitter.com/MBFarmersMarket,https://twitter.com/MBFarmersMarket,,,www.edibleparadise.com,www.edibleparadise.com,01/01/2014 to 12/31/2014,2014-01-01,2014-12-31,Sat: 8:00 AM-12:00 PM;,Sat: 8:00 AM-12:00 PM,,,,,,,,,,,,,,,,,,,,,,,,,,,,,,,,
1001738,Aquidneck Growers Markets,http://www.aquidneckgrowersmarket.org,http://www.aquidneckgrowersmarket.org,https://www.facebook.com/pages/Aquidneck-Growers-Market/145175198849594?ref=hl,https://www.facebook.com/pages/Aquidneck-Growers-Market/145175198849594?ref=hl,,,,,,,01/01/2015 to 12/31/2015,2015-01-01,2015-12-31,Sat: 9:00 AM-1:00 PM;,Sat: 9:00 AM-1:00 PM,,,,,,,,,,,,,,,,,,,,,,,,,,,,,,,,
1010986,Aquidneck Growers Markets In Newport,http://www.aquidneckgrowersmarket.org,http://www.aquidneckgrowersmarket.org,https://www.facebook.com/pages/Aquidneck-Growers-Market/145175198849594?ref=hl,https://www.facebook.com/pages/Aquidneck-Growers-Market/145175198849594?ref=hl,,,,,,,05/20/2015 to 10/28/2015,2015-05-20,2015-10-28,Wed: 2:00 PM-6:00 PM;,Wed: 2:00 PM-6:00 PM,,,,,,,,,,,,,,,,,,,,,,,,,,,,,,,,
1008482,Arbuckle Certified Farmers Market,http://arbucklerevitalization.org/farmersmarket.html,http://arbucklerevitalization.org/farmersmarket.html,,,,,,,,,,,,,,,,,,,,,,,,,,,,,,,,,,,,,,,,,,,,,
1001764,Arcade Farmers Market,,,,,,,,,,,June to October,2010-06-01,2010-10-31,Sat:9:00 AM - 1:00 PM;,Sat:9:00 AM - 1:00 PM,,,,,,,,,,,,,,,,,,,,,,,,,,,,,,,,
1000558,Arcadia Valley Farmers Market,,,,,,,,,,,05/25/2013 to 10/26/2013,2013-05-25,2013-10-26,Sat: 7:00 AM-12:00 PM;,Sat: 7:00 AM-12:00 PM,,,,,,,,,,,,,,,,,,,,,,,,,,,,,,,,
1012474,Arcadias Mobile Market -- Barry Farm Recreation Center,http://arcadiafood.org/programs/mobile-market,http://arcadiafood.org/programs/mobile-market,,,,,https://www.youtube.com/user/ArcadiaFoodTV,https://www.youtube.com/user/ArcadiaFoodTV,,,06/03/2016 to 10/28/2016,2016-06-03,2016-10-28,Fri: 2:00 PM-5:00 PM;,Fri: 2:00 PM-5:00 PM,,,,,,,,,,,,,,,,,,,,,,,,,,,,,,,,
1012410,Arcadias Mobile Market -- Childrens National Medical Center Wic Clinic,http://arcadiafood.org/programs/mobile-market,http://arcadiafood.org/programs/mobile-market,,,,,https://www.youtube.com/user/ArcadiaFoodTV,https://www.youtube.com/user/ArcadiaFoodTV,,,05/04/2016 to 11/30/2016,2016-05-04,2016-11-30,Wed: 12:00 PM-2:00 PM;,Wed: 12:00 PM-2:00 PM,,,,,,,,,,,,,,,,,,,,,,,,,,,,,,,,
1012375,Arcadias Mobile Market -- Community Of Hope - Conway Health And Resource Center,http://arcadiafood.org/programs/mobile-market,http://arcadiafood.org/programs/mobile-market,,,,,https://www.youtube.com/user/ArcadiaFoodTV,https://www.youtube.com/user/ArcadiaFoodTV,,,05/31/2016 to 10/25/2016,2016-05-31,2016-10-25,Tue: 3:00 PM-6:00 PM;,Tue: 3:00 PM-6:00 PM,,,,,,,,,,,,,,,,,,,,,,,,,,,,,,,,
1012453,Arcadias Mobile Market -- Community Of Hope Family Health And Birth Center,http://arcadiafood.org/programs/mobile-market,http://arcadiafood.org/programs/mobile-market,,,,,https://www.youtube.com/user/ArcadiaFoodTV,https://www.youtube.com/user/ArcadiaFoodTV,,,06/02/2016 to 10/27/2016,2016-06-02,2016-10-27,Thu: 3:00 PM-6:00 PM;,Thu: 3:00 PM-6:00 PM,,,,,,,,,,,,,,,,,,,,,,,,,,,,,,,,
1012422,Arcadias Mobile Market -- Congress Heights Senior Wellness Center,http://arcadiafood.org/programs/mobile-market,http://arcadiafood.org/programs/mobile-market,,,,,https://www.youtube.com/user/ArcadiaFoodTV,https://www.youtube.com/user/ArcadiaFoodTV,,,05/05/2016 to 11/17/2016,2016-05-05,2016-11-17,Thu: 10:00 AM-12:00 PM;,Thu: 10:00 AM-12:00 PM,,,,,,,,,,,,,,,,,,,,,,,,,,,,,,,,
1012455,Arcadias Mobile Market -- Deanwood Recreation Center,http://arcadiafood.org/programs/mobile-market,http://arcadiafood.org/programs/mobile-market,,,,,https://www.youtube.com/user/ArcadiaFoodTV,https://www.youtube.com/user/ArcadiaFoodTV,,,05/06/2016 to 11/25/2016,2016-05-06,2016-11-25,Fri: 10:00 AM-12:00 PM;,Fri: 10:00 AM-12:00 PM,,,,,,,,,,,,,,,,,,,,,,,,,,,,,,,,
1012477,Arcadias Mobile Market -- Edgewood Commons,http://arcadiafood.org/programs/mobile-market,http://arcadiafood.org/programs/mobile-market,,,,,https://www.youtube.com/user/ArcadiaFoodTV,https://www.youtube.com/user/ArcadiaFoodTV,,,05/06/2016 to 11/25/2016,2016-05-06,2016-11-25,Fri: 3:00 PM-6:00 PM;,Fri: 3:00 PM-6:00 PM,,,,,,,,,,,,,,,,,,,,,,,,,,,,,,,,
1012413,Arcadias Mobile Market -- Hendley Elementary,http://arcadiafood.org/programs/mobile-market,http://arcadiafood.org/programs/mobile-market,,,,,https://www.youtube.com/user/ArcadiaFoodTV,https://www.youtube.com/user/ArcadiaFoodTV,,,06/01/2016 to 10/26/2016,2016-06-01,2016-10-26,Wed: 3:00 PM-6:00 PM;,Wed: 3:00 PM-6:00 PM,,,,,,,,,,,,,,,,,,,,,,,,,,,,,,,,
1012419,Arcadias Mobile Market -- Ledroit Park,http://arcadiafood.org/programs/mobile-market,http://arcadiafood.org/programs/mobile-market,,,,,https://www.youtube.com/user/ArcadiaFoodTV,https://www.youtube.com/user/ArcadiaFoodTV,,,05/04/2016 to 11/30/2016,2016-05-04,2016-11-30,Wed: 4:00 PM-7:00 PM;,Wed: 4:00 PM-7:00 PM,,,,,,,,,,,,,,,,,,,,,,,,,,,,,,,,
1012454,Arcadias Mobile Market -- Parkside Unity Healthcare/circle 7 Express,http://arcadiafood.org/programs/mobile-market,http://arcadiafood.org/programs/mobile-market,,,,,https://www.youtube.com/user/ArcadiaFoodTV,https://www.youtube.com/user/ArcadiaFoodTV,,,05/05/2016 to 11/17/2016,2016-05-05,2016-11-17,Thu: 3:00 PM-6:00 PM;,Thu: 3:00 PM-6:00 PM,,,,,,,,,,,,,,,,,,,,,,,,,,,,,,,,
1012374,Arcadias Mobile Market -- The Overlook At Oxon Run,http://arcadiafood.org/programs/mobile-market,http://arcadiafood.org/programs/mobile-market,,,,,https://www.youtube.com/user/ArcadiaFoodTV,https://www.youtube.com/user/ArcadiaFoodTV,,,05/03/2016 to 11/29/2016,2016-05-03,2016-11-29,Tue: 4:00 PM-6:00 PM;,Tue: 4:00 PM-6:00 PM,,,,,,,,,,,,,,,,,,,,,,,,,,,,,,,,
1012427,Arcadias Mobile Market -- United Medical Center,http://arcadiafood.org/programs/mobile-market,http://arcadiafood.org/programs/mobile-market,,,,,https://www.youtube.com/user/ArcadiaFoodTV,https://www.youtube.com/user/ArcadiaFoodTV,,,06/02/2016 to 10/27/2016,2016-06-02,2016-10-27,Thu: 10:00 AM-12:00 PM;,Thu: 10:00 AM-12:00 PM,,,,,,,,,,,,,,,,,,,,,,,,,,,,,,,,
1012377,Arcadias Mobile Market -- Wah Luck House Chinatown,http://arcadiafood.org/programs/mobile-market,http://arcadiafood.org/programs/mobile-market,,,,,https://www.youtube.com/user/ArcadiaFoodTV,https://www.youtube.com/user/ArcadiaFoodTV,,,06/01/2016 to 10/26/2016,2016-06-01,2016-10-26,Wed: 10:00 AM-12:00 PM;,Wed: 10:00 AM-12:00 PM,,,,,,,,,,,,,,,,,,,,,,,,,,,,,,,,
1002085,Arcata Plaza Farmers Market,http://www.humfarm.org,http://www.humfarm.org,https://www.facebook.com/North.Coast.Growers.Association,https://www.facebook.com/North.Coast.Growers.Association,,,,,,,01/01/2014 to 12/31/2014,2014-01-01,2014-12-31,Sat: 9:00 AM-2:00 PM;,Sat: 9:00 AM-2:00 PM,,,,,,,,,,,,,,,,,,,,,,,,,,,,,,,,
1001628,Archwood Green Barns Farmers Market,,,https://www.facebook.com/Archwoodgreenbarns,https://www.facebook.com/Archwoodgreenbarns,,,,,,,04/27/2014 to 11/09/2014,2014-04-27,2014-11-09,Sun: 10:00 AM-3:00 PM;,Sun: 10:00 AM-3:00 PM,,,,,,,,,,,,,,,,,,,,,,,,,,,,,,,,
1007662,Area Farmers Market,http://www.brazosvalleyfarmersmarket.com,http://www.brazosvalleyfarmersmarket.com,,,,,,,,,,,,,,,,,,,,,,,,,,,,,,,,,,,,,,,,,,,,,
1002798,Arenac Conservation District Farmers Market,http://www.arenacconservationdistrict.com,http://www.arenacconservationdistrict.com,,,,,,,,,June to October,2010-06-01,2010-10-31,Sat:9:00 AM - 1:00 PM;,Sat:9:00 AM - 1:00 PM,,,,,,,,,,,,,,,,,,,,,,,,,,,,,,,,
1010882,Argus Farm Stop,http://www.argusfarmstop.com,http://www.argusfarmstop.com,https://www.facebook.com/argusfarmstop,https://www.facebook.com/argusfarmstop,Argus Farm Stop,,,,,,01/01/2015 to 12/31/2015,2015-01-01,2015-12-31,Mon: 7:00 AM-7:00 PM;Tue: 7:00 AM-7:00 PM;Wed: 7:00 AM-7:00 PM;Thu: 7:00 AM-7:00 PM;Fri: 7:00 AM-7:00 PM;Sat: 8:00 AM-6:00 PM;Sun: 8:00 AM-6:00 PM;,Mon: 7:00 AM-7:00 PM,Tue: 7:00 AM-7:00 PM,Wed: 7:00 AM-7:00 PM,Thu: 7:00 AM-7:00 PM,Fri: 7:00 AM-7:00 PM,Sat: 8:00 AM-6:00 PM,Sun: 8:00 AM-6:00 PM,,,,,,,,,,,,,,,,,,,,,,,,,,
1002314,Ark City Farm And Art Market,http://www.arkcity.org/CurrentEvents.asp?EID=1457,http://www.arkcity.org/CurrentEvents.asp?EID=1457,,,,,,,,,,,,,,,,,,,,,,,,,,,,,,,,,,,,,,,,,,,,,
1005928,Arkansas County/north Farmers Market,,,,,,,,,,,,,,,,,,,,,,,,,,,,,,,,,,,,,,,,,,,,,,,
1005927,Arkansas County/south Farmers Market,,,,,,,,,,,,,,,,,,,,,,,,,,,,,,,,,,,,,,,,,,,,,,,
1002621,Arkansas Home Grown Market I,,,,,,,,,,,,,,,,,,,,,,,,,,,,,,,,,,,,,,,,,,,,,,,
1002622,Arkansas Home Grown Market Ii,,,,,,,,,,,,,,,,,,,,,,,,,,,,,,,,,,,,,,,,,,,,,,,
1002620,Arkansas Home Grown Market Iii,,,,,,,,,,,,,,,,,,,,,,,,,,,,,,,,,,,,,,,,,,,,,,,
1001018,Arkansas Local Food Network Online Farmers Market,http://www.littlerock.locallygrown.net,http://www.littlerock.locallygrown.net,,,,,,,,,01/01/2015 to 12/31/2015,2015-01-01,2015-12-31,Mon: 5:00 PM-6:00 PM;Sat: 10:00 AM-12:00 PM;,Mon: 5:00 PM-6:00 PM,Sat: 10:00 AM-12:00 PM,,,,,,,,,,,,,,,,,,,,,,,,,,,,,,,
1002581,Arlene Knudson,,,,,,,,,,,,,,,,,,,,,,,,,,,,,,,,,,,,,,,,,,,,,,,
1002611,Arlington Farmers Market,http://www.Arlingtonfarmersmarket.blogspot.com,http://www.Arlingtonfarmersmarket.blogspot.com,https://www.facebook.com/pages/Arlington-Farmers-Market/148219895193047,https://www.facebook.com/pages/Arlington-Farmers-Market/148219895193047,,,,,,,07/05/2014 to 09/20/2014,2014-07-05,2014-09-20,Sat: 10:00 AM-3:00 PM;,Sat: 10:00 AM-3:00 PM,,,,,,,,,,,,,,,,,,,,,,,,,,,,,,,,
1008236,Arlington Farmers Market,http://www.arlingtonhasit.org,http://www.arlingtonhasit.org,,,,,,,,,06/02/2016 to 10/27/2016,2016-06-02,2016-10-27,Thu: 3:00 PM-7:00 PM;,Thu: 3:00 PM-7:00 PM,,,,,,,,,,,,,,,,,,,,,,,,,,,,,,,,
1009968,Arlington Farmers Market,http://farmersmarketarlington.org,http://farmersmarketarlington.org,,,,,,,,,06/11/2014 to 10/29/2014,2014-06-11,2014-10-29,Wed: 2:00 PM-6:30 PM;,Wed: 2:00 PM-6:30 PM,,,,,,,,,,,,,,,,,,,,,,,,,,,,,,,,
1012129,Arlington Farmers Market,http://www.community-foodworks.org/arlington-courthouse-market,,https://www.facebook.com/ArlingtonFarmersMarket/,https://www.facebook.com/ArlingtonFarmersMarket/,Twitter: @ArlFarmersMkt,,,,Instagram: arlfarmersmkt,Instagram: arlfarmersmkt,01/02/2016 to 03/26/2016,2016-01-02,2016-03-26,Sat: 9:00 AM-12:00 PM;,Sat: 9:00 AM-12:00 PM,,,,,,,04/02/2016 to 12/17/2016,4/2/16, 12/17/2016,Sat: 8:00 AM-12:00 PM;,Sat: 8:00 AM-12:00 PM,,,,,,,,,,,,,,,,,,,,,
1003571,Arlington Heights Farmers Market,,,,,,,,,,,,,,,,,,,,,,,,,,,,,,,,,,,,,,,,,,,,,,,
1010945,Arlington Mill Farmers Market,http://www.columbiapike.org,http://www.columbiapike.org,www.facebook.com/pages/Columbia-Pike-Farmers-Marke,,,,,,,,04/29/2015 to 10/21/2015,2015-04-29,2015-10-21,Wed: 3:00 PM-7:00 PM;,Wed: 3:00 PM-7:00 PM,,,,,,,,,,,,,,,,,,,,,,,,,,,,,,,,
1011958,Arlington Park Farmers Market,,,https://www.facebook.com/friendsofarlingtonpark/?fref=ts,https://www.facebook.com/friendsofarlingtonpark/?fref=ts,,,,,https://www.instagram.com/p/6aOvP7BLEo/,https://www.instagram.com/p/6aOvP7BLEo/,06/04/2016 to 10/29/2016,2016-06-04,2016-10-29,Sat: 10:00 AM-2:00 PM;,Sat: 10:00 AM-2:00 PM,,,,,,,,,,,,,,,,,,,,,,,,,,,,,,,,
1011122,Armijo Village Growers Market,,,,,,,,,,,05/09/2015 to 10/31/2015,2015-05-09,2015-10-31,Sat: 8:00 AM-12:00 PM;,Sat: 8:00 AM-12:00 PM,,,,,,,,,,,,,,,,,,,,,,,,,,,,,,,,
1010187,Armory Farmers Market,http://www.farmfreshri.org,http://www.farmfreshri.org,https://www.facebook.com/farmfreshri,https://www.facebook.com/farmfreshri,,,,,,,,,,Thu: 3:30 AM-7:00 PM;,Thu: 3:30 AM-7:00 PM,,,,,,,,,,,,,,,,,,,,,,,,,,,,,,,,
1001991,Arnold Farmers Market,http://www.arnoldmo.org,http://www.arnoldmo.org,https://www.facebook.com/arnoldfarmersmarket,https://www.facebook.com/arnoldfarmersmarket,https://twitter.com/arnoldfarmmkt,https://twitter.com/arnoldfarmmkt,,,,,05/07/2016 to 10/15/2016,2016-05-07,2016-10-15,Sat: 8:00 AM-12:00 PM;,Sat: 8:00 AM-12:00 PM,,,,,,,,,,,,,,,,,,,,,,,,,,,,,,,,
1000294,Arnold-mountain Growers Farmers Market,,,,,,,,,,,,,,,,,,,,,,,,,,,,,,,,,,,,,,,,,,,,,,,
1001892,Arroyo Grande Oak Park Plaza Farmers Market,,,,,,,,,,,,,,,,,,,,,,,,,,,,,,,,,,,,,,,,,,,,,,,
1001893,Arroyo Grande Spencers Cfm,,,,,,,,,,,,,,,,,,,,,,,,,,,,,,,,,,,,,,,,,,,,,,,
1006270,Arthur Produce Auction,,,,,,,,,,,,,,,,,,,,,,,,,,,,,,,,,,,,,,,,,,,,,,,
1008855,Artisan And Agriculture Market,http://www.MacombConservationDistrict.org,http://www.MacombConservationDistrict.org,https://www.facebook.com/macombcd,https://www.facebook.com/macombcd,https://twitter.com/macombcd1,https://twitter.com/macombcd1,,,,,06/15/2014 to 09/21/2014,2014-06-15,2014-09-21,Sun: 10:00 AM-3:00 PM;,Sun: 10:00 AM-3:00 PM,,,,,,,,,,,,,,,,,,,,,,,,,,,,,,,,
1010575,Artisan Exchange West Chester,http://www.artisanexchangewcpa.com,http://www.artisanexchangewcpa.com,http://www.facebook.com/ArtisanExchangeWCPa,http://www.facebook.com/ArtisanExchangeWCPa,,,,,,,01/01/2014 to 12/31/2014,2014-01-01,2014-12-31,Sat: 10:00 AM-2:00 PM;,Sat: 10:00 AM-2:00 PM,,,,,,,01/01/2015 to 12/31/2015,1/1/15, 12/31/2015,Sat: 10:00 AM-2:00 PM;,Sat: 10:00 AM-2:00 PM,,,,,,,,,,,,,,,,,,,,,
1008534,Artisan Foodworks Thursday Evening Market,http://www.artisanfoodworks.com/,http://www.artisanfoodworks.com/,http://www.facebook.com/ArtisanFoodworksMKT,http://www.facebook.com/ArtisanFoodworksMKT,https://twitter.com/AFoodworksMKT,https://twitter.com/AFoodworksMKT,,,,,06/06/2013 to 09/26/2013,2013-06-06,2013-09-26,Thu: 3:30 PM-7:00 PM;,Thu: 3:30 PM-7:00 PM,,,,,,,,,,,,,,,,,,,,,,,,,,,,,,,,
1007842,Artisan Gift And Farmers Market,,,,,,,,,,,,,,,,,,,,,,,,,,,,,,,,,,,,,,,,,,,,,,,
1005081,Arvada Farmers Market,http://www.arvadafarmersmarket.com,http://www.arvadafarmersmarket.com,https://www.facebook.com/arvadafarmersmarket,https://www.facebook.com/arvadafarmersmarket,,,,,,,06/02/2013 to 09/29/2013,2013-06-02,2013-09-29,Sun: 9:00 AM-1:30 PM;,Sun: 9:00 AM-1:30 PM,,,,,,,,,,,,,,,,,,,,,,,,,,,,,,,,
1009285,Arvada Five Parks Farmers Market,http://www.arvadafiveparksfarmersmarket.blogspot.com/,http://www.arvadafiveparksfarmersmarket.blogspot.com/,https://www.facebook.com/pages/Arvada-Five-Parks-Farmers-Market/469569033116556,https://www.facebook.com/pages/Arvada-Five-Parks-Farmers-Market/469569033116556,,,,,,,,,,,,,,,,,,,,,,,,,,,,,,,,,,,,,,,,,,,
1009272,Asbury Fresh,http://www.asburyfresh.com/,http://www.asburyfresh.com/,,,,,,,,,,,,,,,,,,,,,,,,,,,,,,,,,,,,,,,,,,,,,
1004350,Asbury Park Carousel Farmers Market,,,,,,,,,,,June to October,2010-06-01,2010-10-31,Thu:4:00 PM - 7:00 PM;,Thu:4:00 PM - 7:00 PM,,,,,,,,,,,,,,,,,,,,,,,,,,,,,,,,
1000397,Ashboro Downtown Farmers Market,,,,,,,,,,,,,,,,,,,,,,,,,,,,,,,,,,,,,,,,,,,,,,,
1002490,Ashburn (chicago) Farmers Market,http://www.cityofchicago.org/specialevents,http://www.cityofchicago.org/specialevents,,,,,,,,,,,,,,,,,,,,,,,,,,,,,,,,,,,,,,,,,,,,,
1003061,Ashburn Farmers Market,http://www.loudounfarmersmarkets.org,http://www.loudounfarmersmarkets.org,https://www.facebook.com/pages/Ashburn-Farmers-Market/229607597124025,https://www.facebook.com/pages/Ashburn-Farmers-Market/229607597124025,https://twitter.com/LoudounFarmMkts,https://twitter.com/LoudounFarmMkts,,,,,05/02/2015 to 10/31/2015,2015-05-02,2015-10-31,Sat: 8:00 AM-12:00 PM;,Sat: 8:00 AM-12:00 PM,,,,,,,,,,,,,,,,,,,,,,,,,,,,,,,,
1007599,Ashburnham Farmers Market,,,,,,,,,,,,,,,,,,,,,,,,,,,,,,,,,,,,,,,,,,,,,,,
1007600,Ashby Farmers Market,,,,,,,,,,,,,,,,,,,,,,,,,,,,,,,,,,,,,,,,,,,,,,,
1003575,Ashdown Farmers Market,,,,,,,,,,,,,,,,,,,,,,,,,,,,,,,,,,,,,,,,,,,,,,,
1003219,Ashe County Farmers Market,http://www.ashefarmersmarket.com,http://www.ashefarmersmarket.com,https://www.facebook.com/ashe.farmers?fref=ts,https://www.facebook.com/ashe.farmers?fref=ts,,,,,,,04/11/2015 to 10/31/2015,2015-04-11,2015-10-31,Wed: 8:00 AM-1:00 PM;Sat: 8:00 AM-1:00 PM;,Wed: 8:00 AM-1:00 PM,Sat: 8:00 AM-1:00 PM,,,,,,11/21/2015 to 12/05/2015,11/21/15, 12/05/2015,Sat: 10:00 AM-2:00 PM;,Sat: 10:00 AM-2:00 PM,,,,,,,,,,,,,,,,,,,,,
1008904,Asheville City Market,http://asapconnections.org/citymarket,http://asapconnections.org/citymarket,https://www.facebook.com/AshevilleCityMarket,https://www.facebook.com/AshevilleCityMarket,https://twitter.com/avlcitymarket,https://twitter.com/avlcitymarket,,,,,01/01/2016 to 12/31/2016,2016-01-01,2016-12-31,Sat: 8:00 AM-12:00 PM;,Sat: 8:00 AM-12:00 PM,,,,,,,,,,,,,,,,,,,,,,,,,,,,,,,,
1008905,Asheville City Market - South,http://asapconnections.org/citymarket,http://asapconnections.org/citymarket,https://www.facebook.com/AshevilleCityMarket,https://www.facebook.com/AshevilleCityMarket,https://twitter.com/avlcitymarket,https://twitter.com/avlcitymarket,,,,,04/06/2016 to 10/26/2016,2016-04-06,2016-10-26,Wed: 12:00 PM-4:00 PM;,Wed: 12:00 PM-4:00 PM,,,,,,,,,,,,,,,,,,,,,,,,,,,,,,,,
1000887,Ashfield Farmers Market,http://www.ashfieldfarmersmarket.com,http://www.ashfieldfarmersmarket.com,,,,,,,,,,,,,,,,,,,,,,,,,,,,,,,,,,,,,,,,,,,,,
1007501,Ashford Farmers’ Market,,,,,,,,,,,,,,,,,,,,,,,,,,,,,,,,,,,,,,,,,,,,,,,
1005158,Ashland Area Farmers Market,http://www.ashlandareafarmersmarket.com/,http://www.ashlandareafarmersmarket.com/,,,,,,,,,06/06/2015 to 10/10/2015,2015-06-06,2015-10-10,Sat: 8:00 AM-12:00 PM;,Sat: 8:00 AM-12:00 PM,,,,,,,,,,,,,,,,,,,,,,,,,,,,,,,,
1008897,Ashland Farmers Market,http://www.facebook.com/ashlandfarmersmarket,http://www.facebook.com/ashlandfarmersmarket,https://www.facebook.com/ashlandfarmersmarket,https://www.facebook.com/ashlandfarmersmarket,https://twitter.com/ashlandvafm,https://twitter.com/ashlandvafm,,,,,05/07/2016 to 11/05/2016,2016-05-07,2016-11-05,Sat: 9:00 AM-12:00 PM;,Sat: 9:00 AM-12:00 PM,,,,,,,,,,,,,,,,,,,,,,,,,,,,,,,,
1009810,Ashland Farmers Market,http://www.ashlandfarmersmarket.org/,http://www.ashlandfarmersmarket.org/,https://www.facebook.com/AshlandMAFarmersMarket,https://www.facebook.com/AshlandMAFarmersMarket,,,,,,,06/11/2016 to 10/08/2016,2016-06-11,2016-10-08,Sat: 9:00 AM-1:00 PM;,Sat: 9:00 AM-1:00 PM,,,,,,,,,,,,,,,,,,,,,,,,,,,,,,,,
1007787,Ashland Tuesday Market,http://www.rvgrowersmarket.com,http://www.rvgrowersmarket.com,,,,,,,,,,,,,,,,,,,,,,,,,,,,,,,,,,,,,,,,,,,,,
1000465,Ashland United Methodist Church Farmers Market,http://www.ashlandumc.com/gallery/seeds/seeds.htm,http://www.ashlandumc.com/gallery/seeds/seeds.htm,,,,,,,,,,,,,,,,,,,,,,,,,,,,,,,,,,,,,,,,,,,,,
1003642,Ashley County Farmers Market,,,,,,,,,,,,,,,,,,,,,,,,,,,,,,,,,,,,,,,,,,,,,,,
1006964,Ashley Farmers Market,,,,,,,,,,,,,,,,,,,,,,,,,,,,,,,,,,,,,,,,,,,,,,,
1000836,Ashley Valley Farmers Market (vernal),http://www.avfarmersmarket.com,http://www.avfarmersmarket.com,,,,,,,,,July to September,2010-07-01,2010-09-30,Sat:8:00 AM - 12:00 PM;,Sat:8:00 AM - 12:00 PM,,,,,,,,,,,,,,,,,,,,,,,,,,,,,,,,
1008599,Ashmont/peabody Square Farmers Market,http://www.smams.org,http://www.smams.org,https://www.facebook.com/AshmontPeabodySquareMarket,https://www.facebook.com/AshmontPeabodySquareMarket,https://twitter.com/AshmontFarmMkt,https://twitter.com/AshmontFarmMkt,,,,,06/26/2015 to 10/16/2015,2015-06-26,2015-10-16,Fri: 3:00 PM-7:00 PM;,Fri: 3:00 PM-7:00 PM,,,,,,,,,,,,,,,,,,,,,,,,,,,,,,,,
1004530,Ashotn Farmers Market,http://www.gardenshelper.blogspot.com,http://www.gardenshelper.blogspot.com,,,,,,,,,,,,,,,,,,,,,,,,,,,,,,,,,,,,,,,,,,,,,
1009244,Ashtabula Farmers Market,,,https://www.facebook.com/AshtabulaFarmersMarket,https://www.facebook.com/AshtabulaFarmersMarket,,,,,,,,,,,,,,,,,,,,,,,,,,,,,,,,,,,,,,,,,,,
1004692,Aspen Grove Farmers Market,http://www.denverfarmersmarket.com,http://www.denverfarmersmarket.com,https://www.facebook.com/denverfarmersmarket,https://www.facebook.com/denverfarmersmarket,,,,,,,06/17/2015 to 10/28/2015,2015-06-17,2015-10-28,Wed: 10:00 AM-2:00 PM;,Wed: 10:00 AM-2:00 PM,,,,,,,,,,,,,,,,,,,,,,,,,,,,,,,,
1005837,Aspen Saturday Market,,,,,,,,,,,,,,,,,,,,,,,,,,,,,,,,,,,,,,,,,,,,,,,
1000086,Astoria Greenmarket,http://www.grownyc.org,http://www.grownyc.org,https://www.facebook.com/QueensGreenmarkets,https://www.facebook.com/QueensGreenmarkets,,,,,,,07/10/2013 to 11/20/2013,2013-07-10,2013-11-20,Wed: 8:00 AM-3:00 PM;,Wed: 8:00 AM-3:00 PM,,,,,,,,,,,,,,,,,,,,,,,,,,,,,,,,
1003661,Astoria Sunday Market,http://www.AstoriaSundayMarket.com,http://www.AstoriaSundayMarket.com,,,,,,,,,05/12/2013 to 10/13/2013,2013-05-12,2013-10-13,Sun: 10:00 AM-3:00 PM;,Sun: 10:00 AM-3:00 PM,,,,,,,,,,,,,,,,,,,,,,,,,,,,,,,,
1001245,Asu Regional Farmers Market,http://www.asuregionalfarmersmarket.org,http://www.asuregionalfarmersmarket.org,https://www.facebook.com/asuregionalfarmersmarket,https://www.facebook.com/asuregionalfarmersmarket,https://twitter.com/asufarmersmarket,https://twitter.com/asufarmersmarket,,,,,05/02/2015 to 05/30/2015,2015-05-02,2015-05-30,Sat: 7:00 AM-1:00 PM;,Sat: 7:00 AM-1:00 PM,,,,,,,06/02/2015 to 09/29/2015,6/2/15, 09/29/2015,Tue: 12:00 PM-5:30 PM;Sat: 7:00 AM-1:00 PM;,Tue: 12:00 PM-5:30 PM,Sat: 7:00 AM-1:00 PM,,,,,,10/3/15, 10/24/2015,Sat: 7:00 AM-1:00 PM;,Sat: 7:00 AM-1:00 PM,,,,,,,,,,,
1004818,Asuep Natchez Farmers Market,,,,,,,,,,,06/01/2012 to 11/31/2012,2012-06-01,,,,,,,,,,12/01/2012 to 05/31/2012,12/1/12, 05/31/2012,,,,,,,,,,,,,,,,,,,,,,,
1009516,Atacs Capitan Farmers Market,http://www.ataclincolncounty.org,http://www.ataclincolncounty.org,https://www.facebook.com/pages/Capitan-Farmers-Market/160832100703579,https://www.facebook.com/pages/Capitan-Farmers-Market/160832100703579,,,,,,,,,,,,,,,,,,,,,,,,,,,,,,,,,,,,,,,,,,,
1009447,Atascadero Farmers Market,http://www.northcountyfarmersmarkets.com/,http://www.northcountyfarmersmarkets.com/,https://www.facebook.com/NorthCountyFarmersMarkets,https://www.facebook.com/NorthCountyFarmersMarkets,,,,,,,,,,,,,,,,,,,,,,,,,,,,,,,,,,,,,,,,,,,
1003911,Atascadero Farmers Market,,,,,,,,,,,,,,,,,,,,,,,,,,,,,,,,,,,,,,,,,,,,,,,
1001294,Atascadero Main Street Cfm,,,,,,,,,,,,,,,,,,,,,,,,,,,,,,,,,,,,,,,,,,,,,,,
1002984,Atchison Farmers Market,http://www.atchisonfarmersmarket.com,http://www.atchisonfarmersmarket.com,,,,,,,,,April to October,2010-04-01,2010-10-31,Wed:2:30 PM - 5:30 PM;Sat:8:00 AM - 12:00 PM;,Wed:2:30 PM - 5:30 PM,Sat:8:00 AM - 12:00 PM,,,,,,,,,,,,,,,,,,,,,,,,,,,,,,,
1000448,Athen Farmers Market,,,www.Facebook.com/athensfarmersmarket,,,,,,,,06/07/2013 to 09/30/2013,2013-06-07,2013-09-30,Fri: 2:00 PM-6:00 PM;,Fri: 2:00 PM-6:00 PM,,,,,,,,,,,,,,,,,,,,,,,,,,,,,,,,
1003223,Athens Farmers Market,,,,,,,,,,,,,,,,,,,,,,,,,,,,,,,,,,,,,,,,,,,,,,,
1005086,Athens Farmers Market,http://www.athensfarmersmarket.org,http://www.athensfarmersmarket.org,https://www.facebook.com/pages/Athens-Farmers-Market,https://www.facebook.com/pages/Athens-Farmers-Market,,,,,,,01/01/2016 to 12/31/2016,2016-01-01,2016-12-31,Wed: 9:00 AM-12:00 PM;Thu: 4:00 PM-7:00 PM;Sat: 9:00 AM-12:00 PM;,Wed: 9:00 AM-12:00 PM,Thu: 4:00 PM-7:00 PM,Sat: 9:00 AM-12:00 PM,,,,,,,,,,,,,,,,,,,,,,,,,,,,,,
1010034,Athens Farmers Market At Market Park,http://cityofathenstn.com/parks,http://cityofathenstn.com/parks,,,,,,,,,06/17/2014 to 10/30/2014,2014-06-17,2014-10-30,Tue: 4:00 PM-6:00 PM;Thu: 4:00 PM-6:00 PM;Sat: 5:00 PM-9:00 PM;,Tue: 4:00 PM-6:00 PM,Thu: 4:00 PM-6:00 PM,Sat: 5:00 PM-9:00 PM,,,,,,,,,,,,,,,,,,,,,,,,,,,,,,
1008974,Athens Farmers Market Downtown,http://www.athensfarmersmarket.net,http://www.athensfarmersmarket.net,https://www.facebook.com/AthensFarmersMarket,https://www.facebook.com/AthensFarmersMarket,https://twitter.com/AthFarmersMkt,https://twitter.com/AthFarmersMkt,,,INSTAGRAM: athensfarmersmarket,INSTAGRAM: athensfarmersmarket,04/09/2014 to 10/29/2014,2014-04-09,2014-10-29,Wed: 4:00 PM-7:00 PM;,Wed: 4:00 PM-7:00 PM,,,,,,,,,,,,,,,,,,,,,,,,,,,,,,,,
1008857,"Athens Farmers Market, Llc",http://athensfarmersmarket.net,http://athensfarmersmarket.net,https://www.facebook.com/AthensFarmersMarket,https://www.facebook.com/AthensFarmersMarket,https://twitter.com/AthFarmersMkt,https://twitter.com/AthFarmersMkt,,,https://www.instagram.com/athensfarmersmarket/,https://www.instagram.com/athensfarmersmarket/,04/02/2016 to 12/17/2016,2016-04-02,2016-12-17,Sat: 8:00 AM-12:00 PM;,Sat: 8:00 AM-12:00 PM,,,,,,,,,,,,,,,,,,,,,,,,,,,,,,,,
1000297,Athens Locally Grown,http://www.athens.locallygrown.net,http://www.athens.locallygrown.net,,,,,,,,,January to December,2010-01-01,2010-12-31,Thu:4:30 PM - 8:00 PM;,Thu:4:30 PM - 8:00 PM,,,,,,,,,,,,,,,,,,,,,,,,,,,,,,,,
1011861,Athens Saturday Market,http://www.athenssaturdaymarket.com,http://www.athenssaturdaymarket.com,athenssaturdaymarket,,@AthensMarket,@AthensMarket,,,"Twitter , instagram","Twitter , instagram",06/04/2016 to 08/27/2016,2016-06-04,2016-08-27,Sat: 8:00 AM-12:00 PM;,Sat: 8:00 AM-12:00 PM,,,,,,,,,,,,,,,,,,,,,,,,,,,,,,,,
1002987,Atherton Market,http://www.athertonmillandmarket.com,http://www.athertonmillandmarket.com,https://www.facebook.com/athertonmillandmarket,https://www.facebook.com/athertonmillandmarket,athertonmillmkt,,,,Instagram @athertonmillmkt,http://www.instagram.com/athertonmillmkt,,,,Mon: 9:00 AM-6:00 PM;Tue: 9:00 AM-6:00 PM;Wed: 9:00 AM-6:00 PM;Thu: 9:00 AM-6:00 PM;Fri: 9:00 AM-6:00 PM;Sat: 9:00 AM-6:00 PM;,Mon: 9:00 AM-6:00 PM,Tue: 9:00 AM-6:00 PM,Wed: 9:00 AM-6:00 PM,Thu: 9:00 AM-6:00 PM,Fri: 9:00 AM-6:00 PM,Sat: 9:00 AM-6:00 PM,,,,,,,,,,,,,,,,,,,,,,,,,,,
1000750,Athol Farmers Market,http://www.townofathol.org,http://www.townofathol.org,,,,,,,,,June to October,2010-06-01,2010-10-31,Sat:9:00 AM - 12:00 PM;,Sat:9:00 AM - 12:00 PM,,,,,,,,,,,,,,,,,,,,,,,,,,,,,,,,
1006095,Atlanta State Farmers Market,,,,,,,,,,,,,,,,,,,,,,,,,,,,,,,,,,,,,,,,,,,,,,,
1000708,Atlantic City Farmers Market,http://www.acsid.com,http://www.acsid.com,,,,,,,,,July to October,2010-07-01,2010-10-31,Thu:10:00 am - 4:00 pm;Sat:10:00 am - 4:00 pm;,Thu:10:00 am - 4:00 pm,Sat:10:00 am - 4:00 pm,,,,,,,,,,,,,,,,,,,,,,,,,,,,,,,
1000464,Atlantic Farmers Market,,,,,,,,,,,,,,,,,,,,,,,,,,,,,,,,,,,,,,,,,,,,,,,
1006303,Atlantic Highlands Chamber Of Commerce Farmers Market,http://www.AtlanticHighlands.org,http://www.AtlanticHighlands.org,Atlantic Highlands Farmers Market,,,,,,,,06/03/2016 to 10/07/2016,2016-06-03,2016-10-07,Fri: 12:00 PM-6:00 PM;,Fri: 12:00 PM-6:00 PM,,,,,,,,,,,,,,,,,,,,,,,,,,,,,,,,
1001992,Atmore Farmers Market,,,,,,,,,,,,,,,,,,,,,,,,,,,,,,,,,,,,,,,,,,,,,,,
1001503,Attala County Farmers Market,,,https://www.facebook.com/pages/Attala-County-Farmers-Market/244536342327690,https://www.facebook.com/pages/Attala-County-Farmers-Market/244536342327690,,,,,,,,,,Sat: 7:00 AM-12:00 PM;,Sat: 7:00 AM-12:00 PM,,,,,,,,,,,,,,,,,,,,,,,,,,,,,,,,
1002860,Attalla City Farmers Market,,,https://www.facebook.com/pages/City-of-Attalla/123797897678490,https://www.facebook.com/pages/City-of-Attalla/123797897678490,,,,,,,06/06/2013 to 09/26/2013,2013-06-06,2013-09-26,Thu: 2:00 PM-6:00 PM;,Thu: 2:00 PM-6:00 PM,,,,,,,,,,,,,,,,,,,,,,,,,,,,,,,,
1004743,Attleboro Farmers Market,http://www.attleborofarmersmarket.com,http://www.attleborofarmersmarket.com,https://www.facebook.com/AttFrmMkt,https://www.facebook.com/AttFrmMkt,,,,,,,06/14/2014 to 10/25/2014,2014-06-14,2014-10-25,Sat: 9:00 AM-1:00 PM;,Sat: 9:00 AM-1:00 PM,,,,,,,,,,,,,,,,,,,,,,,,,,,,,,,,
1012102,Attleboro Farmers Market,http://www.attleborofarmersmarket@gmail.com,http://www.attleborofarmersmarket@gmail.com,,,,,,,,,06/18/2016 to 10/29/2016,2016-06-18,2016-10-29,Sat: 9:00 AM-1:00 PM;,Sat: 9:00 AM-1:00 PM,,,,,,,,,,,,,,,,,,,,,,,,,,,,,,,,
1010003,Atwater Village Farmers Market,http://www.seela.org/atwater-village-farmers-market/,http://www.seela.org/atwater-village-farmers-market/,https://www.facebook.com/pages/Atwater-Village-Farmers-Market/336210064056,https://www.facebook.com/pages/Atwater-Village-Farmers-Market/336210064056,https://twitter.com/AtwaterFM,https://twitter.com/AtwaterFM,,,www.instagram.com/atwatervillagefm,www.instagram.com/atwatervillagefm,01/01/2014 to 12/31/2014,2014-01-01,2014-12-31,Sun: 10:00 AM-2:00 PM;,Sun: 10:00 AM-2:00 PM,,,,,,,,,,,,,,,,,,,,,,,,,,,,,,,,
1000655,Auburn Dewitt Center Farmers Market,http://www.foothillfarmersmarket.com,http://www.foothillfarmersmarket.com,,,,,,,,,,,,,,,,,,,,,,,,,,,,,,,,,,,,,,,,,,,,,
1006311,Auburn Farmers Market,http://www.cityofauburn-ga.org/,,,,,,,,,,June to September,2010-06-01,2010-09-30,Wed:3:00 PM - 7:00 PM;,Wed:3:00 PM - 7:00 PM,,,,,,,,,,,,,,,,,,,,,,,,,,,,,,,,
1002377,Auburn Farmers Co-op Market Inc.,http://www.Auburnfarmerscoopmarketinc.com,http://www.Auburnfarmerscoopmarketinc.com,https://www.facebook.com/AuburnFarmersCoOpMarketInc,https://www.facebook.com/AuburnFarmersCoOpMarketInc,https://twitter.com/AuburnMarket,https://twitter.com/AuburnMarket,,,,,06/03/2014 to 10/30/2014,2014-06-03,2014-10-30,Tue: 7:00 AM-2:00 PM;Thu: 7:00 AM-2:00 PM;Sat: 7:00 AM-2:00 PM;,Tue: 7:00 AM-2:00 PM,Thu: 7:00 AM-2:00 PM,Sat: 7:00 AM-2:00 PM,,,,,,,,,,,,,,,,,,,,,,,,,,,,,,
1001349,Auburn Farmers Market,,,,,,,,,,,,,,,,,,,,,,,,,,,,,,,,,,,,,,,,,,,,,,,
1003772,Auburn Farmers Market,http://www.auburnpres.org,http://www.auburnpres.org,,,,,,,,,04/29/2014 to 09/30/2014,2014-04-29,2014-09-30,Tue: 1:00 PM-6:00 PM;,Tue: 1:00 PM-6:00 PM,,,,,,,,,,,,,,,,,,,,,,,,,,,,,,,,
1006712,Auburn Farmers Market,,,,,,,,,,,,,,,,,,,,,,,,,,,,,,,,,,,,,,,,,,,,,,,
1006410,Auburn Hills Farmers Market,http://www.auburnhills.org/farmersmarket,http://www.auburnhills.org/farmersmarket,,,,,,,,,06/06/2014 to 09/26/2014,2014-06-06,2014-09-26,Thu: 2:30 PM-6:30 PM;,Thu: 2:30 PM-6:30 PM,,,,,,,,,,,,,,,,,,,,,,,,,,,,,,,,
1011950,Auburn International Farmers Market,http://www.auburnfarmersmarket.org/,http://www.auburnfarmersmarket.org/,https://www.facebook.com/AuburnInternationalFarmersMarket/,https://www.facebook.com/AuburnInternationalFarmersMarket/,https://twitter.com/AuburnFarmerMkt,https://twitter.com/AuburnFarmerMkt,,,,,06/05/2016 to 09/25/2016,2016-06-05,2016-09-25,Sun: 10:00 AM-3:00 PM;,Sun: 10:00 AM-3:00 PM,,,,,,,,,,,,,,,,,,,,,,,,,,,,,,,,
1001569,Auburn Marketplace Farmers Market,,,,,,,,,,,,,,,,,,,,,,,,,,,,,,,,,,,,,,,,,,,,,,,
1000736,Auburn Old Town Farmers Market,http://www.foothillfarmersmarket.com,http://www.foothillfarmersmarket.com,,,,,,,,,,,,,,,,,,,,,,,,,,,,,,,,,,,,,,,,,,,,,
1003923,Audubon Farmers Market,http://www.audubonneighborhood.org/content/audubon-farmers’-market,,,,,,,,,,June to September,2010-06-01,2010-09-30,Thu:4:00 PM - 7:00 PM;,Thu:4:00 PM - 7:00 PM,,,,,,,,,,,,,,,,,,,,,,,,,,,,,,,,
1005375,Audubon Farmers Market,,,,,,,,,,,,,,,,,,,,,,,,,,,,,,,,,,,,,,,,,,,,,,,
1008999,Audubon Park Community Market,http://audubonmarket.com/,http://audubonmarket.com/,https://www.facebook.com/apmarket,https://www.facebook.com/apmarket,https://twitter.com/apmarket,https://twitter.com/apmarket,,,,,01/01/2014 to 12/31/2014,2014-01-01,2014-12-31,Mon: 6:00 PM-10:00 PM;,Mon: 6:00 PM-10:00 PM,,,,,,,,,,,,,,,,,,,,,,,,,,,,,,,,
1003866,Augsburg Farmers Market,http://www.iatp.org/minimarkets,http://www.iatp.org/minimarkets,,,,,,,,,,,,,,,,,,,,,,,,,,,,,,,,,,,,,,,,,,,,,
1004300,Augusta Farmers Market At Mill Park,http://www.augustamaine.gov/index.asp?Type=B_BASIC&SEC={FFE91C07-6389-4065-B49A-6EEF08D7D3B5}&DE=,,,,,,,,,,,,,,,,,,,,,,,,,,,,,,,,,,,,,,,,,,,,,,
1000870,Augusta State Farmers Market,http://WWW.AGR.GEORGIA.GOV,,,,,,,,,,January to December,2010-01-01,2010-12-31,Mon:7:00 AM - 7:00 PM;Tue:7:00 AM - 7:00 PM;Wed:7:00 AM - 7:00 PM;Thu:7:00 AM - 7:00 PM;Fri:7:00 AM - 7:00 PM;Sat:7:00 AM - 3:30 PM;,Mon:7:00 AM - 7:00 PM,Tue:7:00 AM - 7:00 PM,Wed:7:00 AM - 7:00 PM,Thu:7:00 AM - 7:00 PM,Fri:7:00 AM - 7:00 PM,Sat:7:00 AM - 3:30 PM,,,,,,,,,,,,,,,,,,,,,,,,,,,
1000559,Aurora Local Farmers Market - Summer Market,,,,,,,,,,,04/06/2013 to 10/26/2013,2013-04-06,2013-10-26,Mon: -12:00 PM;Sat: 8:00 AM-;,Mon: -12:00 PM,Sat: 8:00 AM-,,,,,,,,,,,,,,,,,,,,,,,,,,,,,,,
1005604,Aurora Local Farmers Market,,,Aurora Local Farmers Market,,,,,,,,05/01/2013 to 10/31/2013,2013-05-01,2013-10-31,Wed: 8:00 AM-12:00 PM;Sat: 7:00 AM-12:00 PM;,Wed: 8:00 AM-12:00 PM,Sat: 7:00 AM-12:00 PM,,,,,,11/04/2015 to 02/27/2016,11/4/15, 02/27/2016,Sat: 9:00 AM-12:00 PM;,Sat: 9:00 AM-12:00 PM,,,,,,,,,,,,,,,,,,,,,
1010694,Aurora Local Farmers Market - Winter Market,http://agrimissouri.com/mo-grown/grodetail.php?type=mo-grown&ID=1663,http://agrimissouri.com/mo-grown/grodetail.php?type=mo-grown&ID=1663,,,,,,,,,11/01/2014 to 02/28/2015,2014-11-01,2015-02-28,Sat: 7:00 AM-12:00 PM;,Sat: 7:00 AM-12:00 PM,,,,,,,,,,,,,,,,,,,,,,,,,,,,,,,,
1011929,Auroras Farmers Market Downtown,http://www.aurorasfarmersmarket@aurora-il.org,,https://www.facebook.com/Friends.AFM.Aurora.IL/,https://www.facebook.com/Friends.AFM.Aurora.IL/,,,,,,,06/11/2016 to 10/15/2016,2016-06-11,2016-10-15,Sat: 8:00 AM-12:00 PM;,Sat: 8:00 AM-12:00 PM,,,,,,,,,,,,,,,,,,,,,,,,,,,,,,,,
1011927,Auroras Farmers Market East,,,https://www.facebook.com/Friends.AFM.Aurora.IL/,https://www.facebook.com/Friends.AFM.Aurora.IL/,,,,,,,07/07/2016 to 08/25/2016,2016-07-07,2016-08-25,Thu: 10:00 AM-2:00 PM;,Thu: 10:00 AM-2:00 PM,,,,,,,,,,,,,,,,,,,,,,,,,,,,,,,,
1011928,Auroras Farmers Market West,http://ww.aurorasfarmersmarket.com,http://ww.aurorasfarmersmarket.com,https://www.facebook.com/Friends.AFM.Aurora.IL/,https://www.facebook.com/Friends.AFM.Aurora.IL/,,,,,,,07/06/2016 to 09/28/2016,2016-07-06,2016-09-28,Wed: 12:00 PM-5:00 PM;,Wed: 12:00 PM-5:00 PM,,,,,,,,,,,,,,,,,,,,,,,,,,,,,,,,
1001695,Ausable Valley Farmers Market,,,https://www.facebook.com/pages/Ausable-Valley-Farmers-Market/124928937581337,https://www.facebook.com/pages/Ausable-Valley-Farmers-Market/124928937581337,,,,,,,June to September,2010-06-01,2010-09-30,Fri:4:00 pm - 7:00 pm;,Fri:4:00 pm - 7:00 pm,,,,,,,,,,,,,,,,,,,,,,,,,,,,,,,,
1002491,Austin (chicago) Farmers Market,http://www.cityofchicago.org/specialevents,http://www.cityofchicago.org/specialevents,,,,,,,,,,,,,,,,,,,,,,,,,,,,,,,,,,,,,,,,,,,,,
1012430,Austin Farmers Market,http://www.eatfreshaustin.com,http://www.eatfreshaustin.com,https://www.facebook.com/austinfarmersmarket/,https://www.facebook.com/austinfarmersmarket/,https://twitter.com/EatFreshAustin,https://twitter.com/EatFreshAustin,,,,,05/02/2016 to 10/29/2016,2016-05-02,2016-10-29,Mon: 4:00 PM-7:00 PM;Thu: 4:00 PM-7:00 PM;Sat: 9:00 AM-12:00 PM;,Mon: 4:00 PM-7:00 PM,Thu: 4:00 PM-7:00 PM,Sat: 9:00 AM-12:00 PM,,,,,,,,,,,,,,,,,,,,,,,,,,,,,,
1011490,Austintown Farmers Market,http://www.facebook.com/austintownfarmersmarket,http://www.facebook.com/austintownfarmersmarket,Austintown Farmers Market,,AustintownFM,,,,Instagram: AustintownFM,Instagram:  AustintownFM,06/08/2015 to 08/29/2016,2015-06-08,2016-08-29,Mon: 5:00 PM-8:00 PM;,Mon: 5:00 PM-8:00 PM,,,,,,,,,,,,,,,,,,,,,,,,,,,,,,,,
1011826,Authentically Ajo Farmers Market,http://www.ajocsa.com (under construction),,Authentically Ajo Farmers Market,,,,,,,,10/01/2016 to 03/01/2017,2016-10-01,2017-03-01,Thu: 3:00 PM-6:00 PM;Sat: 9:00 AM-12:00 PM;,Thu: 3:00 PM-6:00 PM,Sat: 9:00 AM-12:00 PM,,,,,,04/01/2017 to 06/30/2017,4/1/17, 06/30/2017,Thu: 5:00 AM-7:00 PM;,Thu: 5:00 AM-7:00 PM,,,,,,,,,,,,,,,,,,,,,
1005376,Ava Farmers Market,,,,,,,,,,,,,,,,,,,,,,,,,,,,,,,,,,,,,,,,,,,,,,,
1010695,Ava Growers Market,http://www.usdalocalfooddirectories.com/farmersmarketdirectoryupdate/FM_BasicInfo.aspx?source=en&did=Wr9I0nOZZPBL7IAEse8z5w%3d%3d&cid=TaSF3iA3jK80vXTmtxIL3A==,http://www.usdalocalfooddirectories.com/farmersmarketdirectoryupdate/FM_BasicInfo.aspx?source=en&did=Wr9I0nOZZPBL7IAEse8z5w%3d%3d&cid=TaSF3iA3jK80vXTmtxIL3A==,,,,,,,,,04/01/2014 to 10/31/2014,2014-04-01,2014-10-31,Sat: 7:00 AM-12:00 PM;,Sat: 7:00 AM-12:00 PM,,,,,,,,,,,,,,,,,,,,,,,,,,,,,,,,
1003539,Aventura Mall Market,http://www.rhemrketcompany.org,http://www.rhemrketcompany.org,,,,,,,,,February to September,2010-02-01,2010-09-30,Sat:10:00 AM - 9:30 PM;sun:12:00 PM - 8:00 PM;,Sat:10:00 AM - 9:30 PM,sun:12:00 PM - 8:00 PM,,,,,,,,,,,,,,,,,,,,,,,,,,,,,,,
1007033,Avery County Farmers Market,,,,,,,,,,,,,,,,,,,,,,,,,,,,,,,,,,,,,,,,,,,,,,,
1010061,Avon Farmers Market,http://www.avongov.org,http://www.avongov.org,,,,,,,,,,,,Tue: 4:00 PM-7:00 PM;,Tue: 4:00 PM-7:00 PM,,,,,,,,,,,,,,,,,,,,,,,,,,,,,,,,
1011092,Avon Lake Farmers Market,http://avonlakefarmersmarket.org,http://avonlakefarmersmarket.org,https://www.facebook.com/pages/Avon-Lake-Farmers-Market/1402286433426690?ref=tn_tnmn,https://www.facebook.com/pages/Avon-Lake-Farmers-Market/1402286433426690?ref=tn_tnmn,,,,,,,06/07/2016 to,2016-06-07,,Tue: 3:00 PM-6:00 PM;,Tue: 3:00 PM-6:00 PM,,,,,,,,,,,,,,,,,,,,,,,,,,,,,,,,
1000898,Avon Market Days,http://www.avonfarmersmarket.org,http://www.avonfarmersmarket.org,,,,,,,,,06/19/2013 to 10/16/2013,2013-06-19,2013-10-16,Wed: 3:00 PM-6:00 PM;,Wed: 3:00 PM-6:00 PM,,,,,,,,,,,,,,,,,,,,,,,,,,,,,,,,
1009298,Avon Park Farmers Market,,,https://www.facebook.com/avonparkfarmersmarket,https://www.facebook.com/avonparkfarmersmarket,,,,,,,,,,,,,,,,,,,,,,,,,,,,,,,,,,,,,,,,,,,
1007131,Avondale Farmers Market,,,,,,,,,,,,,,,,,,,,,,,,,,,,,,,,,,,,,,,,,,,,,,,
1000502,Awendaw Farmers And Fresh Seafood Market,,,,,,,,,,,,,,,,,,,,,,,,,,,,,,,,,,,,,,,,,,,,,,,
1003520,Aya Community Markets,http://www.dreamingoutloud.org/programs/ayamarkets/,http://www.dreamingoutloud.org/programs/ayamarkets/,,,,,,,,,April to November,2010-04-01,2010-11-30,Sat:10:00 AM - 3:00 PM;,Sat:10:00 AM - 3:00 PM,,,,,,,,,,,,,,,,,,,,,,,,,,,,,,,,
1007435,Ayer Farmers Market,,,,,,,,,,,,,,,,,,,,,,,,,,,,,,,,,,,,,,,,,,,,,,,
1006907,Azalea Street Marketplace,,,,,,,,,,,,,,,,,,,,,,,,,,,,,,,,,,,,,,,,,,,,,,,
1004803,Aztec Farmers Market,,,,,,,,,,,07/09/2014 to 10/31/2014,2014-07-09,2014-10-31,Wed: 4:30 PM-7:00 PM;,Wed: 4:30 PM-7:00 PM,,,,,,,,,,,,,,,,,,,,,,,,,,,,,,,,
1010696,B2b (back To Basics) Farmers Maket - Pineville,http://agrimissouri.com/mo-grown/grodetail.php?type=mo-grown&ID=2057,http://agrimissouri.com/mo-grown/grodetail.php?type=mo-grown&ID=2057,,,,,,,,,05/05/2015 to 10/27/2015,2015-05-05,2015-10-27,Tue: 8:00 AM-2:00 PM;,Tue: 8:00 AM-2:00 PM,,,,,,,,,,,,,,,,,,,,,,,,,,,,,,,,
1005235,B2b (back To Basics) Farmers Market,,,,,,,,,,,May to October,2010-05-01,2010-10-31,Sat:8:00 AM - 12:00 PM;,Sat:8:00 AM - 12:00 PM,,,,,,,,,,,,,,,,,,,,,,,,,,,,,,,,
1010697,B2b Farmers Market- Thursdays,http://agrimissouri.com/mo-grown/grodetail.php?type=mo-grown&ID=273,http://agrimissouri.com/mo-grown/grodetail.php?type=mo-grown&ID=273,,,,,,,,,05/01/2014 to 10/29/2014,2014-05-01,2014-10-29,Thu: 8:00 AM-2:00 PM;,Thu: 8:00 AM-2:00 PM,,,,,,,,,,,,,,,,,,,,,,,,,,,,,,,,
1002624,Back Mountain Farmers Market,,,,,,,,,,,,,,,,,,,,,,,,,,,,,,,,,,,,,,,,,,,,,,,
1000029,Bagley Area Farmrs Market,http://www.bagleyareafarmersmarkeet.com,http://www.bagleyareafarmersmarkeet.com,,,,,,,,,July to October,2010-07-01,2010-10-31,Fri:4:00 pm - 6:00 pm;,Fri:4:00 pm - 6:00 pm,,,,,,,,,,,,,,,,,,,,,,,,,,,,,,,,
1005228,Bagnell Dam Farmers Market,,,,,,,,,,,May to October,2010-05-01,2010-10-31,Fri:8:00 AM - 12:00 PM;,Fri:8:00 AM - 12:00 PM,,,,,,,,,,,,,,,,,,,,,,,,,,,,,,,,
1010608,Bainbridge Farmers Market,http://www.thebainbridgefarmersmarket.com/,http://www.thebainbridgefarmersmarket.com/,https://www.facebook.com/bainbridgemkt?fref=ts,https://www.facebook.com/bainbridgemkt?fref=ts,https://twitter.com/@bainbridgemkt,https://twitter.com/@bainbridgemkt,,,https://www.instagram.com/bainbridgefarmersmarket/,https://www.instagram.com/bainbridgefarmersmarket/,04/16/2016 to 06/30/2016,2016-04-16,2016-06-30,Sat: 9:00 AM-1:00 PM;,Sat: 9:00 AM-1:00 PM,,,,,,,10/01/2016 to 12/17/2016,10/1/16, 12/17/2016,Sat: 9:00 AM-1:00 PM;,Sat: 9:00 AM-1:00 PM,,,,,,,,,,,,,,,,,,,,,
1004633,Bainbridge Island Farmers Market,http://www.bainbridgefarmersmarket.org,http://www.bainbridgefarmersmarket.org,https://www.facebook.com/BIFarmersMkt,https://www.facebook.com/BIFarmersMkt,https://twitter.com/BIfarmersmkt,https://twitter.com/BIfarmersmkt,,,,,04/12/2014 to 11/15/2014,2014-04-12,2014-11-15,Sat: 9:00 AM-1:00 PM;,Sat: 9:00 AM-1:00 PM,,,,,,,11/22/2014 to 12/20/2014,11/22/14, 12/20/2014,Sat: 9:00 AM-2:00 PM;,Sat: 9:00 AM-2:00 PM,,,,,,,,,,,,,,,,,,,,,
1003411,Baker City Farmers Market,,,https://www.facebook.com/pages/Baker-City-Farmers-Market/106757499355968?ref=hl,https://www.facebook.com/pages/Baker-City-Farmers-Market/106757499355968?ref=hl,,,,,,,06/08/2016 to 10/12/2016,2016-06-08,2016-10-12,Wed: 3:30 PM-6:30 PM;,Wed: 3:30 PM-6:30 PM,,,,,,,,,,,,,,,,,,,,,,,,,,,,,,,,
1000540,Bakersfield Health Dept Cfm,,,,,,,,,,,,,,,,,,,,,,,,,,,,,,,,,,,,,,,,,,,,,,,
1003134,Bakersfield Mt. Vernon Farmers Market,,,,,,,,,,,,,,,,,,,,,,,,,,,,,,,,,,,,,,,,,,,,,,,
1001448,Bakersfield Wall St. Alley Farmers Market,,,,,,,,,,,,,,,,,,,,,,,,,,,,,,,,,,,,,,,,,,,,,,,
1001017,Bakersville Farmers Market,,,,,,,,,,,,,,,,,,,,,,,,,,,,,,,,,,,,,,,,,,,,,,,
1007121,Bald Eagle Valley Methodist Church,,,,,,,,,,,,,,,,,,,,,,,,,,,,,,,,,,,,,,,,,,,,,,,
1004882,Baldwin City Farmers Market,,,,,,,,,,,April to October,2010-04-01,2010-10-31,Sat:7:30 AM - 12:00 PM;,Sat:7:30 AM - 12:00 PM,,,,,,,,,,,,,,,,,,,,,,,,,,,,,,,,
1009475,Baldwin Farmers Market,,,https://www.facebook.com/BaldwinFarmersMarket,https://www.facebook.com/BaldwinFarmersMarket,,,,,,,,,,,,,,,,,,,,,,,,,,,,,,,,,,,,,,,,,,,
1009163,Baldwin Lake Vegetable Market,http://www.baldwinlakenews.com/,http://www.baldwinlakenews.com/,,,,,,,,,,,,,,,,,,,,,,,,,,,,,,,,,,,,,,,,,,,,,
1003720,Baldwin Park Farmers Market,http://www.farmernet.com,http://www.farmernet.com,,,,,,,,,,,,,,,,,,,,,,,,,,,,,,,,,,,,,,,,,,,,,
1008721,Ballard County Farmers Market,,,,,,,,,,,05/15/2013 to 10/31/2013,2013-05-15,2013-10-31,Wed: 8:00 AM-5:00 PM;Thu: 8:00 AM-5:00 PM;Fri: 8:00 AM-5:00 PM;Sat: 8:00 AM-3:00 PM;,Wed: 8:00 AM-5:00 PM,Thu: 8:00 AM-5:00 PM,Fri: 8:00 AM-5:00 PM,Sat: 8:00 AM-3:00 PM,,,,,,,,,,,,,,,,,,,,,,,,,,,,,
1011333,Ballard Farmers Market,http://sfmamarkets.com,http://sfmamarkets.com,Ballard Farmers Market,,@BallardFMKT,@BallardFMKT,,,Seattle_Farmers_Markets Instagram,Seattle_Farmers_Markets   Instagram,01/01/2015 to 12/31/2015,2015-01-01,2015-12-31,Sun: 10:00 AM-3:00 PM;,Sun: 10:00 AM-3:00 PM,,,,,,,,,,,,,,,,,,,,,,,,,,,,,,,,
1006740,Ballston Farmers Market,,,,,,,,,,,,,,,,,,,,,,,,,,,,,,,,,,,,,,,,,,,,,,,
1011939,Ballston Freshfarm Market,http://www.freshfarm.org,http://www.freshfarm.org,https://www.facebook.com/freshfarmmarkets/,https://www.facebook.com/freshfarmmarkets/,https://twitter.com/FRESHFARMBllstn,https://twitter.com/FRESHFARMBllstn,,,,,04/14/2016 to 10/27/2016,2016-04-14,2016-10-27,Thu: 3:00 PM-7:00 PM;,Thu: 3:00 PM-7:00 PM,,,,,,,,,,,,,,,,,,,,,,,,,,,,,,,,
1003662,Ballston Spa Farmers Market,http://www.ballston.org,http://www.ballston.org,,,,,,,,,06/12/2014 to 10/18/2014,2014-06-12,2014-10-18,Thu: 3:00 PM-6:00 PM;Sat: 9:00 AM-12:00 PM;,Thu: 3:00 PM-6:00 PM,Sat: 9:00 AM-12:00 PM,,,,,,,,,,,,,,,,,,,,,,,,,,,,,,,
1003814,Balsam Lake Farmers Market,,,,,,,,,,,,,,,,,,,,,,,,,,,,,,,,,,,,,,,,,,,,,,,
1006519,Baltimore County Farmers Market,http://www.baltimorecountyfarmersmarket.com,http://www.baltimorecountyfarmersmarket.com,,,,,,,,,,,,,,,,,,,,,,,,,,,,,,,,,,,,,,,,,,,,,
1000790,Baltimore Farmers Market,http://www.promotionandarts.org,http://www.promotionandarts.org,,,,,,,,,April to December,2010-04-01,2010-12-31,sun:7:00 AM - 12:00 PM;,sun:7:00 AM - 12:00 PM,,,,,,,,,,,,,,,,,,,,,,,,,,,,,,,,
1001027,Bancroft Street Farmers Market,,,,,,,,,,,,,,,,,,,,,,,,,,,,,,,,,,,,,,,,,,,,,,,
1010688,Bandera Farmers Market,http://www.banderafarmersmarket.org/,http://www.banderafarmersmarket.org/,https://www.facebook.com/pages/Bandera-Farmers-Market/229035860539228,https://www.facebook.com/pages/Bandera-Farmers-Market/229035860539228,,,,,,,01/01/2014 to 12/31/2014,2014-01-01,2014-12-31,Thu: 8:00 AM-11:00 AM;,Thu: 8:00 AM-11:00 AM,,,,,,,,,,,,,,,,,,,,,,,,,,,,,,,,
1008053,Bangor Farmers Market,,,https://www.facebook.com/BangorFarmMarket,https://www.facebook.com/BangorFarmMarket,,,,,,,05/10/2013 to 10/25/2013,2013-05-10,2013-10-25,Fri: 3:00 PM-8:00 PM;,Fri: 3:00 PM-8:00 PM,,,,,,,,,,,,,,,,,,,,,,,,,,,,,,,,
1012081,Bangor Farmers Market,http://www.bangorfarmersmarket.org,http://www.bangorfarmersmarket.org,,,,,,,,,05/01/2016 to 11/20/2016,2016-05-01,2016-11-20,Sun: 11:00 AM-2:00 PM;,Sun: 11:00 AM-2:00 PM,,,,,,,,,,,,,,,,,,,,,,,,,,,,,,,,
1012134,Banning Market Night,,,facebook.com/banningmarketnight,,,,,,,,05/10/2016 to 10/25/2016,2016-05-10,2016-10-25,Tue: 6:00 PM-9:00 PM;,Tue: 6:00 PM-9:00 PM,,,,,,,,,,,,,,,,,,,,,,,,,,,,,,,,
1010152,Bar Harbor Eden Farmers Market,http://www.mdifarmersmarkets.com,http://www.mdifarmersmarkets.com,https://www.facebook.com/BarHarborEdenFarmersMarket,https://www.facebook.com/BarHarborEdenFarmersMarket,,,,,,,05/10/2015 to 10/25/2015,2015-05-10,2015-10-25,Sun: 9:00 AM-12:00 PM;,Sun: 9:00 AM-12:00 PM,,,,,,,,,,,,,,,,,,,,,,,,,,,,,,,,
1002881,Barberville Family Farm Swap And Market,http://www.farmswapmarket.com,http://www.farmswapmarket.com,,,,,,,,,01/01/2012 to 12/31/2012,2012-01-01,2012-12-31,Sat: 6:00 AM-1:00 PM;,Sat: 6:00 AM-1:00 PM,,,,,,,,,,,,,,,,,,,,,,,,,,,,,,,,
1004549,Barbour County Community Garden Market,http://www.heartandhandhouse.org,http://www.heartandhandhouse.org,https://www.facebook.com/bccgardenmarket,https://www.facebook.com/bccgardenmarket,,,,,,,01/01/2014 to,2014-01-01,,Tue: 7:00 AM-5:00 PM;Wed: 7:00 AM-5:00 PM;Thu: 7:00 AM-5:00 PM;Fri: 7:00 AM-5:00 PM;Sat: 7:00 AM-12:00 PM;,Tue: 7:00 AM-5:00 PM,Wed: 7:00 AM-5:00 PM,Thu: 7:00 AM-5:00 PM,Fri: 7:00 AM-5:00 PM,Sat: 7:00 AM-12:00 PM,,,,,,,,,,,,,,,,,,,,,,,,,,,,
1001612,Barbour County Farmers Market,,,,,,,,,,,,,,,,,,,,,,,,,,,,,,,,,,,,,,,,,,,,,,,
1008918,Barclays Center,http://www.grownyc.org,http://www.grownyc.org,https://www.facebook.com/BrooklynGreenmarkets,https://www.facebook.com/BrooklynGreenmarkets,,,,,,,07/17/2013 to 11/27/2013,2013-07-17,2013-11-27,Sat: 8:00 AM-4:00 PM;,Sat: 8:00 AM-4:00 PM,,,,,,,,,,,,,,,,,,,,,,,,,,,,,,,,
1007268,Bardstown Farmers Market,http://www.ces.ca.uky.edu/nelson/bardstownfarmersmarket,http://www.ces.ca.uky.edu/nelson/bardstownfarmersmarket,https://www.facebook.com/pages/Bardstown-Road-Farmers-Market/103858952056,https://www.facebook.com/pages/Bardstown-Road-Farmers-Market/103858952056,,,,,,,05/03/2013 to 10/29/2013,2013-05-03,2013-10-29,Tue: 7:30 AM-12:30 PM;Fri: 7:30 AM-12:30 PM;Sat: 7:30 AM-12:30 PM;,Tue: 7:30 AM-12:30 PM,Fri: 7:30 AM-12:30 PM,Sat: 7:30 AM-12:30 PM,,,,,,,,,,,,,,,,,,,,,,,,,,,,,,
1008466,Barham Cattle Company And Family Farm,http://www.barnhamcattleco.com,http://www.barnhamcattleco.com,https://www.facebook.com/pages/Barham-Cattle-Company-Family-Farm/253576221378846,https://www.facebook.com/pages/Barham-Cattle-Company-Family-Farm/253576221378846,,,,,,,,,,,,,,,,,,,,,,,,,,,,,,,,,,,,,,,,,,,
1003082,Barker Farmers Market,http://www.VillageofBarker@roadrunner.com,http://www.VillageofBarker@roadrunner.com,,,,,,,,,06/12/2014 to 08/28/2014,2014-06-12,2014-08-28,Thu: 5:00 PM-8:00 PM;,Thu: 5:00 PM-8:00 PM,,,,,,,,,,,,,,,,,,,,,,,,,,,,,,,,
1005428,Barkers Island Farmers Market,,,https://www.facebook.com/pages/Barkers-Island-Farmers-Market/529899253797038,https://www.facebook.com/pages/Barkers-Island-Farmers-Market/529899253797038,,,,,,,05/30/2015 to 10/31/2015,2015-05-30,2015-10-31,Sat: 8:00 AM-12:00 PM;,Sat: 8:00 AM-12:00 PM,,,,,,,,,,,,,,,,,,,,,,,,,,,,,,,,
1001604,Barnegat Farmers Market,http://www.barnegat.net,http://www.barnegat.net,,,,,,,,,06/19/2014 to 10/23/2014,2014-06-19,2014-10-23,Thu: 11:00 AM-4:00 PM;,Thu: 11:00 AM-4:00 PM,,,,,,,,,,,,,,,,,,,,,,,,,,,,,,,,
1003211,Barnesville Farmers Market,,,,,,,,,,,,,,,,,,,,,,,,,,,,,,,,,,,,,,,,,,,,,,,
1000353,Barnesville/lamar County Farmers Market,,,,,,,,,,,,,,,,,,,,,,,,,,,,,,,,,,,,,,,,,,,,,,,
1002354,Barre Farmers Market,http://barrefarmersmarket.org,http://barrefarmersmarket.org,https://www.facebook.com/BarreFarmersMarket,https://www.facebook.com/BarreFarmersMarket,,,,,,,10/25/2014 to,2014-10-25,,Sat: 9:00 AM-12:30 PM;,Sat: 9:00 AM-12:30 PM,,,,,,,,,,,,,,,,,,,,,,,,,,,,,,,,
1010903,Barre Farmers Market,http://barrefarmersmarketvt.com,http://barrefarmersmarketvt.com,,,,,,,,,05/16/2015 to 10/17/2015,2015-05-16,2015-10-17,Wed: 3:00 PM-7:00 PM;Sat: 9:00 AM-1:00 PM;,Wed: 3:00 PM-7:00 PM,Sat: 9:00 AM-1:00 PM,,,,,,,,,,,,,,,,,,,,,,,,,,,,,,,
1003976,Barren County Regional Farmers Market,http://www.rebelhome.net/ccrfm.html,http://www.rebelhome.net/ccrfm.html,,,,,,,,,05/02/2014 to 10/31/2014,2014-05-02,2014-10-31,Tue: 8:00 AM-1:00 PM;Fri: 8:00 AM-1:00 PM;,Tue: 8:00 AM-1:00 PM,Fri: 8:00 AM-1:00 PM,,,,,,,,,,,,,,,,,,,,,,,,,,,,,,,
1002269,Barrington Farmers Market,http://www.barringtonfarmersmarket.org,http://www.barringtonfarmersmarket.org,,,,,,,,,,,,,,,,,,,,,,,,,,,,,,,,,,,,,,,,,,,,,
1006364,Barrington Farmers Market,,,,,,,,,,,June to November,2010-06-01,2010-11-30,Tue:3:00 PM - 6:00 PM;,Tue:3:00 PM - 6:00 PM,,,,,,,,,,,,,,,,,,,,,,,,,,,,,,,,
1007010,Barrington Farmers Market,,,,,,,,,,,,,,,,,,,,,,,,,,,,,,,,,,,,,,,,,,,,,,,
1003550,Barry University Green Market,http://www.themarketcompany.org,http://www.themarketcompany.org,,,,,,,,,,,,,,,,,,,,,,,,,,,,,,,,,,,,,,,,,,,,,
1012205,Barryville Farmers Market,http://www.barryvillefarmersmarket.com/,http://www.barryvillefarmersmarket.com/,https://www.facebook.com/barryvillefarmersmarket,https://www.facebook.com/barryvillefarmersmarket,,,,,,,05/14/2016 to 10/29/2016,2016-05-14,2016-10-29,Sat: 10:00 AM-1:00 PM;,Sat: 10:00 AM-1:00 PM,,,,,,,,,,,,,,,,,,,,,,,,,,,,,,,,
1002936,Barstow Market Festival Farmers Market,,,,,,,,,,,,,,,,,,,,,,,,,,,,,,,,,,,,,,,,,,,,,,,
1006001,Bartel Pritchard Square Greenmarket,http://www.grownyc.org/greenmarket,http://www.grownyc.org/greenmarket,,,,,,,,,,,,Wed: 8:00 AM-3:00 PM;,Wed: 8:00 AM-3:00 PM,,,,,,,,,,,,,,,,,,,,,,,,,,,,,,,,
1002564,Bartlesville Farmers Market,http://www.hotmarket.org,http://www.hotmarket.org,,,,,,,,,,,,,,,,,,,,,,,,,,,,,,,,,,,,,,,,,,,,,
1006441,Bartlett Farmers Market,http://www.village.bartlett.il.us,http://www.village.bartlett.il.us,,,,,,,,,,,,,,,,,,,,,,,,,,,,,,,,,,,,,,,,,,,,,
1008194,Bartlett Station Farmers Market,http://www.bartlettstationfarmersmarket.org,http://www.bartlettstationfarmersmarket.org,https://www.facebook.com/bartlettmarket,https://www.facebook.com/bartlettmarket,https://twitter.com/BartSt_FarmMrkt,https://twitter.com/BartSt_FarmMrkt,,,,,05/17/2014 to 09/27/2014,2014-05-17,2014-09-27,Sat: 7:00 AM-12:00 PM;,Sat: 7:00 AM-12:00 PM,,,,,,,,,,,,,,,,,,,,,,,,,,,,,,,,
1009308,Barton Creek Farmers Market,http://www.bartoncreekfarmersmarket.org/,http://www.bartoncreekfarmersmarket.org/,,,,,,,,,,,,,,,,,,,,,,,,,,,,,,,,,,,,,,,,,,,,,
1009402,Barton Creek Farmers Market (highland Mall),http://www.bartoncreekfarmersmarket.org/,http://www.bartoncreekfarmersmarket.org/,,,,,,,,,,,,,,,,,,,,,,,,,,,,,,,,,,,,,,,,,,,,,
1003335,Basalt Sunday Market,http://www.basaltsundaymarket.com,http://www.basaltsundaymarket.com,,,,,,,,,,,,,,,,,,,,,,,,,,,,,,,,,,,,,,,,,,,,,
1010197,Basin Farmers Market,,,,,,,,,,,07/01/2014 to 09/30/2014,2014-07-01,2014-09-30,Wed: 4:30 PM-6:00 PM;,Wed: 4:30 PM-6:00 PM,,,,,,,,,,,,,,,,,,,,,,,,,,,,,,,,
1009522,Bass Lake Center Farmers Market,,,https://www.facebook.com/pages/Bass-Lake-Center-Farmers-Market/217402851617503?sk=info,https://www.facebook.com/pages/Bass-Lake-Center-Farmers-Market/217402851617503?sk=info,,,,,,,,,,,,,,,,,,,,,,,,,,,,,,,,,,,,,,,,,,,
1004987,Bass River Farmers Market,http://www.BassRiverFarmersMarket.org,http://www.BassRiverFarmersMarket.org,https://www.facebook.com/bassriverfarmersmarket,https://www.facebook.com/bassriverfarmersmarket,,,,,,,05/23/2013 to 09/26/2013,2013-05-23,2013-09-26,Thu: 9:00 AM-1:30 PM;Sat: 8:00 AM-12:00 PM;,Thu: 9:00 AM-1:30 PM,Sat: 8:00 AM-12:00 PM,,,,,,,,,,,,,,,,,,,,,,,,,,,,,,,
1000436,Bastrop 1832 Farmers Market,http://www.bastrop1832farmersmarket.org,http://www.bastrop1832farmersmarket.org,https://www.facebook.com/pages/Bastrop-1832-Farmers-Market/118950738119102,https://www.facebook.com/pages/Bastrop-1832-Farmers-Market/118950738119102,https://twitter.com/bastrop1832,https://twitter.com/bastrop1832,,,http://www.pinterest.com/dlpr/bastrop-1832-farmers-market/,http://www.pinterest.com/dlpr/bastrop-1832-farmers-market/,01/01/2016 to 12/31/2016,2016-01-01,2016-12-31,Sat: 10:00 AM-2:00 PM;,Sat: 10:00 AM-2:00 PM,,,,,,,,,,,,,,,,,,,,,,,,,,,,,,,,
1005439,Batavia Farmers Market,http://www.downtownbatavia.com,http://www.downtownbatavia.com,,,,,,,,,June to October,2010-06-01,2010-10-31,Sat:8:00 AM - 12:00 PM;,Sat:8:00 AM - 12:00 PM,,,,,,,,,,,,,,,,,,,,,,,,,,,,,,,,
1006462,Bath County Farmers Market,http://www.bacofarmmkt.com/,http://www.bacofarmmkt.com/,https://www.facebook.com/pages/Bath-County-Farmers-Market/10150097888390157,https://www.facebook.com/pages/Bath-County-Farmers-Market/10150097888390157,,,,,,,06/07/2014 to 09/27/2014,2014-06-07,2014-09-27,Sun: 9:00 AM-1:00 PM;,Sun: 9:00 AM-1:00 PM,,,,,,,,,,,,,,,,,,,,,,,,,,,,,,,,
1001325,Bath County Farmers Market,,,,,,,,,,,06/21/2013 to 10/31/2013,2013-06-21,2013-10-31,Tue: 8:00 AM-5:00 PM;Fri: 8:00 AM-5:00 PM;Sat: 8:00 AM-5:00 PM;,Tue: 8:00 AM-5:00 PM,Fri: 8:00 AM-5:00 PM,Sat: 8:00 AM-5:00 PM,,,,,,,,,,,,,,,,,,,,,,,,,,,,,,
1007420,Bath Farmers Market,http://www.bathtownship.us,http://www.bathtownship.us,,,,,,,,,05/01/2012 to 10/31/2012,2012-05-01,2012-10-31,Thu: 3:00 PM-7:00 PM;,Thu: 3:00 PM-7:00 PM,,,,,,,,,,,,,,,,,,,,,,,,,,,,,,,,
1002294,Bath Saturday Farmers Market,,,,,,,,,,,,,,,,,,,,,,,,,,,,,,,,,,,,,,,,,,,,,,,
1007305,Bath Winter And Summer Market,,,,,,,,,,,May to October,2010-05-01,2010-10-31,Sat:8:30 am - 12:00 pm;,Sat:8:30 am - 12:00 pm,,,,,,,,,,,,,,,,,,,,,,,,,,,,,,,,
1010533,Battens Farmers Market And Davie Agritourism Center,http://www.newbattensfarmersmarket.com,http://www.newbattensfarmersmarket.com,www.facebook.com/battensmarket,,@battensmarket,@battensmarket,,,www.yelp.com/biz/battens-farmers-market-davie,www.yelp.com/biz/battens-farmers-market-davie,,,,,,,,,,,,,,,,,,,,,,,,,,,,,,,,,,,,,
1009051,Battle Creek Farmers Market,http://www.battlecreekfarmersmarket.com/,http://www.battlecreekfarmersmarket.com/,https://www.facebook.com/pages/Battle-Creek-Farmers-Market-Association/103649874595,https://www.facebook.com/pages/Battle-Creek-Farmers-Market-Association/103649874595,,,,,,,05/03/2014 to 10/29/2014,2014-05-03,2014-10-29,Wed: 9:00 AM-1:00 PM;Sat: 9:00 AM-1:00 PM;,Wed: 9:00 AM-1:00 PM,Sat: 9:00 AM-1:00 PM,,,,,,,,,,,,,,,,,,,,,,,,,,,,,,,
1003806,Battlefield Farmers Market,http://www.battlefieldfmkt.org,http://www.battlefieldfmkt.org,https://www.facebook.com/Battlefield-Farmers-Market,https://www.facebook.com/Battlefield-Farmers-Market,https://twitter.com/BFMKT,https://twitter.com/BFMKT,,,,,05/07/2016 to 11/12/2016,2016-05-07,2016-11-12,Wed: 3:00 PM-6:00 PM;Sat: 8:00 AM-12:00 PM;,Wed: 3:00 PM-6:00 PM,Sat: 8:00 AM-12:00 PM,,,,,,,,,,,,,,,,,,,,,,,,,,,,,,,
1004026,Baxter Farmers Market,,,,,,,,,,,,,,,,,,,,,,,,,,,,,,,,,,,,,,,,,,,,,,,
1000919,Bay County Farmers Market,,,,,,,,,,,,,,,,,,,,,,,,,,,,,,,,,,,,,,,,,,,,,,,
1003239,Bay County Farmers Market,,,,,,,,,,,,,,,,,,,,,,,,,,,,,,,,,,,,,,,,,,,,,,,
1000057,Bay Ridge Greenmarket,http://www.grownyc.org,http://www.grownyc.org,https://www.facebook.com/BrooklynGreenmarkets,https://www.facebook.com/BrooklynGreenmarkets,,,,,,,06/01/2013 to 11/23/2013,2013-06-01,2013-11-23,Sat: 8:00 AM-3:00 PM;,Sat: 8:00 AM-3:00 PM,,,,,,,,,,,,,,,,,,,,,,,,,,,,,,,,
1005817,Bayberry Plaza Farmers Market,,,,,,,,,,,May to October,2010-05-01,2010-10-31,Wed:8:00 am - 5:00 pm;,Wed:8:00 am - 5:00 pm,,,,,,,,,,,,,,,,,,,,,,,,,,,,,,,,
1009215,Bayfield Farmers Market,http://www.localharvest.org/bayfield-farmers-market-M36004,http://www.localharvest.org/bayfield-farmers-market-M36004,,,,,,,,,,,,,,,,,,,,,,,,,,,,,,,,,,,,,,,,,,,,,
1003728,Bayfield Lions Club Farmers Market,,,,,,,,,,,,,,,,,,,,,,,,,,,,,,,,,,,,,,,,,,,,,,,
1007808,Bayou Teche Market,http://www.stmartinville.org,http://www.stmartinville.org,,,,,,,,,,,,,,,,,,,,,,,,,,,,,,,,,,,,,,,,,,,,,
1004003,Bayport Farmers Market,http://www.bayportfarmersmarket.com,http://www.bayportfarmersmarket.com,,,,,,,,,,,,,,,,,,,,,,,,,,,,,,,,,,,,,,,,,,,,,
1010298,Bayside Farmers Market,,,,,,,,,,,07/03/2014 to 09/25/2014,2014-07-03,2014-09-25,Thu: 4:00 PM-7:00 PM;,Thu: 4:00 PM-7:00 PM,,,,,,,,,,,,,,,,,,,,,,,,,,,,,,,,
1012004,Bayside Harvest Market,http://somosinc.org,http://somosinc.org,Bayside Harvest Market,,,,,,,,01/01/2016 to,2016-01-01,,,,,,,,,,,,,,,,,,,,,,,,,,,,,,,,,,,
1008861,Bayview Farmers Market,http://www.bayviewfarmersmarket.com/,http://www.bayviewfarmersmarket.com/,,,,,,,,,,,,,,,,,,,,,,,,,,,,,,,,,,,,,,,,,,,,,
1007020,Bayville Farmers Market,,,,,,,,,,,,,,,,,,,,,,,,,,,,,,,,,,,,,,,,,,,,,,,
1009448,Baywood Los Osos Farmers Market,http://www.northcountyfarmersmarkets.com/,http://www.northcountyfarmersmarkets.com/,https://www.facebook.com/NorthCountyFarmersMarkets,https://www.facebook.com/NorthCountyFarmersMarkets,,,,,,,,,,,,,,,,,,,,,,,,,,,,,,,,,,,,,,,,,,,
1003912,Baywood/los Osos Certified Farmers Market,http://www.northcountyfarmersmarkets.com,http://www.northcountyfarmersmarkets.com,,,,,,,,,,,,Mon: 2:00 PM-4:30 PM;,Mon: 2:00 PM-4:30 PM,,,,,,,,,,,,,,,,,,,,,,,,,,,,,,,,
1009473,Be Local Winter Farmers Market,http://www.belocalnc.org/,http://www.belocalnc.org/,,,,,,,,,,,,,,,,,,,,,,,,,,,,,,,,,,,,,,,,,,,,,
1012753,Beach Baptist Farmers Market,http://www.41markets.com,http://www.41markets.com,www.facebook.com/beachbaptistfarmersmarket,,,,,,,,08/03/2016 to 04/26/2017,2016-08-03,2017-04-26,Wed: 9:00 AM-2:00 PM;,Wed: 9:00 AM-2:00 PM,,,,,,,,,,,,,,,,,,,,,,,,,,,,,,,,
1001852,Beaches Green Market,http://www.diglocalnetwork.com,http://www.diglocalnetwork.com,https://www.facebook.com/pages/Beaches-Local-Food-Network/133107640044845,https://www.facebook.com/pages/Beaches-Local-Food-Network/133107640044845,,,,,,,01/01/2016 to 12/31/2016,2016-01-01,2016-12-31,Sat: 2:00 PM-5:00 PM;,Sat: 2:00 PM-5:00 PM,,,,,,,,,,,,,,,,,,,,,,,,,,,,,,,,
1006359,Beacon Farmers Market (summer),http://beaconfarmersmarket.com,http://beaconfarmersmarket.com,https://www.facebook.com/Beacon-Farmers-Market-232116360132380/,https://www.facebook.com/Beacon-Farmers-Market-232116360132380/,@beaconfarmermkt,@beaconfarmermkt,,,Instagram: beaconfarmersmkt,Instagram: beaconfarmersmkt,04/24/2016 to 11/20/2016,2016-04-24,2016-11-20,Sun: 10:00 AM-3:00 PM;,Sun: 10:00 AM-3:00 PM,,,,,,,,,,,,,,,,,,,,,,,,,,,,,,,,
1011153,Bean Blossom Farmers Market,http://Www.beanblossomfarmersmarket.com,http://Www.beanblossomfarmersmarket.com,https://Facebook.com/beanblossomfarmersmarket,https://Facebook.com/beanblossomfarmersmarket,,,,,,,05/13/2016 to 09/30/2016,2016-05-13,2016-09-30,Fri: 4:00 PM-7:00 PM;,Fri: 4:00 PM-7:00 PM,,,,,,,,,,,,,,,,,,,,,,,,,,,,,,,,
1009334,Bear Creek Farmers Market,http://www.bearcreekfarmersmarket.webs.com/,http://www.bearcreekfarmersmarket.webs.com/,,,,,,,,,,,,,,,,,,,,,,,,,,,,,,,,,,,,,,,,,,,,,
1010739,Beaumont Farmers Market,http://www.beaumontfarmersmarket.org,http://www.beaumontfarmersmarket.org,,,,,,,,,02/20/2016 to 12/17/2016,2016-02-20,2016-12-17,Sat: 8:00 AM-11:00 AM;,Sat: 8:00 AM-11:00 AM,,,,,,,,,,,,,,,,,,,,,,,,,,,,,,,,
1001275,"Beaumont Hospital Royal Oak, Farmers Market",,,,,,,,,,,06/02/2016 to 10/06/2016,2016-06-02,2016-10-06,Thu: 8:00 AM-2:00 PM;,Thu: 8:00 AM-2:00 PM,,,,,,,,,,,,,,,,,,,,,,,,,,,,,,,,
1001827,Beaver County Fruit Company I,,,,,,,,,,,,,,,,,,,,,,,,,,,,,,,,,,,,,,,,,,,,,,,
1011675,Beaver Dam Farmers Market,,,Beaver Dam Community Farmers Market,,,,,,,,05/23/2015 to 10/31/2015,2015-05-23,2015-10-31,Tue: 3:00 PM-6:00 PM;Sat: 8:00 AM-12:00 PM;,Tue: 3:00 PM-6:00 PM,Sat: 8:00 AM-12:00 PM,,,,,,,,,,,,,,,,,,,,,,,,,,,,,,,
1001828,Beaver Falls Farmers Market,,,,,,,,,,,,,,,,,,,,,,,,,,,,,,,,,,,,,,,,,,,,,,,
1007999,Beaverdale Farmers Market,http://www.beaverdalefarmersmarket.org,http://www.beaverdalefarmersmarket.org,https://www.facebook.com/BeaverdaleFarmFest,https://www.facebook.com/BeaverdaleFarmFest,@BeaverdaleFarm,@BeaverdaleFarm,,,,,06/07/2016 to 09/13/2016,2016-06-07,2016-09-13,Tue: 4:30 PM-7:30 PM;,Tue: 4:30 PM-7:30 PM,,,,,,,,,,,,,,,,,,,,,,,,,,,,,,,,
1001403,Beaverton Farmers Market,http://www.beavertonfarmersmarket.com,http://www.beavertonfarmersmarket.com,https://www.facebook.com/pages/Beaverton-Farmers-Market/157043335073?ref=hl,https://www.facebook.com/pages/Beaverton-Farmers-Market/157043335073?ref=hl,,,,,,,05/02/2015 to 09/24/2016,2015-05-02,2016-09-24,Sat: 8:00 AM-1:30 PM;,Sat: 8:00 AM-1:30 PM,,,,,,,10/3/15,10/3/15,,Sat: 9:00 AM-1:30 PM;,Sat: 9:00 AM-1:30 PM,,,,,,,2/1/16, 04/01/2016,Sat: 10:00 AM-1:30 PM;,Sat: 10:00 AM-1:30 PM,,,,,,,,,,,
1008103,Beaverton Farmers Market - Wednesday,http://www.beavertonfarmersmarket.com,http://www.beavertonfarmersmarket.com,https://www.facebook.com/pages/Beaverton-Farmers-Market/157043335073?ref=hl,https://www.facebook.com/pages/Beaverton-Farmers-Market/157043335073?ref=hl,,,,,,,06/17/2015 to 08/26/2015,2015-06-17,2015-08-26,Wed: 3:00 AM-6:00 PM;,Wed: 3:00 AM-6:00 PM,,,,,,,,,,,,,,,,,,,,,,,,,,,,,,,,
1011291,Bedford Farmers Market,http://bedfordmifarmersmarket.org,http://bedfordmifarmersmarket.org,https://www.facebook.com/bedfordmifarmersmarket/,https://www.facebook.com/bedfordmifarmersmarket/,,,,,,,05/14/2016 to 10/29/2016,2016-05-14,2016-10-29,Sun: 8:00 AM-1:00 PM;,Sun: 8:00 AM-1:00 PM,,,,,,,,,,,,,,,,,,,,,,,,,,,,,,,,
1010175,Bedford Farmers Market,http://bedfordymca.org/BEDFORD%20FARMERS%20MARKET.htm,http://bedfordymca.org/BEDFORD%20FARMERS%20MARKET.htm,https://www.facebook.com/BedfordFarmersMarket/,https://www.facebook.com/BedfordFarmersMarket/,,,,,,,05/01/2016 to 10/01/2016,2016-05-01,2016-10-01,Tue: 3:00 PM-6:00 PM;Fri: 8:00 AM-1:30 PM;,Tue: 3:00 PM-6:00 PM,Fri: 8:00 AM-1:30 PM,,,,,,,,,,,,,,,,,,,,,,,,,,,,,,,
1011041,Bedford Farmers Market,,,,,,,,,,,05/16/2015 to 10/31/2015,2015-05-16,2015-10-31,Sun: 8:00 AM-1:00 PM;,Sun: 8:00 AM-1:00 PM,,,,,,,,,,,,,,,,,,,,,,,,,,,,,,,,
1001912,"Bedford Farmers Market, Inc.",http://www.bedfordfarmersmarket.org,http://www.bedfordfarmersmarket.org,https://www.facebook.com/pages/Bedford-Farmers-Market/126373044107414,https://www.facebook.com/pages/Bedford-Farmers-Market/126373044107414,,,,,,,June to October,2010-06-01,2010-10-31,Tue:3:00 PM - 6:00 PM;,Tue:3:00 PM - 6:00 PM,,,,,,,,,,,,,,,,,,,,,,,,,,,,,,,,
1009202,Bedners Farm Fresh Market,http://www.bedners.com/,http://www.bedners.com/,,,,,,,,,,,,,,,,,,,,,,,,,,,,,,,,,,,,,,,,,,,,,
1005936,Bee Hive Farmers Market,,,,,,,,,,,,,,,,,,,,,,,,,,,,,,,,,,,,,,,,,,,,,,,
1000497,Beechmont Open Air Market,http://www.Beechmont.org,http://www.Beechmont.org,,,,,,,,,06/13/2015 to 09/26/2015,2015-06-13,2015-09-26,Sat: 8:00 AM-12:00 PM;,Sat: 8:00 AM-12:00 PM,,,,,,,,,,,,,,,,,,,,,,,,,,,,,,,,
1010368,Beehaven Farm Roadside Market,http://beehaven-farm.com,,https://www.facebook.com/BeeHavenFarmRoadsideMarket,https://www.facebook.com/BeeHavenFarmRoadsideMarket,,,,,,,05/31/2016 to 10/31/2016,2016-05-31,2016-10-31,Mon: 10:00 AM-6:00 PM;Tue: 10:00 AM-6:00 PM;Fri: 10:00 AM-6:00 PM;Sat: 10:00 AM-6:00 PM;Sun: 10:00 AM-6:00 PM;,Mon: 10:00 AM-6:00 PM,Tue: 10:00 AM-6:00 PM,Fri: 10:00 AM-6:00 PM,Sat: 10:00 AM-6:00 PM,Sun: 10:00 AM-6:00 PM,,,,,,,,,,,,,,,,,,,,,,,,,,,,
1006161,"Beets, Beats, And Eats Farmers Market",http://www.downtownortonville.org/bbe,http://www.downtownortonville.org/bbe,https://www.facebook.com/beetsbeatseats,https://www.facebook.com/beetsbeatseats,,,,,,,06/12/2015 to 09/04/2015,2015-06-12,2015-09-04,Fri: 6:00 PM-9:00 PM;,Fri: 6:00 PM-9:00 PM,,,,,,,,,,,,,,,,,,,,,,,,,,,,,,,,
1005696,"Beginning May 11, 2011",,,,,,,,,,,January to December,2010-01-01,2010-12-31,Wed:3:00 pm - 6:00 pm;,Wed:3:00 pm - 6:00 pm,,,,,,,,,,,,,,,,,,,,,,,,,,,,,,,,
1010607,Bel Air Farmers Market,http://www.BelAirFarmersMarket.com,http://www.BelAirFarmersMarket.com,BelAir Farmers Market,,@belairfm,@belairfm,,,Instagram @belairfm,Instagram  @belairfm,04/09/2016 to 11/12/2016,2016-04-09,2016-11-12,Sat: 7:00 AM-11:00 AM;,Sat: 7:00 AM-11:00 AM,,,,,,,11/19/2016 to 12/17/2016,11/19/16, 12/17/2016,Sat: 10:00 AM-12:00 PM;,Sat: 10:00 AM-12:00 PM,,,,,,,,,,,,,,,,,,,,,
1012635,Belchertown Farmers Market,http://belchertownfarmersmarket.weebly.com/,http://belchertownfarmersmarket.weebly.com/,https://www.facebook.com/Belchertown-Farmers-Market-112245358807378/,https://www.facebook.com/Belchertown-Farmers-Market-112245358807378/,https://twitter.com/marketbtown,https://twitter.com/marketbtown,,,http://imgleak.com/user/belchertownfarmersmarket/2085736663,http://imgleak.com/user/belchertownfarmersmarket/2085736663,06/19/2016 to 10/09/2016,2016-06-19,2016-10-09,Sun: 10:00 AM-2:00 PM;,Sun: 10:00 AM-2:00 PM,,,,,,,,,,,,,,,,,,,,,,,,,,,,,,,,
1011913,Belding Beatnik Bazaar,,,https://www.facebook.com/Belding-Beatnik-Bazaar-813935875369495/,https://www.facebook.com/Belding-Beatnik-Bazaar-813935875369495/,,,,,,,06/11/2016 to 10/08/2016,2016-06-11,2016-10-08,Sat: 9:00 AM-1:00 PM;,Sat: 9:00 AM-1:00 PM,,,,,,,,,,,,,,,,,,,,,,,,,,,,,,,,
1004782,Belen Farmers Market,http://farmersmarketsnm.org/Shoppers/FindMarket/find.php,http://farmersmarketsnm.org/Shoppers/FindMarket/find.php,https://www.facebook.com/pages/Belen-Farmers-Market/125777090774908,https://www.facebook.com/pages/Belen-Farmers-Market/125777090774908,,,,,,,06/13/2014 to 10/31/2014,2014-06-13,2014-10-31,Fri: 4:30 PM-7:00 PM;,Fri: 4:30 PM-7:00 PM,,,,,,,,,,,,,,,,,,,,,,,,,,,,,,,,
1009384,Belfair Farmers Market,http://www.belfairfarmersmarket.org/,http://www.belfairfarmersmarket.org/,https://www.facebook.com/BelfairSaturdayMarket,https://www.facebook.com/BelfairSaturdayMarket,,,,,,,,,,,,,,,,,,,,,,,,,,,,,,,,,,,,,,,,,,,
1008797,Belfast Farmers Market,http://www.belfastfarmersmarket.org,http://www.belfastfarmersmarket.org,https://www.facebook.com/pages/Belfast-Farmers-Market,https://www.facebook.com/pages/Belfast-Farmers-Market,,,,,,,05/02/2014 to 10/31/2014,2014-05-02,2014-10-31,Fri: 9:00 AM-1:00 PM;,Fri: 9:00 AM-1:00 PM,,,,,,,11/07/2014 to 03/27/2015,11/7/14, 03/27/2015,Fri: 9:00 AM-1:00 PM;,Fri: 9:00 AM-1:00 PM,,,,,,,,,,,,,,,,,,,,,
1004852,Belgrade Lions Farmers Market,,,,,,,,,,,"June 30, 2011 to Oct. 13, 2011",2011-06-30,2011-10-13,Thu:4:00 PM - 7:00 PM;,Thu:4:00 PM - 7:00 PM,,,,,,,,,,,,,,,,,,,,,,,,,,,,,,,,
1007195,Belington Farmers Market,,,,,,,,,,,,,,,,,,,,,,,,,,,,,,,,,,,,,,,,,,,,,,,
1007653,Bell County Farmers Market Association I,http://www.austinfarmersmarket.org,http://www.austinfarmersmarket.org,,,,,,,,,,,,,,,,,,,,,,,,,,,,,,,,,,,,,,,,,,,,,
1007182,Bell County Farmers Market Association Ii,,,,,,,,,,,,,,,,,,,,,,,,,,,,,,,,,,,,,,,,,,,,,,,
1004824,Bella Vista Cfm,,,,,,,,,,,,,,,,,,,,,,,,,,,,,,,,,,,,,,,,,,,,,,,
1003347,Bella Vista Farmers Market,http://www.market.cbmcci.com/,http://www.market.cbmcci.com/,,,,,,,,,,,,,,,,,,,,,,,,,,,,,,,,,,,,,,,,,,,,,
1011051,Bellaire Farmers Market,,,www.facebook.com/BellaireFarmersMarket,,,,,,,,05/27/2016 to 10/21/2016,2016-05-27,2016-10-21,Fri: 8:00 AM-12:00 PM;,Fri: 8:00 AM-12:00 PM,,,,,,,,,,,,,,,,,,,,,,,,,,,,,,,,
1012629,Belle Plaine Farmers Market,,,Belle Plaine IA Farmers Mkt,,,,,,,,07/01/2016 to 10/28/2016,2016-07-01,2016-10-28,Fri: 5:00 PM-7:00 PM;,Fri: 5:00 PM-7:00 PM,,,,,,,,,,,,,,,,,,,,,,,,,,,,,,,,
1001076,Belleairs Market On The Mall,http://www.belleairrec.com,http://www.belleairrec.com,,,,,,,,,,,,,,,,,,,,,,,,,,,,,,,,,,,,,,,,,,,,,
1010227,Bellefonte De Farmers Market,http://bellefontefarmersmarket.com/,http://bellefontefarmersmarket.com/,https://www.facebook.com/BellefonteFarmersMarket,https://www.facebook.com/BellefonteFarmersMarket,,,,,,,05/17/2014 to 09/13/2014,2014-05-17,2014-09-13,Sat: 9:00 AM-1:00 PM;,Sat: 9:00 AM-1:00 PM,,,,,,,,,,,,,,,,,,,,,,,,,,,,,,,,
1007114,Bellefonte Fm,,,,,,,,,,,,,,,,,,,,,,,,,,,,,,,,,,,,,,,,,,,,,,,
1011902,Belleville Farmers Market,http://bellevilleks.org,http://bellevilleks.org,https://www.facebook.com/bellevillechambermainstreet/?ref=settings,https://www.facebook.com/bellevillechambermainstreet/?ref=settings,,,,,,,05/28/2016 to 09/24/2016,2016-05-28,2016-09-24,Sat: 8:00 AM-11:00 AM;,Sat: 8:00 AM-11:00 AM,,,,,,,,,,,,,,,,,,,,,,,,,,,,,,,,
1001082,Belleville Farmers Market,,,,,,,,,,,,,,,,,,,,,,,,,,,,,,,,,,,,,,,,,,,,,,,
1001176,Belleville Farmers Market And Livestock,,,,,,,,,,,,,,,,,,,,,,,,,,,,,,,,,,,,,,,,,,,,,,,
1008875,Belleville Old Town Market,http://www.bellevillemainstreet.net,http://www.bellevillemainstreet.net,https://www.facebook.com/pages/Belleville-Old-Town-Market/156265797784556,https://www.facebook.com/pages/Belleville-Old-Town-Market/156265797784556,,,,,,,05/04/2013 to 10/26/2013,2013-05-04,2013-10-26,Sat: 7:30 AM-12:00 PM;,Sat: 7:30 AM-12:00 PM,,,,,,,,,,,,,,,,,,,,,,,,,,,,,,,,
1005468,Bellevue Area Farmers Market,,,,,,,,,,,,,,,,,,,,,,,,,,,,,,,,,,,,,,,,,,,,,,,
1001204,Bellevue Farmers Market,http://www.battlecreekfarmersmarket.com,http://www.battlecreekfarmersmarket.com,,,,,,,,,06/05/2014 to 09/25/2014,2014-06-05,2014-09-25,Thu: 3:00 PM-6:00 PM;,Thu: 3:00 PM-6:00 PM,,,,,,,,,,,,,,,,,,,,,,,,,,,,,,,,
1002917,Bellevue Farmers Market,http://bellevuefarmersmarket.org,http://bellevuefarmersmarket.org,https://www.facebook.com/bellevueFM/,https://www.facebook.com/bellevueFM/,https://twitter.com/BellevueFarmMkt,https://twitter.com/BellevueFarmMkt,,,https://www.instagram.com/bellevuefarmersmrkt/,https://www.instagram.com/bellevuefarmersmrkt/,05/12/2016 to 10/27/2016,2016-05-12,2016-10-27,Thu: 3:00 PM-7:00 PM;,Thu: 3:00 PM-7:00 PM,,,,,,,,,,,,,,,,,,,,,,,,,,,,,,,,
1008085,Bellevue Farmers Market-saturday,http://www.bellevuefarmersmarket.org,http://www.bellevuefarmersmarket.org,https://www.facebook.com/pages/Bellevue-Farmers-Market/106575142705237,https://www.facebook.com/pages/Bellevue-Farmers-Market/106575142705237,https://twitter.com/BellevueFarmMkt,https://twitter.com/BellevueFarmMkt,,,urbanfarmjunkie.blogspot.com,urbanfarmjunkie.blogspot.com,06/08/2013 to 11/23/2013,2013-06-08,2013-11-23,Sat: 10:00 AM-3:00 PM;,Sat: 10:00 AM-3:00 PM,,,,,,,,,,,,,,,,,,,,,,,,,,,,,,,,
1010259,Bellevue Farmers Market,http://www.bellevuenebraskafarmersmarket.com,http://www.bellevuenebraskafarmersmarket.com,https://www.facebook.com/bellevuenebraskafarmersmarket,https://www.facebook.com/bellevuenebraskafarmersmarket,,,,,,,05/31/2014 to 09/20/2014,2014-05-31,2014-09-20,Sat: 8:00 AM-12:00 PM;,Sat: 8:00 AM-12:00 PM,,,,,,,,,,,,,,,,,,,,,,,,,,,,,,,,
1004973,Bellflower Farmers Market,http://www.farmernet.com,http://www.farmernet.com,,,,,,,,,,,,,,,,,,,,,,,,,,,,,,,,,,,,,,,,,,,,,
1008140,Bellingham Farmers Market,http://www.bellinghamfarmers.org,http://www.bellinghamfarmers.org,https://www.facebook.com/pages/Bellingham-Farmers-Market/30710694970,https://www.facebook.com/pages/Bellingham-Farmers-Market/30710694970,https://twitter.com/BhamFarmersMkt,https://twitter.com/BhamFarmersMkt,,,,,06/03/2014 to 09/30/2015,2014-06-03,2015-09-30,Wed: 12:00 PM-5:00 PM;,Wed: 12:00 PM-5:00 PM,,,,,,,,,,,,,,,,,,,,,,,,,,,,,,,,
1008824,Bellows Falls Farmers Market,http://www.bffarmersmarket.com,http://www.bffarmersmarket.com,https://www.facebook.com/BellowsFallsFarmersMarket?ref=hl,https://www.facebook.com/BellowsFallsFarmersMarket?ref=hl,,,,,,,05/16/2014 to 10/17/2014,2014-05-16,2014-10-17,Fri: 4:00 PM-7:00 PM;,Fri: 4:00 PM-7:00 PM,,,,,,,11/21/2014 to 03/20/2015,11/21/14, 03/20/2015,Fri: 4:00 PM-7:00 PM;,Fri: 4:00 PM-7:00 PM,,,,,,,,,,,,,,,,,,,,,
1000940,Bellville Farmers Market,http://www.bellvilleohio.net,http://www.bellvilleohio.net,https://www.facebook.com/BellvilleFarmersMarket,https://www.facebook.com/BellvilleFarmersMarket,,,,,,,05/18/2013 to 10/12/2013,2013-05-18,2013-10-12,Sat: 9:00 AM-12:00 PM;,Sat: 9:00 AM-12:00 PM,,,,,,,,,,,,,,,,,,,,,,,,,,,,,,,,
1009929,Belmar Fresh Market,http://www.coloradofreshmarkets.com/,http://www.coloradofreshmarkets.com/,https://www.facebook.com/pages/Colorado-Fresh-Markets/110945278932210,https://www.facebook.com/pages/Colorado-Fresh-Markets/110945278932210,,,,,,,06/07/2014 to 09/27/2014,2014-06-07,2014-09-27,Sat: 9:00 AM-1:00 PM;,Sat: 9:00 AM-1:00 PM,,,,,,,,,,,,,,,,,,,,,,,,,,,,,,,,
1005168,Belmond Area Farmers Market,,,,,,,,,,,,,,,,,,,,,,,,,,,,,,,,,,,,,,,,,,,,,,,
1011488,Belmont Certified Farmers Market,http://pcfma.org,http://pcfma.org,facebook.com/BelmontMarket,,twitter.com/PacCoastFarmers,,,,instagram.com/pcfma,instagram.com/pcfma,01/01/2015 to 12/31/2015,2015-01-01,2015-12-31,Sun: 9:00 AM-1:00 PM;,Sun: 9:00 AM-1:00 PM,,,,,,,,,,,,,,,,,,,,,,,,,,,,,,,,
1002064,Belmont Farmers Market,,,https://www.facebook.com/pages/Southern-Tier-Farmers-Market/165092373544019,https://www.facebook.com/pages/Southern-Tier-Farmers-Market/165092373544019,,,,,,,05/29/2014 to 10/30/2014,2014-05-29,2014-10-30,Thu: 11:00 AM-5:00 PM;,Thu: 11:00 AM-5:00 PM,,,,,,,,,,,,,,,,,,,,,,,,,,,,,,,,
1009323,Belmont Farmers Market Nc,http://www.localharvest.org/belmont-farmers-market-nc-M58853,http://www.localharvest.org/belmont-farmers-market-nc-M58853,,,,,,,,,,,,,,,,,,,,,,,,,,,,,,,,,,,,,,,,,,,,,
1001640,Belmont Farmers Market,http://www.belmontfarmersmarket.org,http://www.belmontfarmersmarket.org,https://www.facebook.com/BelmontFarmersMarket,https://www.facebook.com/BelmontFarmersMarket,https://twitter.com/BelmontFarmersMkt,https://twitter.com/BelmontFarmersMkt,,,,,06/09/2016 to 09/01/2016,2016-06-09,2016-09-01,Thu: 2:00 PM-6:30 PM;,Thu: 2:00 PM-6:30 PM,,,,,,,09/08/2016 to 10/27/2016,9/8/16, 10/27/2016,Thu: 2:00 PM-6:00 PM;,Thu: 2:00 PM-6:00 PM,,,,,,,,,,,,,,,,,,,,,
1000530,Belton Farmers Market,,,,,,,,,,,,,,,,,,,,,,,,,,,,,,,,,,,,,,,,,,,,,,,
1011363,Belton Farmers Market,http://www.beltoncommunityprojects.com/#!projects/c21kz,,https://www.facebook.com/pages/Belton-Mo-Farmers-Market/671066459653137,https://www.facebook.com/pages/Belton-Mo-Farmers-Market/671066459653137,,,,,,,06/02/2016 to 09/29/2016,2016-06-02,2016-09-29,Thu: 4:00 PM-7:00 PM;,Thu: 4:00 PM-7:00 PM,,,,,,,,,,,,,,,,,,,,,,,,,,,,,,,,
1003956,Belvidere Farmers Market,http://www.belviderefarmersmarket.com,http://www.belviderefarmersmarket.com,https://www.facebook.com/BelvidereFarmersMarketandCrafts,https://www.facebook.com/BelvidereFarmersMarketandCrafts,,,,,,,June to October,2010-06-01,2010-10-31,Sat:9:00 AM - 12:30 PM;,Sat:9:00 AM - 12:30 PM,,,,,,,,,,,,,,,,,,,,,,,,,,,,,,,,
1009956,Belvidere Nj Farmers Market,http://www.belviderenjfarmersmarket.com,http://www.belviderenjfarmersmarket.com,https://www.facebook.com/belviderefarmersmarket,https://www.facebook.com/belviderefarmersmarket,,,,,,,06/01/2014 to 10/26/2014,2014-06-01,2014-10-26,Sun: 10:00 AM-2:00 PM;,Sun: 10:00 AM-2:00 PM,,,,,,,,,,,,,,,,,,,,,,,,,,,,,,,,
1008877,Belvideres Hometown Market,,,https://www.facebook.com/BelvidereHometownMarket,https://www.facebook.com/BelvidereHometownMarket,,,,,,,06/29/2013 to,2013-06-29,,Sat: 11:00 AM-3:00 PM;,Sat: 11:00 AM-3:00 PM,,,,,,,,,,,,,,,,,,,,,,,,,,,,,,,,
1008722,Bemidji Area Farmers Market,http://www.bemidjifarmersmarket.com,http://www.bemidjifarmersmarket.com,https://www.facebook.com/groups/bemidjiareafarmersmarket/,https://www.facebook.com/groups/bemidjiareafarmersmarket/,,,,,,,,,,Tue: 10:00 AM-5:00 PM;Thu: 12:00 AM-6:00 PM;Sat: 9:00 AM-3:00 PM;Sun: 11:00 AM-4:00 PM;,Tue: 10:00 AM-5:00 PM,Thu: 12:00 AM-6:00 PM,Sat: 9:00 AM-3:00 PM,Sun: 11:00 AM-4:00 PM,,,,,,,,,,,,,,,,,,,,,,,,,,,,,
1001316,Bemidjis Natural Choice Farmers Market,http://www.bemidjisnaturalfarmersmarket.com,http://www.bemidjisnaturalfarmersmarket.com,http://www.facebook.com/bemidjisfarmersmarket,http://www.facebook.com/bemidjisfarmersmarket,,,,,,,05/28/2016 to 10/29/2016,2016-05-28,2016-10-29,Sat: 9:00 AM-1:00 PM;,Sat: 9:00 AM-1:00 PM,,,,,,,,,,,,,,,,,,,,,,,,,,,,,,,,
1007658,Bend Farmers Market,http://www.bendfarmersmarket.com,http://www.bendfarmersmarket.com,,,,,,,,,,,,,,,,,,,,,,,,,,,,,,,,,,,,,,,,,,,,,
1001533,Benica Certified Farmers Market,http://www.beniciamainstreet.org,http://www.beniciamainstreet.org,,,,,,,,,04/24/2014 to 10/30/2014,2014-04-24,2014-10-30,Thu: 4:00 PM-8:00 PM;,Thu: 4:00 PM-8:00 PM,,,,,,,,,,,,,,,,,,,,,,,,,,,,,,,,
1010001,Bennet Farmers Market,,,,,,,,,,,05/14/2014 to 10/01/2014,2014-05-14,2014-10-01,Wed: 4:00 PM-7:00 PM;,Wed: 4:00 PM-7:00 PM,,,,,,,,,,,,,,,,,,,,,,,,,,,,,,,,
1000934,Bennigton Township Farmers Market,http://www.bennington-township.org/,,,,,,,,,,,,,,,,,,,,,,,,,,,,,,,,,,,,,,,,,,,,,,
1012679,Bensenville French Market,http://www.bensidounmidwestmarkets.com/,http://www.bensidounmidwestmarkets.com/,facebook.com/BensenvilleFrenchMarket,,https://twitter.com/BensidounMarket,https://twitter.com/BensidounMarket,,,https://www.instagram.com/bensidounfrenchmarket/,https://www.instagram.com/bensidounfrenchmarket/,06/15/2016 to 08/31/2016,2016-06-15,2016-08-31,Wed: 5:00 PM-9:00 PM;,Wed: 5:00 PM-9:00 PM,,,,,,,,,,,,,,,,,,,,,,,,,,,,,,,,
1007425,Benson Farmers Market,http://www.bensonfarmersmarket.org,http://www.bensonfarmersmarket.org,https://www.facebook.com/BensonFarmersMarket?ref=ts,https://www.facebook.com/BensonFarmersMarket?ref=ts,,,,,,,05/03/2014 to 09/27/2014,2014-05-03,2014-09-27,Sat: 9:00 AM-1:00 PM;,Sat: 9:00 AM-1:00 PM,,,,,,,,,,,,,,,,,,,,,,,,,,,,,,,,
1005543,Benson Mill Harvest Days,http://www.bensonmill.org,http://www.bensonmill.org,,,,,,,,,August to October,2010-08-01,2010-10-31,Sat:9:00 AM - 1:00 PM;,Sat:9:00 AM - 1:00 PM,,,,,,,,,,,,,,,,,,,,,,,,,,,,,,,,
1008920,Bensonhurst,http://www.grownyc.org,http://www.grownyc.org,https://www.facebook.com/BrooklynGreenmarkets,https://www.facebook.com/BrooklynGreenmarkets,,,,,,,07/07/2013 to 11/23/2013,2013-07-07,2013-11-23,Sun: 9:00 AM-4:00 PM;,Sun: 9:00 AM-4:00 PM,,,,,,,,,,,,,,,,,,,,,,,,,,,,,,,,
1009219,Benton City Community Market,http://www.localharvest.org/benton-city-community-market-M18889,http://www.localharvest.org/benton-city-community-market-M18889,,,,,,,,,,,,,,,,,,,,,,,,,,,,,,,,,,,,,,,,,,,,,
1000333,Benton Farmers Market,,,,,,,,,,,,,,,,,,,,,,,,,,,,,,,,,,,,,,,,,,,,,,,
1004458,Benton Farmers Market,,,,,,,,,,,,,,,,,,,,,,,,,,,,,,,,,,,,,,,,,,,,,,,
1010815,Benton Farmers Market,http://www.bentonlafarmersmarket.com,http://www.bentonlafarmersmarket.com,,,,,,,,,05/31/2015 to 07/26/2015,2015-05-31,2015-07-26,Sun: 12:00 PM-4:00 PM;,Sun: 12:00 PM-4:00 PM,,,,,,,,,,,,,,,,,,,,,,,,,,,,,,,,
1005291,Benton Harbor Farmers Market,,,www.facebook.com/bentonharborfarmersmarket,,,,,,,,07/08/2015 to 10/14/2015,2015-07-08,2015-10-14,Wed: 10:00 AM-3:00 PM;,Wed: 10:00 AM-3:00 PM,,,,,,,,,,,,,,,,,,,,,,,,,,,,,,,,
1012718,Bentonville Farmers Market - Saturday,http://www.downtownbentonville.org/farmersmarket,http://www.downtownbentonville.org/farmersmarket,https://www.facebook.com/BentonvilleFarmersMarket,https://www.facebook.com/BentonvilleFarmersMarket,,,,,,,04/23/2016 to 10/29/2016,2016-04-23,2016-10-29,Sat: 7:00 AM-1:00 PM;,Sat: 7:00 AM-1:00 PM,,,,,,,,,,,,,,,,,,,,,,,,,,,,,,,,
1010940,Bentonville Farmers Market - Wednesday,http://downtownbentonville.org/events/farmers-market/,http://downtownbentonville.org/events/farmers-market/,https://www.facebook.com/BentonvilleFarmersMarket,https://www.facebook.com/BentonvilleFarmersMarket,,,,,,,05/06/2015 to 10/28/2015,2015-05-06,2015-10-28,Wed: 2:30 PM-7:00 PM;,Wed: 2:30 PM-7:00 PM,,,,,,,,,,,,,,,,,,,,,,,,,,,,,,,,
1012011,Berea Farmers Market,http://bereafarmersmarket.org/,http://bereafarmersmarket.org/,https://www.facebook.com/bereafarmersmarket/,https://www.facebook.com/bereafarmersmarket/,https://twitter.com/BereaFarmMarket,https://twitter.com/BereaFarmMarket,,,,,04/09/2016 to 10/31/2016,2016-04-09,2016-10-31,Tue: 3:00 PM-6:00 PM;Sun: 9:00 AM-1:00 PM;,Tue: 3:00 PM-6:00 PM,Sun: 9:00 AM-1:00 PM,,,,,,,,,,,,,,,,,,,,,,,,,,,,,,,
1009491,Berkeley Lakeside Market,http://www.berkeleylakesidemarket.mudfairyfarm.com/,http://www.berkeleylakesidemarket.mudfairyfarm.com/,https://www.facebook.com/BerkeleyLakesideMarket,https://www.facebook.com/BerkeleyLakesideMarket,,,,,,,,,,,,,,,,,,,,,,,,,,,,,,,,,,,,,,,,,,,
1005183,Berkeley Springs Farmers Market,http://www.berkeleyspringsfarmersmarket.com,http://www.berkeleyspringsfarmersmarket.com,https://www.facebook.com/pages/Berkeley-Springs-Farmers-Market/354062496235,https://www.facebook.com/pages/Berkeley-Springs-Farmers-Market/354062496235,,,,,,,04/07/2013 to 12/15/2013,2013-04-07,2013-12-15,Thu: 2:00 PM-5:00 PM;Sun: 10:00 AM-2:00 PM;,Thu: 2:00 PM-5:00 PM,Sun: 10:00 AM-2:00 PM,,,,,,,,,,,,,,,,,,,,,,,,,,,,,,,
1007371,Berkshire - Rome Vendors Market,,,,,,,,,,,05/02/2014 to 11/07/2014,2014-05-02,2014-11-07,Fri: 9:00 AM-5:00 PM;,Fri: 9:00 AM-5:00 PM,,,,,,,,,,,,,,,,,,,,,,,,,,,,,,,,
1004320,Berkshire Area Farmers Market,,,,,,,,,,,May to November,2010-05-01,2010-11-30,Wed:8:00 AM - 2:00 PM;Sat:8:00 AM - 2:00 PM;,Wed:8:00 AM - 2:00 PM,Sat:8:00 AM - 2:00 PM,,,,,,,,,,,,,,,,,,,,,,,,,,,,,,,
1005773,Berkshire Grown Winter Farmers Market Great Barrington,http://berkshiregrown.org/programs/winter-farmers-markets/,http://berkshiregrown.org/programs/winter-farmers-markets/,https://www.facebook.com/BerkshireGrown,https://www.facebook.com/BerkshireGrown,,,,,,,11/19/2016 to 02/18/2017,2016-11-19,2017-02-18,Sat: 10:00 AM-2:00 PM;,Sat: 10:00 AM-2:00 PM,,,,,,,,,,,,,,,,,,,,,,,,,,,,,,,,
1011835,Berkshire Grown Winter Farmers Market- Williamstown,http://berkshiregrown.org/programs/winter-farmers-markets/,http://berkshiregrown.org/programs/winter-farmers-markets/,https://www.facebook.com/BerkshireGrown,https://www.facebook.com/BerkshireGrown,,,,,,,11/20/2016 to 12/18/2016,2016-11-20,2016-12-18,Sun: 10:00 AM-2:00 PM;,Sun: 10:00 AM-2:00 PM,,,,,,,,,,,,,,,,,,,,,,,,,,,,,,,,
1001622,"Berkshire Harmony Downtown Pittsfield Farmers Markets, Music, And Creative Arts Fair",http://www.berkshireharmony.com,http://www.berkshireharmony.com,,,,,,,,,May to October,2010-05-01,2010-10-31,Tue:2:00 PM - 6:00 PM;Thu:2:00 PM - 8:00 PM;Sat:9:00 AM - 1:00 PM;,Tue:2:00 PM - 6:00 PM,Thu:2:00 PM - 8:00 PM,Sat:9:00 AM - 1:00 PM,,,,,,,,,,,,,,,,,,,,,,,,,,,,,,
1007659,Berlin Farmers Market,http://www.berlinchamber.org/event-farmers-market,http://www.berlinchamber.org/event-farmers-market,,,,,,,,,,,,,,,,,,,,,,,,,,,,,,,,,,,,,,,,,,,,,
1011942,Berlin Farmers And Artists Market,http://berlinwi.wix.com/market,http://berlinwi.wix.com/market,https://www.facebook.com/Berlin.WI.FarmersMarket/,https://www.facebook.com/Berlin.WI.FarmersMarket/,,,https://www.youtube.com/channel/UC3KCiT-hRPL-_YUduEUIuvw,https://www.youtube.com/channel/UC3KCiT-hRPL-_YUduEUIuvw,,,06/07/2016 to 08/30/2016,2016-06-07,2016-08-30,Tue: 4:00 PM-7:30 PM;,Tue: 4:00 PM-7:30 PM,,,,,,,,,,,,,,,,,,,,,,,,,,,,,,,,
1012087,Berlin Farmers Market,,,https://www.facebook.com/Berlin-Farmers-Market-Berlin-Ct-390030617712122/,https://www.facebook.com/Berlin-Farmers-Market-Berlin-Ct-390030617712122/,,,,,,,06/11/2016 to 09/24/2016,2016-06-11,2016-09-24,Sat: 9:00 AM-1:00 PM;,Sat: 9:00 AM-1:00 PM,,,,,,,,,,,,,,,,,,,,,,,,,,,,,,,,
1011252,Berlin Local Works Farmers Market,http://www.wrenworks.org,http://www.wrenworks.org,https://www.facebook.com/berlin.farmersmarket,https://www.facebook.com/berlin.farmersmarket,,,,,,,06/25/2015 to 09/17/2015,2015-06-25,2015-09-17,Thu: 3:00 PM-7:00 PM;,Thu: 3:00 PM-7:00 PM,,,,,,,,,,,,,,,,,,,,,,,,,,,,,,,,
1001424,Bernardston Farmers Market,,,https://www.facebook.com/pages/Bernardston-Farmers-Market-Sat-10-1/250630118284345,https://www.facebook.com/pages/Bernardston-Farmers-Market-Sat-10-1/250630118284345,,,,,,,05/31/2014 to,2014-05-31,,Sat: 10:00 AM-1:00 PM;,Sat: 10:00 AM-1:00 PM,,,,,,,,,,,,,,,,,,,,,,,,,,,,,,,,
1011221,Bernice Garden Farmers Market,http://www.thebernicegarden.org/?portfolio=farmers-market,http://www.thebernicegarden.org/?portfolio=farmers-market,https://m.facebook.com/pages/Bernice-Garden-Farmers-Market/192032990911029?fref=ts,https://m.facebook.com/pages/Bernice-Garden-Farmers-Market/192032990911029?fref=ts,,,,,,,03/22/2015 to 11/22/2015,2015-03-22,2015-11-22,Sun: 10:00 AM-2:00 PM;,Sun: 10:00 AM-2:00 PM,,,,,,,,,,,,,,,,,,,,,,,,,,,,,,,,
1002802,Berrien County Farmers Market,http://www.Better hometown.com,,,,,,,,,,,,,Thu: 10:00 AM-5:00 PM;Fri: 10:00 AM-5:00 PM;Sat: 8:00 AM-5:00 PM;,Thu: 10:00 AM-5:00 PM,Fri: 10:00 AM-5:00 PM,Sat: 8:00 AM-5:00 PM,,,,,04/01/2014 to 12/01/2014,4/1/14, 12/01/2014,Thu: 9:00 AM-6:00 PM;Fri: 9:00 AM-6:00 PM;Sat: 9:00 AM-3:00 PM;,Thu: 9:00 AM-6:00 PM,Fri: 9:00 AM-6:00 PM,Sat: 9:00 AM-3:00 PM,,,,,,,,,,,,,,,,,,,
1010605,Berrys Produce And Country Market,,,,,,,,,,,,,,,,,,,,,,,,,,,,,,,,,,,,,,,,,,,,,,,
1011447,Berryessa Farmers Market,http://www.pcfma.org,http://www.pcfma.org,www.facebook.com/BerryessaFarmersMarket,,www.twitter.com/PacCoastFarmers,,,,,,01/01/2015 to 12/31/2015,2015-01-01,2015-12-31,Sat: 9:00 AM-1:00 PM;,Sat: 9:00 AM-1:00 PM,,,,,,,,,,,,,,,,,,,,,,,,,,,,,,,,
1004403,Berryville Farmers Market,,,https://www.facebook.com/pages/Berryville-Farmers-market/406568499439280,https://www.facebook.com/pages/Berryville-Farmers-market/406568499439280,,,,,,,04/01/2014 to 10/01/2014,2014-04-01,2014-10-01,Sat: 7:00 AM-12:00 PM;,Sat: 7:00 AM-12:00 PM,,,,,,,,,,,,,,,,,,,,,,,,,,,,,,,,
1011149,Berthoud Local Farmers Market,http://berthoudlocal.org,http://berthoudlocal.org,facebook.com/berthoudlocal,,,,,,,,06/25/2016 to 09/24/2016,2016-06-25,2016-09-24,Sat: 9:00 AM-1:00 PM;,Sat: 9:00 AM-1:00 PM,,,,,,,,,,,,,,,,,,,,,,,,,,,,,,,,
1011685,Berwick Winter Farmers Market,https://berwickfarmersmarket.wordpress.com/,https://berwickfarmersmarket.wordpress.com/,https://www.facebook.com/berwickmainefarmersmarket,https://www.facebook.com/berwickmainefarmersmarket,,,,,,,11/20/2016 to 04/23/2017,2016-11-20,2017-04-23,Sun: 10:00 AM-1:30 PM;,Sun: 10:00 AM-1:30 PM,,,,,,,,,,,,,,,,,,,,,,,,,,,,,,,,
1010832,Berwyn Township Farmers Market,http://berwyntownshipfarmersmarket.org/,http://berwyntownshipfarmersmarket.org/,Berwyn Township Farmers' Market,,,,,,,,06/14/2015 to 10/25/2015,2015-06-14,2015-10-25,Sun: 10:00 AM-2:00 PM;,Sun: 10:00 AM-2:00 PM,,,,,,,,,,,,,,,,,,,,,,,,,,,,,,,,
1005173,Bessemer Farmers Market,http://www.bessemerfarmersmarket.com/,http://www.bessemerfarmersmarket.com/,https://www.facebook.com/groups/436681066414815/,https://www.facebook.com/groups/436681066414815/,,,,,https://www.instagram.com/bessemer_farmers_market/?hl=en,https://www.instagram.com/bessemer_farmers_market/?hl=en,06/02/2016 to 09/15/2016,2016-06-02,2016-09-15,Thu: 4:00 PM-6:30 PM;,Thu: 4:00 PM-6:30 PM,,,,,,,,,,,,,,,,,,,,,,,,,,,,,,,,
1010985,Bethany Beach Farmers Market,,,,,,,,,,,06/14/2015 to 08/30/2015,2015-06-14,2015-08-30,Sun: 8:00 AM-12:00 PM;,Sun: 8:00 AM-12:00 PM,,,,,,,,,,,,,,,,,,,,,,,,,,,,,,,,
1005277,Bethany Farmers Market,http://www.bethanyfarmersmarket.com,http://www.bethanyfarmersmarket.com,https://www.facebook.com/pages/Bethany-CT-Farmers-Market/171830646224253,https://www.facebook.com/pages/Bethany-CT-Farmers-Market/171830646224253,,,,,,,07/02/2016 to 10/08/2016,2016-07-02,2016-10-08,Sat: 9:00 AM-1:00 PM;,Sat: 9:00 AM-1:00 PM,,,,,,,,,,,,,,,,,,,,,,,,,,,,,,,,
1007052,Bethany Farmers Market,,,,,,,,,,,,,,,,,,,,,,,,,,,,,,,,,,,,,,,,,,,,,,,
1010111,Bethany Farmers Market,,,,,,,,,,,04/26/2014 to 10/25/2014,2014-04-26,2014-10-25,Sat: 7:30 AM-;,Sat: 7:30 AM-,,,,,,,06/28/2014 to 09/27/2014,6/28/14, 09/27/2014,Wed: 3:30 PM-;Sat: 7:30 AM-;,Wed: 3:30 PM-,Sat: 7:30 AM-,,,,,,,,,,,,,,,,,,,,
1003666,Bethel Farmers Market,http://www.bethelfarmersmarket.com,http://www.bethelfarmersmarket.com,https://www.facebook.com/pages/Bethel-Farmers-Market/154633517928274,https://www.facebook.com/pages/Bethel-Farmers-Market/154633517928274,,,,,,,May to October,2010-05-01,2010-10-31,Sat:9:00 AM - 1:00 PM;,Sat:9:00 AM - 1:00 PM,,,,,,,,,,,,,,,,,,,,,,,,,,,,,,,,
1004386,Bethel Farmers Market,,,,,,,,,,,,,,,,,,,,,,,,,,,,,,,,,,,,,,,,,,,,,,,
1007462,Bethel Farmers Market,,,,,,,,,,,,,,,,,,,,,,,,,,,,,,,,,,,,,,,,,,,,,,,
1000745,Bethesda - Farm Womens Market,http://www.farmwomensmarket.com,http://www.farmwomensmarket.com,https://www.facebook.com/pages/Bethesda-Farm-Womens-Market/697706890333533,https://www.facebook.com/pages/Bethesda-Farm-Womens-Market/697706890333533,https://twitter.com/BethFWM,https://twitter.com/BethFWM,https://youtu.be/0bs5rEYAZYQ,https://youtu.be/0bs5rEYAZYQ,,,01/01/2015 to 12/31/2015,2015-01-01,2015-12-31,Wed: 7:00 AM-4:00 PM;Fri: 7:00 AM-4:00 PM;Sat: 7:00 AM-4:00 PM;Sun: 8:00 AM-4:00 PM;,Wed: 7:00 AM-4:00 PM,Fri: 7:00 AM-4:00 PM,Sat: 7:00 AM-4:00 PM,Sun: 8:00 AM-4:00 PM,,,,,,,,,,,,,,,,,,,,,,,,,,,,,
1010406,Bethesda Central Farm Market,http://www.centralfarmmarkets.com,http://www.centralfarmmarkets.com,www.facebook.com/CentralFarmMarkets,,@CentralFarmMKTs,@CentralFarmMKTs,,,http://dishingthedirtblog.wordpress.com/,http://dishingthedirtblog.wordpress.com/,01/04/2015 to 03/29/2015,2015-01-04,2015-03-29,Sun: 10:00 AM-1:30 PM;,Sun: 10:00 AM-1:30 PM,,,,,,,04/05/2015 to 12/27/2015,4/5/15, 12/27/2015,Sun: 9:00 AM-1:30 PM;,Sun: 9:00 AM-1:30 PM,,,,,,,,,,,,,,,,,,,,,
1006801,Bethesda Freshfarm Market,http://www.freshfarmmarkets.org/markets/bethesda.html,http://www.freshfarmmarkets.org/markets/bethesda.html,,,,,,,,,May to October,2010-05-01,2010-10-31,Sat:9:00 AM - 1:00 PM;,Sat:9:00 AM - 1:00 PM,,,,,,,,,,,,,,,,,,,,,,,,,,,,,,,,
1012494,Bethlehem Farmers Market,http://www.bethlehemfarmersmarket.com,http://www.bethlehemfarmersmarket.com,facebook.com/BethlehemFarmersMarketPA,,twitter.com/BethFarmMkt,,,,instagram.com/bethlehemfarmersmarket,instagram.com/bethlehemfarmersmarket,05/05/2016 to 10/27/2016,2016-05-05,2016-10-27,Thu: 11:00 AM-3:00 PM;,Thu: 11:00 AM-3:00 PM,,,,,,,,,,,,,,,,,,,,,,,,,,,,,,,,
1012624,Bettendorf Farmers Market,http://mvgrowers.com,http://mvgrowers.com,Mississippi Valley Growers farmers Market,,,,,,,,05/02/2016 to,2016-05-02,,Mon: 2:30 AM-5:30 AM;Thu: 2:30 AM-5:30 AM;,Mon: 2:30 AM-5:30 AM,Thu: 2:30 AM-5:30 AM,,,,,,,,,,,,,,,,,,,,,,,,,,,,,,,
1005222,Better Lives Today Farmers Market,http://www.betterlivestoday.org,http://www.betterlivestoday.org,,,,,,,,,May to August,2010-05-01,2010-08-31,Sat:8:00 AM - 12:00 PM;,Sat:8:00 AM - 12:00 PM,,,,,,,,,,,,,,,,,,,,,,,,,,,,,,,,
1000335,Beverly Farmers Market,http://www.beverlyfarmersmarket.org,http://www.beverlyfarmersmarket.org,https://www.facebook.com/beverlyfarmersmarket,https://www.facebook.com/beverlyfarmersmarket,https://twitter.com/BevFarmersMkt,https://twitter.com/BevFarmersMkt,,,,,06/16/2014 to 10/06/2014,2014-06-16,2014-10-06,Mon: 3:00 PM-7:00 PM;,Mon: 3:00 PM-7:00 PM,,,,,,,,,,,,,,,,,,,,,,,,,,,,,,,,
1001460,Beverly Hills Farmers Market,http://www.beverlyhills.org/farmersmarket,http://www.beverlyhills.org/farmersmarket,https://www.facebook.com/BHFarmersMarket,https://www.facebook.com/BHFarmersMarket,,,,,,,01/01/2013 to 12/31/2013,2013-01-01,2013-12-31,Sun: 9:00 AM-1:00 PM;,Sun: 9:00 AM-1:00 PM,,,,,,,,,,,,,,,,,,,,,,,,,,,,,,,,
1009978,Bexley Farmers Market,http://www.bexleyfarmersmarket.com,http://www.bexleyfarmersmarket.com,https://www.facebook.com/bexleyfarmersmarket,https://www.facebook.com/bexleyfarmersmarket,https://twitter.com/BexleyMarket,https://twitter.com/BexleyMarket,,,,,05/15/2014 to 10/30/2014,2014-05-15,2014-10-30,Thu: 4:00 PM-7:00 PM;,Thu: 4:00 PM-7:00 PM,,,,,,,,,,,,,,,,,,,,,,,,,,,,,,,,
1005378,Bfr/oyate Teca Farmers Market,,,,,,,,,,,07/15/2013 to 10/01/2013,2013-07-15,2013-10-01,Mon: 10:00 AM-5:00 PM;Tue: 10:00 AM-5:00 PM;Wed: 10:00 AM-5:00 PM;Thu: 10:00 AM-5:00 PM;Fri: 10:00 AM-5:00 PM;,Mon: 10:00 AM-5:00 PM,Tue: 10:00 AM-5:00 PM,Wed: 10:00 AM-5:00 PM,Thu: 10:00 AM-5:00 PM,Fri: 10:00 AM-5:00 PM,,,,,,,,,,,,,,,,,,,,,,,,,,,,
1004627,Bibb County Farmers Market,,,,,,,,,,,,,,,,,,,,,,,,,,,,,,,,,,,,,,,,,,,,,,,
1005949,Big Bear Farmers Market,http://www.highdesertfarmersmarket.com,http://www.highdesertfarmersmarket.com,https://www.facebook.com/BigBearFarmersMarket,https://www.facebook.com/BigBearFarmersMarket,,,,,,,04/01/2014 to 09/30/2014,2014-04-01,2014-09-30,Tue: 8:30 AM-1:00 PM;,Tue: 8:30 AM-1:00 PM,,,,,,,,,,,,,,,,,,,,,,,,,,,,,,,,
1002540,Big Flats Community Market,,,,,,,,,,,,,,,,,,,,,,,,,,,,,,,,,,,,,,,,,,,,,,,
1011915,Big Horn Basin Farmers Market Cody,http://basinmarket.com,http://basinmarket.com,https://www.facebook.com/BigHornBasinFarmerMarket/,https://www.facebook.com/BigHornBasinFarmerMarket/,,,,,,,06/09/2016 to 10/27/2016,2016-06-09,2016-10-27,Thu: 4:30 PM-6:30 PM;,Thu: 4:30 PM-6:30 PM,,,,,,,,,,,,,,,,,,,,,,,,,,,,,,,,
1011917,Big Horn Basin Farmers Market Powell,http://basinmarket.com,http://basinmarket.com,https://www.facebook.com/BigHornBasinFarmerMarket/,https://www.facebook.com/BigHornBasinFarmerMarket/,,,,,,,06/13/2016 to 10/24/2016,2016-06-13,2016-10-24,Mon: 4:30 PM-6:30 PM;,Mon: 4:30 PM-6:30 PM,,,,,,,,,,,,,,,,,,,,,,,,,,,,,,,,
1005765,Big Ivy Tailgate Market,,,,,,,,,,,,,,,,,,,,,,,,,,,,,,,,,,,,,,,,,,,,,,,
1007345,Big Rapids Farmers Market,,,,,,,,,,,,,,,,,,,,,,,,,,,,,,,,,,,,,,,,,,,,,,,
1000700,Big Red Barn Farmers Market,http://www.bigredbarnfarmersmarket.blogspot.com,http://www.bigredbarnfarmersmarket.blogspot.com,https://www.facebook.com/BRBFarmersMarket,https://www.facebook.com/BRBFarmersMarket,,,,,,,06/21/2013 to 10/11/2013,2013-06-21,2013-10-11,Fri: 3:00 PM-7:00 PM;,Fri: 3:00 PM-7:00 PM,,,,,,,,,,,,,,,,,,,,,,,,,,,,,,,,
1005730,Big Sky Farmers Market,http://www.bigskytowncenter.com,http://www.bigskytowncenter.com,,,,,,,,,July to September,2010-07-01,2010-09-30,Wed:5:00 PM - 8:00 PM;,Wed:5:00 PM - 8:00 PM,,,,,,,,,,,,,,,,,,,,,,,,,,,,,,,,
1006345,Big Stone Gap Farmers Market,http://www.appfma.org/markets/big-stone-gap,http://www.appfma.org/markets/big-stone-gap,https://www.facebook.com/bsgfarmersmarket,https://www.facebook.com/bsgfarmersmarket,,,,,,,05/04/2013 to 10/05/2013,2013-05-04,2013-10-05,Sun: 9:30 AM-0:00 AM;,Sun: 9:30 AM-0:00 AM,,,,,,,,,,,,,,,,,,,,,,,,,,,,,,,,
1001879,Big Timber Farmers Market,,,,,,,,,,,,,,,,,,,,,,,,,,,,,,,,,,,,,,,,,,,,,,,
1008121,Bigfork Farmers Market Cooperative,http://www.bigforkfarmersmarket.com,http://www.bigforkfarmersmarket.com,https://www.facebook.com/BigforkFarmersMarket,https://www.facebook.com/BigforkFarmersMarket,,,,,,,06/07/2014 to 10/11/2014,2014-06-07,2014-10-11,Sat: 10:00 AM-1:00 PM;,Sat: 10:00 AM-1:00 PM,,,,,,,,,,,,,,,,,,,,,,,,,,,,,,,,
1009854,Bigfork Farmers Market Cooperative,http://www.bigforkfarmersmarket.com,http://www.bigforkfarmersmarket.com,,,,,,,,,06/04/2014 to 10/15/2014,2014-06-04,2014-10-15,Wed: 3:00 PM-6:00 PM;Sat: 10:00 AM-1:00 PM;,Wed: 3:00 PM-6:00 PM,Sat: 10:00 AM-1:00 PM,,,,,,,,,,,,,,,,,,,,,,,,,,,,,,,
1008122,Billerica Farmers Market,http://www.billericafarmersmarket.org,http://www.billericafarmersmarket.org,https://www.facebook.com/groups/107405076015086/,https://www.facebook.com/groups/107405076015086/,,,,,Weekly Newsletter/Constant Contact,Weekly Newsletter/Constant Contact,06/20/2016 to 10/03/2016,2016-06-20,2016-10-03,Mon: 3:00 PM-7:00 PM;,Mon: 3:00 PM-7:00 PM,,,,,,,,,,,,,,,,,,,,,,,,,,,,,,,,
1006523,Binford Farmers Market,http://www.BinfordFarmersMarket.com,http://www.BinfordFarmersMarket.com,https://www.facebook.com/pages/Binford-Farmers-Market/111165068392?ref=nf,https://www.facebook.com/pages/Binford-Farmers-Market/111165068392?ref=nf,,,,,,,March to December,2010-03-01,2010-12-31,Sat:8:00 AM - 1:00 PM;,Sat:8:00 AM - 1:00 PM,,,,,,,,,,,,,,,,,,,,,,,,,,,,,,,,
1000443,Bird-in-hand Farmers Market,http://www.BirdInHandFarmersMarket.com,http://www.BirdInHandFarmersMarket.com,https://www.facebook.com/pages/Bird-in-hand-Farmers-Market/181812508520469,https://www.facebook.com/pages/Bird-in-hand-Farmers-Market/181812508520469,,,,,,,,,,,,,,,,,,,,,,,,,,,,,,,,,,,,,,,,,,,
1010217,Birmingham Farmers Market,http://www.birminghamfarmersmarket.org,http://www.birminghamfarmersmarket.org,https://www.facebook.com/BIRMINGHAMFARMERSMARKET,https://www.facebook.com/BIRMINGHAMFARMERSMARKET,https://twitter.com/BhamFarmMkt,https://twitter.com/BhamFarmMkt,,,Instagram: BhamFarmMkt,Instagram: BhamFarmMkt,05/01/2016 to 10/23/2016,2016-05-01,2016-10-23,Sun: 9:00 AM-2:00 PM;,Sun: 9:00 AM-2:00 PM,,,,,,,,,,,,,,,,,,,,,,,,,,,,,,,,
1005217,Bisbee Farmers Market,http://www.bisbeefarmersmarket.org,http://www.bisbeefarmersmarket.org,https://www.facebook.com/pages/Bisbee-Farmers-Market/177022835686159,https://www.facebook.com/pages/Bisbee-Farmers-Market/177022835686159,,,,,,,01/01/2014 to 12/31/2014,2014-01-01,2014-12-31,Sat: 9:00 AM-1:00 PM;,Sat: 9:00 AM-1:00 PM,,,,,,,,,,,,,,,,,,,,,,,,,,,,,,,,
1011692,Biscuits And Jam Farmers Market,,,,,,,,,,,06/04/2016 to 08/27/2016,2016-06-04,2016-08-27,Sat: 7:30 AM-10:30 PM;,Sat: 7:30 AM-10:30 PM,,,,,,,,,,,,,,,,,,,,,,,,,,,,,,,,
1011854,Bishop Farmers Market - Eastern Sierra Certified Farmers Market,,,Bishop Farmers' Market,,,,,,,,06/25/2016 to 10/29/2016,2016-06-25,2016-10-29,Sat: 9:00 AM-12:00 PM;,Sat: 9:00 AM-12:00 PM,,,,,,,,,,,,,,,,,,,,,,,,,,,,,,,,
1003485,Bishop Market,,,,,,,,,,,,,,,,,,,,,,,,,,,,,,,,,,,,,,,,,,,,,,,
1011037,Bismarket,http://www.bismarket.com,http://www.bismarket.com,www.facebook.com/bismarketnd,,,,,,,,06/06/2015 to 10/31/2015,2015-06-06,2015-10-31,Tue: 4:00 PM-7:00 PM;Sat: 10:00 AM-1:00 PM;,Tue: 4:00 PM-7:00 PM,Sat: 10:00 AM-1:00 PM,,,,,,,,,,,,,,,,,,,,,,,,,,,,,,,
1003953,Bitner Vineyards Farmers Market,http://www.bitnervineyards.com,http://www.bitnervineyards.com,,,,,,,,,,,,,,,,,,,,,,,,,,,,,,,,,,,,,,,,,,,,,
1003954,Bitterroot Valley Growers Market,,,,,,,,,,,June to October,2010-06-01,2010-10-31,Sat:9:00 AM - 1:00 PM;,Sat:9:00 AM - 1:00 PM,,,,,,,,,,,,,,,,,,,,,,,,,,,,,,,,
1009738,Bixlers Farmers Market (ripleys Farmers Market),,,,,,,,,,,05/10/2014 to 12/01/2014,2014-05-10,2014-12-01,Sat: 9:00 AM-2:00 PM;,Sat: 9:00 AM-2:00 PM,,,,,,,,,,,,,,,,,,,,,,,,,,,,,,,,
1001781,Black Eaglefarmers Market,,,,,,,,,,,June to October,2010-06-01,2010-10-31,Sat:9:00 AM - 3:00 PM;,Sat:9:00 AM - 3:00 PM,,,,,,,,,,,,,,,,,,,,,,,,,,,,,,,,
1003939,Black Forest Farmers Market,,,,,,,,,,,,,,,,,,,,,,,,,,,,,,,,,,,,,,,,,,,,,,,
1000730,Black Hills Farmers Market Inc.,http://www.BlackHillsFarmersMarket.org,http://www.BlackHillsFarmersMarket.org,https://www.facebook/BlackHillsFarmersMarket,,,,,,,,05/16/2015 to 10/31/2015,2015-05-16,2015-10-31,Tue: 9:00 AM-3:00 PM;Thu: 9:00 AM-3:00 PM;Sat: 9:00 AM-3:00 PM;,Tue: 9:00 AM-3:00 PM,Thu: 9:00 AM-3:00 PM,Sat: 9:00 AM-3:00 PM,,,,,,,,,,,,,,,,,,,,,,,,,,,,,,
1003085,Black Mountain Tailgate Market,http://www.blackmountaintailgatemarket.org,http://www.blackmountaintailgatemarket.org,https://www.facebook.com/BMTMarket,https://www.facebook.com/BMTMarket,,,,,,,05/04/2013 to 10/26/2013,2013-05-04,2013-10-26,Sat: 9:00 AM-12:00 PM;,Sat: 9:00 AM-12:00 PM,,,,,,,,,,,,,,,,,,,,,,,,,,,,,,,,
1010440,Black River Falls Community Farmers Market,http://www.scholzeace.com/farmersmarket,http://www.scholzeace.com/farmersmarket,blackriverfallscommunityfarmersmarket,,,,,,,,05/24/2014 to 10/25/2014,2014-05-24,2014-10-25,Tue: 2:00 PM-6:00 PM;Sat: 9:00 AM-1:00 PM;,Tue: 2:00 PM-6:00 PM,Sat: 9:00 AM-1:00 PM,,,,,,,,,,,,,,,,,,,,,,,,,,,,,,,
1010442,Black River Falls Downtown Farmers Market,,,,,,,,,,,06/05/2014 to 09/25/2014,2014-06-05,2014-09-25,Thu: 4:00 PM-6:00 PM;,Thu: 4:00 PM-6:00 PM,,,,,,,,,,,,,,,,,,,,,,,,,,,,,,,,
1002126,Black River Landing Farmers Market,http://www.lorainportauthority.com,http://www.lorainportauthority.com,,,,,,,,,,,,,,,,,,,,,,,,,,,,,,,,,,,,,,,,,,,,,
1012660,Black Seed Farmers Market,http://www.blackseedfarmersmarket.com,http://www.blackseedfarmersmarket.com,www.facebook.com/blackseedfarmersmarket,,,,,,,,,,,Sun: 10:00 AM-2:00 PM;,Sun: 10:00 AM-2:00 PM,,,,,,,,,,,,,,,,,,,,,,,,,,,,,,,,
1000254,Blacksburg Farmers Market,http://www.blacksburgfarmersmarket.com,http://www.blacksburgfarmersmarket.com,https://www.facebook.com/blacksburgfarmersmarket,https://www.facebook.com/blacksburgfarmersmarket,,,,,,,,,,Wed: 2:00 PM-7:00 PM;Sat: 8:00 AM-2:00 PM;,Wed: 2:00 PM-7:00 PM,Sat: 8:00 AM-2:00 PM,,,,,,11/01/2014 to 12/31/2014,11/1/14, 12/31/2014,Wed: 2:00 PM-6:00 PM;Sat: 9:00 AM-2:00 PM;,Wed: 2:00 PM-6:00 PM,Sat: 9:00 AM-2:00 PM,,,,,,1/1/15, 03/28/2015,Sat: 10:00 AM-2:00 PM;,Sat: 10:00 AM-2:00 PM,,,,,,,,,,,
1002032,Blackstone River State Park Farmers Market,http://www.rigrown.gov,http://www.rigrown.gov,,,,,,,,,,,,Tue: 2:00 PM-6:00 PM;,Tue: 2:00 PM-6:00 PM,,,,,,,,,,,,,,,,,,,,,,,,,,,,,,,,
1003393,Blackwell Farmers Market,,,,,,,,,,,May to October,2010-05-01,2010-10-31,Sat:7:30 AM - 11:30 AM;,Sat:7:30 AM - 11:30 AM,,,,,,,,,,,,,,,,,,,,,,,,,,,,,,,,
1009274,Blackwood Farmers Market,http://www.blackwoodfarmersmarket.webs.com/,http://www.blackwoodfarmersmarket.webs.com/,https://www.facebook.com/pages/Blackwood-Farmers-Market/150288411734197,https://www.facebook.com/pages/Blackwood-Farmers-Market/150288411734197,,,,,,,,,,,,,,,,,,,,,,,,,,,,,,,,,,,,,,,,,,,
1001268,Bladen County Farmers Market,,,,,,,,,,,,,,,,,,,,,,,,,,,,,,,,,,,,,,,,,,,,,,,
1001916,Blair Farmers Market,,,,,,,,,,,,,,,,,,,,,,,,,,,,,,,,,,,,,,,,,,,,,,,
1012163,Blairstown Farmers Market,http://BlairstownFarmersMarket.com,http://BlairstownFarmersMarket.com,https://www.facebook.com/foodshedalliance/,https://www.facebook.com/foodshedalliance/,https://twitter.com/FoodshedNJ,https://twitter.com/FoodshedNJ,,,,,,,,Sat: 10:00 AM-2:00 PM;,Sat: 10:00 AM-2:00 PM,,,,,,,,,,,,,,,,,,,,,,,,,,,,,,,,
1001851,Blanchard Farmers Market,,,https://www.facebook.com/pages/Blanchard-Farmers-Market/124896884245689,https://www.facebook.com/pages/Blanchard-Farmers-Market/124896884245689,,,,,,,May to September,2010-05-01,2010-09-30,Sat:7:30 AM - 11:30 AM;,Sat:7:30 AM - 11:30 AM,,,,,,,,,,,,,,,,,,,,,,,,,,,,,,,,
1002609,Bland County Farmers Market,http://www.bland.org,http://www.bland.org,https://www.facebook.com/pages/Bland-County-Farmers-Market/105110259527804,https://www.facebook.com/pages/Bland-County-Farmers-Market/105110259527804,,,,,,,06/01/2014 to 10/25/2014,2014-06-01,2014-10-25,Sat: 9:00 AM-12:00 PM;,Sat: 9:00 AM-12:00 PM,,,,,,,,,,,,,,,,,,,,,,,,,,,,,,,,
1010004,Blasdell Farmers Market,http://www.hamburg-chamber.org/visit/farmers_market_history.aspx,,https://www.facebook.com/The Blasdell Farmers' Market,,,,,,,,06/04/2014 to 10/22/2014,2014-06-04,2014-10-22,Wed: 9:00 AM-2:00 PM;,Wed: 9:00 AM-2:00 PM,,,,,,,,,,,,,,,,,,,,,,,,,,,,,,,,
1009512,Blendon Township Farmers Market,http://www.localharvest.org/blendon-township-farmers-market-M35245,http://www.localharvest.org/blendon-township-farmers-market-M35245,,,,,,,,,,,,,,,,,,,,,,,,,,,,,,,,,,,,,,,,,,,,,
1011911,Bliss Farmers Market,,,,,,,,,,,06/04/2016 to 10/29/2016,2016-06-04,2016-10-29,Sat: 9:00 AM-2:00 PM;,Sat: 9:00 AM-2:00 PM,,,,,,,,,,,,,,,,,,,,,,,,,,,,,,,,
1000964,Block Island Farmers Market - Negus Park,http://blockislandfarmersmarket.com/,http://blockislandfarmersmarket.com/,,,,,,,,,06/14/2014 to 08/30/2014,2014-06-14,2014-08-30,Sat: 9:00 AM-11:30 AM;,Sat: 9:00 AM-11:30 AM,,,,,,,,,,,,,,,,,,,,,,,,,,,,,,,,
1007473,Bloomfield Farmers Market,,,,,,,,,,,,,,,,,,,,,,,,,,,,,,,,,,,,,,,,,,,,,,,
1005232,Bloomfield Farmers Market,,,,,,,,,,,May to October,2010-05-01,2010-10-31,Thu:4:00 PM - 6:00 PM;,Thu:4:00 PM - 6:00 PM,,,,,,,,,,,,,,,,,,,,,,,,,,,,,,,,
1011829,Bloomfield Saturday Market,http://www.bloomfieldnow.org,http://www.bloomfieldnow.org,https://www.facebook.com/bloomfieldmarket/,https://www.facebook.com/bloomfieldmarket/,twitter.com/bloomfieldmrkt,,,,instagram.com/bloomfieldpgh,instagram.com/bloomfieldpgh,06/04/2016 to 11/05/2016,2016-06-04,2016-11-05,Sat: 9:00 AM-1:00 PM;,Sat: 9:00 AM-1:00 PM,,,,,,,,,,,,,,,,,,,,,,,,,,,,,,,,
1001125,Blooming Prairie Farmers Market,,,,,,,,,,,May to October,2010-05-01,2010-10-31,Fri:4:00 pm - 6:00 pm;,Fri:4:00 pm - 6:00 pm,,,,,,,,,,,,,,,,,,,,,,,,,,,,,,,,
1008070,Bloomingdale Farmers Market,,,https://www.facebook.com/BloomingdaleFarmersMarket,https://www.facebook.com/BloomingdaleFarmersMarket,https://twitter.com/BloomingdaleFM,https://twitter.com/BloomingdaleFM,,,,,05/04/2014 to 11/23/2014,2014-05-04,2014-11-23,Sun: 9:00 AM-1:00 PM;,Sun: 9:00 AM-1:00 PM,,,,,,,,,,,,,,,,,,,,,,,,,,,,,,,,
1000154,Bloomingrove Produce Auction,,,,,,,,,,,,,,,,,,,,,,,,,,,,,,,,,,,,,,,,,,,,,,,
1002254,Bloomington Community Farmers Market,http://www.bloomington.in.gov/farmersmarket,http://www.bloomington.in.gov/farmersmarket,https://www.facebook.com/pages/Bloomington-Community-Farmers-Market/130635957114110,https://www.facebook.com/pages/Bloomington-Community-Farmers-Market/130635957114110,,,,,,,04/01/2015 to 11/28/2015,2015-04-01,2015-11-28,Sat: 8:00 AM-1:00 PM;,Sat: 8:00 AM-1:00 PM,,,,,,,,,,,,,,,,,,,,,,,,,,,,,,,,
1005945,Bloomington Farmers Market,http://www.BloomingtonMN.gov,http://www.BloomingtonMN.gov,,,,,,,,,06/08/2013 to 10/12/2013,2013-06-08,2013-10-12,Sat: 8:00 AM-1:00 PM;,Sat: 8:00 AM-1:00 PM,,,,,,,,,,,,,,,,,,,,,,,,,,,,,,,,
1011784,Bloomington Winter Farmers Market,http://bloomingtonwinterfarmersmarket.com,http://bloomingtonwinterfarmersmarket.com,https://www.facebook.com/Bloomington-Winter-Farmers-Market-205299875349/,https://www.facebook.com/Bloomington-Winter-Farmers-Market-205299875349/,,,,,,,12/03/2016 to 03/25/2017,2016-12-03,2017-03-25,Sat: 9:00 AM-12:30 PM;,Sat: 9:00 AM-12:30 PM,,,,,,,,,,,,,,,,,,,,,,,,,,,,,,,,
1000208,Bloomsburg Farmers Market,http://www.bloomsburgpa.org/bloomsburg-farmers-market,http://www.bloomsburgpa.org/bloomsburg-farmers-market,,,,,,,,,05/28/2016 to 10/29/2016,2016-05-28,2016-10-29,Tue: 7:00 AM-1:00 PM;Thu: 7:00 AM-1:00 PM;Sat: 7:00 AM-1:00 PM;,Tue: 7:00 AM-1:00 PM,Thu: 7:00 AM-1:00 PM,Sat: 7:00 AM-1:00 PM,,,,,,,,,,,,,,,,,,,,,,,,,,,,,,
1002737,Blossom Hill Certified Farmers Market,http://www.cafarmersmkts.com/markets/category/blossom,http://www.cafarmersmkts.com/markets/category/blossom,https://www.Facebook.com/SanJoseFarmersMarket,https://www.Facebook.com/SanJoseFarmersMarket,https://twitter.com/cafarmersmkts,https://twitter.com/cafarmersmkts,,,http://www.pinterest.com/cafarmersmkts/,http://www.pinterest.com/cafarmersmkts/,01/01/2016 to 12/31/2016,2016-01-01,2016-12-31,Sun: 9:00 AM-1:00 PM;,Sun: 9:00 AM-1:00 PM,,,,,,,,,,,,,,,,,,,,,,,,,,,,,,,,
1005883,Blount County Farmers Market,http://www.bcoabc.com,http://www.bcoabc.com,,,,,,,,,06/01/2013 to 10/26/2013,2013-06-01,2013-10-26,Tue: 7:00 AM-1:00 PM;Thu: 7:00 AM-1:00 PM;Sat: 7:00 AM-1:00 PM;,Tue: 7:00 AM-1:00 PM,Thu: 7:00 AM-1:00 PM,Sat: 7:00 AM-1:00 PM,,,,,,,,,,,,,,,,,,,,,,,,,,,,,,
1005708,Blountville Farmers Market,,,,,,,,,,,April to October,2010-04-01,2010-10-31,,,,,,,,,,,,,,,,,,,,,,,,,,,,,,,,,,
1007661,Blowing Rock Fresh Market,http://www.blowingrock.com/freshmarket.htm,http://www.blowingrock.com/freshmarket.htm,,,,,,,,,,,,,,,,,,,,,,,,,,,,,,,,,,,,,,,,,,,,,
1008372,Blue Hill Farmers Market,http://www.bluehillfarmersmarket.com,http://www.bluehillfarmersmarket.com,https://www.facebook.com/bluehillfarmersmarket,https://www.facebook.com/bluehillfarmersmarket,,,,,,,05/24/2014 to 08/16/2014,2014-05-24,2014-08-16,Sat: 9:30 AM-11:30 PM;,Sat: 9:30 AM-11:30 PM,,,,,,,,,,,,,,,,,,,,,,,,,,,,,,,,
1009271,"Blue Moon Acres Farm Market- Pennington, Nj",http://www.bluemoonacres.net/,http://www.bluemoonacres.net/,,,,,,,,,,,,,,,,,,,,,,,,,,,,,,,,,,,,,,,,,,,,,
1005223,Blue Springs Farmers Market,http://www.bluespringsfarmersmarket.com,http://www.bluespringsfarmersmarket.com,https://www.facebook.com/BlueSpringsFarmersMarket,https://www.facebook.com/BlueSpringsFarmersMarket,,,,,,,May to October,2010-05-01,2010-10-31,Sat:7:00 AM - 12:00 PM;,Sat:7:00 AM - 12:00 PM,,,,,,,,,,,,,,,,,,,,,,,,,,,,,,,,
1003675,Blue Water Farmers Market,,,,,,,,,,,,,,,,,,,,,,,,,,,,,,,,,,,,,,,,,,,,,,,
1001063,Bluebird Market,http://www.bluebirdmarket.com,http://www.bluebirdmarket.com,https://www.facebook.com/BluebirdMarket,https://www.facebook.com/BluebirdMarket,,,,,,,January to December,2010-01-01,2010-12-31,Sat:8:00 AM - 12:00 PM;,Sat:8:00 AM - 12:00 PM,,,,,,,,,,,,,,,,,,,,,,,,,,,,,,,,
1005436,"Bluefield, Va Farmers Market",,,,,,,,,,,05/01/2012 to 10/31/2012,2012-05-01,2012-10-31,Fri: 8:00 AM-12:00 PM;,Fri: 8:00 AM-12:00 PM,,,,,,,,,,,,,,,,,,,,,,,,,,,,,,,,
1008177,"Bluegrass Farmers Market, Inc.",http://www.bluegrassfarmersmarket.org,http://www.bluegrassfarmersmarket.org,https://www.facebook.com/pages/Bluegrass-Farmers-Market/108689732505252,https://www.facebook.com/pages/Bluegrass-Farmers-Market/108689732505252,,,,,http://www.localharvest.org/blog/29529/,http://www.localharvest.org/blog/29529/,04/18/2015 to 10/31/2015,2015-04-18,2015-10-31,Tue: 3:00 PM-6:00 PM;Sat: 9:00 AM-2:00 PM;,Tue: 3:00 PM-6:00 PM,Sat: 9:00 AM-2:00 PM,,,,,,,,,,,,,,,,,,,,,,,,,,,,,,,
1010000,"Bluegrass Farmers Market, Inc.",http://www.bluegrassfarmersmarket.org,http://www.bluegrassfarmersmarket.org,https://www.facebook.com/pages/Bluegrass-Farmers-Market-at-AZUR-restaurant-and-patio/108689732505252?ref=br_tf,https://www.facebook.com/pages/Bluegrass-Farmers-Market-at-AZUR-restaurant-and-patio/108689732505252?ref=br_tf,,,,,www.localharvest.org/blog/29529,www.localharvest.org/blog/29529,03/22/2014 to 12/12/2015,2014-03-22,2015-12-12,Thu: 3:00 PM-6:00 PM;Sat: 9:00 AM-2:00 PM;,Thu: 3:00 PM-6:00 PM,Sat: 9:00 AM-2:00 PM,,,,,,,,,,,,,,,,,,,,,,,,,,,,,,,
1004274,Bluegrass Global Growers Market,http://www.americanacc.org,http://www.americanacc.org,https://www.facebook.com/kentuckyRAPP,https://www.facebook.com/kentuckyRAPP,https://twitter.com/RAPPky,https://twitter.com/RAPPky,,,,,07/16/2013 to 10/29/2013,2013-07-16,2013-10-29,Tue: 5:30 PM-8:30 PM;,Tue: 5:30 PM-8:30 PM,,,,,,,,,,,,,,,,,,,,,,,,,,,,,,,,
1008789,Bluelicks Farmers Market,,,,,,,,,,,05/09/2014 to 10/03/2014,2014-05-09,2014-10-03,Fri: 3:00 PM-7:00 PM;,Fri: 3:00 PM-7:00 PM,,,,,,,,,,,,,,,,,,,,,,,,,,,,,,,,
1005713,Bluffton Farmers Market,,,,,,,,,,,,,,,,,,,,,,,,,,,,,,,,,,,,,,,,,,,,,,,
1001780,Bluffton Farmers And Artisans Market,,,https://www.facebook.com/BlufftonIndianaFarmersMarket/,https://www.facebook.com/BlufftonIndianaFarmersMarket/,,,,,,,05/07/2016 to 10/08/2016,2016-05-07,2016-10-08,Wed: 3:00 PM-6:00 PM;Sat: 9:00 AM-1:00 PM;,Wed: 3:00 PM-6:00 PM,Sat: 9:00 AM-1:00 PM,,,,,,,,,,,,,,,,,,,,,,,,,,,,,,,
1006960,Blytheville Farmers Market,,,,,,,,,,,,,,,,,,,,,,,,,,,,,,,,,,,,,,,,,,,,,,,
1006643,Bmi Farmers Market,http://www.thebmi.org/calendar-events/bmi-farmers-market/,http://www.thebmi.org/calendar-events/bmi-farmers-market/,http://www.facebook.com/pages/Baltimore-MD/Baltimore-Museum-of-Industry/61070592971,http://www.facebook.com/pages/Baltimore-MD/Baltimore-Museum-of-Industry/61070592971,https://twitter.com/BMIatWork,https://twitter.com/BMIatWork,,,,,05/07/2016 to 11/26/2016,2016-05-07,2016-11-26,Sat: 9:00 AM-1:00 PM;,Sat: 9:00 AM-1:00 PM,,,,,,,,,,,,,,,,,,,,,,,,,,,,,,,,
1004074,Boalsburg Farmers Market,http://www.boalsburgfarmersmarket.com,http://www.boalsburgfarmersmarket.com,https://www.facebook.com/pages/Boalsburg-Farmers-Market/108299077230,https://www.facebook.com/pages/Boalsburg-Farmers-Market/108299077230,,,,,https://www.instagram.com/boalsburgfarmersmarket/,https://www.instagram.com/boalsburgfarmersmarket/,01/01/2016 to 12/31/2016,2016-01-01,2016-12-31,Tue: 2:00 PM-6:00 PM;,Tue: 2:00 PM-6:00 PM,,,,,,,,,,,,,,,,,,,,,,,,,,,,,,,,
1001617,Boaz Farmers Market,,,,,,,,,,,,,,,,,,,,,,,,,,,,,,,,,,,,,,,,,,,,,,,
1000279,Boca Raton Green Market,,,https://www.facebook.com/bocaratongreenmarket,https://www.facebook.com/bocaratongreenmarket,,,,,,,10/18/2014 to 06/06/2015,2014-10-18,2015-06-06,Sat: 8:00 AM-1:00 PM;,Sat: 8:00 AM-1:00 PM,,,,,,,,,,,,,,,,,,,,,,,,,,,,,,,,
1006683,Bogert Farmers Market,http://www.bogertfarmersmarket.com,http://www.bogertfarmersmarket.com,https://www.facebook.com/pages/Bogert-Farmers-Market/212101778815402,https://www.facebook.com/pages/Bogert-Farmers-Market/212101778815402,,,,,,,,,,,,,,,,,,,,,,,,,,,,,,,,,,,,,,,,,,,
1010486,Boise Farmers Market,http://www.theboisefarmersmarket.com,http://www.theboisefarmersmarket.com,,,,,,,,,,,,Sat: 9:00 AM-1:00 PM;,Sat: 9:00 AM-1:00 PM,,,,,,,,,,,,,,,,,,,,,,,,,,,,,,,,
1002866,Bolan Farmers Market,,,,,,,,,,,,,,,,,,,,,,,,,,,,,,,,,,,,,,,,,,,,,,,
1005231,Bollinger County Farmers Market,,,,,,,,,,,April to October,2010-04-01,2010-10-31,Sat:8:00 AM - 12:00 PM;,Sat:8:00 AM - 12:00 PM,,,,,,,,,,,,,,,,,,,,,,,,,,,,,,,,
1009168,Bolton Landing Chamber Of Commerce Farmers Market,http://www.boltonlandingfarmersmarket.com/boltonlandingfarmersmarket.com/Welcome.html,http://www.boltonlandingfarmersmarket.com/boltonlandingfarmersmarket.com/Welcome.html,,,,,,,,,,,,,,,,,,,,,,,,,,,,,,,,,,,,,,,,,,,,,
1001513,Bonaparte Farmers Market,,,,,,,,,,,,,,,,,,,,,,,,,,,,,,,,,,,,,,,,,,,,,,,
1009399,Bondurant Farmers Market,http://www.localharvest.org/bondurant-farmers-market-M57024,http://www.localharvest.org/bondurant-farmers-market-M57024,,,,,,,,,,,,,,,,,,,,,,,,,,,,,,,,,,,,,,,,,,,,,
1010517,Bonita Springs Farmers Market,http://BuyLocalLee.com,http://BuyLocalLee.com,Facebook.com/BonitaSpringsFarmersMarketPromenade,,LocalRootsFM,,,,,,10/01/2016 to 04/29/2017,2016-10-01,2017-04-29,Sat: 8:00 AM-12:00 PM;,Sat: 8:00 AM-12:00 PM,,,,,,,,,,,,,,,,,,,,,,,,,,,,,,,,
1004185,Bonita Springs Lions Club Downtown Farmers Market,http://www.Cityofbonitasprings.org,http://www.Cityofbonitasprings.org,,,,,,,,,10/16/2013 to 05/14/2014,2013-10-16,2014-05-14,Wed: 8:00 AM-1:00 PM;,Wed: 8:00 AM-1:00 PM,,,,,,,,,,,,,,,,,,,,,,,,,,,,,,,,
1001840,Bonners Ferry Farmers Market,http://www.bonnersferryfarmersmarket.org,http://www.bonnersferryfarmersmarket.org,https://www.facebook.com/BonnersFerryFarmersMarket,https://www.facebook.com/BonnersFerryFarmersMarket,,,,,,,April to October,2010-04-01,2010-10-31,Sat:8:00 AM - 1:00 PM;,Sat:8:00 AM - 1:00 PM,,,,,,,,,,,,,,,,,,,,,,,,,,,,,,,,
1003632,Boone County Farmers Market,http://www.boonecountyfarmersmarket.org,http://www.boonecountyfarmersmarket.org,https://www.facebook.com/TheBooneCountyFarmersMarket,https://www.facebook.com/TheBooneCountyFarmersMarket,,,,,,,05/04/2013 to 12/20/2013,2013-05-04,2013-12-20,Mon: 9:00 AM-6:00 PM;Tue: 9:00 AM-6:00 PM;Wed: 9:00 AM-6:00 PM;Thu: 9:00 AM-6:00 PM;Fri: 9:00 AM-6:00 PM;Sat: 9:00 AM-6:00 PM;Sun: 9:00 AM-6:00 PM;,Mon: 9:00 AM-6:00 PM,Tue: 9:00 AM-6:00 PM,Wed: 9:00 AM-6:00 PM,Thu: 9:00 AM-6:00 PM,Fri: 9:00 AM-6:00 PM,Sat: 9:00 AM-6:00 PM,Sun: 9:00 AM-6:00 PM,,,,,,,,,,,,,,,,,,,,,,,,,,
1005874,Boone County Farmers Market,http://www.mainstreetharrison.org,http://www.mainstreetharrison.org,,,,,,,,,,,,,,,,,,,,,,,,,,,,,,,,,,,,,,,,,,,,,
1011796,Boone County Farmers Market,http://www.boonecountyfarmers.com,http://www.boonecountyfarmers.com,,,,,,,,,04/16/2016 to 10/29/2016,2016-04-16,2016-10-29,Sat: 8:00 AM-12:00 PM;,Sat: 8:00 AM-12:00 PM,,,,,,,,,,,,,,,,,,,,,,,,,,,,,,,,
1006833,Boone Farmers Market Association,http://www.boonefarmersmarket.com,http://www.boonefarmersmarket.com,,,,,,,,,06/02/2016 to 10/27/2016,2016-06-02,2016-10-27,Thu: 3:00 PM-6:00 PM;,Thu: 3:00 PM-6:00 PM,,,,,,,,,,,,,,,,,,,,,,,,,,,,,,,,
1012632,Boone Street Market,http://jonesborough.locallygrown.net,http://jonesborough.locallygrown.net,facebook.com/Boone-Street-Market-738767102860278/,,@boonestmarket,@boonestmarket,,,,,01/01/2016 to 12/31/2016,2016-01-01,2016-12-31,Mon: 10:00 AM-6:00 PM;Tue: 10:00 AM-6:00 PM;Wed: 10:00 AM-6:00 PM;Thu: 10:00 AM-6:00 PM;Fri: 10:00 AM-6:00 PM;Sat: 10:00 AM-5:00 PM;,Mon: 10:00 AM-6:00 PM,Tue: 10:00 AM-6:00 PM,Wed: 10:00 AM-6:00 PM,Thu: 10:00 AM-6:00 PM,Fri: 10:00 AM-6:00 PM,Sat: 10:00 AM-5:00 PM,,,,,,,,,,,,,,,,,,,,,,,,,,,
1012583,Booneville Community Market,http://RuralDigitalBridge.org,http://RuralDigitalBridge.org,STEPUPArkansas,,,,,,,,,,,Sat: 8:00 AM-12:00 PM;,Sat: 8:00 AM-12:00 PM,,,,,,,,,,,,,,,,,,,,,,,,,,,,,,,,
1001144,Booneville Farmers Market,,,,,,,,,,,,,,,,,,,,,,,,,,,,,,,,,,,,,,,,,,,,,,,
1003803,Boonton Farmers Market,http://www.BoontonMainStreet.org,http://www.BoontonMainStreet.org,,,,,,,,,06/07/2014 to 11/15/2014,2014-06-07,2014-11-15,Sat: 8:30 AM-1:00 PM;,Sat: 8:30 AM-1:00 PM,,,,,,,,,,,,,,,,,,,,,,,,,,,,,,,,
1001907,Boonville Cfm,,,,,,,,,,,May to October,2010-05-01,2010-10-31,Sat:9:30 AM - 12:00 PM;,Sat:9:30 AM - 12:00 PM,,,,,,,,,,,,,,,,,,,,,,,,,,,,,,,,
1005230,Boonville Farmers Market,,,,,,,,,,,April to October,2010-04-01,2010-10-31,Sat:8:00 AM - 1:00 PM;,Sat:8:00 AM - 1:00 PM,,,,,,,,,,,,,,,,,,,,,,,,,,,,,,,,
1005908,Boonville Farmers Market,http://www.boonvillefarmersmarket.com,http://www.boonvillefarmersmarket.com,https://www.facebook.com/groups/450336421724155/,https://www.facebook.com/groups/450336421724155/,,,,,,,,,,Thu: 12:00 PM-6:00 PM;,Thu: 12:00 PM-6:00 PM,,,,,,,,,,,,,,,,,,,,,,,,,,,,,,,,
1000953,Boordy Vineyards-good Life Thursdays,http://www.boordy.com,http://www.boordy.com,,,,,,,,,,,,,,,,,,,,,,,,,,,,,,,,,,,,,,,,,,,,,
1002672,Bordentown Citys Farmers Market,,,https://www.facebook.com/BordentownFarmersMarket,https://www.facebook.com/BordentownFarmersMarket,,,,,,,06/01/2014 to 09/31/2014,2014-06-01,,,,,,,,,,,,,,,,,,,,,,,,,,,,,,,,,,,
1001016,Boring Farmers Market,http://www.boringfarmersmarket.com,http://www.boringfarmersmarket.com,https://www.facebook.com/pages/Boring-Farmers-Market/223625564346989,https://www.facebook.com/pages/Boring-Farmers-Market/223625564346989,,,,,,,06/01/2014 to 09/07/2014,2014-06-01,2014-09-07,Sun: 10:00 AM-3:00 PM;,Sun: 10:00 AM-3:00 PM,,,,,,,,,,,,,,,,,,,,,,,,,,,,,,,,
1007073,Boro Farmers Market,,,,,,,,,,,,,,,,,,,,,,,,,,,,,,,,,,,,,,,,,,,,,,,
1000101,Boro Park Greenmarket,http://www.grownyc.org,http://www.grownyc.org,https://www.facebook.com/BrooklynGreenmarkets,https://www.facebook.com/BrooklynGreenmarkets,,,,,,,07/11/2013 to 11/21/2013,2013-07-11,2013-11-21,Thu: 8:00 AM-3:00 PM;,Thu: 8:00 AM-3:00 PM,,,,,,,,,,,,,,,,,,,,,,,,,,,,,,,,
1000293,Borrego Springs Chamber Of Commerce Farmers Market,,,,,,,,,,,,,,,,,,,,,,,,,,,,,,,,,,,,,,,,,,,,,,,
1011061,Boscobel Farmers Market,,,Boscobel Farmers Market,,,,,,,,05/09/2015 to 10/17/2015,2015-05-09,2015-10-17,Sat: 8:00 AM-12:00 PM;,Sat: 8:00 AM-12:00 PM,,,,,,,,,,,,,,,,,,,,,,,,,,,,,,,,
1012513,Bosque Farmers Market,http://bosque.agrilife.org/bosque-farmers-market/,http://bosque.agrilife.org/bosque-farmers-market/,https://www.facebook.com/Bosque-Farmers-Market-956350901151818/,https://www.facebook.com/Bosque-Farmers-Market-956350901151818/,,,,,https://www.instagram.com/bosquefarmersmarket/,https://www.instagram.com/bosquefarmersmarket/,05/07/2016 to 10/29/2016,2016-05-07,2016-10-29,Sat: 9:00 AM-1:00 PM;,Sat: 9:00 AM-1:00 PM,,,,,,,,,,,,,,,,,,,,,,,,,,,,,,,,
1006967,Boston Medical Center,,,,,,,,,,,,,,,,,,,,,,,,,,,,,,,,,,,,,,,,,,,,,,,
1012593,Boston University Farmers Market,http://www.bu.edu/dining/about-us/sustainability/farmers-market/,http://www.bu.edu/dining/about-us/sustainability/farmers-market/,,,,,,,,,09/08/2016 to 10/27/2016,2016-09-08,2016-10-27,Thu: 11:00 AM-3:00 PM;,Thu: 11:00 AM-3:00 PM,,,,,,,,,,,,,,,,,,,,,,,,,,,,,,,,
1006886,Boston/prudential Center,,,,,,,,,,,,,,,,,,,,,,,,,,,,,,,,,,,,,,,,,,,,,,,
1011174,Botetourt Farmers Market,http://www.facebook.com/botetourtfarmersmarket,http://www.facebook.com/botetourtfarmersmarket,www.facebook.com/botetourtfarmersmarket,,,,,,,,05/07/2016 to 10/15/2016,2016-05-07,2016-10-15,Sat: 9:00 AM-1:00 PM;,Sat: 9:00 AM-1:00 PM,,,,,,,,,,,,,,,,,,,,,,,,,,,,,,,,
1004298,Bothell Farmers Market,http://www.countryvillagebothell.com/farmersmarket,http://www.countryvillagebothell.com/farmersmarket,,,,,,,,,06/06/2014 to 10/03/2014,2014-06-06,2014-10-03,Fri: 12:00 PM-6:00 PM;,Fri: 12:00 PM-6:00 PM,,,,,,,,,,,,,,,,,,,,,,,,,,,,,,,,
1012002,Bottineau Farmers Market,https://www.facebook.com/Bottineau-Farmers-Market-1665424737011341/?fref=ts,https://www.facebook.com/Bottineau-Farmers-Market-1665424737011341/?fref=ts,Bottineau Farmers Market,,,,,,,,07/09/2016 to 10/01/2016,2016-07-09,2016-10-01,,,,,,,,,,,,,,,,,,,,,,,,,,,,,,,,,,
1005438,Boulder Community Market,,,,,,,,,,,,,,,,,,,,,,,,,,,,,,,,,,,,,,,,,,,,,,,
1003353,Boulder County Farmers Market - Longmont And Boulder,http://www.boulderfarmers.org,http://www.boulderfarmers.org,https://www.facebook.com/BoulderCountyFarmersMarkets,https://www.facebook.com/BoulderCountyFarmersMarkets,https://twitter.com/BCFMarkets,https://twitter.com/BCFMarkets,,,,,April to November,2010-04-01,2010-11-30,Sat:8:00 AM - 1:00 PM;,Sat:8:00 AM - 1:00 PM,,,,,,,December to December,December , December,Sat:9:00 AM - 3:00 PM;sun:9:00 AM - 3:00 PM;,Sat:9:00 AM - 3:00 PM,sun:9:00 AM - 3:00 PM,,,,,,,,,,,,,,,,,,,,
1001526,Boulder Farmers Market,,,,,,,,,,,07/04/2013 to 09/26/2013,2013-07-04,2013-09-26,Thu: 10:00 AM-3:00 PM;,Thu: 10:00 AM-3:00 PM,,,,,,,,,,,,,,,,,,,,,,,,,,,,,,,,
1012335,Boulder Farmers Market,http://www.bcfm.org,http://www.bcfm.org,,,www.twitter.com/bldrfarmersmkt,,,,www.instagram.com/boulderfarmersmarket,www.instagram.com/boulderfarmersmarket,04/02/2016 to 11/19/2016,2016-04-02,2016-11-19,Sat: 8:00 AM-2:00 PM;,Sat: 8:00 AM-2:00 PM,,,,,,,05/04/2016 to 10/05/2016,5/4/16, 10/05/2016,Wed: 4:00 PM-8:00 PM;,Wed: 4:00 PM-8:00 PM,,,,,,,,,,,,,,,,,,,,,
1003794,Bound Brook Farmers Market,,,,,,,,,,,,,,,,,,,,,,,,,,,,,,,,,,,,,,,,,,,,,,,
1003958,Bountiful Farmers Market,,,,,,,,,,,,,,,,,,,,,,,,,,,,,,,,,,,,,,,,,,,,,,,
1001773,Bounty Of The Barrens Farmers Market - Summer,http://www.barrencountybounty.com,http://www.barrencountybounty.com,https://www.facebook.com/BOTBFM,https://www.facebook.com/BOTBFM,https://twitter.com/BOTBMarket,https://twitter.com/BOTBMarket,,,,,04/25/2015 to 10/31/2015,2015-04-25,2015-10-31,Sat: 8:00 AM-12:00 PM;,Sat: 8:00 AM-12:00 PM,,,,,,,,,,,,,,,,,,,,,,,,,,,,,,,,
1001772,Bounty Of The Barrens Farmers Market - Winter,http://www.barrencountybounty.com,http://www.barrencountybounty.com,https://www.facebook.com/BOTBFM,https://www.facebook.com/BOTBFM,https://twitter.com/BOTBMarket,https://twitter.com/BOTBMarket,,,,,11/14/2015 to 04/09/2016,2015-11-14,2016-04-09,Sat: 8:00 AM-12:00 PM;,Sat: 8:00 AM-12:00 PM,,,,,,,,,,,,,,,,,,,,,,,,,,,,,,,,
1009259,Bourbon Farmers Market,http://www.bourbonfarmersmarket.com/,http://www.bourbonfarmersmarket.com/,https://www.facebook.com/BourbonFarmersMarket,https://www.facebook.com/BourbonFarmersMarket,,,,,,,,,,,,,,,,,,,,,,,,,,,,,,,,,,,,,,,,,,,
1006980,Bourbon Farmers Market,,,,,,,,,,,May to September,2010-05-01,2010-09-30,Tue:7:00 AM - 5:00 PM;Thu:7:00 AM - 5:00 PM;Fri:7:00 AM - 5:00 PM;,Tue:7:00 AM - 5:00 PM,Thu:7:00 AM - 5:00 PM,Fri:7:00 AM - 5:00 PM,,,,,,,,,,,,,,,,,,,,,,,,,,,,,,
1002728,Bovill Farmers Market,,,,,,,,,,,,,,,,,,,,,,,,,,,,,,,,,,,,,,,,,,,,,,,
1004020,Bow Little Market,http://www.bowlittlemarket.com,http://www.bowlittlemarket.com,https://www.facebook.com/BowLittleMarket,https://www.facebook.com/BowLittleMarket,,,,,,,06/09/2016 to 09/01/2016,2016-06-09,2016-09-01,Thu: 1:00 PM-6:00 PM;,Thu: 1:00 PM-6:00 PM,,,,,,,,,,,,,,,,,,,,,,,,,,,,,,,,
1009682,Bow Little Market Holiday Festival,http://www.bowlittlemarket.wordpress.com,http://www.bowlittlemarket.wordpress.com,https://www.facebook.com/BowLittleMarket,https://www.facebook.com/BowLittleMarket,,,,,,,11/15/2014 to 11/15/2014,2014-11-15,2014-11-15,,,,,,,,,,,,,,,,,,,,,,,,,,,,,,,,,,
1006542,Bowdoin Geneva Farmers Market,http://www.foodinthehood.wordpress.com,http://www.foodinthehood.wordpress.com,,,,,,,,,06/20/2013 to 10/31/2013,2013-06-20,2013-10-31,Thu: 2:30 PM-6:30 PM;,Thu: 2:30 PM-6:30 PM,,,,,,,,,,,,,,,,,,,,,,,,,,,,,,,,
1004534,Bowdoinham Farmers Market,,,https://www.facebook.com/pages/Bowdoinham-Farmers-Market/100378033339903,https://www.facebook.com/pages/Bowdoinham-Farmers-Market/100378033339903,,,,,Town of Bowdoinham web site & facebook,Town of Bowdoinham web site & facebook,05/18/2013 to 10/26/2013,2013-05-18,2013-10-26,Sat: 8:30 AM-12:30 PM;,Sat: 8:30 AM-12:30 PM,,,,,,,,,,,,,,,,,,,,,,,,,,,,,,,,
1009863,Bowie Farmers Market,,,https://www.facebook.com/pages/Bowie-Farmers-Market/213945728747865,https://www.facebook.com/pages/Bowie-Farmers-Market/213945728747865,,,,,,,01/01/2014 to 12/31/2014,2014-01-01,2014-12-31,Wed: 10:00 AM-5:00 PM;Fri: 10:00 AM-5:00 PM;Sat: 9:00 AM-3:00 PM;,Wed: 10:00 AM-5:00 PM,Fri: 10:00 AM-5:00 PM,Sat: 9:00 AM-3:00 PM,,,,,,,,,,,,,,,,,,,,,,,,,,,,,,
1006524,Bowie Farmers Market,http://www.cityofbowie.org/LeisureActivities/farmers_market.asp,http://www.cityofbowie.org/LeisureActivities/farmers_market.asp,,,,,,,,,05/17/2015 to 10/25/2015,2015-05-17,2015-10-25,Sun: 8:00 AM-12:00 PM;,Sun: 8:00 AM-12:00 PM,,,,,,,,,,,,,,,,,,,,,,,,,,,,,,,,
1008423,Bowling Green Community Farmers Market,http://www.townofbowlinggreen.com,http://www.townofbowlinggreen.com,https://www.facebook.com/pages/Bowling-Green-Farmers-Market-VA/480342235310524,https://www.facebook.com/pages/Bowling-Green-Farmers-Market-VA/480342235310524,,,,,,,04/19/2014 to 10/18/2014,2014-04-19,2014-10-18,Sat: 9:00 AM-1:00 PM;,Sat: 9:00 AM-1:00 PM,,,,,,,,,,,,,,,,,,,,,,,,,,,,,,,,
1006911,Bowling Green Farmers And Artists Market,,,,,,,,,,,May to October,2010-05-01,2010-10-31,Fri:3:00 PM - 7:00 PM;,Fri:3:00 PM - 7:00 PM,,,,,,,,,,,,,,,,,,,,,,,,,,,,,,,,
1000066,Bowling Green Greenmarket,http://www.grownyc.org,http://www.grownyc.org,https://www.facebook.com/ManhattanGreenmarkets,https://www.facebook.com/ManhattanGreenmarkets,,,,,,,01/01/2013 to 12/31/2013,2013-01-01,2013-12-31,Tue: 8:00 AM-5:00 PM;Thu: 8:00 AM-5:00 PM;,Tue: 8:00 AM-5:00 PM,Thu: 8:00 AM-5:00 PM,,,,,,,,,,,,,,,,,,,,,,,,,,,,,,,
1008806,Bowling Greens Original Farmers Market,http://www.bgfarmersmarket.com,http://www.bgfarmersmarket.com,https://www.facebook.com/pages/Bowling-Greens-Original-Farmers-Market/109677325732060,https://www.facebook.com/pages/Bowling-Greens-Original-Farmers-Market/109677325732060,,,,,,,03/16/2013 to 11/16/2013,2013-03-16,2013-11-16,Tue: 6:00 AM-;Thu: 6:00 AM-;Sat: 6:00 AM-;,Tue: 6:00 AM-,Thu: 6:00 AM-,Sat: 6:00 AM-,,,,,,,,,,,,,,,,,,,,,,,,,,,,,,
1007556,Boyd County Farmers’ Market,,,,,,,,,,,,,,,,,,,,,,,,,,,,,,,,,,,,,,,,,,,,,,,
1008808,Boyle County Farmers Market,http://eatlocaldanville.org,http://eatlocaldanville.org,https://www.facebook.com/pages/Boyle-County-Farmers-Market/102141493210469,https://www.facebook.com/pages/Boyle-County-Farmers-Market/102141493210469,,,,,,,04/02/2016 to 10/29/2016,2016-04-02,2016-10-29,Sat: 9:00 AM-2:00 PM;,Sat: 9:00 AM-2:00 PM,,,,,,,,,,,,,,,,,,,,,,,,,,,,,,,,
1004174,Boylston Farmers Market,,,https://www.facebook.com/BoylstonFarmersMarket,https://www.facebook.com/BoylstonFarmersMarket,,,,,,,07/09/2016 to 10/01/2016,2016-07-09,2016-10-01,Sat: 10:00 AM-1:00 PM;,Sat: 10:00 AM-1:00 PM,,,,,,,,,,,,,,,,,,,,,,,,,,,,,,,,
1002171,Boyne City Farmers Market,http://www.boynecityfarmersmarket.org,http://www.boynecityfarmersmarket.org,https://www.facebook.com/BoyneCityFarmersMarket,https://www.facebook.com/BoyneCityFarmersMarket,,,,,,,04/01/2013 to 10/31/2013,2013-04-01,2013-10-31,Wed: 8:00 AM-12:00 PM;Sat: 8:00 AM-12:00 PM;,Wed: 8:00 AM-12:00 PM,Sat: 8:00 AM-12:00 PM,,,,,,11/02/2013 to 04/26/2014,11/2/13, 04/26/2014,Sat: 9:00 AM-1:00 PM;,Sat: 9:00 AM-1:00 PM,,,,,,,,,,,,,,,,,,,,,
1006498,Bozeman Winter Farmers Market,http://bozemanwintermarket.com/,http://bozemanwintermarket.com/,https://www.facebook.com/bozemanwintermarket?ref=ts,https://www.facebook.com/bozemanwintermarket?ref=ts,,,,,,,10/18/2014 to 04/18/2015,2014-10-18,2015-04-18,Sat: 9:00 AM-12:00 PM;,Sat: 9:00 AM-12:00 PM,,,,,,,,,,,,,,,,,,,,,,,,,,,,,,,,
1000162,Bozrah Farmers Market,http://www.bozrahfarmersmarket.org,http://www.bozrahfarmersmarket.org,https://www.facebook.com/bozrahfarmersmarket,https://www.facebook.com/bozrahfarmersmarket,,,http://www.youtube.com/watch?v=RF1onYtECNU,http://www.youtube.com/watch?v=RF1onYtECNU,www.pintrest.com/bozrahfarmersmarket,www.pintrest.com/bozrahfarmersmarket,07/03/2015 to 10/09/2015,2015-07-03,2015-10-09,Fri: 4:00 PM-7:00 PM;,Fri: 4:00 PM-7:00 PM,,,,,,,,,,,,,,,,,,,,,,,,,,,,,,,,
1010329,Bpma At The Greenway,http://www.bostonpublicmarket.org,http://www.bostonpublicmarket.org,https://www.facebook.com/BostonPublicMarket,https://www.facebook.com/BostonPublicMarket,https://twitter.com/bospublicmarket,https://twitter.com/bospublicmarket,,,https://instagram.com/bostonpublicmarket,https://instagram.com/bostonpublicmarket,05/27/2015 to 11/25/2015,2015-05-27,2015-11-25,Wed: 11:00 AM-6:00 PM;Sun: 10:00 AM-4:00 PM;,Wed: 11:00 AM-6:00 PM,Sun: 10:00 AM-4:00 PM,,,,,,,,,,,,,,,,,,,,,,,,,,,,,,,
1007429,Bracken County Farmers Market Ii,,,,,,,,,,,,,,,,,,,,,,,,,,,,,,,,,,,,,,,,,,,,,,,
1012320,Bradenton Farmers Market,http://www.realizebradenton.com/farmers_market,http://www.realizebradenton.com/farmers_market,https://www.facebook.com/bradentonfarmersmarket/,https://www.facebook.com/bradentonfarmersmarket/,,,,,,,10/01/2016 to 05/27/2017,2016-10-01,2017-05-27,Sat: 9:00 AM-2:00 PM;,Sat: 9:00 AM-2:00 PM,,,,,,,,,,,,,,,,,,,,,,,,,,,,,,,,
1006731,Bradford Farmers Market,http://www.bradfordfarmersmarket.com,http://www.bradfordfarmersmarket.com,,,,,,,,,,,,,,,,,,,,,,,,,,,,,,,,,,,,,,,,,,,,,
1006913,Bradford Farmers Market,,,,,,,,,,,June to October,2010-06-01,2010-10-31,Thu:3:00 PM - 6:00 PM;,Thu:3:00 PM - 6:00 PM,,,,,,,,,,,,,,,,,,,,,,,,,,,,,,,,
1009876,Bradford Farmers Market,,,https://www.facebook.com/BradfordFarmersMarket,https://www.facebook.com/BradfordFarmersMarket,,,,,,,05/18/2014 to 10/19/2014,2014-05-18,2014-10-19,Sun: 10:00 AM-2:00 PM;,Sun: 10:00 AM-2:00 PM,,,,,,,,,,,,,,,,,,,,,,,,,,,,,,,,
1008629,Bradford Square Farmers Market,,,,,,,,,,,06/03/2014 to 10/30/2014,2014-06-03,2014-10-30,Tue: 6:00 AM-1:00 PM;Thu: 6:00 AM-1:00 PM;Sat: 6:00 AM-1:00 PM;,Tue: 6:00 AM-1:00 PM,Thu: 6:00 AM-1:00 PM,Sat: 6:00 AM-1:00 PM,,,,,,,,,,,,,,,,,,,,,,,,,,,,,,
1000023,Bradford Store,http://www.thebradfordstore.com/,http://www.thebradfordstore.com/,,,,,,,,,January to December,2010-01-01,2010-12-31,Tue:10:00 AM - 6:00 PM;Wed:10:00 AM - 6:00 PM;Thu:10:00 AM - 6:00 PM;Fri:10:00 AM - 6:00 PM;Sat:9:00 AM - 4:00 PM;,Tue:10:00 AM - 6:00 PM,Wed:10:00 AM - 6:00 PM,Thu:10:00 AM - 6:00 PM,Fri:10:00 AM - 6:00 PM,Sat:9:00 AM - 4:00 PM,,,,,,,,,,,,,,,,,,,,,,,,,,,,
1005051,Bradley County Farmers Market,,,,,,,,,,,,,,,,,,,,,,,,,,,,,,,,,,,,,,,,,,,,,,,
1010748,Brainerd Farmers Market,,,www.facebook.com/BrainerdFarmersMarket,,,,,,,,01/01/2014 to 12/31/2014,2014-01-01,2014-12-31,Sat: 10:00 AM-12:00 PM;,Sat: 10:00 AM-12:00 PM,,,,,,,,,,,,,,,,,,,,,,,,,,,,,,,,
1012386,Braintree Farmers Market,http://www.braintreefarmersmarket.org,http://www.braintreefarmersmarket.org,https://www.facebook.com/braintreefarmersmarket,https://www.facebook.com/braintreefarmersmarket,,,,,,,06/18/2016 to 11/19/2016,2016-06-18,2016-11-19,Sat: 9:00 AM-1:00 PM;,Sat: 9:00 AM-1:00 PM,,,,,,,,,,,,,,,,,,,,,,,,,,,,,,,,
1003062,Brambleton Farmers Market,http://www.loudounfarmersmarkets.org,http://www.loudounfarmersmarkets.org,https://www.facebook.com/pages/Brambleton-Farmers-Market/258238347581071,https://www.facebook.com/pages/Brambleton-Farmers-Market/258238347581071,https://twitter.com/LoudounFarmMkts,https://twitter.com/LoudounFarmMkts,,,,,05/03/2015 to 11/01/2015,2015-05-03,2015-11-01,Sun: 9:00 AM-1:00 PM;,Sun: 9:00 AM-1:00 PM,,,,,,,,,,,,,,,,,,,,,,,,,,,,,,,,
1008830,Bramwell Farmers Market,,,https://www.facebook.com/BramwellFarmersMarket,https://www.facebook.com/BramwellFarmersMarket,,,,,,,06/05/2015 to 10/09/2015,2015-06-05,2015-10-09,Fri: 9:00 AM-1:00 PM;,Fri: 9:00 AM-1:00 PM,,,,,,,,,,,,,,,,,,,,,,,,,,,,,,,,
1007584,Branch Avenue In Bloom Farmers Market,,,,,,,,,,,,,,,,,,,,,,,,,,,,,,,,,,,,,,,,,,,,,,,
1000156,Branch Brook Park Farmers Market,http://www.branchbrookpark.org,http://www.branchbrookpark.org,,,,,,,,,,,,,,,,,,,,,,,,,,,,,,,,,,,,,,,,,,,,,
1008401,Branchport Farmers Market,,,https://www.facebook.com/branchport.farmers.market?ref=hl,https://www.facebook.com/branchport.farmers.market?ref=hl,,,,,,,05/26/2016 to 10/27/2016,2016-05-26,2016-10-27,Thu: 4:00 PM-6:30 PM;,Thu: 4:00 PM-6:30 PM,,,,,,,,,,,,,,,,,,,,,,,,,,,,,,,,
1003465,Brandermill Green Market,http://www.brandermill.com,http://www.brandermill.com,,,,,,,,,May to October,2010-05-01,2010-10-31,Sat:10:00 AM - 12:00 PM;,Sat:10:00 AM - 12:00 PM,,,,,,,,,,,,,,,,,,,,,,,,,,,,,,,,
1005714,Brandon Farmers Market,,,https://www.facebook.com/pages/Brandon-Farmers-Market-Brandon-Vermont/128788920470609,https://www.facebook.com/pages/Brandon-Farmers-Market-Brandon-Vermont/128788920470609,,,,,,,05/22/2015 to 10/09/2015,2015-05-22,2015-10-09,Fri: 9:00 AM-2:00 PM;,Fri: 9:00 AM-2:00 PM,,,,,,,,,,,,,,,,,,,,,,,,,,,,,,,,
1002178,Brandon Fresh Market,http://www.brandonfreshmarket.com,http://www.brandonfreshmarket.com,,,,,,,,,,,,,,,,,,,,,,,,,,,,,,,,,,,,,,,,,,,,,
1012403,Branford Alps Farmers Market,http://alpsmkt.org/,http://alpsmkt.org/,https://m.facebook.com/BranfordAlpsFarmersMarket/,https://m.facebook.com/BranfordAlpsFarmersMarket/,,,,,,,06/23/2016 to 10/27/2016,2016-06-23,2016-10-27,Thu: 4:00 PM-7:00 PM;,Thu: 4:00 PM-7:00 PM,,,,,,,,,,,,,,,,,,,,,,,,,,,,,,,,
1007428,Branford Community Farmers Market,,,,,,,,,,,,,,,,,,,,,,,,,,,,,,,,,,,,,,,,,,,,,,,
1006926,Branson Farmers Market,,,,,,,,,,,May to October,2010-05-01,2010-10-31,Sat:7:00 AM - 12:00 PM;,Sat:7:00 AM - 12:00 PM,,,,,,,,,,,,,,,,,,,,,,,,,,,,,,,,
1002407,Brattleboro Area Farmers Market,http://www.brattleborofarmersmarket.com,http://www.brattleborofarmersmarket.com,https://www.facebook.com/pages/Brattleboro-Area-Farmers-Market/197642043604505,https://www.facebook.com/pages/Brattleboro-Area-Farmers-Market/197642043604505,,,,,,,05/03/2014 to 10/25/2014,2014-05-03,2014-10-25,Sat: 9:00 AM-2:00 PM;,Sat: 9:00 AM-2:00 PM,,,,,,,,,,,,,,,,,,,,,,,,,,,,,,,,
1002408,Brattleboro Area Farmers Market,http://www.brattleborofarmersmarket.com,http://www.brattleborofarmersmarket.com,https://www.facebook.com/pages/Brattleboro-Area-Farmers-Market/197642043604505,https://www.facebook.com/pages/Brattleboro-Area-Farmers-Market/197642043604505,,,,,,,05/07/2014 to 10/29/2014,2014-05-07,2014-10-29,Wed: 10:00 AM-2:00 PM;,Wed: 10:00 AM-2:00 PM,,,,,,,,,,,,,,,,,,,,,,,,,,,,,,,,
1011075,Brattleboro Winter Farmers Market,,,//www.facebook.com/BrattleboroWinterFarmersMarket,,//twitter.com/BrattWinterMkt,,,,,,11/07/2015 to 03/26/2016,2015-11-07,2016-03-26,Sat: 10:00 AM-2:00 PM;,Sat: 10:00 AM-2:00 PM,,,,,,,,,,,,,,,,,,,,,,,,,,,,,,,,
1003052,Braxton County Tailgate Market,,,,,,,,,,,,,,,,,,,,,,,,,,,,,,,,,,,,,,,,,,,,,,,
1007663,Brazos Valley Farmers Market,http://www.brazosvalleyfarmersmarket.com,http://www.brazosvalleyfarmersmarket.com,https://www.facebook.com/brazos.valley.farmers.market,https://www.facebook.com/brazos.valley.farmers.market,,,,,,,,,,,,,,,,,,,,,,,,,,,,,,,,,,,,,,,,,,,
1003139,Brea Farmers Market,,,,,,,,,,,,,,,,,,,,,,,,,,,,,,,,,,,,,,,,,,,,,,,
1007746,Breaux Bridge Farmers Market,http://www.laboutiquesdepontbreaux.com,http://www.laboutiquesdepontbreaux.com,,,,,,,,,,,,,,,,,,,,,,,,,,,,,,,,,,,,,,,,,,,,,
1007558,Breckinridge County Farmers’ Produce Market,,,,,,,,,,,,,,,,,,,,,,,,,,,,,,,,,,,,,,,,,,,,,,,
1004819,Breezy Acres Orchard,,,,,,,,,,,,,,,,,,,,,,,,,,,,,,,,,,,,,,,,,,,,,,,
1003293,Bremerton Farmers Market,http://www.bremertonmarket.com,http://www.bremertonmarket.com,https://www.facebook.com/BremertonMarket,https://www.facebook.com/BremertonMarket,https://twitter.com/bremertonfm,https://twitter.com/bremertonfm,,,,,05/01/2014 to 10/16/2014,2014-05-01,2014-10-16,Thu: 4:00 PM-7:00 PM;,Thu: 4:00 PM-7:00 PM,,,,,,,,,,,,,,,,,,,,,,,,,,,,,,,,
1003294,Bremerton Farmers Market - Ferry Terminal,http://www.bremertonmarket.com,http://www.bremertonmarket.com,https://www.facebook.com/BremertonMarket,https://www.facebook.com/BremertonMarket,https://twitter.com/bremertonfm,https://twitter.com/bremertonfm,,,,,05/04/2014 to 10/12/2014,2014-05-04,2014-10-12,Sun: 10:30 AM-2:30 PM;,Sun: 10:30 AM-2:30 PM,,,,,,,,,,,,,,,,,,,,,,,,,,,,,,,,
1011349,Brentwood Farmers Market,http://www.pcfma.org,http://www.pcfma.org,https://www.facebook.com/BrentwoodFarmersMarket,https://www.facebook.com/BrentwoodFarmersMarket,,,,,,,03/07/2015 to 11/21/2015,2015-03-07,2015-11-21,Sat: 8:00 AM-12:00 PM;,Sat: 8:00 AM-12:00 PM,,,,,,,,,,,,,,,,,,,,,,,,,,,,,,,,
1008611,Brevard County Farmers Market,https://www.brevardcountyfarmersmarket.com,https://www.brevardcountyfarmersmarket.com,https://www.facebook.com/brevardcountyfarmersmarket,https://www.facebook.com/brevardcountyfarmersmarket,,,,,,,01/01/2013 to 12/31/2013,2013-01-01,2013-12-31,Thu: 3:00 PM-6:00 PM;,Thu: 3:00 PM-6:00 PM,,,,,,,,,,,,,,,,,,,,,,,,,,,,,,,,
1003004,Brewer Farmers Market,http://www.brewermaine.gov/community,http://www.brewermaine.gov/community,https://www.facebook.com/ShopBrewerFarmersMarket,https://www.facebook.com/ShopBrewerFarmersMarket,,,,,,,05/01/2015 to 05/01/2015,2015-05-01,2015-05-01,Mon: -1:00 AM;Tue: 8:30 AM-1:00 PM;Thu: 8:30 AM-1:00 PM;Sat: 8:30 AM-2:00 PM;,Mon: -1:00 AM,Tue: 8:30 AM-1:00 PM,Thu: 8:30 AM-1:00 PM,Sat: 8:30 AM-2:00 PM,,,,,,,,,,,,,,,,,,,,,,,,,,,,,
1005878,Brewster Farmers Market,http://www.brewsterfarmersmarket.com,http://www.brewsterfarmersmarket.com,,,,,,,,,06/11/2014 to 11/22/2014,2014-06-11,2014-11-22,Wed: 9:00 AM-2:00 PM;Sat: 9:00 AM-2:00 PM;,Wed: 9:00 AM-2:00 PM,Sat: 9:00 AM-2:00 PM,,,,,,,,,,,,,,,,,,,,,,,,,,,,,,,
1001610,Brewton Farmers Market,,,,,,,,,,,,,,,,,,,,,,,,,,,,,,,,,,,,,,,,,,,,,,,
1003867,Brian Coyle Farmers Market,http://www.iatp.org/minimarkets,http://www.iatp.org/minimarkets,,,,,,,,,,,,,,,,,,,,,,,,,,,,,,,,,,,,,,,,,,,,,
1006853,Briarcliff Village Farmers Market,http://www.greenacres.com,http://www.greenacres.com,https://www.facebook.com/briarcliffvillagefarmersmarket,https://www.facebook.com/briarcliffvillagefarmersmarket,,,,,,,05/01/2014 to 09/25/2014,2014-05-01,2014-09-25,Thu: 3:00 PM-7:00 PM;,Thu: 3:00 PM-7:00 PM,,,,,,,,,,,,,,,,,,,,,,,,,,,,,,,,
1006144,Briarcliff Winter Farmers Market,http://www.communitymarkets.biz,http://www.communitymarkets.biz,,,,,,,,,,,,,,,,,,,,,,,,,,,,,,,,,,,,,,,,,,,,,
1006305,Briargate Farmers Market,http://www.springsfarmersmarket.com,http://www.springsfarmersmarket.com,,,,,,,,,05/21/2014 to 10/08/2014,2014-05-21,2014-10-08,Mon: 10:00 AM-4:00 PM;,Mon: 10:00 AM-4:00 PM,,,,,,,,,,,,,,,,,,,,,,,,,,,,,,,,
1008568,Brick District Farmers Market,http://agrimissouri.com/mo-grown/grodetail.php?type=mo-grown&ID=102,http://agrimissouri.com/mo-grown/grodetail.php?type=mo-grown&ID=102,,,,,,,,,,,,Sat: 9:00 AM-12:00 PM;,Sat: 9:00 AM-12:00 PM,,,,,,,,,,,,,,,,,,,,,,,,,,,,,,,,
1011201,Brick Farmers Market,http://www.brickfarmersmarket.com,http://www.brickfarmersmarket.com,https://www.facebook.com/brickfarmersmarket,https://www.facebook.com/brickfarmersmarket,https://twitter.com/brickfresh,https://twitter.com/brickfresh,,,https://instagram.com/brickfarmersmarket/,https://instagram.com/brickfarmersmarket/,05/21/2016 to 10/01/2016,2016-05-21,2016-10-01,Sat: 9:00 AM-12:00 PM;,Sat: 9:00 AM-12:00 PM,,,,,,,,,,,,,,,,,,,,,,,,,,,,,,,,
1004664,Bridge Street Farmers Market,,,,,,,,,,,,,,,,,,,,,,,,,,,,,,,,,,,,,,,,,,,,,,,
1005068,Bridge Street Farmers Market,,,,,,,,,,,,,,,,,,,,,,,,,,,,,,,,,,,,,,,,,,,,,,,
1001519,Bridgeport Farmers Market,,,https://www.facebook.com/pages/Bridgeport-Farmers-Market/181228659667,https://www.facebook.com/pages/Bridgeport-Farmers-Market/181228659667,Follow us on Twitter,,,,Information on Connect-Bridgeport.com,Information on Connect-Bridgeport.com,05/12/2013 to 10/13/2013,2013-05-12,2013-10-13,Sun: 10:00 AM-2:00 PM;,Sun: 10:00 AM-2:00 PM,,,,,,,11/03/2013 to 04/06/2014,11/3/13, 04/06/2014,Sun: 11:00 AM-2:00 PM;,Sun: 11:00 AM-2:00 PM,,,,,,,,,,,,,,,,,,,,,
1002700,Bridgeport Farmers Market,,,https://www.facebook.com/BridgeportFarmersMarket,https://www.facebook.com/BridgeportFarmersMarket,,,,,,,06/03/2015 to 10/21/2015,2015-06-03,2015-10-21,Wed: 4:00 PM-7:30 PM;,Wed: 4:00 PM-7:30 PM,,,,,,,,,,,,,,,,,,,,,,,,,,,,,,,,
1011212,Bridges To Wellness Farm Stand,,,,,,,,,,,,,,Tue: 11:00 AM-2:00 PM;,Tue: 11:00 AM-2:00 PM,,,,,,,,,,,,,,,,,,,,,,,,,,,,,,,,
1000781,Bridgeton Outdoor Market In The Culinary District - A Community Farmers Market,http://www.getbridgeton.com,http://www.getbridgeton.com,,,,,,,,,06/28/2013 to 08/30/2013,2013-06-28,2013-08-30,Fri: 10:00 AM-2:00 PM;,Fri: 10:00 AM-2:00 PM,,,,,,,,,,,,,,,,,,,,,,,,,,,,,,,,
1007207,Bridgeview La Crosse Farmers Wednesday Market,,,,,,,,,,,,,,,,,,,,,,,,,,,,,,,,,,,,,,,,,,,,,,,
1011242,Bridgeville Farmers Market,https://bridgevillefarmersmarket.wordpress.com/,https://bridgevillefarmersmarket.wordpress.com/,https://www.facebook.com/pages/Bridgeville-Farmers-Market/,https://www.facebook.com/pages/Bridgeville-Farmers-Market/,,,,,,,06/16/2015 to 10/06/2015,2015-06-16,2015-10-06,Tue: 4:00 PM-6:30 PM;,Tue: 4:00 PM-6:30 PM,,,,,,,,,,,,,,,,,,,,,,,,,,,,,,,,
1008382,Bridgton Farmers Market,http://www.bridgtonfarmersmarket.com,http://www.bridgtonfarmersmarket.com,https://www.facebook.com/BridgtonFarmersMarket,https://www.facebook.com/BridgtonFarmersMarket,,,,,,,05/04/2013 to 11/02/2013,2013-05-04,2013-11-02,Sat: 8:00 AM-1:00 PM;,Sat: 8:00 AM-1:00 PM,,,,,,,,,,,,,,,,,,,,,,,,,,,,,,,,
1009462,Briggs Chaney-greencastle Farmers And Artisans Market,http://www.whiteoakmarket.org/,http://www.whiteoakmarket.org/,https://www.facebook.com/bcgfarmersmarket,https://www.facebook.com/bcgfarmersmarket,,,,,,,,,,,,,,,,,,,,,,,,,,,,,,,,,,,,,,,,,,,
1004823,Brighton Downtown Saturday Market,,,,,,,,,,,,,,,,,,,,,,,,,,,,,,,,,,,,,,,,,,,,,,,
1003816,Brighton Farmers Market,,,,,,,,,,,,,,,,,,,,,,,,,,,,,,,,,,,,,,,,,,,,,,,
1005440,Brighton Farmers Market,http://www.brightonfarmersmarket.org,http://www.brightonfarmersmarket.org,https://www.facebook.com/pages/Brighton-Farmers-Market/113613384778,https://www.facebook.com/pages/Brighton-Farmers-Market/113613384778,,,,,,,05/22/2016 to 10/30/2016,2016-05-22,2016-10-30,Sun: 9:00 AM-1:00 PM;,Sun: 9:00 AM-1:00 PM,,,,,,,11/06/2016 to 05/14/2017,11/6/16, 05/14/2017,Sun: 1:00 PM-4:00 PM;,Sun: 1:00 PM-4:00 PM,,,,,,,,,,,,,,,,,,,,,
1003717,Brillion Farmers Market,,,,,,,,,,,,,,,,,,,,,,,,,,,,,,,,,,,,,,,,,,,,,,,
1005483,Brimfield At Hitchcock Free Academy,http://www.hitchcockacademy.org,http://www.hitchcockacademy.org,,,,,,,,,04/12/2014 to 11/22/2014,2014-04-12,2014-11-22,Sat: 9:00 AM-2:00 PM;,Sat: 9:00 AM-2:00 PM,,,,,,,,,,,,,,,,,,,,,,,,,,,,,,,,
1003513,Brimfield Farmers Market,,,,,,,,,,,,,,,,,,,,,,,,,,,,,,,,,,,,,,,,,,,,,,,
1000541,Brimhall Cfm,,,,,,,,,,,,,,,,,,,,,,,,,,,,,,,,,,,,,,,,,,,,,,,
1007649,Bringing Home Grown To U 1,,,,,,,,,,,January to December,2010-01-01,2010-12-31,Sat:8:00 AM - 1:00 PM;,Sat:8:00 AM - 1:00 PM,,,,,,,,,,,,,,,,,,,,,,,,,,,,,,,,
1007650,Bringing Homegrown To U 2,,,,,,,,,,,January to December,2010-01-01,2010-12-31,Thu:3:00 PM - 7:00 PM;Sat:8:00 AM - 5:00 PM;,Thu:3:00 PM - 7:00 PM,Sat:8:00 AM - 5:00 PM,,,,,,,,,,,,,,,,,,,,,,,,,,,,,,,
1007502,Bristol - Housing Authority Farmers’ Market,,,,,,,,,,,,,,,,,,,,,,,,,,,,,,,,,,,,,,,,,,,,,,,
1012058,Bristol County Agricultural High School,http://www.bcahs.com,http://www.bcahs.com,Bristol Aggie Grows Farm Stand,,,,,,,,,,,Sat: 8:00 AM-1:00 PM;,Sat: 8:00 AM-1:00 PM,,,,,,,,,,,,,,,,,,,,,,,,,,,,,,,,
1004480,Bristol Farmers Market,http://www.FreeWebs.com/BristolFarmersMarket,http://www.FreeWebs.com/BristolFarmersMarket,,,,,,,,,June to October,2010-06-01,2010-10-31,Wed:2:00 PM - 6:00 PM;,Wed:2:00 PM - 6:00 PM,,,,,,,,,,,,,,,,,,,,,,,,,,,,,,,,
1007474,Bristol Farmers Market,,,,,,,,,,,,,,,,,,,,,,,,,,,,,,,,,,,,,,,,,,,,,,,
1000309,Bristol Farmers Market,http://www.bristolfarmersmarket.org,http://www.bristolfarmersmarket.org,https://www.facebook.com/BristolFarmersMarket,https://www.facebook.com/BristolFarmersMarket,,,,,,,,,,Wed: 3:00 PM-6:00 PM;Sat: 10:00 AM-1:00 PM;,Wed: 3:00 PM-6:00 PM,Sat: 10:00 AM-1:00 PM,,,,,,,,,,,,,,,,,,,,,,,,,,,,,,,
1008017,Bristow Farmers Market,http://www.BristowFarmersMarket.com,http://www.BristowFarmersMarket.com,https://www.facebook.com/pages/Bristow-Farmers-Market/336754686393407,https://www.facebook.com/pages/Bristow-Farmers-Market/336754686393407,,,,,,,01/01/2014 to 12/31/2014,2014-01-01,2014-12-31,Sun: 10:00 AM-2:00 PM;,Sun: 10:00 AM-2:00 PM,,,,,,,,,,,,,,,,,,,,,,,,,,,,,,,,
1010604,Brit First Saturday Farmers Market,http://www.brit.org,http://www.brit.org,https://www.facebook.com/BRITorg,https://www.facebook.com/BRITorg,,,,,,,04/05/2014 to 10/04/2014,2014-04-05,2014-10-04,Sat: 8:00 AM-12:00 PM;,Sat: 8:00 AM-12:00 PM,,,,,,,,,,,,,,,,,,,,,,,,,,,,,,,,
1002198,Britt Farmers Market,,,,,,,,,,,,,,,,,,,,,,,,,,,,,,,,,,,,,,,,,,,,,,,
1010335,Broad And Mt. Vernon,,,,,,,,,,,,,,,,,,,,,,,,,,,,,,,,,,,,,,,,,,,,,,,
1005301,Broad And Snyder Farmers Market,http://thefoodtrust.org/farmers-markets/market/broad-and-snyder-1,http://thefoodtrust.org/farmers-markets/market/broad-and-snyder-1,,,,,,,,,06/01/2015 to 11/15/2015,2015-06-01,2015-11-15,Tue: 2:00 PM-7:00 PM;,Tue: 2:00 PM-7:00 PM,,,,,,,,,,,,,,,,,,,,,,,,,,,,,,,,
1005321,Broad And South,http://thefoodtrust.org/farmers-markets/market/broad-and-south,http://thefoodtrust.org/farmers-markets/market/broad-and-south,,,,,,,,,06/01/2015 to 11/01/2015,2015-06-01,2015-11-01,Wed: 2:00 PM-7:00 PM;,Wed: 2:00 PM-7:00 PM,,,,,,,,,,,,,,,,,,,,,,,,,,,,,,,,
1001493,Broad Branch Farmers Market,http://www.redbudfarm.com,http://www.redbudfarm.com,,,,,,,,,,,,,,,,,,,,,,,,,,,,,,,,,,,,,,,,,,,,,
1005505,Broad Ripple Farmers Market,http://www.broadripplefarmersmarket.org,http://www.broadripplefarmersmarket.org,https://www.facebook.com/BroadRippleFarmersMarket,https://www.facebook.com/BroadRippleFarmersMarket,,,,,,,05/03/2014 to 11/22/2014,2014-05-03,2014-11-22,Sat: 8:00 AM-12:00 PM;,Sat: 8:00 AM-12:00 PM,,,,,,,,,,,,,,,,,,,,,,,,,,,,,,,,
1006306,Broadmoor Farmers Market,http://www.springsfarmersmarket.com,http://www.springsfarmersmarket.com,,,,,,,,,05/26/2014 to 09/29/2014,2014-05-26,2014-09-29,Mon: 9:00 AM-2:00 PM;,Mon: 9:00 AM-2:00 PM,,,,,,,,,,,,,,,,,,,,,,,,,,,,,,,,
1008896,Broadway Farmers Market,http://www.town.broadway.va.us/farmers-market,http://www.town.broadway.va.us/farmers-market,https://www.facebook.com/broadwayfarmersmarket,https://www.facebook.com/broadwayfarmersmarket,,,,,,,05/07/2016 to 11/05/2016,2016-05-07,2016-11-05,Wed: 4:00 PM-7:00 PM;Sat: 8:00 AM-12:00 PM;,Wed: 4:00 PM-7:00 PM,Sat: 8:00 AM-12:00 PM,,,,,,,,,,,,,,,,,,,,,,,,,,,,,,,
1009948,Broadway Farmers Market,http://slavicvillage.org/farmersmarket,http://slavicvillage.org/farmersmarket,https://www.facebook.com/pages/Broadway-Farmers-Market,https://www.facebook.com/pages/Broadway-Farmers-Market,,,,,,,06/23/2014 to 09/22/2014,2014-06-23,2014-09-22,Mon: 4:00 PM-7:00 PM;,Mon: 4:00 PM-7:00 PM,,,,,,,,,,,,,,,,,,,,,,,,,,,,,,,,
1010385,Broadway Farmers Market,http://www.tacomafarmersmarket.com,http://www.tacomafarmersmarket.com,https://www.facebook.com/TacomaFarmersMarket,https://www.facebook.com/TacomaFarmersMarket,,,,,,,05/01/2014 to 10/30/2014,2014-05-01,2014-10-30,Thu: 10:00 AM-3:00 PM;,Thu: 10:00 AM-3:00 PM,,,,,,,,,,,,,,,,,,,,,,,,,,,,,,,,
1000821,Brockport Farmers Market,,,,,,,,,,,,,,,,,,,,,,,,,,,,,,,,,,,,,,,,,,,,,,,
1007603,Brockton Fairgrounds Farmers Market,,,,,,,,,,,,,,,,,,,,,,,,,,,,,,,,,,,,,,,,,,,,,,,
1011852,Brockton Farmers Market - City Hall Plaza,http://brocktonfarmersmarket.com,http://brocktonfarmersmarket.com,www.facebook.com/BrocktonFarmersMarket/,,twitter.com/BrocktonMarket,,,,www.instagram.com/brocktonfarmersmkt/,www.instagram.com/brocktonfarmersmkt/,07/08/2016 to 10/28/2016,2016-07-08,2016-10-28,Fri: 10:00 AM-2:00 PM;,Fri: 10:00 AM-2:00 PM,,,,,,,,,,,,,,,,,,,,,,,,,,,,,,,,
1001333,Broken Bow Farmers Market,,,,,,,,,,,06/06/2013 to 10/17/2013,2013-06-06,2013-10-17,Thu: 11:00 AM-;,Thu: 11:00 AM-,,,,,,,,,,,,,,,,,,,,,,,,,,,,,,,,
1006039,Bronson Winter Farmers Market,http://www.bronsonhealth.com/farmersmarket,http://www.bronsonhealth.com/farmersmarket,,,,,,,,,November to April,2010-11-01,2010-04-30,Fri:10:30 am - 2:00 pm;,Fri:10:30 am - 2:00 pm,,,,,,,,,,,,,,,,,,,,,,,,,,,,,,,,
1000095,Bronx Borough Hall Greenmarket,http://www.grownyc.org,http://www.grownyc.org,https://www.facebook.com/bronxgreenmarkets,https://www.facebook.com/bronxgreenmarkets,,,,,,,06/04/2013 to 11/26/2013,2013-06-04,2013-11-26,Tue: 8:00 AM-4:00 PM;,Tue: 8:00 AM-4:00 PM,,,,,,,,,,,,,,,,,,,,,,,,,,,,,,,,
1012744,Bronxville Farmers Market,http://www.bronxvillefarmersmarket.com/,http://www.bronxvillefarmersmarket.com/,https://www.facebook.com/BronxvilleFarmersMarket/,https://www.facebook.com/BronxvilleFarmersMarket/,,,,,,,05/04/2016 to 11/19/2016,2016-05-04,2016-11-19,Sat: 8:30 AM-1:00 PM;,Sat: 8:30 AM-1:00 PM,,,,,,,,,,,,,,,,,,,,,,,,,,,,,,,,
1006203,Bronzeville (chicago) Farmers Market,http://www.cityofchicago.org/specialevents,http://www.cityofchicago.org/specialevents,,,,,,,,,,,,,,,,,,,,,,,,,,,,,,,,,,,,,,,,,,,,,
1005367,Brooke County Farmers Market - Follansbee,,,https://www.facebook.com/Brookecountyfarmersmarketwv/,https://www.facebook.com/Brookecountyfarmersmarketwv/,,,,,,,06/22/2016 to 09/28/2016,2016-06-22,2016-09-28,Wed: 3:00 PM-6:00 PM;,Wed: 3:00 PM-6:00 PM,,,,,,,,,,,,,,,,,,,,,,,,,,,,,,,,
1000787,Brooke County Farmers Market - Wellsburg,https://www.facebook.com/Brookecountyfarmersmarketwv/,https://www.facebook.com/Brookecountyfarmersmarketwv/,,,,,,,,,06/25/2016 to 09/17/2016,2016-06-25,2016-09-17,Sat: 9:00 AM-1:00 PM;,Sat: 9:00 AM-1:00 PM,,,,,,,,,,,,,,,,,,,,,,,,,,,,,,,,
1001097,Brookfield Farmers Market,http://www.brookfieldfarmersmarket.com,http://www.brookfieldfarmersmarket.com,,,,,,,,,05/07/2016 to 10/29/2016,2016-05-07,2016-10-29,Sat: 7:30 AM-12:00 PM;,Sat: 7:30 AM-12:00 PM,,,,,,,,,,,,,,,,,,,,,,,,,,,,,,,,
1003988,Brookfield Farmers Market,http://www.brookfieldchamber.net,http://www.brookfieldchamber.net,https://www.facebook.com/pages/Brookfield-IL-Chamber-of-Commerce/302614520085?ref=search&sid=1019319338.2148396957..1,https://www.facebook.com/pages/Brookfield-IL-Chamber-of-Commerce/302614520085?ref=search&sid=1019319338.2148396957..1,,,,,,,06/08/2014 to 10/18/2014,2014-06-08,2014-10-18,Sat: 8:00 AM-1:00 PM;,Sat: 8:00 AM-1:00 PM,,,,,,,,,,,,,,,,,,,,,,,,,,,,,,,,
1007361,Brookfield Farmers Market,,,https://www.facebook.com/brookfieldfarmersmarket,https://www.facebook.com/brookfieldfarmersmarket,,,,,,,06/07/2013 to 09/27/2013,2013-06-07,2013-09-27,Fri: 4:00 PM-6:30 PM;,Fri: 4:00 PM-6:30 PM,,,,,,,,,,,,,,,,,,,,,,,,,,,,,,,,
1006915,Brookfield Farmers Market,,,,,,,,,,,May to October,2010-05-01,2010-10-31,Sat:8:00 AM - 12:00 PM;,Sat:8:00 AM - 12:00 PM,,,,,,,,,,,,,,,,,,,,,,,,,,,,,,,,
1002166,Brookhaven Farmers Market,,,https://www.facebook.com/farmersmarketbrookaven,https://www.facebook.com/farmersmarketbrookaven,,,,,,,06/06/2014 to 09/12/2014,2014-06-06,2014-09-12,Tue: 3:00 PM-6:00 PM;Fri: 7:00 AM-12:00 PM;,Tue: 3:00 PM-6:00 PM,Fri: 7:00 AM-12:00 PM,,,,,,,,,,,,,,,,,,,,,,,,,,,,,,,
1012726,Brookhaven Farmers Market,http://www.brookhavenfarmersmarket.com,http://www.brookhavenfarmersmarket.com,https://www.facebook.com/brookhavenmarket,https://www.facebook.com/brookhavenmarket,,,,,,,04/16/2016 to 12/10/2016,2016-04-16,2016-12-10,Sat: 9:00 AM-12:00 PM;,Sat: 9:00 AM-12:00 PM,,,,,,,,,,,,,,,,,,,,,,,,,,,,,,,,
1005482,Brookings Farmers Market,http://www.brookingsfarmersmarket.com,http://www.brookingsfarmersmarket.com,https://www.facebook.com/pages/Brookings-Farmers-Market/117737541579595,https://www.facebook.com/pages/Brookings-Farmers-Market/117737541579595,,,,,,,05/07/2016 to 10/29/2016,2016-05-07,2016-10-29,Sun: 9:00 AM-1:00 PM;,Sun: 9:00 AM-1:00 PM,,,,,,,,,,,,,,,,,,,,,,,,,,,,,,,,
1005671,Brookings Harbor Farmers And Artisans Market,http://www.LocalHarvest.com,http://www.LocalHarvest.com,https://www.facebook.com/BrookingsFarmersAndArtisansMarket,https://www.facebook.com/BrookingsFarmersAndArtisansMarket,,,,,,,05/31/2014 to 10/11/2014,2014-05-31,2014-10-11,Sat: 10:00 AM-4:00 PM;Sun: 10:00 AM-4:00 PM;,Sat: 10:00 AM-4:00 PM,Sun: 10:00 AM-4:00 PM,,,,,,,,,,,,,,,,,,,,,,,,,,,,,,,
1008242,Brookland Farmers Market,http://www.lickingcreekbendfarm.com,http://www.lickingcreekbendfarm.com,https://www.facebook.com/NeedmoreVeggies/timeline,https://www.facebook.com/NeedmoreVeggies/timeline,,,,,https://www.instagram.com/lickingcreekbendfarm/,https://www.instagram.com/lickingcreekbendfarm/,06/01/2016 to 10/25/2016,2016-06-01,2016-10-25,Tue: 4:00 PM-7:00 PM;,Tue: 4:00 PM-7:00 PM,,,,,,,,,,,,,,,,,,,,,,,,,,,,,,,,
1012257,Brooklands Monroe St Farmers Market,http://www.community-foodworks.org/monroe-street-ne,,https://www.facebook.com/FarmersMarketontheArtsWalk/,https://www.facebook.com/FarmersMarketontheArtsWalk/,https://twitter.com/monroestfm,https://twitter.com/monroestfm,,,,,04/16/2016 to 12/17/2016,2016-04-16,2016-12-17,Sat: 9:00 AM-1:00 PM;,Sat: 9:00 AM-1:00 PM,,,,,,,,,,,,,,,,,,,,,,,,,,,,,,,,
1005212,Brooklin Farmers Market,,,,,,,,,,,,,,,,,,,,,,,,,,,,,,,,,,,,,,,,,,,,,,,
1012091,Brookline Farmers Market,http://brooklinefarmersmarket.com,http://brooklinefarmersmarket.com,https://www.facebook.com/BrooklineFarmersMarket/,https://www.facebook.com/BrooklineFarmersMarket/,,,,,https://www.instagram.com/brooklinefarmersmarket/,https://www.instagram.com/brooklinefarmersmarket/,06/02/2016 to 11/17/2016,2016-06-02,2016-11-17,Thu: 1:30 PM-6:30 PM;,Thu: 1:30 PM-6:30 PM,,,,,,,,,,,,,,,,,,,,,,,,,,,,,,,,
1000100,Brooklyn Borough Hall Greenmarket,http://www.grownyc.org,http://www.grownyc.org,https://www.facebook.com/BrooklynGreenmarkets,https://www.facebook.com/BrooklynGreenmarkets,,,,,,,01/01/2013 to 12/31/2013,2013-01-01,2013-12-31,Tue: 8:00 AM-6:00 PM;Thu: 8:00 AM-6:00 PM;Sat: 8:00 AM-6:00 PM;,Tue: 8:00 AM-6:00 PM,Thu: 8:00 AM-6:00 PM,Sat: 8:00 AM-6:00 PM,,,,,,,,,,,,,,,,,,,,,,,,,,,,,,
1000775,Brooklyn Farmers Market,,,,,,,,,,,,,,,,,,,,,,,,,,,,,,,,,,,,,,,,,,,,,,,
1007767,Brooklyn Fm,http://www.nectfarmersmarket.org,http://www.nectfarmersmarket.org,,,,,,,,,,,,,,,,,,,,,,,,,,,,,,,,,,,,,,,,,,,,,
1001371,Brooks Farm Market,,,,,,,,,,,,,,,,,,,,,,,,,,,,,,,,,,,,,,,,,,,,,,,
1002427,Brookside Farmers Market,http://www.brooksidefarmersmarket.com,http://www.brooksidefarmersmarket.com,,,https://twitter.com/BKSfarmersmkt,https://twitter.com/BKSfarmersmkt,,,www.instagram.com/brooksidefarmersmarket/,www.instagram.com/brooksidefarmersmarket/,04/16/2016 to 10/29/2016,2016-04-16,2016-10-29,Sat: 8:00 AM-1:00 PM;,Sat: 8:00 AM-1:00 PM,,,,,,,11/05/2016 to 11/19/2016,11/5/16, 11/19/2016,Sat: 9:00 AM-12:00 PM;,Sat: 9:00 AM-12:00 PM,,,,,,,,,,,,,,,,,,,,,
1006584,Brookside Farmers Market,http://www.pcfma.com/market_home.php?market_id=75,http://www.pcfma.com/market_home.php?market_id=75,,,,,,,,,May to September,2010-05-01,2010-09-30,Thu:4:00 AM - 7:00 PM;,Thu:4:00 AM - 7:00 PM,,,,,,,,,,,,,,,,,,,,,,,,,,,,,,,,
1008379,Brooksville Farmers Market,,,https://www.facebook.com/BrooksvilleMaineFarmersMarket,https://www.facebook.com/BrooksvilleMaineFarmersMarket,,,,,,,05/28/2013 to 09/24/2013,2013-05-28,2013-09-24,Tue: 9:30 AM-12:00 PM;,Tue: 9:30 AM-12:00 PM,,,,,,,,,,,,,,,,,,,,,,,,,,,,,,,,
1001086,Brookville Farmers Market,,,https://www.facebook.com/groups/63096253830/,https://www.facebook.com/groups/63096253830/,,,,,,,05/16/2014 to 10/17/2014,2014-05-16,2014-10-17,Fri: 3:30 PM-7:00 PM;,Fri: 3:30 PM-7:00 PM,,,,,,,,,,,,,,,,,,,,,,,,,,,,,,,,
1005909,Brookwood Farmers Market,http://www.brookwoodfarmersmarket.com,http://www.brookwoodfarmersmarket.com,,,,,,,,,June to September,2010-06-01,2010-09-30,Fri:4:00 pm - 7:00 pm;,Fri:4:00 pm - 7:00 pm,,,,,,,,,,,,,,,,,,,,,,,,,,,,,,,,
1012171,Broome County Regional Farmers Market,http://www.bcregionalmkt.com,http://www.bcregionalmkt.com,Facebook.com/broomecountyregionalfarmersmarket,,,,,,,,6/25/16,2016-06-25,,Tue: 4:00 PM-7:00 PM;Sat: 9:00 AM-1:00 PM;,Tue: 4:00 PM-7:00 PM,Sat: 9:00 AM-1:00 PM,,,,,,,,,,,,,,,,,,,,,,,,,,,,,,,
1002708,Broomfield Farmers Market At Holy Comforter Episcopal Church,http://www.broomfieldfarmersmarket.org,http://www.broomfieldfarmersmarket.org,https://www.facebook.com/pages/Broomfield-Farmers-Market-at-Holy-Comforter/205491972824879,https://www.facebook.com/pages/Broomfield-Farmers-Market-at-Holy-Comforter/205491972824879,https://twitter.com/blfdfarmmarket,https://twitter.com/blfdfarmmarket,,,,,06/14/2016 to 09/27/2016,2016-06-14,2016-09-27,Tue: 4:00 PM-7:00 PM;,Tue: 4:00 PM-7:00 PM,,,,,,,,,,,,,,,,,,,,,,,,,,,,,,,,
1001751,Brooten Farmers Market,,,,,,,,,,,June to September,2010-06-01,2010-09-30,Thu:4:30 pm - 6:00 pm;,Thu:4:30 pm - 6:00 pm,,,,,,,,,,,,,,,,,,,,,,,,,,,,,,,,
1005744,Brown County Farmers Market,,,,,,,,,,,May to October,2010-05-01,2010-10-31,Sat:8:00 AM - 12:00 PM;,Sat:8:00 AM - 12:00 PM,,,,,,,,,,,,,,,,,,,,,,,,,,,,,,,,
1009737,Brown County Farmers Market (ripley Farmers Market),,,,,,,,,,,05/08/2014 to 11/01/2014,2014-05-08,2014-11-01,Thu: 3:00 PM-7:00 PM;,Thu: 3:00 PM-7:00 PM,,,,,,,,,,,,,,,,,,,,,,,,,,,,,,,,
1009736,Brown County Farmers Market (ripleys Farmers Market),,,,,,,,,,,05/10/2014 to 11/01/2014,2014-05-10,2014-11-01,Sat: 9:00 AM-12:00 PM;,Sat: 9:00 AM-12:00 PM,,,,,,,,,,,,,,,,,,,,,,,,,,,,,,,,
1012328,Brown Deer Farmers Market,http://www.browndeerfarmersmarket.org/,http://www.browndeerfarmersmarket.org/,@BrownDeerFarmersMarket,,,,,,,,06/15/2016 to 10/26/2016,2016-06-15,2016-10-26,Wed: 9:00 AM-6:00 PM;,Wed: 9:00 AM-6:00 PM,,,,,,,,,,,,,,,,,,,,,,,,,,,,,,,,
1006782,Brown University Farmers Market,http://www.farmfresh.org/food/farmersmarkets_details.php?market=5,http://www.farmfresh.org/food/farmersmarkets_details.php?market=5,,,,,,,,,09/04/2013 to 10/30/2013,2013-09-04,2013-10-30,Wed: 11:00 AM-2:00 PM;,Wed: 11:00 AM-2:00 PM,,,,,,,,,,,,,,,,,,,,,,,,,,,,,,,,
1009820,Brownsburg Farmers Market,http://www.brownsburg.org,http://www.brownsburg.org,https://www.facebook.com/BrownsburgFarmersMarket,https://www.facebook.com/BrownsburgFarmersMarket,https://twitter.com/BrownsburgIN,https://twitter.com/BrownsburgIN,,,,,,,,Thu: 4:00 PM-7:00 PM;,Thu: 4:00 PM-7:00 PM,,,,,,,,,,,,,,,,,,,,,,,,,,,,,,,,
1009721,Brownstown Farmers Market,http://www.brownstowndda.org,http://www.brownstowndda.org,https://www.facebook.com/BrownstownFarmersMarket?ref=hl,https://www.facebook.com/BrownstownFarmersMarket?ref=hl,,,,,,,06/14/2016 to 08/30/2016,2016-06-14,2016-08-30,Tue: 12:00 PM-6:00 PM;,Tue: 12:00 PM-6:00 PM,,,,,,,,,,,,,,,,,,,,,,,,,,,,,,,,
1004188,"Brownstown, Indiana Farmers Market",http://www.brownstownchamber.org,http://www.brownstownchamber.org,,,,,,,,,,,,,,,,,,,,,,,,,,,,,,,,,,,,,,,,,,,,,
1004405,Brownsville Community Farmers Market,,,,,,,,,,,,,,,,,,,,,,,,,,,,,,,,,,,,,,,,,,,,,,,
1001326,Brownsville Farmers Market,http://www.brownsvillefarmersmarket.net,http://www.brownsvillefarmersmarket.net,,,,,,,,,06/14/2014 to 09/06/2014,2014-06-14,2014-09-06,Sat: 9:00 AM-12:00 PM;,Sat: 9:00 AM-12:00 PM,,,,,,,,,,,,,,,,,,,,,,,,,,,,,,,,
1001910,Brownsville Farmers Market,http://www.gocfa.org,http://www.gocfa.org,,,,,,,,,05/05/2016 to 10/27/2016,2016-05-05,2016-10-27,Thu: 3:00 PM-7:00 PM;,Thu: 3:00 PM-7:00 PM,,,,,,,,,,,,,,,,,,,,,,,,,,,,,,,,
1008036,Brownsville Farmers Market,,,,,,,,,,,,,,,,,,,,,,,,,,,,,,,,,,,,,,,,,,,,,,,
1006168,Brownsville Farmers Market,http://www.brownsvillefarmersmarket.com,http://www.brownsvillefarmersmarket.com,https://www.facebook.com/BrownsvilleFarmersMarket,https://www.facebook.com/BrownsvilleFarmersMarket,,,,,,,01/01/2014 to 01/01/2015,2014-01-01,2015-01-01,Sat: 9:00 AM-12:00 PM;,Sat: 9:00 AM-12:00 PM,,,,,,,,,,,,,,,,,,,,,,,,,,,,,,,,
1008924,Brownsville Pitkin Ym,http://www.grownyc.org,http://www.grownyc.org,https://www.facebook.com/BrooklynGreenmarkets,https://www.facebook.com/BrooklynGreenmarkets,,,,,,,07/13/2013 to 11/23/2013,2013-07-13,2013-11-23,Sat: 9:30 AM-3:30 PM;,Sat: 9:30 AM-3:30 PM,,,,,,,,,,,,,,,,,,,,,,,,,,,,,,,,
1008922,Brownsville Rockaway Ym,http://www.grownyc.org,http://www.grownyc.org,https://www.facebook.com/BrooklynGreenmarkets,https://www.facebook.com/BrooklynGreenmarkets,,,,,,,07/12/2013 to 11/22/2013,2013-07-12,2013-11-22,Fri: 1:00 PM-6:00 PM;,Fri: 1:00 PM-6:00 PM,,,,,,,,,,,,,,,,,,,,,,,,,,,,,,,,
1006966,Brownwood Area Farmers Market,,,,,,,,,,,,,,,,,,,,,,,,,,,,,,,,,,,,,,,,,,,,,,,
1009204,Brownwood Farmers Market,http://www.localharvest.org/brownwood-farmers-market-M59762,http://www.localharvest.org/brownwood-farmers-market-M59762,,,,,,,,,,,,,,,,,,,,,,,,,,,,,,,,,,,,,,,,,,,,,
1006476,Bruce Community Farmers Market,,,https://www.facebook.com/BruceCommunityFarmersMarket,https://www.facebook.com/BruceCommunityFarmersMarket,,,,,,,06/05/2015 to 10/30/2015,2015-06-05,2015-10-30,Fri: 2:00 PM-6:00 PM;,Fri: 2:00 PM-6:00 PM,,,,,,,,,,,,,,,,,,,,,,,,,,,,,,,,
1000211,Bruceton Farmers Market,http://www.pcfamilyfit.org,http://www.pcfamilyfit.org,,,,,,,,,,,,,,,,,,,,,,,,,,,,,,,,,,,,,,,,,,,,,
1000161,Bruceton Mills Farmers Market,,,,,,,,,,,,,,,,,,,,,,,,,,,,,,,,,,,,,,,,,,,,,,,
1007142,Bruners Gardens Farmers Market Ii,,,,,,,,,,,,,,,,,,,,,,,,,,,,,,,,,,,,,,,,,,,,,,,
1006260,Brunswick Farmers Market,http://www.townofbrunswick.org,http://www.townofbrunswick.org,,,,,,,,,June to August,2010-06-01,2010-08-31,Tue:5:00 PM - 8:00 PM;,Tue:5:00 PM - 8:00 PM,,,,,,,,,,,,,,,,,,,,,,,,,,,,,,,,
1008607,Brunswick-topsham Land Trust Farmers Market At Crystal Spring Farm,http://www.btlt.org/farmers-market,http://www.btlt.org/farmers-market,,,,,,,,,05/02/2015 to 11/07/2015,2015-05-02,2015-11-07,Sat: 8:30 AM-12:30 PM;,Sat: 8:30 AM-12:30 PM,,,,,,,,,,,,,,,,,,,,,,,,,,,,,,,,
1004032,Brunwick Place Farmers Market,,,,,,,,,,,,,,,,,,,,,,,,,,,,,,,,,,,,,,,,,,,,,,,
1007369,Brush Farmers Market,http://www.brushchamber.org,http://www.brushchamber.org,,,,,,,,,06/29/2013 to 09/21/2013,2013-06-29,2013-09-21,Sat: 8:00 AM-10:00 AM;,Sat: 8:00 AM-10:00 AM,,,,,,,,,,,,,,,,,,,,,,,,,,,,,,,,
1012625,Bryan House Farmers Market,,,,,,,,,,,10/01/2016 to,2016-10-01,,Sat: 12:00 PM-2:00 PM;,Sat: 12:00 PM-2:00 PM,,,,,,,,,,,,,,,,,,,,,,,,,,,,,,,,
1008485,Bryn Mawr Farmers Market,http://www.farmtocity.org/FarmersMarkets.asp,http://www.farmtocity.org/FarmersMarkets.asp,https://www.facebook.com/Bryn-Mawr-Farmers-Market-104172772952887/,https://www.facebook.com/Bryn-Mawr-Farmers-Market-104172772952887/,https://twitter.com/FarmtoCity,https://twitter.com/FarmtoCity,,,,,01/01/2016 to 12/31/2016,2016-01-01,2016-12-31,Sat: 9:00 AM-1:00 PM;,Sat: 9:00 AM-1:00 PM,,,,,,,,,,,,,,,,,,,,,,,,,,,,,,,,
1011923,Btn Lake Nona Farmers Market,http://BTNLakeNonaFarmersMarket.weebly.com,http://BTNLakeNonaFarmersMarket.weebly.com,https://www.facebook.com/LakeNonaFarmersFreshMarket/,https://www.facebook.com/LakeNonaFarmersFreshMarket/,,,,,www.BTNWildlife.org,www.BTNWildlife.org,01/01/2016 to 12/31/2016,2016-01-01,2016-12-31,Sat: 9:00 AM-2:00 PM;,Sat: 9:00 AM-2:00 PM,,,,,,,06/01/2016 to 09/05/2016,6/1/16, 09/05/2016,Sat: 9:00 AM-1:00 PM;,Sat: 9:00 AM-1:00 PM,,,,,,,,,,,,,,,,,,,,,
1006164,Buchanan Farmer Market,http://www.buchananfarmersmarket.com,http://www.buchananfarmersmarket.com,,,,,,,,,,,,,,,,,,,,,,,,,,,,,,,,,,,,,,,,,,,,,
1008472,Buckeye Acres Farmers Market,http://www.buckeye-acres.com,,,,,,,,,,,,,,,,,,,,,,,,,,,,,,,,,,,,,,,,,,,,,,
1011832,Buckeye Farmers Market,http://www.buckeyeaz.gov,http://www.buckeyeaz.gov,https://www.facebook.com/buckeyeaz.gov,https://www.facebook.com/buckeyeaz.gov,https://twitter.com/buckeyeazgov,https://twitter.com/buckeyeazgov,https://www.youtube.com/watch?v=IZmrP_tIBeo,https://www.youtube.com/watch?v=IZmrP_tIBeo,,,04/23/2016 to 04/23/2016,2016-04-23,2016-04-23,Sat: 9:00 AM-1:00 PM;,Sat: 9:00 AM-1:00 PM,,,,,,,,,,,,,,,,,,,,,,,,,,,,,,,,
1009437,Buckfield Farmers Market And Co Op,,,https://www.facebook.com/BuckfeildFarmersMarketCoOp,https://www.facebook.com/BuckfeildFarmersMarketCoOp,,,,,,,,,,,,,,,,,,,,,,,,,,,,,,,,,,,,,,,,,,,
1001707,Buckhannon - Upshur Farmers Market Association,,,www.facebook.com/BuckhannonUpshurFarmerMarket,,,,,,,,,,,Mon: 8:00 AM-2:00 PM;Wed: 8:00 AM-2:00 PM;Fri: 8:00 AM-2:00 PM;Sat: 8:00 AM-2:00 PM;,Mon: 8:00 AM-2:00 PM,Wed: 8:00 AM-2:00 PM,Fri: 8:00 AM-2:00 PM,Sat: 8:00 AM-2:00 PM,,,,,,,,,,,,,,,,,,,,,,,,,,,,,
1003921,Buckingham County Farmers Market,,,,,,,,,,,,,,,,,,,,,,,,,,,,,,,,,,,,,,,,,,,,,,,
1009376,Buckland Farm Market,http://www.bucklandfarmmarket.com/,http://www.bucklandfarmmarket.com/,https://www.facebook.com/pages/Buckland-Farm-Market/102039677901,https://www.facebook.com/pages/Buckland-Farm-Market/102039677901,,,,,,,,,,,,,,,,,,,,,,,,,,,,,,,,,,,,,,,,,,,
1008953,Bucksport Bay Farmers Market,http://www.bucksportbaychamber.com/farmers-market.html,http://www.bucksportbaychamber.com/farmers-market.html,https://www.facebook.com/BucksportBayFarmersMarket,https://www.facebook.com/BucksportBayFarmersMarket,,,,,,,05/16/2013 to 10/17/2013,2013-05-16,2013-10-17,Thu: 2:00 PM-5:00 PM;,Thu: 2:00 PM-5:00 PM,,,,,,,10/17/2015 to 12/31/2015,10/17/15, 12/31/2015,Thu: 2:00 PM-5:00 PM;,Thu: 2:00 PM-5:00 PM,,,,,,,,,,,,,,,,,,,,,
1005010,Buckwalters Farmers Market,,,,,,,,,,,,,,,,,,,,,,,,,,,,,,,,,,,,,,,,,,,,,,,
1000170,Buena Vista Community Market,http://www.bvmarket.com,http://www.bvmarket.com,,,,,,,,,,,,,,,,,,,,,,,,,,,,,,,,,,,,,,,,,,,,,
1006844,Buena Vista Farmers Market,,,,,,,,,,,,,,,,,,,,,,,,,,,,,,,,,,,,,,,,,,,,,,,
1006166,Buffalo Center Farmers Market,,,,,,,,,,,,,,,,,,,,,,,,,,,,,,,,,,,,,,,,,,,,,,,
1006993,Buffalo Farmers Market,,,,,,,,,,,April to November,2010-04-01,2010-11-30,Tue:3:00 PM - 7:00 PM;,Tue:3:00 PM - 7:00 PM,,,,,,,,,,,,,,,,,,,,,,,,,,,,,,,,
1002305,Buffalo Main Street Market,http://www.mainstreetbuffalo.org,http://www.mainstreetbuffalo.org,,,,,,,,,July to September,2010-07-01,2010-09-30,Wed:4:00 PM - 6:30 PM;,Wed:4:00 PM - 6:30 PM,,,,,,,,,,,,,,,,,,,,,,,,,,,,,,,,
1001368,Bullock County Farmers Market,,,,,,,,,,,,,,,,,,,,,,,,,,,,,,,,,,,,,,,,,,,,,,,
1010621,Bunnell Farmers Market,,,https://www.facebook.com/bunnellfarmswapandmarket?ref=hl,https://www.facebook.com/bunnellfarmswapandmarket?ref=hl,,,,,,,01/01/2014 to 12/31/2014,2014-01-01,2014-12-31,Sat: 8:00 AM-1:00 PM;,Sat: 8:00 AM-1:00 PM,,,,,,,,,,,,,,,,,,,,,,,,,,,,,,,,
1000843,Burbank Certified Farmers Market,http://www.burbankfarmersmarket.org,http://www.burbankfarmersmarket.org,https://www.facebook.com/burbankfarmersmarket,https://www.facebook.com/burbankfarmersmarket,@BurbFarmMkt,@BurbFarmMkt,,,burbankfarmersmarket,burbankfarmersmarket,01/01/2014 to 12/31/2014,2014-01-01,2014-12-31,Sat: 8:00 AM-12:30 PM;,Sat: 8:00 AM-12:30 PM,,,,,,,01/01/2016 to 12/31/2016,1/1/16, 12/31/2016,Sat: 8:00 AM-12:30 PM;,Sat: 8:00 AM-12:30 PM,,,,,,,,,,,,,,,,,,,,,
1001541,Burien Farmers Market,http://www.discoverburien.com,http://www.discoverburien.com,,,,,,,,,05/01/2012 to 10/31/2012,2012-05-01,2012-10-31,Thu: 11:00 AM-6:00 PM;,Thu: 11:00 AM-6:00 PM,,,,,,,,,,,,,,,,,,,,,,,,,,,,,,,,
1009873,Burke Area Farmers Market,http://www.burkeareafarmersmarket.com,http://www.burkeareafarmersmarket.com,https://www.facebook.com/BurkeAreaFarmersMarket?ref=hl,https://www.facebook.com/BurkeAreaFarmersMarket?ref=hl,,,,,,,07/07/2016 to 10/06/2016,2016-07-07,2016-10-06,Thu: 4:00 PM-6:00 PM;,Thu: 4:00 PM-6:00 PM,,,,,,,,,,,,,,,,,,,,,,,,,,,,,,,,
1000503,Burke County Farmers Market Ii,,,,,,,,,,,,,,Wed: 8:00 AM-12:00 PM;Fri: 2:00 PM-5:00 PM;,Wed: 8:00 AM-12:00 PM,Fri: 2:00 PM-5:00 PM,,,,,,,,,,,,,,,,,,,,,,,,,,,,,,,
1012598,Burke Farmers Market,http://www.fairfaxcounty.gov/parks/farmersmarkets/burkemkt.htm,http://www.fairfaxcounty.gov/parks/farmersmarkets/burkemkt.htm,,,,,,,,,,,,Sat: 8:00 AM-12:00 PM;,Sat: 8:00 AM-12:00 PM,,,,,,,,,,,,,,,,,,,,,,,,,,,,,,,,
1009233,Burleson Farmers Market,http://www.burlesonfarmersmarket.com/,http://www.burlesonfarmersmarket.com/,,,,,,,,,,,,,,,,,,,,,,,,,,,,,,,,,,,,,,,,,,,,,
1011375,Burlingame Farmers Market,,,https://www.facebook.com/pages/Burlingame-Kansas-Farmers-Market/1392689114394059?fref=ts&ref=br_tf,https://www.facebook.com/pages/Burlingame-Kansas-Farmers-Market/1392689114394059?fref=ts&ref=br_tf,,,,,,,03/05/2015 to 10/29/2015,2015-03-05,2015-10-29,Thu: 4:00 PM-8:00 PM;,Thu: 4:00 PM-8:00 PM,,,,,,,,,,,,,,,,,,,,,,,,,,,,,,,,
1005322,Burlingame Fresh Market Farmers Market,http://www.burlingamechamber.org,http://www.burlingamechamber.org,,,,,,,,,,,,,,,,,,,,,,,,,,,,,,,,,,,,,,,,,,,,,
1007666,Burlington County Farmers Market,http://www.burlcoagcenter.com,http://www.burlcoagcenter.com,,,,,,,,,,,,,,,,,,,,,,,,,,,,,,,,,,,,,,,,,,,,,
1011402,Burlington Downtown Farmers Market,http://www.farmersfeedingfolks.org,http://www.farmersfeedingfolks.org,https://www.facebook.com/FarmersFeedingFolks,https://www.facebook.com/FarmersFeedingFolks,https://twitter.com/FarmMarketBurNC,https://twitter.com/FarmMarketBurNC,,,,,04/02/2016 to 10/29/2016,2016-04-02,2016-10-29,Sat: 8:00 AM-12:00 PM;,Sat: 8:00 AM-12:00 PM,,,,,,,,,,,,,,,,,,,,,,,,,,,,,,,,
1005892,Burlington Farmers Market,http://www.coffeycountychamber.com,http://www.coffeycountychamber.com,,,,,,,,,May to October,2010-05-01,2010-10-31,Fri:3:00 PM - 6:00 PM;,Fri:3:00 PM - 6:00 PM,,,,,,,,,,,,,,,,,,,,,,,,,,,,,,,,
1007475,Burlington Farmers Market,,,,,,,,,,,,,,,,,,,,,,,,,,,,,,,,,,,,,,,,,,,,,,,
1012090,Burlington Farmers Market,http://www.burlingtonfarmersmarket.org,http://www.burlingtonfarmersmarket.org,https://www.facebook.com/Burlington-Farmers-Market-115041215180553/,https://www.facebook.com/Burlington-Farmers-Market-115041215180553/,,,,,,,05/07/2016 to 10/29/2016,2016-05-07,2016-10-29,Sat: 8:30 AM-2:00 PM;,Sat: 8:30 AM-2:00 PM,,,,,,,,,,,,,,,,,,,,,,,,,,,,,,,,
1011043,Burlington Farmers Market,http://www.farmersmarketburlington.org,http://www.farmersmarketburlington.org,,,,,,,,,06/04/2015 to 10/29/2015,2015-06-04,2015-10-29,Thu: 2:30 AM-6:30 AM;,Thu: 2:30 AM-6:30 AM,,,,,,,,,,,,,,,,,,,,,,,,,,,,,,,,
1010100,Burlington New North End Farmers Market,http://www.farmersmarket.05408.org,http://www.farmersmarket.05408.org,https://www.facebook.com/pages/New-North-End-Farmers-Market/153281078060256,https://www.facebook.com/pages/New-North-End-Farmers-Market/153281078060256,,,,,,,05/22/2014 to 09/25/2014,2014-05-22,2014-09-25,Thu: 3:30 PM-6:30 PM;,Thu: 3:30 PM-6:30 PM,,,,,,,,,,,,,,,,,,,,,,,,,,,,,,,,
1009303,Burnaps Farm Market And Garden Cafe,,,https://www.facebook.com/BurnapsFarmMarket,https://www.facebook.com/BurnapsFarmMarket,,,,,,,,,,,,,,,,,,,,,,,,,,,,,,,,,,,,,,,,,,,
1004249,Burnet Road Farmers Market,http://www.funkytonkfarmersmarket.com,http://www.funkytonkfarmersmarket.com,https://www.facebook.com/funkytonkfarmersmarket,https://www.facebook.com/funkytonkfarmersmarket,,,,,,,,,,Sat: 9:00 AM-1:00 PM;,Sat: 9:00 AM-1:00 PM,,,,,,,,,,,,,,,,,,,,,,,,,,,,,,,,
1008964,Burnett County Farmers Markets - Alpha,,,https://www.facebook.com/pages/Burnett-County-Farmers-Markets,https://www.facebook.com/pages/Burnett-County-Farmers-Markets,,,,,,,06/11/2015 to 10/29/2015,2015-06-11,2015-10-29,Thu: 3:00 PM-5:00 PM;,Thu: 3:00 PM-5:00 PM,,,,,,,,,,,,,,,,,,,,,,,,,,,,,,,,
1012716,Burnett County Farmers Markets - Grantsburg - Burnett Medical Center,,,https://www.facebook.com/Burnett-County-Farmers-Markets-250874305027758/,https://www.facebook.com/Burnett-County-Farmers-Markets-250874305027758/,,,,,,,06/24/2016 to 10/28/2016,2016-06-24,2016-10-28,Sat: 2:00 PM-4:00 PM;,Sat: 2:00 PM-4:00 PM,,,,,,,,,,,,,,,,,,,,,,,,,,,,,,,,
1008967,Burnett County Farmers Markets - Grantsburg - Library,,,https://www.facebook.com/Burnett-County-Farmers-Markets-250874305027758/,https://www.facebook.com/Burnett-County-Farmers-Markets-250874305027758/,,,,,,,06/27/2016 to 10/31/2016,2016-06-27,2016-10-31,Mon: 12:00 PM-2:00 PM;,Mon: 12:00 PM-2:00 PM,,,,,,,,,,,,,,,,,,,,,,,,,,,,,,,,
1008969,Burnett County Farmers Markets - Siren,,,https://www.facebook.com/Burnett-County-Farmers-Markets-250874305027758/,https://www.facebook.com/Burnett-County-Farmers-Markets-250874305027758/,,,,,,,05/28/2016 to 11/05/2016,2016-05-28,2016-11-05,Sat: 1:00 PM-3:00 PM;,Sat: 1:00 PM-3:00 PM,,,,,,,,,,,,,,,,,,,,,,,,,,,,,,,,
1006194,Burney Certfied Farmers Market,http://www.shastagrowersassociation.com,http://www.shastagrowersassociation.com,,,,,,,,,July to October,2010-07-01,2010-10-31,Wed:3:00 pm - 6:00 pm;,Wed:3:00 pm - 6:00 pm,,,,,,,,,,,,,,,,,,,,,,,,,,,,,,,,
1002006,Burney Wednesday Farmers Market,,,,,,,,,,,,,,,,,,,,,,,,,,,,,,,,,,,,,,,,,,,,,,,
1004904,Burnsville Farmers Market Ii,http://www.stpaulfarmersmarket.com,http://www.stpaulfarmersmarket.com,,,,,,,,,,,,,,,,,,,,,,,,,,,,,,,,,,,,,,,,,,,,,
1012559,Burnt Hills Farmers Market,,,Route 50 Green Market,,,,,,,,06/04/2016 to 10/15/2016,2016-06-04,2016-10-15,Sat: 9:00 AM-1:00 PM;,Sat: 9:00 AM-1:00 PM,,,,,,,,,,,,,,,,,,,,,,,,,,,,,,,,
1004281,Burrillville Farmers Market,http://www.burrillvillefarmersmarket.org.,http://www.burrillvillefarmersmarket.org.,https://www.facebook.com/pages/Burrillville-Farmers-Market/65478021959,https://www.facebook.com/pages/Burrillville-Farmers-Market/65478021959,,,,,,,05/17/2014 to 10/18/2014,2014-05-17,2014-10-18,Sat: 9:30 AM-12:30 PM;,Sat: 9:30 AM-12:30 PM,,,,,,,,,,,,,,,,,,,,,,,,,,,,,,,,
1007007,Burwell Farmers Market,,,,,,,,,,,,,,,,,,,,,,,,,,,,,,,,,,,,,,,,,,,,,,,
1004868,Bush Farmers Market,,,,,,,,,,,,,,,,,,,,,,,,,,,,,,,,,,,,,,,,,,,,,,,
1004727,Bushwick Farmers Market,http://www.EcoStationNY.org,http://www.EcoStationNY.org,,,,,,,,,June to November,2010-06-01,2010-11-30,Thu:10:00 AM - 6:00 PM;,Thu:10:00 AM - 6:00 PM,,,,,,,,,,,,,,,,,,,,,,,,,,,,,,,,
1004729,Bushwick Farmers Market,http://www.EcoStationNY.org,http://www.EcoStationNY.org,,,,,,,,,,,,,,,,,,,,,,,,,,,,,,,,,,,,,,,,,,,,,
1008987,Bushwick Farmers Market,http://www.BushwickFarmersMarket.org,http://www.BushwickFarmersMarket.org,https://www.facebook.com/EcoStationNY,https://www.facebook.com/EcoStationNY,,,,,,,06/25/2016 to 11/19/2016,2016-06-25,2016-11-19,Sat: 9:00 AM-3:00 PM;,Sat: 9:00 AM-3:00 PM,,,,,,,,,,,,,,,,,,,,,,,,,,,,,,,,
1005591,Bushwick Farmers Market At Maria Hernandez Park,http://www. BushwickFarmersMarket.org,,https://www.facebook.com/EcoStationNY,https://www.facebook.com/EcoStationNY,,,,,,,06/01/2012 to 11/31/2012,2012-06-01,,Sat: 11:00 AM-3:00 PM;,Sat: 11:00 AM-3:00 PM,,,,,,,,,,,,,,,,,,,,,,,,,,,,,,,,
1004730,Bushwick Farmers Market Satellite Farm Stand,http://www.EcoStationNY.org,http://www.EcoStationNY.org,,,,,,,,,June to November,2010-06-01,2010-11-30,Thu:12:00 PM - 5:00 PM;,Thu:12:00 PM - 5:00 PM,,,,,,,,,,,,,,,,,,,,,,,,,,,,,,,,
1002567,"Butler County Farmers Market, Greenville, Al",,,,,,,,,,,May to October,2010-05-01,2010-10-31,Tue:6:30 am - 1:00 pm;Thu:6:30 am - 1:00 pm;Sat:6:30 am - 1:00 pm;,Tue:6:30 am - 1:00 pm,Thu:6:30 am - 1:00 pm,Sat:6:30 am - 1:00 pm,,,,,,,,,,,,,,,,,,,,,,,,,,,,,,
1005485,Butler Farmers Market,http://www.ButlerFarmersMarket.com,http://www.ButlerFarmersMarket.com,,,,,,,,,06/02/2014 to 10/20/2014,2014-06-02,2014-10-20,Mon: 11:00 AM-3:00 PM;,Mon: 11:00 AM-3:00 PM,,,,,,,,,,,,,,,,,,,,,,,,,,,,,,,,
1004214,Butler Plaza Satellite Market,,,,,,,,,,,,,,,,,,,,,,,,,,,,,,,,,,,,,,,,,,,,,,,
1001990,Butler Walkabout Farmers Market,,,,,,,,,,,,,,,,,,,,,,,,,,,,,,,,,,,,,,,,,,,,,,,
1001362,Butte Farmers Market,http://www.mainstrreetbutte.org/fmarket.htm,http://www.mainstrreetbutte.org/fmarket.htm,https://www.facebook.com/ButteFM,https://www.facebook.com/ButteFM,,,,,,,05/21/2016 to 10/08/2016,2016-05-21,2016-10-08,Sat: 8:30 AM-1:00 PM;,Sat: 8:30 AM-1:00 PM,,,,,,,,,,,,,,,,,,,,,,,,,,,,,,,,
1010322,Buy Fresh Buy Local Of North Carolina Farmers Market - Salisbury,http://seedfoundationnc.com/?page_id=134,http://seedfoundationnc.com/?page_id=134,https://www.facebook.com/BuyFreshBuyLocalNC,https://www.facebook.com/BuyFreshBuyLocalNC,,,,,,,06/11/2014 to 10/29/2014,2014-06-11,2014-10-29,Wed: 8:00 AM-7:00 PM;,Wed: 8:00 AM-7:00 PM,,,,,,,,,,,,,,,,,,,,,,,,,,,,,,,,
1010321,Buy Fresh Buy Local Of North Carolina Farmers Market - Spencer,http://seedfoundationnc.com/?page_id=134,http://seedfoundationnc.com/?page_id=134,https://www.facebook.com/BuyFreshBuyLocalNC,https://www.facebook.com/BuyFreshBuyLocalNC,,,,,,,06/14/2014 to 10/25/2014,2014-06-14,2014-10-25,Sat: 8:00 AM-1:00 PM;,Sat: 8:00 AM-1:00 PM,,,,,,,,,,,,,,,,,,,,,,,,,,,,,,,,
1007604,Buzzards Bay Farmers Market,,,,,,,,,,,,,,,,,,,,,,,,,,,,,,,,,,,,,,,,,,,,,,,
1008380,Byrd House Market,http://byrdhousemarket.blogspot.com,http://byrdhousemarket.blogspot.com,https://www.facebook.com/byrdhousemarket,https://www.facebook.com/byrdhousemarket,,,,,,,05/07/2013 to 10/29/2013,2013-05-07,2013-10-29,Tue: 3:00 PM-7:00 PM;,Tue: 3:00 PM-7:00 PM,,,,,,,11/05/2013 to 04/29/2014,11/5/13, 04/29/2014,Tue: 3:00 PM-6:00 PM;,Tue: 3:00 PM-6:00 PM,,,,,,,,,,,,,,,,,,,,,
1005481,Byrnes Mill Farmers Market,http://www.byrnesmill.org/farmersmarket,http://www.byrnesmill.org/farmersmarket,,,,,,,,,,,,,,,,,,,,,,,,,,,,,,,,,,,,,,,,,,,,,
1002617,Byron Farmers Market,,,https://www.facebook.com/ByronCenterFarmersMarket,https://www.facebook.com/ByronCenterFarmersMarket,,,,,,,05/04/2014 to 10/25/2014,2014-05-04,2014-10-25,Sat: 8:00 AM-1:00 PM;,Sat: 8:00 AM-1:00 PM,,,,,,,,,,,,,,,,,,,,,,,,,,,,,,,,
1007741,C Street Market,http://www.itsalldowntown.com/c-streetmarket,http://www.itsalldowntown.com/c-streetmarket,,,,,,,,,April to October,2010-04-01,2010-10-31,Sat:8:00 AM - 1:00 PM;,Sat:8:00 AM - 1:00 PM,,,,,,,,,,,,,,,,,,,,,,,,,,,,,,,,
1010702,Cabool Area Farmers Market,http://agrimissouri.com/mo-grown/grodetail.php?type=mo-grown&ID=2553,http://agrimissouri.com/mo-grown/grodetail.php?type=mo-grown&ID=2553,,,,,,,,,04/02/2014 to 11/26/2014,2014-04-02,2014-11-26,Wed: 11:00 AM-4:00 PM;,Wed: 11:00 AM-4:00 PM,,,,,,,,,,,,,,,,,,,,,,,,,,,,,,,,
1009640,Cache Valley Gardeners Market,http://www.gardenersmarket.org,http://www.gardenersmarket.org,https://www.facebook.com/cachevalleygardenersmarket,https://www.facebook.com/cachevalleygardenersmarket,,,,,,,05/07/2016 to 10/15/2016,2016-05-07,2016-10-15,Sat: 9:00 AM-1:00 PM;,Sat: 9:00 AM-1:00 PM,,,,,,,,,,,,,,,,,,,,,,,,,,,,,,,,
1004248,Cadillac Area Farmers Market,,,,,,,,,,,July to October,2010-07-01,2010-10-31,Tue:8:00 AM - 4:30 PM;Fri:8:00 AM - 4:30 PM;,Tue:8:00 AM - 4:30 PM,Fri:8:00 AM - 4:30 PM,,,,,,"June 15, 2012 to June",15-Jun-12, June,Tue:8:00 AM - 1:00 PM;Fri:8:00 AM - 1:00 PM;,Tue:8:00 AM - 1:00 PM,Fri:8:00 AM - 1:00 PM,,,,,,,,,,,,,,,,,,,,
1004299,Cadiz Trigg County Farmers Market,,,https://www.facebook.com/cadiztriggfarmersmarket,https://www.facebook.com/cadiztriggfarmersmarket,,,,,,,04/04/2015 to 09/26/2015,2015-04-04,2015-09-26,Wed: 7:00 AM-12:00 PM;Sat: 7:00 AM-12:00 PM;,Wed: 7:00 AM-12:00 PM,Sat: 7:00 AM-12:00 PM,,,,,,,,,,,,,,,,,,,,,,,,,,,,,,,
1004927,Cagan Crossings Farmers Market,http://cagancrossingfarmersmarket@gmail.com,http://cagancrossingfarmersmarket@gmail.com,Cagan Crossings Farmers Market,,,,,,,,01/01/2015 to 12/31/2015,2015-01-01,2015-12-31,Fri: 4:00 PM-8:00 PM;,Fri: 4:00 PM-8:00 PM,,,,,,,,,,,,,,,,,,,,,,,,,,,,,,,,
1002592,Cairo State Farmers Market,,,,,,,,,,,,,,,,,,,,,,,,,,,,,,,,,,,,,,,,,,,,,,,
1004862,Cajun Farmers Market,,,,,,,,,,,01/01/2012 to 12/31/2012,2012-01-01,2012-12-31,,,,,,,,,,,,,,,,,,,,,,,,,,,,,,,,,,
1003449,Calabasas Old Town Farmers Market,,,,,,,,,,,,,,,,,,,,,,,,,,,,,,,,,,,,,,,,,,,,,,,
1001342,Caldwell County Farmers Market,,,,,,,,,,,,,,,,,,,,,,,,,,,,,,,,,,,,,,,,,,,,,,,
1002026,Caldwell Farmers Market,,,http://www.facebook.com/pages/Kauneonga-Lake-Farmers-Market/112206352134212,http://www.facebook.com/pages/Kauneonga-Lake-Farmers-Market/112206352134212,,,,,,,June to October,2010-06-01,2010-10-31,Fri:12:00 PM - 6:00 PM;,Fri:12:00 PM - 6:00 PM,,,,,,,,,,,,,,,,,,,,,,,,,,,,,,,,
1005821,Caldwell Farmers Market,http://www.caldwellidfarmersmarket.com,http://www.caldwellidfarmersmarket.com,https://www.facebook.com/pages/Caldwell-Farmers-Market/78644466683,https://www.facebook.com/pages/Caldwell-Farmers-Market/78644466683,,,,,,,05/13/2015 to 09/23/2015,2015-05-13,2015-09-23,Wed: 3:00 PM-7:00 PM;,Wed: 3:00 PM-7:00 PM,,,,,,,,,,,,,,,,,,,,,,,,,,,,,,,,
1002113,Caledonia Farmers Market,http://www.caledoniafarmersmarket.org,http://www.caledoniafarmersmarket.org,,,,,,,,,,,,,,,,,,,,,,,,,,,,,,,,,,,,,,,,,,,,,
1003652,Caledonia Farmers Market Association,http://www.sites.google.com/site/caledoniafarmersmarket/,http://www.sites.google.com/site/caledoniafarmersmarket/,,,,,,,,,"June 13, 2012 to October 3, 2012",2012-06-13,2012-10-03,Wed:9:00 AM - 1:00 PM;,Wed:9:00 AM - 1:00 PM,,,,,,,,,,,,,,,,,,,,,,,,,,,,,,,,
1011082,Caledonia Farmers Market Association - Saturday,https://sites.google.com/site/caledoniafarmersmarket/,https://sites.google.com/site/caledoniafarmersmarket/,www.facebook.com/St.J.Farmers.Market,,,,,,,,05/14/2016 to 10/29/2016,2016-05-14,2016-10-29,Sat: 9:00 AM-1:00 PM;,Sat: 9:00 AM-1:00 PM,,,,,,,,,,,,,,,,,,,,,,,,,,,,,,,,
1011083,Caledonia Farmers Market Association - Winter,https://sites.google.com/site/caledoniafarmersmarket/,https://sites.google.com/site/caledoniafarmersmarket/,www.facebook.com/St.J.Farmers.Market,,,,,,,,11/05/2016 to 04/15/2017,2016-11-05,2017-04-15,Sat: 10:00 AM-1:00 PM;,Sat: 10:00 AM-1:00 PM,,,,,,,,,,,,,,,,,,,,,,,,,,,,,,,,
1002174,Calera Farmers Market,http://www.calerafarmersmarket.com,http://www.calerafarmersmarket.com,,,,,,,,,April to August,2010-04-01,2010-08-31,Tue:3:00 PM - 6:00 PM;,Tue:3:00 PM - 6:00 PM,,,,,,,,,,,,,,,,,,,,,,,,,,,,,,,,
1010783,Calexico Farmers Market,http://calexicorecreation.org/events/calexico-farmers-market,http://calexicorecreation.org/events/calexico-farmers-market,https://www.facebook.com/clxfarmersmarket,https://www.facebook.com/clxfarmersmarket,,,,,,,11/22/2014 to 04/18/2015,2014-11-22,2015-04-18,Sat: 10:00 AM-2:00 PM;,Sat: 10:00 AM-2:00 PM,,,,,,,,,,,,,,,,,,,,,,,,,,,,,,,,
1001554,Calgo Gardens Farmers Market,http://www.calogardens.com,http://www.calogardens.com,,,,,,,,,,,,,,,,,,,,,,,,,,,,,,,,,,,,,,,,,,,,,
1003599,Calhoun City Farmers Market,,,,,,,,,,,,,,,,,,,,,,,,,,,,,,,,,,,,,,,,,,,,,,,
1000532,Calhoun County Farmers Market,,,,,,,,,,,,,,,,,,,,,,,,,,,,,,,,,,,,,,,,,,,,,,,
1001323,Calhoun County Farmers Market,,,,,,,,,,,,,,,,,,,,,,,,,,,,,,,,,,,,,,,,,,,,,,,
1002788,Calhoun County Farmers Market,http://www.aces.edu/calhoun,http://www.aces.edu/calhoun,,,,,,,,,01/01/2012 to 12/31/2012,2012-01-01,2012-12-31,Wed: 7:00 AM-12:00 PM;Sat: 7:00 AM-12:00 PM;,Wed: 7:00 AM-12:00 PM,Sat: 7:00 AM-12:00 PM,,,,,,,,,,,,,,,,,,,,,,,,,,,,,,,
1003689,Calhoun County Farmers Market,,,,,,,,,,,May to November,2010-05-01,2010-11-30,Wed:9:00 AM - 1:00 PM;,Wed:9:00 AM - 1:00 PM,,,,,,,,,,,,,,,,,,,,,,,,,,,,,,,,
1007348,California Avenue Farmers Market,http://www.urbanvillageonline.com,http://www.urbanvillageonline.com,,,,,,,,,January to December,2010-01-01,2010-12-31,sun:9:00 AM - 1:00 PM;,sun:9:00 AM - 1:00 PM,,,,,,,,,,,,,,,,,,,,,,,,,,,,,,,,
1000501,California Farmers Market,,,,,,,,,,,,,,,,,,,,,,,,,,,,,,,,,,,,,,,,,,,,,,,
1009017,Calistoga Farmers Market,http://www.calistogafarmersmarket.com,http://www.calistogafarmersmarket.com,,,,,Calistoga Farmers Market,,,,05/01/2014 to 10/31/2014,2014-05-01,2014-10-31,Sat: 9:00 AM-1:00 PM;,Sat: 9:00 AM-1:00 PM,,,,,,,11/01/2014 to 04/30/2015,11/1/14, 04/30/2015,Sat: 9:00 AM-1:00 PM;,Sat: 9:00 AM-1:00 PM,,,,,,,,,,,,,,,,,,,,,
1008263,Callaway Community Farmers Market,http://www.WaterfrontMarkets.org,http://www.WaterfrontMarkets.org,https://www.facebook.com/Callaway.Community.Farmers.Market,https://www.facebook.com/Callaway.Community.Farmers.Market,,,,,,,01/01/2013 to 12/31/2013,2013-01-01,2013-12-31,Thu: 3:00 PM-7:00 PM;,Thu: 3:00 PM-7:00 PM,,,,,,,,,,,,,,,,,,,,,,,,,,,,,,,,
1003561,Callaway Gardens Farmers Market,http://www.callawaygardens.com/info/calendar/calendar.farmers-market.event.aspx,http://www.callawaygardens.com/info/calendar/calendar.farmers-market.event.aspx,,,,,,,,,06/01/2012 to 10/31/2012,2012-06-01,2012-10-31,,,,,,,,,,,,,,,,,,,,,,,,,,,,,,,,,,
1002666,Callicoon Farmers Market,http://www.sullivancountyfarmersmarkets.org,http://www.sullivancountyfarmersmarkets.org,https://www.facebook.com/scfma,https://www.facebook.com/scfma,,,,,,,05/03/2015 to 11/08/2015,2015-05-03,2015-11-08,Sun: 11:00 AM-2:00 PM;,Sun: 11:00 AM-2:00 PM,,,,,,,,,,,,,,,,,,,,,,,,,,,,,,,,
1002669,Callicoon Indoor Winter Farmers Market,http://www.sullivancountyfarmersmarkets.org,http://www.sullivancountyfarmersmarkets.org,https://www.facebook.com/scfma,https://www.facebook.com/scfma,,,,,,,11/15/2015 to 04/17/2016,2015-11-15,2016-04-17,Sun: 11:00 AM-2:00 PM;,Sun: 11:00 AM-2:00 PM,,,,,,,,,,,,,,,,,,,,,,,,,,,,,,,,
1003938,Calmar Farmers Market,,,,,,,,,,,,,,,,,,,,,,,,,,,,,,,,,,,,,,,,,,,,,,,
1004192,Calvert County Farmers Market - Barstow,http://www.calvertag.com,http://www.calvertag.com,https://www.facebook.com/#!/pages/Calvert-County-Farmers-Market-Association/593391767347027,,,,,,,,05/07/2016 to 11/26/2016,2016-05-07,2016-11-26,Sat: 7:00 AM-12:00 PM;,Sat: 7:00 AM-12:00 PM,,,,,,,,,,,,,,,,,,,,,,,,,,,,,,,,
1004193,Calvert County Farmers Market - Prince Frederick,http://www.calvertag.com,http://www.calvertag.com,https://www.facebook.com/#!/pages/Calvert-County-Farmers-Market-Association/593391767347027,,,,,,,,05/03/2016 to 11/29/2016,2016-05-03,2016-11-29,Tue: 3:00 PM-7:00 PM;,Tue: 3:00 PM-7:00 PM,,,,,,,,,,,,,,,,,,,,,,,,,,,,,,,,
1004194,Calvert County Farmers Market - Solomons,http://www.calvertag.com,http://www.calvertag.com,https://www.facebook.com/#!/pages/Calvert-County-Farmers-Market-Association/593391767347027,,,,,,,,05/05/2016 to 11/17/2016,2016-05-05,2016-11-17,Thu: 4:00 PM-8:00 PM;,Thu: 4:00 PM-8:00 PM,,,,,,,,,,,,,,,,,,,,,,,,,,,,,,,,
1004482,Camanche Farmers Market,,,,,,,,,,,,,,,,,,,,,,,,,,,,,,,,,,,,,,,,,,,,,,,
1010782,Camano Island Farmers Market,,,www.facebook.com/summeroncamano,,,,,,instagram.com/camanofarmersmarket,instagram.com/camanofarmersmarket,07/06/2015 to 09/28/2015,2015-07-06,2015-09-28,Mon: 3:00 PM-7:00 PM;,Mon: 3:00 PM-7:00 PM,,,,,,,,,,,,,,,,,,,,,,,,,,,,,,,,
1008275,Camarillo Hospice Certified Farmers Market,http://www.camarillofarmersmarket.com,http://www.camarillofarmersmarket.com,,,,,,,,,01/01/2016 to 12/31/2016,2016-01-01,2016-12-31,Sat: 8:00 AM-12:00 PM;,Sat: 8:00 AM-12:00 PM,,,,,,,,,,,,,,,,,,,,,,,,,,,,,,,,
1010081,Camas Farmers Market,http://www.camasfarmersmarket.org,http://www.camasfarmersmarket.org,https://www.facebook.com/#!/pages/Camas-Farmers-Market/45735637022,,no,,no,,no,no,06/04/2014 to 10/01/2014,2014-06-04,2014-10-01,Wed: 3:00 PM-7:00 PM;,Wed: 3:00 PM-7:00 PM,,,,,,,,,,,,,,,,,,,,,,,,,,,,,,,,
1001631,Cambria Farmers Market,,,,,,,,,,,June to September,2010-06-01,2010-09-30,Tue:4:00 PM - 7:00 PM;,Tue:4:00 PM - 7:00 PM,,,,,,,,,,,,,,,,,,,,,,,,,,,,,,,,
1004898,Cambria Farmers Market,,,,,,,,,,,,,,,,,,,,,,,,,,,,,,,,,,,,,,,,,,,,,,,
1007349,Cambrian Park Farmers Makret,http://www.urbanvillageonline.com,http://www.urbanvillageonline.com,,,,,,,,,May to September,2010-05-01,2010-09-30,Wed:4:00 AM - 8:00 PM;,Wed:4:00 AM - 8:00 PM,,,,,,,,,,,,,,,,,,,,,,,,,,,,,,,,
1006887,Cambridge Center Market,,,,,,,,,,,,,,,,,,,,,,,,,,,,,,,,,,,,,,,,,,,,,,,
1012479,Cambridge Central Square Farmers Market,http://www.massfarmersmarkets.org,http://www.massfarmersmarkets.org,www.facebook.com/CentralSquareFarmersMarket,,@MAFarmMarkets,@MAFarmMarkets,,,,,05/16/2016 to 11/21/2016,2016-05-16,2016-11-21,Mon: 12:00 PM-6:00 PM;,Mon: 12:00 PM-6:00 PM,,,,,,,,,,,,,,,,,,,,,,,,,,,,,,,,
1000398,Cambridge Farmers Market,,,https://www.facebook.com/PointPleasantBeachFarmersMarket,https://www.facebook.com/PointPleasantBeachFarmersMarket,,,,,,,May to December,2010-05-01,2010-12-31,sun:10:00 AM - 2:00 PM;,sun:10:00 AM - 2:00 PM,,,,,,,,,,,,,,,,,,,,,,,,,,,,,,,,
1001638,Cambridge Farmers Market,http://www.cambridgeidaho.com,http://www.cambridgeidaho.com,,,,,,,,,06/01/2013 to 10/12/2013,2013-06-01,2013-10-12,Sat: 9:00 PM-11:00 PM;,Sat: 9:00 PM-11:00 PM,,,,,,,,,,,,,,,,,,,,,,,,,,,,,,,,
1001753,Cambridge Farmers Market,,,,,,,,,,,,,,,,,,,,,,,,,,,,,,,,,,,,,,,,,,,,,,,
1002969,Cambridge Main Street Farmers Market,http://www.cambridgemainstreet.com/index.php?page=main-street-farmers-market,http://www.cambridgemainstreet.com/index.php?page=main-street-farmers-market,https://www.facebook.com/pages/Cambridge-Farmers-Market/349629905059203?fref=ts,https://www.facebook.com/pages/Cambridge-Farmers-Market/349629905059203?fref=ts,,,,,,,05/05/2016 to 10/13/2016,2016-05-05,2016-10-13,Thu: 3:00 PM-6:00 PM;,Thu: 3:00 PM-6:00 PM,,,,,,,,,,,,,,,,,,,,,,,,,,,,,,,,
1010107,Cambridge Open Air Market,http://www.cambridgewi.com,http://www.cambridgewi.com,https://www.facebook.com/pages/Cambridge-Farmers-Market/256457801041850?ref=hl,https://www.facebook.com/pages/Cambridge-Farmers-Market/256457801041850?ref=hl,,,,,,,06/03/2016 to 09/30/2016,2016-06-03,2016-09-30,Fri: 2:00 PM-6:00 PM;,Fri: 2:00 PM-6:00 PM,,,,,,,,,,,,,,,,,,,,,,,,,,,,,,,,
1002747,Cambridge/kendall Square Main Street,,,,,,,,,,,,,,,,,,,,,,,,,,,,,,,,,,,,,,,,,,,,,,,
1006890,Cambridgeport,,,,,,,,,,,,,,,,,,,,,,,,,,,,,,,,,,,,,,,,,,,,,,,
1005216,Camden Ahec Farmers Market,http://www.camden-ahec.org,http://www.camden-ahec.org,,,,,,,,,July to October,2010-07-01,2010-10-31,Fri:10:00 AM - 2:00 PM;,Fri:10:00 AM - 2:00 PM,,,,,,,,,,,,,,,,,,,,,,,,,,,,,,,,
1004233,Camden Avenue Farmers Market,http://CamdenAveFarmersMarket.com,http://CamdenAveFarmersMarket.com,https://www.facebook.com/CamdenAvenueFarmersMarket,https://www.facebook.com/CamdenAvenueFarmersMarket,,,,,,,01/01/2016 to 12/31/2016,2016-01-01,2016-12-31,Tue: 2:30 PM-6:00 PM;,Tue: 2:30 PM-6:00 PM,,,,,,,,,,,,,,,,,,,,,,,,,,,,,,,,
1000122,Camden Farmers Market,http://www.iatp.org/minimarkets,http://www.iatp.org/minimarkets,,,,,,,,,July to October,2010-07-01,2010-10-31,Thu:3:00 PM - 7:00 PM;,Thu:3:00 PM - 7:00 PM,,,,,,,,,,,,,,,,,,,,,,,,,,,,,,,,
1006182,Camden Farmers Market,,,,,,,,,,,,,,,,,,,,,,,,,,,,,,,,,,,,,,,,,,,,,,,
1006675,Camden Farmers Market,,,,,,,,,,,,,,,,,,,,,,,,,,,,,,,,,,,,,,,,,,,,,,,
1002674,Camellia City Farmers Market,http://www.camelliacitymarket.org,http://www.camelliacitymarket.org,https://www.facebook.com/CamelliaCityMarket,https://www.facebook.com/CamelliaCityMarket,,,,,Facebook.com/CamelliaCityMarket,Facebook.com/CamelliaCityMarket,01/01/2014 to 12/01/2016,2014-01-01,2016-12-01,Sat: 8:00 AM-12:00 PM;,Sat: 8:00 AM-12:00 PM,,,,,,,,,,,,,,,,,,,,,,,,,,,,,,,,
1005275,Cameron Park Farmers Market,http://www.lacrossefarmersmarkets.org,http://www.lacrossefarmersmarkets.org,https://www.facebook.com/pages/Cameron-Park-Farmers-Market/97634216535?ref=hl,https://www.facebook.com/pages/Cameron-Park-Farmers-Market/97634216535?ref=hl,https://twitter.com/CPFarmersmarket,https://twitter.com/CPFarmersmarket,,,,,05/06/2016 to 10/29/2016,2016-05-06,2016-10-29,Fri: 4:00 PM-8:00 PM;Sat: 8:00 AM-1:00 PM;,Fri: 4:00 PM-8:00 PM,Sat: 8:00 AM-1:00 PM,,,,,,,,,,,,,,,,,,,,,,,,,,,,,,,
1003776,Cameron Park Wednesday Farmers Market,http://www.eldoradofarmersmarket.com,http://www.eldoradofarmersmarket.com,,,,,,,,,05/14/2014 to 10/08/2014,2014-05-14,2014-10-08,Wed: 8:00 AM-12:00 PM;,Wed: 8:00 AM-12:00 PM,,,,,,,,,,,,,,,,,,,,,,,,,,,,,,,,
1009861,Camp Lejeune Farmers Market,http://www.onslowncfarmersmarket.com,http://www.onslowncfarmersmarket.com,,,https://twitter.com/FarmersMarketNC/,https://twitter.com/FarmersMarketNC/,,,,,04/15/2014 to 08/26/2014,2014-04-15,2014-08-26,Tue: 10:00 AM-2:00 PM;,Tue: 10:00 AM-2:00 PM,,,,,,,,,,,,,,,,,,,,,,,,,,,,,,,,
1006428,Campbell County Farmers Market Association,http://www.ccfarmersmarket.net,http://www.ccfarmersmarket.net,https://www.facebook.com/campbellcountyfarmmarket,https://www.facebook.com/campbellcountyfarmmarket,,,,,,,05/16/2014 to 10/24/2014,2014-05-16,2014-10-24,Fri: 3:00 PM-6:00 PM;,Fri: 3:00 PM-6:00 PM,,,,,,,,,,,,,,,,,,,,,,,,,,,,,,,,
1006429,Campbell County Farmers Market Association,http://www.ccfarmersmarket.net,http://www.ccfarmersmarket.net,https://www.facebook.com/campbellcountyfarmmarket,https://www.facebook.com/campbellcountyfarmmarket,,,,,,,05/13/2014 to 10/28/2014,2014-05-13,2014-10-28,Tue: 3:00 PM-6:00 PM;,Tue: 3:00 PM-6:00 PM,,,,,,,,,,,,,,,,,,,,,,,,,,,,,,,,
1009653,Campbell County Farmers Market Association,http://www.ccfarmersmarket.net,http://www.ccfarmersmarket.net,https://www.facebook.com/campbellcountyfarmmarket,https://www.facebook.com/campbellcountyfarmmarket,,,,,,,06/07/2014 to 10/25/2014,2014-06-07,2014-10-25,Sat: 9:00 AM-12:00 PM;,Sat: 9:00 AM-12:00 PM,,,,,,,,,,,,,,,,,,,,,,,,,,,,,,,,
1007356,Campbell Farmers Market,http://www.urbanvillageonline.com/,http://www.urbanvillageonline.com/,,,,,,,,,January to December,2010-01-01,2010-12-31,sun:9:00 AM - 1:00 PM;,sun:9:00 AM - 1:00 PM,,,,,,,,,,,,,,,,,,,,,,,,,,,,,,,,
1006978,Campton Farmers Market,,,None,,none,,none,,none,none,06/07/2013 to 09/13/2013,2013-06-07,2013-09-13,Fri: 3:00 PM-6:00 PM;,Fri: 3:00 PM-6:00 PM,,,,,,,,,,,,,,,,,,,,,,,,,,,,,,,,
1006485,Canaan Farmers Market,http://www.canaanmefarmersmarket.webs.com/,http://www.canaanmefarmersmarket.webs.com/,,,,,,,,,,,,,,,,,,,,,,,,,,,,,,,,,,,,,,,,,,,,,
1011170,Canaan Farmers Market,,,,,,,,,,,05/24/2015 to 10/11/2015,2015-05-24,2015-10-11,Sun: 10:00 AM-1:00 PM;,Sun: 10:00 AM-1:00 PM,,,,,,,,,,,,,,,,,,,,,,,,,,,,,,,,
1001909,Canajoharie Farmers Market,http://www.canajohariefarmersmarket.com,http://www.canajohariefarmersmarket.com,https://www.facebook.com/canajohariefarmersmarket,https://www.facebook.com/canajohariefarmersmarket,,,,,,,06/07/2014 to 10/25/2014,2014-06-07,2014-10-25,Sun: 10:00 AM-1:00 PM;,Sun: 10:00 AM-1:00 PM,,,,,,,,,,,,,,,,,,,,,,,,,,,,,,,,
1009034,Canal District Farmers Market,http://www.canaldistrictfarmersmarket.com,http://www.canaldistrictfarmersmarket.com,https://www.facebook.com/canaldistrictfarmersmarket,https://www.facebook.com/canaldistrictfarmersmarket,https://twitter.com/Canaldistrict,https://twitter.com/Canaldistrict,,,Instagram @canaldistrict,http://www.instagram.com/canaldistrict,01/01/2016 to 12/31/2016,2016-01-01,2016-12-31,Sat: 9:00 AM-12:00 PM;,Sat: 9:00 AM-12:00 PM,,,,,,,,,,,,,,,,,,,,,,,,,,,,,,,,
1009411,Canal Fulton Farmers Market,http://www.localharvest.org/canal-fulton-farmers-market-M23597,http://www.localharvest.org/canal-fulton-farmers-market-M23597,,,,,,,,,,,,,,,,,,,,,,,,,,,,,,,,,,,,,,,,,,,,,
1012183,Canal Market District,http://www.canalmarketdistrict.org,http://www.canalmarketdistrict.org,facebook.com/canalmarketdistrict,,,,,,Instagram @canalmarketdistrict,http://www.instagram.com/canalmarketdistrict,06/03/2016 to 10/28/2016,2016-06-03,2016-10-28,Tue: 4:00 PM-7:00 PM;Fri: 4:00 AM-7:00 PM;,Tue: 4:00 PM-7:00 PM,Fri: 4:00 AM-7:00 PM,,,,,,,,,,,,,,,,,,,,,,,,,,,,,,,
1001214,Canal Winchester Farmers Market,http://www.thecwfm.com,http://www.thecwfm.com,,,,,,,,,05/23/2015 to 09/26/2015,2015-05-23,2015-09-26,Sat: 9:00 AM-12:00 PM;,Sat: 9:00 AM-12:00 PM,,,,,,,,,,,,,,,,,,,,,,,,,,,,,,,,
1002058,Canandaigua Farmers Market,http://www.canandaiguafarmersmarket.com,http://www.canandaiguafarmersmarket.com,,,,,,,,,June to October,2010-06-01,2010-10-31,Sat:8:30 am - 12:30 pm;,Sat:8:30 am - 12:30 pm,,,,,,,,,,,,,,,,,,,,,,,,,,,,,,,,
1002837,Canandaigua Va Medical Center Farmers Market,,,http://www.facebook.com/VACanandaigua,http://www.facebook.com/VACanandaigua,,,,,http://www.canandaigua.va.gov/news/index.asp,http://www.canandaigua.va.gov/news/index.asp,06/17/2014 to 10/14/2014,2014-06-17,2014-10-14,Tue: 1:30 PM-5:00 PM;,Tue: 1:30 PM-5:00 PM,,,,,,,,,,,,,,,,,,,,,,,,,,,,,,,,
1006790,Canby Saturday Market,http://www.canby.com/canbycbr,http://www.canby.com/canbycbr,https://www.facebook.com/CanbySaturdayMarket,https://www.facebook.com/CanbySaturdayMarket,,,,,,,05/10/2014 to 10/18/2014,2014-05-10,2014-10-18,Sat: 9:00 AM-1:00 PM;,Sat: 9:00 AM-1:00 PM,,,,,,,,,,,,,,,,,,,,,,,,,,,,,,,,
1007034,Cando Farmers Market,,,,,,,,,,,July to September,2010-07-01,2010-09-30,Thu:5:00 pm - 6:30 pm;,Thu:5:00 pm - 6:30 pm,,,,,,,,,,,,,,,,,,,,,,,,,,,,,,,,
1003627,Cane River Green Market,http://www.canerivergreenmarket.com,http://www.canerivergreenmarket.com,https://www.facebook.com/CRGreenMarket,https://www.facebook.com/CRGreenMarket,,,,,,,04/26/2014 to 07/26/2014,2014-04-26,2014-07-26,Sat: 8:00 AM-12:00 PM;,Sat: 8:00 AM-12:00 PM,,,,,,,10/11/2014 to 11/22/2014,10/11/14, 11/22/2014,Sat: 8:00 AM-12:00 PM;,Sat: 8:00 AM-12:00 PM,,,,,,,,,,,,,,,,,,,,,
1011690,Cankdeska Cikana Community College Farmers Market,,,,,,,,,,,09/05/2015 to,2015-09-05,,Sat: 9:00 AM-3:00 PM;,Sat: 9:00 AM-3:00 PM,,,,,,,,,,,,,,,,,,,,,,,,,,,,,,,,
1012548,Cannon Beach Farmers Market,http://Cannon Beach Market.org,,Cannon Beach Farmers Market,,info@cannon Beach Farmers Market,,,,,,,,,Tue: 1:00 PM-5:00 PM;,Tue: 1:00 PM-5:00 PM,,,,,,,,,,,,,,,,,,,,,,,,,,,,,,,,
1008796,Cannon Park Community Market,http://www.cannonparkmarket.com,http://www.cannonparkmarket.com,https://www.facebook.com/CannonParkCommunityMarket,https://www.facebook.com/CannonParkCommunityMarket,https://twitter.com/CannonParkCM,https://twitter.com/CannonParkCM,,,,,05/07/2014 to 10/22/2014,2014-05-07,2014-10-22,Wed: 3:00 PM-6:00 PM;,Wed: 3:00 PM-6:00 PM,,,,,,,,,,,,,,,,,,,,,,,,,,,,,,,,
1012038,Canoga Park Certified Farmers Market,http://coastalpacificinfo.us,http://coastalpacificinfo.us,https://www.facebook.com/canogafarmersmarket/,https://www.facebook.com/canogafarmersmarket/,,,,,,,01/01/2016 to 12/31/2016,2016-01-01,2016-12-31,Sat: 9:00 AM-1:30 PM;,Sat: 9:00 AM-1:30 PM,,,,,,,,,,,,,,,,,,,,,,,,,,,,,,,,
1009644,Canon City Farmers Market,http://www.canoncityfarmersmarket.com,http://www.canoncityfarmersmarket.com,https://www.facebook.com/pages/Canon-City-Farmers-Market/224357034259851,https://www.facebook.com/pages/Canon-City-Farmers-Market/224357034259851,,,,,,,06/03/2014 to 10/14/2014,2014-06-03,2014-10-14,Tue: 8:00 AM-1:00 PM;,Tue: 8:00 AM-1:00 PM,,,,,,,,,,,,,,,,,,,,,,,,,,,,,,,,
1012636,Canterbury Community Farmers Market Association,http://www.ccfma.net,http://www.ccfma.net,Canterbury Community Farmers Market Association,,,,,,,,06/08/2016 to 10/05/2016,2016-06-08,2016-10-05,Wed: 4:00 PM-6:30 PM;,Wed: 4:00 PM-6:30 PM,,,,,,,,,,,,,,,,,,,,,,,,,,,,,,,,
1009037,Canterbury Village Farmers Market,,,,,,,,,,,05/04/2014 to 09/28/2014,2014-05-04,2014-09-28,Sat: 10:00 AM-3:00 PM;,Sat: 10:00 AM-3:00 PM,,,,,,,,,,,,,,,,,,,,,,,,,,,,,,,,
1001172,Canton Farmers Market,,,,,,,,,,,,,,,,,,,,,,,,,,,,,,,,,,,,,,,,,,,,,,,
1001397,Canton Farmers Market,http://www.cantonhdl.com,http://www.cantonhdl.com,,,,,,,,,May to September,2010-05-01,2010-09-30,Sat:8:00 AM - 12:00 PM;,Sat:8:00 AM - 12:00 PM,,,,,,,,,,,,,,,,,,,,,,,,,,,,,,,,
1002869,Canton Farmers Market,http://www.canton-mississippi.com,http://www.canton-mississippi.com,,,,,,,,,,,,,,,,,,,,,,,,,,,,,,,,,,,,,,,,,,,,,
1004649,Canton Farmers Market,http://www.cantonfun.org,http://www.cantonfun.org,https://www.facebook.com/cantonfarmersmarket,https://www.facebook.com/cantonfarmersmarket,,,,,,,05/15/2016 to 10/16/2016,2016-05-15,2016-10-16,Sun: 9:00 AM-1:00 PM;,Sun: 9:00 AM-1:00 PM,,,,,,,,,,,,,,,,,,,,,,,,,,,,,,,,
1006495,Canton Farmers Market,http://www.extension.uiuc.edu/fulton,http://www.extension.uiuc.edu/fulton,,,,,,,,,,,,,,,,,,,,,,,,,,,,,,,,,,,,,,,,,,,,,
1008518,Canton Farmers Market,http://www.cantonfarmersmarket.org,http://www.cantonfarmersmarket.org,https://www.facebook.com/CantonNYFarmersMarket?fref=ts,https://www.facebook.com/CantonNYFarmersMarket?fref=ts,,,,,,,05/09/2014 to 10/31/2014,2014-05-09,2014-10-31,Tue: 9:00 AM-2:00 PM;Fri: 9:00 AM-2:00 PM;,Tue: 9:00 AM-2:00 PM,Fri: 9:00 AM-2:00 PM,,,,,,,,,,,,,,,,,,,,,,,,,,,,,,,
1009677,Canton Farmers Market And Heritage Crafts,http://focusofcanton.com/farmers-market-canton-nc.html,http://focusofcanton.com/farmers-market-canton-nc.html,https://www.facebook.com/CantonThursdayFarmersMarketAndMore?ref=hl,https://www.facebook.com/CantonThursdayFarmersMarketAndMore?ref=hl,,,,,,,05/08/2014 to 10/31/2014,2014-05-08,2014-10-31,Thu: 3:00 PM-7:00 PM;,Thu: 3:00 PM-7:00 PM,,,,,,,,,,,,,,,,,,,,,,,,,,,,,,,,
1005101,Canton Farmers Market,http://www.cantonfarmersmarket.com,http://www.cantonfarmersmarket.com,https://www.facebook.com/CantonOhioFarmersMarket?fref=ts,https://www.facebook.com/CantonOhioFarmersMarket?fref=ts,,,,,,,June to October,2010-06-01,2010-10-31,Sat:8:00 AM - 11:30 AM;,Sat:8:00 AM - 11:30 AM,,,,,,,,,,,,,,,,,,,,,,,,,,,,,,,,
1005102,Canton Farmers Market,http://www.cantonfarmersmarket.com,http://www.cantonfarmersmarket.com,https://www.facebook.com/CantonOhioFarmersMarket?fref=ts,https://www.facebook.com/CantonOhioFarmersMarket?fref=ts,,,,,,,August to August,2010-08-01,2010-08-31,Sat:8:00 AM - 11:30 AM;,Sat:8:00 AM - 11:30 AM,,,,,,,,,,,,,,,,,,,,,,,,,,,,,,,,
1007855,Canyon Lake Cfm,,,,,,,,,,,,,,,,,,,,,,,,,,,,,,,,,,,,,,,,,,,,,,,
1010438,Canyonville Farmers Market,http://www.CanyonvilleFarmersMarket.org,http://www.CanyonvilleFarmersMarket.org,https://www.facebook.com/CanyonvilleFarmersMarket,https://www.facebook.com/CanyonvilleFarmersMarket,,,,,,,05/01/2014 to 09/01/2014,2014-05-01,2014-09-01,Wed: 4:00 PM-7:00 PM;,Wed: 4:00 PM-7:00 PM,,,,,,,,,,,,,,,,,,,,,,,,,,,,,,,,
1005325,Cape Ann Farmers Market,http://www.capeannfarmersmarket.org,http://www.capeannfarmersmarket.org,,,,,,,,,November to December,2010-11-01,2010-12-31,Sat:9:30 AM - 12:00 PM;,Sat:9:30 AM - 12:00 PM,,,,,,,,,,,,,,,,,,,,,,,,,,,,,,,,
1005326,Cape Ann Farmers Market,http://www.capeannfarmersmarket.org,http://www.capeannfarmersmarket.org,,,,,,,,,June to October,2010-06-01,2010-10-31,Thu:3:00 PM - 6:30 PM;,Thu:3:00 PM - 6:30 PM,,,,,,,,,,,,,,,,,,,,,,,,,,,,,,,,
1003570,Cape Coral Farmers Market,http://www.capecoralfarmersmarket.com,http://www.capecoralfarmersmarket.com,https://www.facebook.com/pages/Cape-Coral-Farmers-Market/162197597146492,https://www.facebook.com/pages/Cape-Coral-Farmers-Market/162197597146492,https://twitter.com/capecoralfarmer,https://twitter.com/capecoralfarmer,,,,,10/01/2016 to,2016-10-01,,Sat: 8:00 AM-1:00 PM;,Sat: 8:00 AM-1:00 PM,,,,,,,,,,,,,,,,,,,,,,,,,,,,,,,,
1006963,Cape Girardeau Farmers Market,,,https://www.facebook.com/pages/Cape-Farmers-Market/105485396140615,https://www.facebook.com/pages/Cape-Farmers-Market/105485396140615,,,,,,,04/17/2014 to 11/20/2014,2014-04-17,2014-11-20,Thu: 12:00 PM-5:00 PM;,Thu: 12:00 PM-5:00 PM,,,,,,,,,,,,,,,,,,,,,,,,,,,,,,,,
1005285,Cape Riverfront Market,http://www.caperiverfrontmarket.com,http://www.caperiverfrontmarket.com,https://www.facebook.com/CapeRiverfrontMarket,https://www.facebook.com/CapeRiverfrontMarket,https://twitter.com/CapeRiverMarket,https://twitter.com/CapeRiverMarket,,,http://pinterest.com/crmmarket/,http://pinterest.com/crmmarket/,05/02/2015 to 10/31/2015,2015-05-02,2015-10-31,Sat: 8:00 AM-12:00 PM;,Sat: 8:00 AM-12:00 PM,,,,,,,,,,,,,,,,,,,,,,,,,,,,,,,,
1006275,Cape Vincent Farmers And Crafters Market,,,,,,,,,,,,,,,,,,,,,,,,,,,,,,,,,,,,,,,,,,,,,,,
1000803,Capital City Farmers Market,http://www.montpelierfarmersmarket.com/,http://www.montpelierfarmersmarket.com/,https://www.facebook.com/pages/Capital-City-Farmers-Market-Montpelier-Vermont/341411712048,https://www.facebook.com/pages/Capital-City-Farmers-Market-Montpelier-Vermont/341411712048,https://twitter.com/montpmarket,https://twitter.com/montpmarket,,,sign up for market newsletter on market's website,sign up for market newsletter on market's website,12/01/2014 to 04/01/2015,2014-12-01,2015-04-01,Sat: 10:00 AM-2:00 PM;,Sat: 10:00 AM-2:00 PM,,,,,,,,,,,,,,,,,,,,,,,,,,,,,,,,
1000804,Capital City Farmers Market,http://www.montpelierfarmersmarket.com/,http://www.montpelierfarmersmarket.com/,https://www.facebook.com/pages/Capital-City-Farmers-Market-Montpelier-Vermont/341411712048,https://www.facebook.com/pages/Capital-City-Farmers-Market-Montpelier-Vermont/341411712048,https://twitter.com/montpmarket,https://twitter.com/montpmarket,,,sign up for market newsletter on market's website,sign up for market newsletter on market's website,05/01/2012 to 10/31/2012,2012-05-01,2012-10-31,Sat: 9:00 AM-1:00 PM;,Sat: 9:00 AM-1:00 PM,,,,,,,,,,,,,,,,,,,,,,,,,,,,,,,,
1000805,Capital City Farmers Market,http://www.montpelierfarmersmarket.com/,http://www.montpelierfarmersmarket.com/,https://www.facebook.com/pages/Capital-City-Farmers-Market-Montpelier-Vermont/341411712048,https://www.facebook.com/pages/Capital-City-Farmers-Market-Montpelier-Vermont/341411712048,https://twitter.com/montpmarket,https://twitter.com/montpmarket,,,sign up for market newsletter on market's website,sign up for market newsletter on market's website,11/01/2012 to 11/31/2012,2012-11-01,,,,,,,,,,,,,,,,,,,,,,,,,,,,,,,,,,,
1004444,Capital City Farmers Market,http://capcitymarket.wordpress.com,http://capcitymarket.wordpress.com,https://www.facebook.com/pages/Capital-City-Farmers-Market/443225632425416,https://www.facebook.com/pages/Capital-City-Farmers-Market/443225632425416,,,,,,,05/07/2016 to 10/29/2016,2016-05-07,2016-10-29,Sat: 9:00 AM-12:00 PM;,Sat: 9:00 AM-12:00 PM,,,,,,,,,,,,,,,,,,,,,,,,,,,,,,,,
1006925,Capital City Farmers Market,http://www.destinationtrenton.com/events/event-markets/,http://www.destinationtrenton.com/events/event-markets/,https://www.facebook.com/trentondowntownassociation/?fref=ts,https://www.facebook.com/trentondowntownassociation/?fref=ts,https://twitter.com/trentondowntown,https://twitter.com/trentondowntown,,,,,05/05/2016 to 10/27/2016,2016-05-05,2016-10-27,Thu: 11:00 AM-2:00 PM;,Thu: 11:00 AM-2:00 PM,,,,,,,,,,,,,,,,,,,,,,,,,,,,,,,,
1011930,Capital City Farmers Market,http://www.downtowndoverpartnership.com/,http://www.downtowndoverpartnership.com/,https://www.facebook.com/capitalcityfarmersmarket/,https://www.facebook.com/capitalcityfarmersmarket/,,,,,,,06/15/2016 to 09/14/2016,2016-06-15,2016-09-14,Wed: 11:30 AM-3:30 PM;,Wed: 11:30 AM-3:30 PM,,,,,,,,,,,,,,,,,,,,,,,,,,,,,,,,
1003356,Capital City Public Market,http://www.capitalcitypublicmarket.com,http://www.capitalcitypublicmarket.com,www.facebook.com/capitalcitypublicmarket,,@boisemarket,@boisemarket,,,,,04/16/2016 to 12/17/2016,2016-04-16,2016-12-17,Sat: 9:00 AM-1:30 PM;,Sat: 9:00 AM-1:30 PM,,,,,,,,,,,,,,,,,,,,,,,,,,,,,,,,
1000314,Capital District Farmers Market In Menands,http://www.capitaldistrictfarmersmarket.org,http://www.capitaldistrictfarmersmarket.org,,,,,,,,,,,,,,,,,,,,,,,,,,,,,,,,,,,,,,,,,,,,,
1010194,Capital District Physicians Health Plan Farmers Market,http://www.cdphp.com/en/Classes-And-Events/farmers-market,http://www.cdphp.com/en/Classes-And-Events/farmers-market,,,,,,,,,05/29/2014 to 10/02/2014,2014-05-29,2014-10-02,Thu: 11:00 AM-1:30 PM;,Thu: 11:00 AM-1:30 PM,,,,,,,,,,,,,,,,,,,,,,,,,,,,,,,,
1003527,Capital Farmers Market I,,,,,,,,,,,,,,,,,,,,,,,,,,,,,,,,,,,,,,,,,,,,,,,
1010433,Capital Harvest On The Plaza,http://capitalharvestdc.com/,http://capitalharvestdc.com/,,,,,,,,,04/04/2014 to 10/24/2014,2014-04-04,2014-10-24,Fri: 11:00 AM-3:00 PM;,Fri: 11:00 AM-3:00 PM,,,,,,,,,,,,,,,,,,,,,,,,,,,,,,,,
1008481,Capital Regional Medical Center Farmers Market,http://agrimissouri.com/mo-grown/grodetail.php?type=mo-grown&ID=1769,http://agrimissouri.com/mo-grown/grodetail.php?type=mo-grown&ID=1769,,,,,,,,,,,,Thu: 4:00 PM-6:00 PM;,Thu: 4:00 PM-6:00 PM,,,,,,,,,,,,,,,,,,,,,,,,,,,,,,,,
1004765,Capitan Farmers Market,http://www.ataclincolncounty.org,http://www.ataclincolncounty.org,,,,,,,www.FarmersMarketsNM.org,www.FarmersMarketsNM.org,07/12/2014 to 10/25/2014,2014-07-12,2014-10-25,Sat: 9:00 AM-11:00 AM;,Sat: 9:00 AM-11:00 AM,,,,,,,,,,,,,,,,,,,,,,,,,,,,,,,,
1003526,Capitol Farmers Market Ii,,,,,,,,,,,,,,,,,,,,,,,,,,,,,,,,,,,,,,,,,,,,,,,
1000437,Capitol Hill Farmers Market,,,,,,,,,,,,,,,,,,,,,,,,,,,,,,,,,,,,,,,,,,,,,,,
1004165,Capitol Hill Farmers Market,http://www.seattlefarmersmarkets.org,http://www.seattlefarmersmarkets.org,https://www.facebook.com/broadwayfarmersmarket,https://www.facebook.com/broadwayfarmersmarket,https://twitter.com/seattlefarmmkts,https://twitter.com/seattlefarmmkts,,,,,01/03/2016 to 12/18/2016,2016-01-03,2016-12-18,Sun: 11:00 AM-3:00 PM;,Sun: 11:00 AM-3:00 PM,,,,,,,,,,,,,,,,,,,,,,,,,,,,,,,,
1004827,Capitol Market,http://www.capitolmarket.net,http://www.capitolmarket.net,,,,,,,,,,,,,,,,,,,,,,,,,,,,,,,,,,,,,,,,,,,,,
1011746,Capitol Midweek Farmers Market,http://www.kdheks.gov/bhp/farmers_market/index.htm,http://www.kdheks.gov/bhp/farmers_market/index.htm,,,,,,,,,05/11/2016 to 10/12/2016,2016-05-11,2016-10-12,Wed: 7:30 AM-12:00 PM;,Wed: 7:30 AM-12:00 PM,,,,,,,,,,,,,,,,,,,,,,,,,,,,,,,,
1009280,Capitol Riverfront Farmers Market At Canal Park,,,https://www.facebook.com/pages/Capitol-Riverfront-Farmers-Market-at-Canal-Park/106331419410626,https://www.facebook.com/pages/Capitol-Riverfront-Farmers-Market-at-Canal-Park/106331419410626,,,,,,,,,,,,,,,,,,,,,,,,,,,,,,,,,,,,,,,,,,,
1004700,Capitol View Farmers Market,http://www.capitolviewfarmersmarket.com,http://www.capitolviewfarmersmarket.com,https://www.facebook.com/pages/Capitol-View-Farmers-Market/204572939582186,https://www.facebook.com/pages/Capitol-View-Farmers-Market/204572939582186,,,,,,,06/01/2016 to 10/12/2016,2016-06-01,2016-10-12,Wed: 3:00 PM-7:00 PM;,Wed: 3:00 PM-7:00 PM,,,,,,,,,,,,,,,,,,,,,,,,,,,,,,,,
1002033,Captial Hill Farmers Market,http://www.rigrown.ri.gov,http://www.rigrown.ri.gov,,,,,,,,,,,,Thu: 11:00 AM-2:00 PM;,Thu: 11:00 AM-2:00 PM,,,,,,,,,,,,,,,,,,,,,,,,,,,,,,,,
1002791,Captina Produce Auction,http://www.captinaproduceauction.com,http://www.captinaproduceauction.com,,,,,,,,,,,,,,,,,,,,,,,,,,,,,,,,,,,,,,,,,,,,,
1006857,Carbondale Community Friday Night Fair,http://www.carbondalemainstreet.com,http://www.carbondalemainstreet.com,https://www.facebook.com/pages/Carbondales-Friday-Night-Fair/198291346855741,https://www.facebook.com/pages/Carbondales-Friday-Night-Fair/198291346855741,https://twitter.com/CdaleFridayFair,https://twitter.com/CdaleFridayFair,,,,,05/03/2013 to 06/28/2013,2013-05-03,2013-06-28,Fri: 6:00 PM-9:00 PM;,Fri: 6:00 PM-9:00 PM,,,,,,,08/02/2013 to 09/27/2013,8/2/13, 09/27/2013,Fri: 6:00 PM-9:00 PM;,Fri: 6:00 PM-9:00 PM,,,,,,,,,,,,,,,,,,,,,
1003292,Carbondale Farmers Market,http://www.carbondalefarmersmarket.com/,http://www.carbondalefarmersmarket.com/,,,,,,,,,June to September,2010-06-01,2010-09-30,Wed:10:00 AM - 3:00 PM;,Wed:10:00 AM - 3:00 PM,,,,,,,,,,,,,,,,,,,,,,,,,,,,,,,,
1005004,Carbondale Farmers Market,,,,,,,,,,,June to October,2010-06-01,2010-10-31,Tue:11:00 AM - 6:00 PM;Thu:11:00 AM - 6:00 PM;,Tue:11:00 AM - 6:00 PM,Thu:11:00 AM - 6:00 PM,,,,,,,,,,,,,,,,,,,,,,,,,,,,,,,
1011167,Carbondale Farmers Market,,,https://www.facebook.com/pages/Carbondale-Farmers-Market/108003322564892,https://www.facebook.com/pages/Carbondale-Farmers-Market/108003322564892,https://twitter.com/cfm1975,https://twitter.com/cfm1975,,,,,04/04/2015 to 11/28/2015,2015-04-04,2015-11-28,Sat: 8:00 AM-12:00 PM;,Sat: 8:00 AM-12:00 PM,,,,,,,,,,,,,,,,,,,,,,,,,,,,,,,,
1012654,Carefree Farmers Market,http://www.arizonacommunityfarmersmarkets.com/FM_Carefree.html,http://www.arizonacommunityfarmersmarkets.com/FM_Carefree.html,https://www.facebook.com/Carefree-Farmers-Market-151858821512415/,https://www.facebook.com/Carefree-Farmers-Market-151858821512415/,https://twitter.com/CarefreeMarket,https://twitter.com/CarefreeMarket,,,,,10/07/2016 to 05/26/2017,2016-10-07,2017-05-26,Fri: 9:00 AM-1:00 PM;,Fri: 9:00 AM-1:00 PM,,,,,,,,,,,,,,,,,,,,,,,,,,,,,,,,
1011204,Carencro Cultural District Farmers Market,,,,,,,,,,,06/27/2015 to 10/31/2015,2015-06-27,2015-10-31,,,,,,,,,,,,,,,,,,,,,,,,,,,,,,,,,,
1003478,Caribou Farmers Market,http://www.cariboumaine.net,http://www.cariboumaine.net,,,,,,,,,May to October,2010-05-01,2010-10-31,Wed:3:00 PM - 6:00 PM;Sat:8:30 AM - 12:00 PM;,Wed:3:00 PM - 6:00 PM,Sat:8:30 AM - 12:00 PM,,,,,,,,,,,,,,,,,,,,,,,,,,,,,,,
1001447,Carlisle County Farmers Market,,,,,,,,,,,,,,,,,,,,,,,,,,,,,,,,,,,,,,,,,,,,,,,
1012670,Carlisle Farmers Market,,,http://www.facebook.com/CarlisleFarmersMarket/,http://www.facebook.com/CarlisleFarmersMarket/,,,,,,,06/04/2016 to 10/29/2016,2016-06-04,2016-10-29,Sat: 8:30 AM-11:30 AM;,Sat: 8:30 AM-11:30 AM,,,,,,,,,,,,,,,,,,,,,,,,,,,,,,,,
1002284,Carlisle Farmers Market,,,,,,,,,,,,,,,,,,,,,,,,,,,,,,,,,,,,,,,,,,,,,,,
1011230,Carlisle Farmers Market,http://Carlislefarmersmarket.org,http://Carlislefarmersmarket.org,,,,,,,,,06/20/2015 to 10/10/2015,2015-06-20,2015-10-10,Sat: 8:00 AM-12:00 PM;,Sat: 8:00 AM-12:00 PM,,,,,,,,,,,,,,,,,,,,,,,,,,,,,,,,
1004804,Carlsbad Downtown Farmers Market,http://farmersmarketsnm.org/Shoppers/FindMarket/find.php,http://farmersmarketsnm.org/Shoppers/FindMarket/find.php,https://www.facebook.com/CarlsbadDowntownFarmersMarket,https://www.facebook.com/CarlsbadDowntownFarmersMarket,,,,,,,06/21/2014 to 09/27/2014,2014-06-21,2014-09-27,Sat: 10:00 AM-2:00 PM;,Sat: 10:00 AM-2:00 PM,,,,,,,,,,,,,,,,,,,,,,,,,,,,,,,,
1002137,Carlton County Farmers Market,,,,,,,,,,,,,,,,,,,,,,,,,,,,,,,,,,,,,,,,,,,,,,,
1002693,Carlyle Courthouse Square Farmers Market,http://www.playandstaycarlyle.com,http://www.playandstaycarlyle.com,,,,,,,,,06/19/2014 to 09/25/2014,2014-06-19,2014-09-25,Thu: 4:00 PM-7:00 PM;,Thu: 4:00 PM-7:00 PM,,,,,,,,,,,,,,,,,,,,,,,,,,,,,,,,
1007367,Carmel Farmers Market,http://www.carmelfarmersmarket.com,http://www.carmelfarmersmarket.com,https://www.facebook.com/carmelfarmersmarket,https://www.facebook.com/carmelfarmersmarket,https://twitter.com/carmelfarmmrkt,https://twitter.com/carmelfarmmrkt,,,,,05/03/2014 to 09/27/2014,2014-05-03,2014-09-27,Sat: 8:00 AM-11:30 AM;,Sat: 8:00 AM-11:30 AM,,,,,,,,,,,,,,,,,,,,,,,,,,,,,,,,
1008450,Carmel Farmers Markets At The Barnyard Shopping Village,http://www.montereybayfarmers.org,http://www.montereybayfarmers.org,https://www.facebook.com/pages/Monterey-Bay-Certified-Farmers-Markets/112446802152723,https://www.facebook.com/pages/Monterey-Bay-Certified-Farmers-Markets/112446802152723,https://twitter.com/MBFarmersMarket,https://twitter.com/MBFarmersMarket,,,www.edibleparadise.com,www.edibleparadise.com,05/06/2014 to 09/30/2014,2014-05-06,2014-09-30,Tue: 9:00 AM-1:00 PM;,Tue: 9:00 AM-1:00 PM,,,,,,,,,,,,,,,,,,,,,,,,,,,,,,,,
1006651,Carnation Farmers Market,http://www.carnationfarmersmarket.org,http://www.carnationfarmersmarket.org,https://www.facebook.com/pages/Carnation-Farmers-Market/113831768657527,https://www.facebook.com/pages/Carnation-Farmers-Market/113831768657527,,,,,,,05/03/2016 to 10/25/2016,2016-05-03,2016-10-25,Tue: 3:00 PM-7:00 PM;,Tue: 3:00 PM-7:00 PM,,,,,,,,,,,,,,,,,,,,,,,,,,,,,,,,
1009038,Caro Farmers Market,http://www.carochamber.org,http://www.carochamber.org,https://www.facebook.com/pages/Caro-Farmers-Market/156760491000879,https://www.facebook.com/pages/Caro-Farmers-Market/156760491000879,,,,,,,,,,Sat: 8:00 AM-2:00 PM;,Sat: 8:00 AM-2:00 PM,,,,,,,,,,,,,,,,,,,,,,,,,,,,,,,,
1010092,Carolina Beach Farmers Market,http://carolinabeachfarmersmarket.com/,http://carolinabeachfarmersmarket.com/,https://www.facebook.com/CarolinaBeachFarmersMarket,https://www.facebook.com/CarolinaBeachFarmersMarket,,,,,,,05/17/2014 to 10/04/2014,2014-05-17,2014-10-04,Sat: 8:00 AM-1:00 PM;,Sat: 8:00 AM-1:00 PM,,,,,,,,,,,,,,,,,,,,,,,,,,,,,,,,
1012028,Carolina Forest Farmers Market,http://waccamawmarkets.org/,http://waccamawmarkets.org/,https://www.facebook.com/WaccamawMarketCooperative/,https://www.facebook.com/WaccamawMarketCooperative/,,,,,,,05/05/2016 to 10/27/2016,2016-05-05,2016-10-27,Thu: 1:00 PM-6:00 PM;,Thu: 1:00 PM-6:00 PM,,,,,,,,,,,,,,,,,,,,,,,,,,,,,,,,
1010106,Caroline Farmers Market,http://www.brooktondalecc.org,http://www.brooktondalecc.org,https://www.facebook.com/pages/Caroline-Farmers-Market/274996612592699,https://www.facebook.com/pages/Caroline-Farmers-Market/274996612592699,,,,,,,05/03/2014 to 10/25/2014,2014-05-03,2014-10-25,Sat: 10:00 AM-2:00 PM;,Sat: 10:00 AM-2:00 PM,,,,,,,,,,,,,,,,,,,,,,,,,,,,,,,,
1006968,Carondelet Farmers Market,,,,,,,,,,,June to October,2010-06-01,2010-10-31,Sat:8:00 AM - 12:00 PM;,Sat:8:00 AM - 12:00 PM,,,,,,,,,,,,,,,,,,,,,,,,,,,,,,,,
1011610,Carousel Park Farmers Market,http://www.nccde.org/farmersmarkets,http://www.nccde.org/farmersmarkets,https://www.facebook.com/pages/New-Castle-County-Farmers-Market-Program/1428440977407063?ref=hl,https://www.facebook.com/pages/New-Castle-County-Farmers-Market-Program/1428440977407063?ref=hl,,,,,,,05/22/2015 to 10/30/2015,2015-05-22,2015-10-30,Fri: 2:00 PM-7:00 PM;,Fri: 2:00 PM-7:00 PM,,,,,,,,,,,,,,,,,,,,,,,,,,,,,,,,
1006696,Carpenteria Cfm,,,,,,,,,,,,,,,,,,,,,,,,,,,,,,,,,,,,,,,,,,,,,,,
1011740,Carrboro Farmers Market,http://www.carrborofarmersmarket.com,http://www.carrborofarmersmarket.com,https://www.facebook.com/carrborofarmersmarket,https://www.facebook.com/carrborofarmersmarket,https://twitter.com/carrboromarket,https://twitter.com/carrboromarket,,,,,11/07/2015 to 03/26/2016,2015-11-07,2016-03-26,Sat: 9:00 AM-12:00 PM;,Sat: 9:00 AM-12:00 PM,,,,,,,04/02/2016 to 10/29/2016,4/2/16, 10/29/2016,Sat: 7:00 AM-12:00 PM;,Sat: 7:00 AM-12:00 PM,,,,,,,4/6/16, 11/16/2016,Wed: 3:00 PM-6:00 PM;,Wed: 3:00 PM-6:00 PM,,,,,,,,,,,
1007100,Carrick Citparks Farmers Market,,,,,,,,,,,,,,,,,,,,,,,,,,,,,,,,,,,,,,,,,,,,,,,
1004738,Carroll County Farmers Market,http://www.carrollcountyfarmersmarket.com,http://www.carrollcountyfarmersmarket.com,https://www.facebook.com/pages/Carroll-County-Farmers-Market/192497340781195?ref=br_tf,https://www.facebook.com/pages/Carroll-County-Farmers-Market/192497340781195?ref=br_tf,,,,,,,03/22/2014 to 05/10/2014,2014-03-22,2014-05-10,Sat: 8:00 AM-2:00 PM;,Sat: 8:00 AM-2:00 PM,,,,,,,06/14/2014 to 10/04/2014,6/14/14, 10/04/2014,Sat: 8:00 AM-1:00 PM;,Sat: 8:00 AM-1:00 PM,,,,,,,11/1/14, 12/13/2014,Sat: 8:00 AM-2:00 PM;,Sat: 8:00 AM-2:00 PM,,,,,,,,,,,
1004016,Carroll Farmers Market,http://www.mmdividercd.org,http://www.mmdividercd.org,,,,,,,,,,,,,,,,,,,,,,,,,,,,,,,,,,,,,,,,,,,,,
1006021,Carroll Gardens Greenmarket,http://www.grownyc.org/greenmarket/brooklyn/carroll-gardens,http://www.grownyc.org/greenmarket/brooklyn/carroll-gardens,https://www.facebook.com/BrooklynGreenmarkets,https://www.facebook.com/BrooklynGreenmarkets,https://twitter.com/NYCGreenmarkets,https://twitter.com/NYCGreenmarkets,,,,,,,,Sun: 8:00 AM-3:00 PM;,Sun: 8:00 AM-3:00 PM,,,,,,,,,,,,,,,,,,,,,,,,,,,,,,,,
1008322,Carrollton Farmers Market,,,https://www.facebook.com/CarrolltonFarmersMarket,https://www.facebook.com/CarrolltonFarmersMarket,,,,,,,05/01/2016 to 09/01/2016,2016-05-01,2016-09-01,Fri: 7:30 AM-12:00 PM;,Fri: 7:30 AM-12:00 PM,,,,,,,,,,,,,,,,,,,,,,,,,,,,,,,,
1000808,"Carrollton, Illinois Chamber Of Commerce Farmers Market",,,,,,,,,,,05/05/2014 to 10/27/2014,2014-05-05,2014-10-27,Mon: 3:00 PM-6:00 PM;,Mon: 3:00 PM-6:00 PM,,,,,,,,,,,,,,,,,,,,,,,,,,,,,,,,
1006098,Carrolton Weekly Farmers Market,,,,,,,,,,,,,,,,,,,,,,,,,,,,,,,,,,,,,,,,,,,,,,,
1004415,Carson City Saturday,http://www.carsonfarmersmarket.com,http://www.carsonfarmersmarket.com,https://www.facebook.com/carsonfarmersmarket,https://www.facebook.com/carsonfarmersmarket,,,,,,,06/07/2014 to 09/20/2014,2014-06-07,2014-09-20,Sat: 8:30 AM-1:00 PM;,Sat: 8:30 AM-1:00 PM,,,,,,,,,,,,,,,,,,,,,,,,,,,,,,,,
1000369,Carson Farmers Market,http://www.farmernet.com,http://www.farmernet.com,,,,,,,,,,,,,,,,,,,,,,,,,,,,,,,,,,,,,,,,,,,,,
1007563,Carter County Farmers’ Market,,,,,,,,,,,,,,,,,,,,,,,,,,,,,,,,,,,,,,,,,,,,,,,
1001264,Carthage Farm And Craft Farmers Market,http://www.carthage.ny.com,http://www.carthage.ny.com,,,,,,,,,,,,,,,,,,,,,,,,,,,,,,,,,,,,,,,,,,,,,
1002722,Carthage Farmers Market,,,,,,,,,,,05/16/2016 to 10/24/2016,2016-05-16,2016-10-24,Mon: 2:30 PM-5:30 PM;,Mon: 2:30 PM-5:30 PM,,,,,,,,,,,,,,,,,,,,,,,,,,,,,,,,
1007651,Carthage Farmers Market,,,,,,,,,,,May to September,2010-05-01,2010-09-30,Thu:5:30 PM - 7:30 PM;Sat:7:00 AM - 11:00 AM;,Thu:5:30 PM - 7:30 PM,Sat:7:00 AM - 11:00 AM,,,,,,,,,,,,,,,,,,,,,,,,,,,,,,,
1002263,Cartwright Pavilion Farmers Market,,,,,,,,,,,,,,,,,,,,,,,,,,,,,,,,,,,,,,,,,,,,,,,
1012093,Carver Farmers Market,,,,,,,,,,,,,,Sun: 12:00 PM-4:00 PM;,Sun: 12:00 PM-4:00 PM,,,,,,,,,,,,,,,,,,,,,,,,,,,,,,,,
1012173,Cary Downtown Farmers Market,http://www.caryfarmersmarket.com,http://www.caryfarmersmarket.com,https://www.facebook.com/CaryDowntownFarmersMarket/,https://www.facebook.com/CaryDowntownFarmersMarket/,@CaryNCfarmermkt,@CaryNCfarmermkt,,,,,04/02/2016 to 11/19/2016,2016-04-02,2016-11-19,Sat: 8:00 AM-12:30 PM;,Sat: 8:00 AM-12:30 PM,,,,,,,04/01/2017 to 11/18/2017,4/1/17, 11/18/2017,Sat: 8:00 AM-12:30 PM;,Sat: 8:00 AM-12:30 PM,,,,,,,,,,,,,,,,,,,,,
1009997,Cary Farmers Market,http://www.carygrovechamber.com,http://www.carygrovechamber.com,https://www.facebook.com/CaryFarmersMarket,https://www.facebook.com/CaryFarmersMarket,,,,,,,06/01/2014 to 09/28/2014,2014-06-01,2014-09-28,Sun: 9:00 AM-1:00 PM;,Sun: 9:00 AM-1:00 PM,,,,,,,,,,,,,,,,,,,,,,,,,,,,,,,,
1011489,Casa Larga Vineyards Farm To Table To Marketplace,http://www.casalarga.com/The-Winery/Events/Marketplace,http://www.casalarga.com/The-Winery/Events/Marketplace,,,,,,,,,06/21/2015 to 10/25/2015,2015-06-21,2015-10-25,Sun: 10:00 AM-2:00 PM;,Sun: 10:00 AM-2:00 PM,,,,,,,,,,,,,,,,,,,,,,,,,,,,,,,,
1002636,Cascade Farmers Market,http://www.cascadeiowa.org,http://www.cascadeiowa.org,,,,,,,,,,,,,,,,,,,,,,,,,,,,,,,,,,,,,,,,,,,,,
1002040,Cascade Locks Farmers And Artists Market,http://www.windancefarmsandart.com,http://www.windancefarmsandart.com,,,,,,,,,,,,,,,,,,,,,,,,,,,,,,,,,,,,,,,,,,,,,
1003063,Cascades Farmers Market,http://www.loudounfarmersmarkets.org,http://www.loudounfarmersmarkets.org,https://www.facebook.com/pages/Cascades-Farmers-Market/311506012220707,https://www.facebook.com/pages/Cascades-Farmers-Market/311506012220707,https://twitter.com/LoudounFarmMkts,https://twitter.com/LoudounFarmMkts,,,,,05/03/2015 to 11/01/2015,2015-05-03,2015-11-01,Sun: 9:00 AM-1:00 PM;,Sun: 9:00 AM-1:00 PM,,,,,,,,,,,,,,,,,,,,,,,,,,,,,,,,
1000566,Casco Farmers Market,http://www.cascofarmersmarket.org,http://www.cascofarmersmarket.org,www.facebook.com/cascofarmersmarket,,https://twitter.com/CascoFMKT,https://twitter.com/CascoFMKT,,,,,06/06/2013 to 09/05/2013,2013-06-06,2013-09-05,Thu: 9:00 AM-2:00 PM;,Thu: 9:00 AM-2:00 PM,,,,,,,,,,,,,,,,,,,,,,,,,,,,,,,,
1008997,Case Western Reserve University Farmers Market,http://students.case.edu/farm/food/farmermarket.html,http://students.case.edu/farm/food/farmermarket.html,https://www.facebook.com/CWRUFarm,https://www.facebook.com/CWRUFarm,https://twitter.com/CWRUFarm,https://twitter.com/CWRUFarm,,,,,01/01/2013 to 12/31/2013,2013-01-01,2013-12-31,Thu: 11:00 AM-2:00 PM;,Thu: 11:00 AM-2:00 PM,,,,,,,,,,,,,,,,,,,,,,,,,,,,,,,,
1006912,Cashiers Tailgate Market,,,,,,,,,,,,,,,,,,,,,,,,,,,,,,,,,,,,,,,,,,,,,,,
1007668,Cass County Farmers Market,http://www.cassfarmers.com,http://www.cassfarmers.com,,,,,,,,,June to October,2010-06-01,2010-10-31,Wed:3:00 PM - 6:00 PM;Sat:7:30 AM - 12:00 PM;,Wed:3:00 PM - 6:00 PM,Sat:7:30 AM - 12:00 PM,,,,,,May to May,May , May,Sat:7:30 AM - 12:00 PM;,Sat:7:30 AM - 12:00 PM,,,,,,,,,,,,,,,,,,,,,
1007644,Cass Lake Farmers Market,,,,,,,,,,,,,,,,,,,,,,,,,,,,,,,,,,,,,,,,,,,,,,,
1009464,Cassopolis Farmers Market,http://www.localharvest.org/cassopolis-farmers-market-M22415,http://www.localharvest.org/cassopolis-farmers-market-M22415,,,,,,,,,,,,,,,,,,,,,,,,,,,,,,,,,,,,,,,,,,,,,
1004317,Cassville Farmers Market,,,,,,,,,,,,,,,,,,,,,,,,,,,,,,,,,,,,,,,,,,,,,,,
1003586,Castine Farmers Market,http://www.castinefarmersmarket.org/,http://www.castinefarmersmarket.org/,,,,,,,,,,,,,,,,,,,,,,,,,,,,,,,,,,,,,,,,,,,,,
1011711,Castle Hills Farm To Market,http://localfarmtomarket.com,http://localfarmtomarket.com,https://www.facebook.com/Castle-Hills-Farm-To-Market-343343119195490,https://www.facebook.com/Castle-Hills-Farm-To-Market-343343119195490,,,,,,,01/01/2015 to 12/31/2015,2015-01-01,2015-12-31,Sun: 10:00 AM-2:00 PM;,Sun: 10:00 AM-2:00 PM,,,,,,,,,,,,,,,,,,,,,,,,,,,,,,,,
1003143,"Castle Rock Farmers Market, Aka Plum Creek Valley Farmers Market",http://www.douglascountyextension.org,http://www.douglascountyextension.org,,,,,,,,,07/12/2014 to 10/04/2014,2014-07-12,2014-10-04,Sat: 8:00 AM-12:00 PM;,Sat: 8:00 AM-12:00 PM,,,,,,,,,,,,,,,,,,,,,,,,,,,,,,,,
1002900,Castleton Village Farmers Market,,,,,,,,,,,,,,,,,,,,,,,,,,,,,,,,,,,,,,,,,,,,,,,
1011460,Castro Certified Farmers Market,http://pcfma.org,http://pcfma.org,facebook.com/CastroFarmersMarket,,twitter.com/PacCoastFarmers,,,,instagram.com/pcfma,instagram.com/pcfma,03/11/2015 to 12/16/2015,2015-03-11,2015-12-16,Wed: 4:00 PM-8:00 PM;,Wed: 4:00 PM-8:00 PM,,,,,,,,,,,,,,,,,,,,,,,,,,,,,,,,
1007358,Castro Valley Farmers Market,http://www.urbanvillage@earthlink.net,http://www.urbanvillage@earthlink.net,,,,,,,,,May to October,2010-05-01,2010-10-31,Sat:10:00 AM - 2:00 PM;,Sat:10:00 AM - 2:00 PM,,,,,,,,,,,,,,,,,,,,,,,,,,,,,,,,
1012399,"Caswell County Local Foods Council ""caswell Farmers Market""",http://www.CaswellLocalFoods.org,http://www.CaswellLocalFoods.org,www.facebook.com/CaswellLocalFoods/,,www.twitter.com/eatwellcaswell,,,,www.instagram.com/localfoodincaswell,www.instagram.com/localfoodincaswell,04/16/2016 to 09/17/2016,2016-04-16,2016-09-17,Sat: 4:00 PM-7:00 PM;,Sat: 4:00 PM-7:00 PM,,,,,,,,,,,,,,,,,,,,,,,,,,,,,,,,
1007844,"Catalina, Saturday Market",,,,,,,,,,,,,,,,,,,,,,,,,,,,,,,,,,,,,,,,,,,,,,,
1008276,Catawba County Public Health Farmers Market,http://www.catawbacountync.gov/phealth/Adult/FarmersMarket.asp,http://www.catawbacountync.gov/phealth/Adult/FarmersMarket.asp,https://www.facebook.com/catawbacountypublichealth,https://www.facebook.com/catawbacountypublichealth,,,,,,,06/04/2015 to 09/24/2015,2015-06-04,2015-09-24,Thu: 11:00 AM-2:00 PM;,Thu: 11:00 AM-2:00 PM,,,,,,,,,,,,,,,,,,,,,,,,,,,,,,,,
1007210,Catawba Farmers Market,,,,,,,,,,,,,,,,,,,,,,,,,,,,,,,,,,,,,,,,,,,,,,,
1012444,Catawba Farms Farmers Market,http://market.catawbafarms.com,http://market.catawbafarms.com,https://www.facebook.com/CatawbaFarms,https://www.facebook.com/CatawbaFarms,https://twitter.com/Catawba_Farms,https://twitter.com/Catawba_Farms,,,https://www.flickr.com/photos/141883075@N07/albums/72157666973763026,https://www.flickr.com/photos/141883075@N07/albums/72157666973763026,04/16/2016 to 12/17/2016,2016-04-16,2016-12-17,Sat: 8:00 AM-1:00 PM;,Sat: 8:00 AM-1:00 PM,,,,,,,,,,,,,,,,,,,,,,,,,,,,,,,,
1011496,Catawba Valley Farmers Market,,,Catawba Valley Farmers Market,,,,,,,,05/07/2015 to 10/15/2015,2015-05-07,2015-10-15,Thu: 3:30 PM-7:00 PM;,Thu: 3:30 PM-7:00 PM,,,,,,,,,,,,,,,,,,,,,,,,,,,,,,,,
1011215,Cathedral Community Farm Stand,,,,,,,,,,,07/08/2015 to 09/02/2015,2015-07-08,2015-09-02,Wed: 2:30 PM-6:00 PM;,Wed: 2:30 PM-6:00 PM,,,,,,,,,,,,,,,,,,,,,,,,,,,,,,,,
1003681,Catonsville Farmers Market,http://www.catonsvillefarmersmarket.com,http://www.catonsvillefarmersmarket.com,https://www.facebook.com/catonsvillefarmersmarket,https://www.facebook.com/catonsvillefarmersmarket,,,,,,,05/04/2016 to 11/30/2016,2016-05-04,2016-11-30,Wed: 10:00 AM-1:00 PM;,Wed: 10:00 AM-1:00 PM,,,,,,,,,,,,,,,,,,,,,,,,,,,,,,,,
1002643,Catonsville Sunday Farmers Market,,,http://www.facebook.com/pages/Lapeer-Farmers-Market/401206524993,http://www.facebook.com/pages/Lapeer-Farmers-Market/401206524993,,,,,,,May to November,2010-05-01,2010-11-30,sun:10:00 AM - 1:30 PM;,sun:10:00 AM - 1:30 PM,,,,,,,,,,,,,,,,,,,,,,,,,,,,,,,,
1003975,Catskill Region Farmers Market,,,,,,,,,,,,,,,,,,,,,,,,,,,,,,,,,,,,,,,,,,,,,,,
1003323,Cavalier Farmers Market,,,,,,,,,,,,,,,,,,,,,,,,,,,,,,,,,,,,,,,,,,,,,,,
1008732,Cave City Farmers Market,http://www.cavecityconventioncenter.com,http://www.cavecityconventioncenter.com,https://www.facebook.com/pages/Cave-City-Kentucky-Tourism/570373322991295,https://www.facebook.com/pages/Cave-City-Kentucky-Tourism/570373322991295,,,,,,,06/06/2013 to 09/26/2013,2013-06-06,2013-09-26,Tue: 8:00 AM-12:00 PM;Thu: 8:00 AM-7:00 PM;Sun: 8:00 AM-12:00 PM;,Tue: 8:00 AM-12:00 PM,Thu: 8:00 AM-7:00 PM,Sun: 8:00 AM-12:00 PM,,,,,,,,,,,,,,,,,,,,,,,,,,,,,,
1002953,Cayucos Farmers Market,,,,,,,,,,,,,,,,,,,,,,,,,,,,,,,,,,,,,,,,,,,,,,,
1010163,Cazenovia Farmers Market,http://www.cazenoviachamber.com/,http://www.cazenoviachamber.com/,https://www.facebook.com/CazenoviaFarmersMarket,https://www.facebook.com/CazenoviaFarmersMarket,,,,,,,05/10/2014 to 11/01/2014,2014-05-10,2014-11-01,Sat: 9:00 AM-3:00 PM;,Sat: 9:00 AM-3:00 PM,,,,,,,,,,,,,,,,,,,,,,,,,,,,,,,,
1009351,Ccc Farmers Market In Bonanza,http://www.localharvest.org/ccc-farmers-market-in-bonanza-M56709,http://www.localharvest.org/ccc-farmers-market-in-bonanza-M56709,,,,,,,,,,,,,,,,,,,,,,,,,,,,,,,,,,,,,,,,,,,,,
1006846,Ccfa Buena Vista Farmers Market,,,https://www.facebook.com/pages/Central-Colorado-Foodshed-Alliance/148961155114184,https://www.facebook.com/pages/Central-Colorado-Foodshed-Alliance/148961155114184,,,Buena Vista,,,,06/08/2014 to 10/12/2014,2014-06-08,2014-10-12,Sun: 9:00 AM-1:00 PM;,Sun: 9:00 AM-1:00 PM,,,,,,,,,,,,,,,,,,,,,,,,,,,,,,,,
1006845,Ccfa Farmers Market Canon City,http://www.canoncityfarmersmarket.com,http://www.canoncityfarmersmarket.com,https://www.facebook.com/pages/Canon-City-Farmers-Market/604185459656195,https://www.facebook.com/pages/Canon-City-Farmers-Market/604185459656195,,,,,,,06/01/2012 to 10/02/2012,2012-06-01,2012-10-02,Tue: 8:00 AM-1:00 PM;,Tue: 8:00 AM-1:00 PM,,,,,,,,,,,,,,,,,,,,,,,,,,,,,,,,
1006847,Ccfa Salida Farmers Market,,,https://www.facebook.com/pages/Central-Colorado-Foodshed-Alliance/148961155114184,https://www.facebook.com/pages/Central-Colorado-Foodshed-Alliance/148961155114184,,,http://www.youtube.com/watch?v=0KvOkZH2QQ0,http://www.youtube.com/watch?v=0KvOkZH2QQ0,,,06/07/2014 to 10/11/2014,2014-06-07,2014-10-11,Sat: 8:00 AM-12:30 PM;,Sat: 8:00 AM-12:30 PM,,,,,,,,,,,,,,,,,,,,,,,,,,,,,,,,
1005295,Cecil B. Moore Farmers Market,http://thefoodtrust.org/farmers-markets/market/cecil-b-moore,http://thefoodtrust.org/farmers-markets/market/cecil-b-moore,,,,,,,,,06/01/2015 to 11/15/2015,2015-06-01,2015-11-15,Thu: 2:00 PM-6:00 PM;,Thu: 2:00 PM-6:00 PM,,,,,,,,,,,,,,,,,,,,,,,,,,,,,,,,
1003117,Cecil County Farmers Market - North East,http://www.cecilcountyag.org,http://www.cecilcountyag.org,https://www.facebook.com/CecilCountyFarmersMarket,https://www.facebook.com/CecilCountyFarmersMarket,,,,,,,05/09/2014 to 10/31/2014,2014-05-09,2014-10-31,Fri: 2:00 PM-6:00 PM;,Fri: 2:00 PM-6:00 PM,,,,,,,,,,,,,,,,,,,,,,,,,,,,,,,,
1000690,Cedar Citys Downtown Farmers Market,http://www.extension.usu.edu/ironmg,http://www.extension.usu.edu/ironmg,https://www.facebook.com/ccdowntownfarmersmarket,https://www.facebook.com/ccdowntownfarmersmarket,,,,,,,07/23/2014 to 10/08/2014,2014-07-23,2014-10-08,Wed: 4:00 PM-7:00 PM;,Wed: 4:00 PM-7:00 PM,,,,,,,,,,,,,,,,,,,,,,,,,,,,,,,,
1000115,Cedar County Farmers Market,,,,,,,,,,,,,,,,,,,,,,,,,,,,,,,,,,,,,,,,,,,,,,,
1008436,Cedar County Farmers Market-el Dorado Springs,,,,,,,,,,,04/06/2013 to 10/26/2013,2013-04-06,2013-10-26,Sat: 8:00 AM-12:00 PM;,Sat: 8:00 AM-12:00 PM,,,,,,,,,,,,,,,,,,,,,,,,,,,,,,,,
1012616,Cedar Falls Farmers Market,https://cedarfallsfarmersmarket.net/,https://cedarfallsfarmersmarket.net/,https://www.facebook.com/Cedar-Falls-Farmers-Market-116358658381830/,https://www.facebook.com/Cedar-Falls-Farmers-Market-116358658381830/,CFFarmersMkt,,,,,,05/07/2016 to 10/29/2016,2016-05-07,2016-10-29,Sat: 8:30 AM-12:00 PM;,Sat: 8:30 AM-12:00 PM,,,,,,,,,,,,,,,,,,,,,,,,,,,,,,,,
1012484,Cedar Mill Farmers Market,http://www.cedarmillfarmersmarket.org,http://www.cedarmillfarmersmarket.org,Cedar Mill Farmers market,,,,,,,,05/07/2016 to 07/30/2016,2016-05-07,2016-07-30,Sat: 8:00 AM-1:00 PM;,Sat: 8:00 AM-1:00 PM,,,,,,,,,,,,,,,,,,,,,,,,,,,,,,,,
1006003,Cedar St. Greenmarket,http://www.cenyc.org,http://www.cenyc.org,,,,,,,,,,,,,,,,,,,,,,,,,,,,,,,,,,,,,,,,,,,,,
1003488,Cedar Valley Farmers Market,http://www.doylescedarhill.com/farmers-market,http://www.doylescedarhill.com/farmers-market,https://www.facebook.com/MurphyNCFarmersMarket,https://www.facebook.com/MurphyNCFarmersMarket,,,,,,,04/05/2014 to 11/01/2014,2014-04-05,2014-11-01,Sat: 10:00 AM-2:00 PM;,Sat: 10:00 AM-2:00 PM,,,,,,,,,,,,,,,,,,,,,,,,,,,,,,,,
1002363,Cedar Valley Farmers Market I,,,,,,,,,,,,,,,,,,,,,,,,,,,,,,,,,,,,,,,,,,,,,,,
1007208,Cedarburg Farmers Market,,,,,,,,,,,,,,,,,,,,,,,,,,,,,,,,,,,,,,,,,,,,,,,
1006849,Celebration Market In Sulphur Springs,http://www.sulphurspringsfarmersmarket.com,http://www.sulphurspringsfarmersmarket.com,https://www.facebook.com/SulphurSpringsMarket,https://www.facebook.com/SulphurSpringsMarket,,,,,,,05/01/2016 to 09/24/2016,2016-05-01,2016-09-24,Sat: 6:00 PM-10:00 PM;,Sat: 6:00 PM-10:00 PM,,,,,,,,,,,,,,,,,,,,,,,,,,,,,,,,
1003361,Celebration Sunday Farmers Market,,,,,,,,,,,,,,,,,,,,,,,,,,,,,,,,,,,,,,,,,,,,,,,
1009482,Celina Farmers Market,http://www.localharvest.org/celina-farmers-market-M57899,http://www.localharvest.org/celina-farmers-market-M57899,,,,,,,,,,,,,,,,,,,,,,,,,,,,,,,,,,,,,,,,,,,,,
1011046,Celinas Friday Night Farmers Market In Historic Downtown Celina,http://www.celinanewcomersandfriends.com,http://www.celinanewcomersandfriends.com,https://www.facebook.com/pages/Celinas-Farmers-Market-Friday-Nights-on-the-Square/556953504444792?ref=hl,https://www.facebook.com/pages/Celinas-Farmers-Market-Friday-Nights-on-the-Square/556953504444792?ref=hl,,,,,,,04/24/2015 to 10/16/2015,2015-04-24,2015-10-16,Fri: 6:00 PM-9:00 PM;,Fri: 6:00 PM-9:00 PM,,,,,,,,,,,,,,,,,,,,,,,,,,,,,,,,
1004680,Centennial Lakes Farmers Market,http://www.CentennialLakesPark.com,http://www.CentennialLakesPark.com,,,,,,,,,06/12/2014 to 09/25/2014,2014-06-12,2014-09-25,Thu: 3:00 PM-7:00 PM;,Thu: 3:00 PM-7:00 PM,,,,,,,,,,,,,,,,,,,,,,,,,,,,,,,,
1001940,Center City Green Market,http://www.centercitygreenmarket.com,http://www.centercitygreenmarket.com,,,,,,,,,,,,,,,,,,,,,,,,,,,,,,,,,,,,,,,,,,,,,
2000001,Center For Design Practice - Mobile Farmers Market,http://www.realfoodfarm.org/get-food/mobilemarket/,http://www.realfoodfarm.org/get-food/mobilemarket/,https://www.facebook.com/rffpage,https://www.facebook.com/rffpage,,,,,,,,,,,,,,,,,,,,,,,,,,,,,,,,,,,,,,,,,,,
1001036,Center Market,http://www.anchoragemarkets.com,http://www.anchoragemarkets.com,,,,,,,,,,,,,,,,,,,,,,,,,,,,,,,,,,,,,,,,,,,,,
1004624,Center Point Farmers Market,,,,,,,,,,,,,,,,,,,,,,,,,,,,,,,,,,,,,,,,,,,,,,,
1004625,Center Point Parkway Market,,,,,,,,,,,,,,,,,,,,,,,,,,,,,,,,,,,,,,,,,,,,,,,
1006984,Centerponite Mall’s Farmers Market,,,,,,,,,,,,,,,,,,,,,,,,,,,,,,,,,,,,,,,,,,,,,,,
1002359,Centerville Farmers Market,,,,,,,,,,,,,,,,,,,,,,,,,,,,,,,,,,,,,,,,,,,,,,,
1005393,Centerville Farmers Market,,,,,,,,,,,,,,,,,,,,,,,,,,,,,,,,,,,,,,,,,,,,,,,
1010090,Centerville Farmers Market,http://www.centervillefarmersmarket.com,http://www.centervillefarmersmarket.com,https://www.facebook.com/pages/Centerville-Farmers-Market/185295434850051,https://www.facebook.com/pages/Centerville-Farmers-Market/185295434850051,,,,,,,05/15/2014 to 10/30/2014,2014-05-15,2014-10-30,Thu: 2:30 PM-6:30 PM;,Thu: 2:30 PM-6:30 PM,,,,,,,,,,,,,,,,,,,,,,,,,,,,,,,,
1012117,Centerville Farmers Market,,,https://www.facebook.com/Centerville-Farmers-Market-1239079762770121/,https://www.facebook.com/Centerville-Farmers-Market-1239079762770121/,,,,,,,06/18/2016 to 10/15/2016,2016-06-18,2016-10-15,Sat: 8:30 AM-12:00 PM;,Sat: 8:30 AM-12:00 PM,,,,,,,,,,,,,,,,,,,,,,,,,,,,,,,,
1012449,Centracare Health - Long Prairie Farmers Market,http://www.centracare.com/wellness/farmers-market/,http://www.centracare.com/wellness/farmers-market/,https://www.facebook.com/CentraCareHealth/,https://www.facebook.com/CentraCareHealth/,,,,,,,06/03/2016 to 10/14/2016,2016-06-03,2016-10-14,Fri: 2:00 PM-6:30 PM;,Fri: 2:00 PM-6:30 PM,,,,,,,,,,,,,,,,,,,,,,,,,,,,,,,,
1012589,Centracare Health Family Farmers Market,http://www.marketmonday.org/,http://www.marketmonday.org/,https://www.facebook.com/pages/Market-MondaySartell-Saturday-Winter-Market/204582149559040,https://www.facebook.com/pages/Market-MondaySartell-Saturday-Winter-Market/204582149559040,,,https://www.youtube.com/user/marketmondays,https://www.youtube.com/user/marketmondays,,,06/16/2016 to 10/13/2016,2016-06-16,2016-10-13,Thu: 3:00 PM-6:00 PM;,Thu: 3:00 PM-6:00 PM,,,,,,,,,,,,,,,,,,,,,,,,,,,,,,,,
1005208,Central Ave Farmers Market,http://www.farmernet.com,http://www.farmernet.com,,,,,,,,,January to December,2010-01-01,2010-12-31,Thu:10:00 am - 4:00 pm;,Thu:10:00 am - 4:00 pm,,,,,,,,,,,,,,,,,,,,,,,,,,,,,,,,
1006668,Central City Mainstreet Farmers Market,,,,,,,,,,,05/22/2014 to 10/09/2014,2014-05-22,2014-10-09,Thu: 4:00 PM-6:00 PM;,Thu: 4:00 PM-6:00 PM,,,,,,,,,,,,,,,,,,,,,,,,,,,,,,,,
1005931,Central City Market,http://www.centralcitymarket.com,http://www.centralcitymarket.com,,,,,,,,,,,,,,,,,,,,,,,,,,,,,,,,,,,,,,,,,,,,,
1003576,Central Kenai Peninsula Farmers Market,http://www.alaskaartguild.com,http://www.alaskaartguild.com,,,,,,,,,,,,,,,,,,,,,,,,,,,,,,,,,,,,,,,,,,,,,
1010399,Central Market York,http://Centralmarketyork.com,http://Centralmarketyork.com,Central Market York,,,,,,,,01/01/2014 to 12/31/2014,2014-01-01,2014-12-31,Tue: 6:00 AM-2:00 PM;Thu: 6:00 AM-2:00 PM;Sat: 6:00 AM-2:00 PM;,Tue: 6:00 AM-2:00 PM,Thu: 6:00 AM-2:00 PM,Sat: 6:00 AM-2:00 PM,,,,,,,,,,,,,,,,,,,,,,,,,,,,,,
1000352,Central Ny Regional Market,,,,,,,,,,,,,,,,,,,,,,,,,,,,,,,,,,,,,,,,,,,,,,,
1003483,Central Park Fm,,,,,,,,,,,,,,,,,,,,,,,,,,,,,,,,,,,,,,,,,,,,,,,
1009725,Central Sarasota Farmers Market,http://www.centralsarasotafarmersmarket.com,http://www.centralsarasotafarmersmarket.com,https://www.facebook.com/CentralSarasotaFarmersMarket,https://www.facebook.com/CentralSarasotaFarmersMarket,,,,,,,01/01/2014 to 12/31/2014,2014-01-01,2014-12-31,Sat: 8:00 AM-1:00 PM;,Sat: 8:00 AM-1:00 PM,,,,,,,,,,,,,,,,,,,,,,,,,,,,,,,,
1007167,Central Texas Farmers Market,,,,,,,,,,,,,,,,,,,,,,,,,,,,,,,,,,,,,,,,,,,,,,,
1001831,Central Valley Farmers Market,,,,,,,,,,,January to December,2010-01-01,2010-12-31,Sat:7:00 AM - 3:00 PM;,Sat:7:00 AM - 3:00 PM,,,,,,,,,,,,,,,,,,,,,,,,,,,,,,,,
1001832,Central Valley Farmers Market,,,,,,,,,,,January to December,2010-01-01,2010-12-31,Thu:7:00 AM - 3:00 PM;sun:7:00 AM - 3:00 PM;,Thu:7:00 AM - 3:00 PM,sun:7:00 AM - 3:00 PM,,,,,,,,,,,,,,,,,,,,,,,,,,,,,,,
1003955,Centralia Farmers Market,,,,,,,,,,,,,,,,,,,,,,,,,,,,,,,,,,,,,,,,,,,,,,,
1000799,Centreville Farmers Market,,,https://www.facebook.com/centrevillemarket,https://www.facebook.com/centrevillemarket,,,,,,,04/22/2015 to 10/31/2015,2015-04-22,2015-10-31,Wed: 2:00 PM-6:00 PM;Sat: 9:00 AM-1:00 PM;,Wed: 2:00 PM-6:00 PM,Sat: 9:00 AM-1:00 PM,,,,,,,,,,,,,,,,,,,,,,,,,,,,,,,
1011326,Centro Agropecuario De San Sebastian Puerto Rico (adea),,,,,,,,,,,,,,Fri: 12:00 AM-9:00 PM;,Fri: 12:00 AM-9:00 PM,,,,,,,,,,,,,,,,,,,,,,,,,,,,,,,,
1004151,Centura College,,,,,,,,,,,,,,,,,,,,,,,,,,,,,,,,,,,,,,,,,,,,,,,
1003440,Century City Farmers Market,http://www.ccfm.com,http://www.ccfm.com,,,,,,,,,,,,,,,,,,,,,,,,,,,,,,,,,,,,,,,,,,,,,
1002943,Ceres Farmers Market,http://www.cerespartnership.org,http://www.cerespartnership.org,,,,,,,,,,,,,,,,,,,,,,,,,,,,,,,,,,,,,,,,,,,,,
1010147,Cerritos Farmers Market,http://www.goodveg.org,http://www.goodveg.org,https://www.facebook.com/harborareafarmersmarkets,https://www.facebook.com/harborareafarmersmarkets,,,,,,,,,,Sat: 8:00 AM-12:00 PM;,Sat: 8:00 AM-12:00 PM,,,,,,,,,,,,,,,,,,,,,,,,,,,,,,,,
1011833,Certified Arkansas Farmers Market Argenta,http://www.certifiedarkansasfarmersmarket.com,http://www.certifiedarkansasfarmersmarket.com,https://m.facebook.com/Argenta-Farmers-Market-110116209028051/?ref=bookmarks,https://m.facebook.com/Argenta-Farmers-Market-110116209028051/?ref=bookmarks,,,,,,,04/02/2016 to 10/29/2016,2016-04-02,2016-10-29,Tue: 4:00 AM-;Sat: 7:00 AM-12:00 PM;,Tue: 4:00 AM-,Sat: 7:00 AM-12:00 PM,,,,,,,,,,,,,,,,,,,,,,,,,,,,,,,
1001583,Certified Arkansas Farmers Market Searcy,http://www.arkansasfood.net,http://www.arkansasfood.net,,,,,,,,,,,,,,,,,,,,,,,,,,,,,,,,,,,,,,,,,,,,,
1004042,Certified Farmers Market Old Town La Quinta,http://www.certifiedfarmersmarket.org,http://www.certifiedfarmersmarket.org,,,,,,,,,,,,,,,,,,,,,,,,,,,,,,,,,,,,,,,,,,,,,
1004929,Certified Sc Winter Farmers Market,http://www.agriculture.sc.gov,http://www.agriculture.sc.gov,,,,,,,,,November to March,2010-11-01,2010-03-31,Sat:9:00 AM - 5:00 PM;,Sat:9:00 AM - 5:00 PM,,,,,,,,,,,,,,,,,,,,,,,,,,,,,,,,
1001321,Cfm At The Promenade Mall,http://www.myfarmersmarkets.com,http://www.myfarmersmarkets.com,Promenade Mall Farmers' Market,,,,,,,,,,,Wed: 9:00 AM-1:00 PM;,Wed: 9:00 AM-1:00 PM,,,,,,,,,,,,,,,,,,,,,,,,,,,,,,,,
1009248,Cfms Certified Farmers Market,http://www.localharvest.org/cfms-certified-farmers-markets-of-sacramento-M45555,http://www.localharvest.org/cfms-certified-farmers-markets-of-sacramento-M45555,,,,,,,,,,,,,,,,,,,,,,,,,,,,,,,,,,,,,,,,,,,,,
1000891,Chadron Farmers Market,http://www.chadron.com,http://www.chadron.com,,,,,,,,,,,,,,,,,,,,,,,,,,,,,,,,,,,,,,,,,,,,,
1004645,Challis Community Farmers Market,,,ChallisCommunityFarmersMarket,,,,,,,,06/05/2015 to 10/03/2015,2015-06-05,2015-10-03,Sat: 10:00 AM-1:00 PM;,Sat: 10:00 AM-1:00 PM,,,,,,,,,,,,,,,,,,,,,,,,,,,,,,,,
1002374,Chamberlain Farmers Market,,,,,,,,,,,05/31/2014 to 09/27/2014,2014-05-31,2014-09-27,Sat: 8:00 AM-12:00 PM;,Sat: 8:00 AM-12:00 PM,,,,,,,,,,,,,,,,,,,,,,,,,,,,,,,,
1006246,Chamblee Farmers Market,http://www.chambleefarmersmarket.com,http://www.chambleefarmersmarket.com,,,,,,,,,,,,,,,,,,,,,,,,,,,,,,,,,,,,,,,,,,,,,
1008664,Champ Farmer Markets - Almaden/via Valiente Plaza,,,https://www.facebook.com/pages/CHAMP-Certified-Farmer-Markets/295246910605451,https://www.facebook.com/pages/CHAMP-Certified-Farmer-Markets/295246910605451,,,,,,,01/01/2014 to 12/31/2014,2014-01-01,2014-12-31,Wed: 12:00 PM-5:00 PM;Sun: 9:00 AM-3:00 PM;,Wed: 12:00 PM-5:00 PM,Sun: 9:00 AM-3:00 PM,,,,,,,,,,,,,,,,,,,,,,,,,,,,,,,
1012507,Champaign County Farmers Market,,,Corner of market Street and Locust Street,,,,,,,,05/07/2016 to 10/29/2016,2016-05-07,2016-10-29,Sat: 9:00 AM-12:00 PM;,Sat: 9:00 AM-12:00 PM,,,,,,,,,,,,,,,,,,,,,,,,,,,,,,,,
1005289,Champion Garden Center,,,,,,,,,,,,,,,,,,,,,,,,,,,,,,,,,,,,,,,,,,,,,,,
1001806,Champlain Islands Farmers Market,http://www.champlainislandsfarmersmarket.com,http://www.champlainislandsfarmersmarket.com,,,,,,,,,,,,Wed: 3:00 PM-6:00 PM;,Wed: 3:00 PM-6:00 PM,,,,,,,,,,,,,,,,,,,,,,,,,,,,,,,,
1010786,Champlain Islands Farmers Market,http://www.champlainislandsfarmersmarket.com,http://www.champlainislandsfarmersmarket.com,https://www.facebook.com/ChamplainIslandsFarmersMarket,https://www.facebook.com/ChamplainIslandsFarmersMarket,,,,,,,05/23/2015 to 10/03/2015,2015-05-23,2015-10-03,Sun: 10:00 AM-2:00 PM;,Sun: 10:00 AM-2:00 PM,,,,,,,,,,,,,,,,,,,,,,,,,,,,,,,,
1010787,Champlain Islands Farmers Market - South Hero,http://www.champlainislandsfarmersmarket.com/,http://www.champlainislandsfarmersmarket.com/,https://www.facebook.com/ChamplainIslandsFarmersMarket,https://www.facebook.com/ChamplainIslandsFarmersMarket,,,,,,,05/27/2015 to 09/23/2015,2015-05-27,2015-09-23,Wed: 3:00 PM-6:00 PM;,Wed: 3:00 PM-6:00 PM,,,,,,,,,,,,,,,,,,,,,,,,,,,,,,,,
1011823,Chandler Farmers Market,http://www.downtownchandler.org,http://www.downtownchandler.org,https://www.facebook.com/ChandlerFarmersMarket/,https://www.facebook.com/ChandlerFarmersMarket/,https://twitter.com/ChandlerMarket,https://twitter.com/ChandlerMarket,https://www.youtube.com/channel/UCNoeSMMSUO7PwcBxJbVpcpw,https://www.youtube.com/channel/UCNoeSMMSUO7PwcBxJbVpcpw,https://www.instagram.com/downtownchandler/,https://www.instagram.com/downtownchandler/,10/06/2016 to 04/27/2017,2016-10-06,2017-04-27,Thu: 3:00 PM-7:00 PM;,Thu: 3:00 PM-7:00 PM,,,,,,,05/04/2017 to 09/28/2017,5/4/17, 09/28/2017,Thu: 3:00 PM-7:00 PM;,Thu: 3:00 PM-7:00 PM,,,,,,,,,,,,,,,,,,,,,
1007672,Chandler Hill Farmers Market (defiance),http://www.chandlerhillvineyards.com,http://www.chandlerhillvineyards.com,,,,,,,,,May to October,2010-05-01,2010-10-31,sun:12:00 PM - 4:00 PM;,sun:12:00 PM - 4:00 PM,,,,,,,,,,,,,,,,,,,,,,,,,,,,,,,,
1005983,Channahon Farmers Market,,,,,,,,,,,June to August,2010-06-01,2010-08-31,Tue:8:30 AM - 12:30 PM;,Tue:8:30 AM - 12:30 PM,,,,,,,,,,,,,,,,,,,,,,,,,,,,,,,,
1000798,Chanute Farmers Market,,,,,,,,,,,04/20/2013 to 10/19/2013,2013-04-20,2013-10-19,Wed: 3:00 PM-6:00 PM;Sat: 8:00 AM-11:00 AM;,Wed: 3:00 PM-6:00 PM,Sat: 8:00 AM-11:00 AM,,,,,,,,,,,,,,,,,,,,,,,,,,,,,,,
1004779,Chaparral Farmers Market,,,,,,,,,,,07/12/2014 to 11/15/2014,2014-07-12,2014-11-15,Sat: 7:30 AM-11:30 AM;,Sat: 7:30 AM-11:30 AM,,,,,,,,,,,,,,,,,,,,,,,,,,,,,,,,
1002817,Chapel Hill Mall Farmers Market,,,,,,,,,,,,,,,,,,,,,,,,,,,,,,,,,,,,,,,,,,,,,,,
1004593,Chapman Food And Fitness Festival,http://www.cchaos.org,http://www.cchaos.org,https://www.facebook.com/groups/325905940864004/?fref=ts,https://www.facebook.com/groups/325905940864004/?fref=ts,,,,,,,01/01/2013 to 12/31/2013,2013-01-01,2013-12-31,Fri: 2:00 PM-5:30 PM;,Fri: 2:00 PM-5:30 PM,,,,,,,,,,,,,,,,,,,,,,,,,,,,,,,,
1009987,Chapmantown Food And Fitness Festival,,,,,,,,,,,01/01/2014 to 12/31/2014,2014-01-01,2014-12-31,Fri: 2:00 PM-6:00 PM;,Fri: 2:00 PM-6:00 PM,,,,,,,,,,,,,,,,,,,,,,,,,,,,,,,,
1002231,Chappaqua Farmers Market,http://www.chappaquafarmersmarket.org,http://www.chappaquafarmersmarket.org,https://www.facebook.com/ChappaquaFarmersMarket,https://www.facebook.com/ChappaquaFarmersMarket,https://twitter.com/chapaqquafarmersmarket,https://twitter.com/chapaqquafarmersmarket,,,,,,,,Sat: 8:30 AM-1:00 PM;,Sat: 8:30 AM-1:00 PM,,,,,,,,,,,,,,,,,,,,,,,,,,,,,,,,
1006859,Chariton Farmers Market,http://www.charitonchamber.com,http://www.charitonchamber.com,https://www.facebook.com/pages/Chariton-Area-ChamberMain-Street/140351426003653,https://www.facebook.com/pages/Chariton-Area-ChamberMain-Street/140351426003653,,,,,,,05/29/2014 to 10/01/2014,2014-05-29,2014-10-01,Thu: 5:00 PM-7:00 PM;,Thu: 5:00 PM-7:00 PM,,,,,,,,,,,,,,,,,,,,,,,,,,,,,,,,
1006941,Charlemont,,,,,,,,,,,,,,,,,,,,,,,,,,,,,,,,,,,,,,,,,,,,,,,
1002644,Charleroi Farmers Market,http://www.teamcharleroi.org,http://www.teamcharleroi.org,,,,,,,,,,,,,,,,,,,,,,,,,,,,,,,,,,,,,,,,,,,,,
1011415,Charles City Farmers Market,http://charlescitychamber.com,http://charlescitychamber.com,https://www.facebook.com/pages/Chuck-Town-Charles-City-Iowa/294931937280255?ref=hl,https://www.facebook.com/pages/Chuck-Town-Charles-City-Iowa/294931937280255?ref=hl,,,,,,,05/09/2015 to 10/17/2015,2015-05-09,2015-10-17,Wed: 3:30 PM-6:00 PM;Sat: 9:00 AM-12:00 PM;,Wed: 3:30 PM-6:00 PM,Sat: 9:00 AM-12:00 PM,,,,,,,,,,,,,,,,,,,,,,,,,,,,,,,
1004643,Charles R. Hegwood Farmers Market,http://www.biloxi.ms.us/pr,http://www.biloxi.ms.us/pr,https://www.facebook.com/pages/-Biloxi-Farmers-Market-Charles-R-Hegwood-Farmers-Market-Biloxi-MS/168392939896442,https://www.facebook.com/pages/-Biloxi-Farmers-Market-Charles-R-Hegwood-Farmers-Market-Biloxi-MS/168392939896442,,,,,,,01/01/2014 to 12/31/2014,2014-01-01,2014-12-31,,,,,,,,,,,,,,,,,,,,,,,,,,,,,,,,,,
1003099,Charles Square,,,,,,,,,,,,,,,,,,,,,,,,,,,,,,,,,,,,,,,,,,,,,,,
1007673,Charles Street Farmers Market,http://www.charlesstreetfridaymarket.com,http://www.charlesstreetfridaymarket.com,,,,,,,,,,,,,,,,,,,,,,,,,,,,,,,,,,,,,,,,,,,,,
1006290,Charles Town Farmers Market,http://www.charlestownfarmersmarket.net,http://www.charlestownfarmersmarket.net,https://www.facebook.com/pages/Charles-Town-Farmers-Market-WV/198296286944643,https://www.facebook.com/pages/Charles-Town-Farmers-Market-WV/198296286944643,,,,,,,04/12/2014 to 10/25/2014,2014-04-12,2014-10-25,Sat: 8:00 AM-12:00 PM;,Sat: 8:00 AM-12:00 PM,,,,,,,,,,,,,,,,,,,,,,,,,,,,,,,,
1012789,Charles Town Farmers Market,,,https://www.facebook.com/Charles-Town-Farmers-Market-WV-198296286944643/,https://www.facebook.com/Charles-Town-Farmers-Market-WV-198296286944643/,,,,,,,04/16/2016 to 10/29/2016,2016-04-16,2016-10-29,Sat: 8:00 AM-12:00 PM;,Sat: 8:00 AM-12:00 PM,,,,,,,,,,,,,,,,,,,,,,,,,,,,,,,,
1003250,Charleston Farmers Market,,,,,,,,,,,06/04/2014 to 10/15/2014,2014-06-04,2014-10-15,Wed: 6:00 AM-10:00 AM;,Wed: 6:00 AM-10:00 AM,,,,,,,,,,,,,,,,,,,,,,,,,,,,,,,,
1003837,Charleston Farmers Market,http://www.charlestonfarmersmarket.com,http://www.charlestonfarmersmarket.com,https://www.facebook.com/CharlestonFarmersMarket?ref=hl,https://www.facebook.com/CharlestonFarmersMarket?ref=hl,https://twitter.com/charlestonfarms,https://twitter.com/charlestonfarms,,,https://instagram.com/charlestonfarms/,https://instagram.com/charlestonfarms/,04/04/2015 to 11/28/2015,2015-04-04,2015-11-28,Sat: 8:00 AM-2:00 PM;,Sat: 8:00 AM-2:00 PM,,,,,,,12/05/2015 to 12/20/2015,12/5/15, 12/20/2015,Sat: 9:00 AM-3:00 PM;Sun: 9:00 AM-3:00 PM;,Sat: 9:00 AM-3:00 PM,Sun: 9:00 AM-3:00 PM,,,,,,,,,,,,,,,,,,,,
1008484,Charlestons Farmers Market,http://agrimissouri.com/mo-grown/grodetail.php?type=mo-grown&ID=2074,http://agrimissouri.com/mo-grown/grodetail.php?type=mo-grown&ID=2074,,,,,,,,,,,,Wed: 3:00 PM-6:00 PM;,Wed: 3:00 PM-6:00 PM,,,,,,,,,,,,,,,,,,,,,,,,,,,,,,,,
1005148,Charlestown Farmers Market,http://www.charlestownfarmersmarket.com,http://www.charlestownfarmersmarket.com,,,,,,,,,January to December,2010-01-01,2010-12-31,Sat:8:00 AM - 12:00 PM;,Sat:8:00 AM - 12:00 PM,,,,,,,,,,,,,,,,,,,,,,,,,,,,,,,,
1005149,Charlestown Farmers Market,http://www.charlestownfarmersmarket.com,http://www.charlestownfarmersmarket.com,,,,,,,,,January to December,2010-01-01,2010-12-31,Thu:2:00 PM - 6:00 PM;,Thu:2:00 PM - 6:00 PM,,,,,,,,,,,,,,,,,,,,,,,,,,,,,,,,
1007605,Charlestown Farmers Market,,,,,,,,,,,,,,,,,,,,,,,,,,,,,,,,,,,,,,,,,,,,,,,
1001682,Charlestown Land Trust Farmers’ Market,http://www.charlestownlandtrust.org/farmers_market.html,http://www.charlestownlandtrust.org/farmers_market.html,https://www.facebook.com/charlestownfarmersmarket,https://www.facebook.com/charlestownfarmersmarket,,,,,,,06/21/2013 to 08/30/2013,2013-06-21,2013-08-30,Fri: 9:30 AM-1:00 PM;,Fri: 9:30 AM-1:00 PM,,,,,,,,,,,,,,,,,,,,,,,,,,,,,,,,
1004271,Charlevoix Farmers Market,http://www.charlevoixmainstreet.org,http://www.charlevoixmainstreet.org,https://www.facebook.com/CharlevoixFarmersMarket,https://www.facebook.com/CharlevoixFarmersMarket,https://twitter.com/MChrisLeese,https://twitter.com/MChrisLeese,https://www.youtube.com/watch?v=DW6QtJYCPiU,https://www.youtube.com/watch?v=DW6QtJYCPiU,http://instagram.com/mchrisleese,http://instagram.com/mchrisleese,05/05/2016 to 10/06/2016,2016-05-05,2016-10-06,Thu: 8:00 AM-1:00 PM;,Thu: 8:00 AM-1:00 PM,,,,,,,10/13/2016 to 11/22/2016,10/13/16, 11/22/2016,Thu: 3:00 PM-6:00 PM;,Thu: 3:00 PM-6:00 PM,,,,,,,,,,,,,,,,,,,,,
1000974,Charlotte Dda Farmers Market,,,,,,,,,,,06/01/2013 to 10/26/2013,2013-06-01,2013-10-26,Sat: 8:00 AM-12:00 PM;,Sat: 8:00 AM-12:00 PM,,,,,,,,,,,,,,,,,,,,,,,,,,,,,,,,
1010687,Charlotte Harbor Farmers Market,,,,,,,,,,,11/16/2014 to 11/15/2015,2014-11-16,2015-11-15,Sun: 9:00 AM-2:00 PM;,Sun: 9:00 AM-2:00 PM,,,,,,,,,,,,,,,,,,,,,,,,,,,,,,,,
1011689,Charlotte Regional Farmers Market,http://www.charlottefarmersmarket.com,http://www.charlottefarmersmarket.com,https://www.facebook.com/CharlotteRegionalFarmersMarket,https://www.facebook.com/CharlotteRegionalFarmersMarket,,,,,,,09/01/2015 to 04/30/2016,2015-09-01,2016-04-30,Tue: 8:00 AM-5:00 PM;Wed: 8:00 AM-5:00 PM;Thu: 8:00 AM-5:00 PM;Fri: 8:00 AM-5:00 PM;Sat: 8:00 AM-5:00 PM;,Tue: 8:00 AM-5:00 PM,Wed: 8:00 AM-5:00 PM,Thu: 8:00 AM-5:00 PM,Fri: 8:00 AM-5:00 PM,Sat: 8:00 AM-5:00 PM,,,05/01/2016 to 08/31/2016,5/1/16, 08/31/2016,Tue: 8:00 AM-6:00 PM;Wed: 8:00 AM-6:00 PM;Thu: 8:00 AM-6:00 PM;Fri: 8:00 AM-6:00 PM;Sat: 8:00 AM-6:00 PM;Sun: 12:00 AM-6:00 PM;,Tue: 8:00 AM-6:00 PM,Wed: 8:00 AM-6:00 PM,Thu: 8:00 AM-6:00 PM,Fri: 8:00 AM-6:00 PM,Sat: 8:00 AM-6:00 PM,Sun: 12:00 AM-6:00 PM,,,,,,,,,,,,,,,,
1012019,Charlottesville City Market,http://www.charlottesville.org/departments-and-services/departments-h-z/parks-recreation-/city-market,http://www.charlottesville.org/departments-and-services/departments-h-z/parks-recreation-/city-market,https://www.facebook.com/CharlottesvilleCityMarket/,https://www.facebook.com/CharlottesvilleCityMarket/,,,,,,,04/02/2016 to 11/19/2016,2016-04-02,2016-11-19,Sun: 7:00 AM-12:00 PM;,Sun: 7:00 AM-12:00 PM,,,,,,,,,,,,,,,,,,,,,,,,,,,,,,,,
1003164,Chateaugay Lakes Farmers Market,http://www.adirondackfarmersmarket.com,http://www.adirondackfarmersmarket.com,,,,,,,,,06/21/2014 to 09/06/2014,2014-06-21,2014-09-06,Sat: 10:00 AM-2:00 PM;,Sat: 10:00 AM-2:00 PM,,,,,,,,,,,,,,,,,,,,,,,,,,,,,,,,
1003565,Chatham (chicago) Farmers Market,,,,,,,,,,,,,,,,,,,,,,,,,,,,,,,,,,,,,,,,,,,,,,,
1004201,Chatham Borough Farmers Market,http://www.ChathamBoroughFarmersMarket.org,http://www.ChathamBoroughFarmersMarket.org,https://www.facebook.com/Chatham-Borough-Farmers-Market-110011434705/,https://www.facebook.com/Chatham-Borough-Farmers-Market-110011434705/,,,,,https://www.instagram.com/chathamboroughfarmersmarket/,https://www.instagram.com/chathamboroughfarmersmarket/,06/11/2016 to 11/19/2016,2016-06-11,2016-11-19,Sat: 8:00 AM-1:00 PM;,Sat: 8:00 AM-1:00 PM,,,,,,,,,,,,,,,,,,,,,,,,,,,,,,,,
1005834,Chatham Farmers Market,,,,,,,,,,,05/19/2015 to 10/20/2015,2015-05-19,2015-10-20,Tue: 3:00 PM-6:30 PM;,Tue: 3:00 PM-6:30 PM,,,,,,,,,,,,,,,,,,,,,,,,,,,,,,,,
1003569,Chatham Farmers Market,,,,,,,,,,,,,,,,,,,,,,,,,,,,,,,,,,,,,,,,,,,,,,,
1000626,Chatham Mills Farmers Market,http://www.chathammillsfarmersmarket.com,http://www.chathammillsfarmersmarket.com,www.facebook.com/Chatham-Mills-Farmers-Market,,,,,,,,04/04/2015 to 09/26/2015,2015-04-04,2015-09-26,Sat: 8:00 AM-1:00 PM;,Sat: 8:00 AM-1:00 PM,,,,,,,10/03/2015 to 12/26/2015,10/3/15, 12/26/2015,Sat: 10:00 AM-1:00 PM;,Sat: 10:00 AM-1:00 PM,,,,,,,,,,,,,,,,,,,,,
1003729,Chatsworth Farmers Market,http://www.farmernet.com,http://www.farmernet.com,,,,,,,,,,,,,,,,,,,,,,,,,,,,,,,,,,,,,,,,,,,,,
1011537,Chattanooga Market,http://chattanoogamarket.com,http://chattanoogamarket.com,https://www.facebook.com/chattamarket,https://www.facebook.com/chattamarket,https://twitter.com/chattamarket,https://twitter.com/chattamarket,,,,,04/26/2015 to 11/21/2015,2015-04-26,2015-11-21,Sun: 11:00 AM-4:00 PM;,Sun: 11:00 AM-4:00 PM,,,,,,,12/05/2015 to 12/27/2015,12/5/15, 12/27/2015,Sat: 10:00 AM-5:00 PM;Sun: 11:00 AM-4:00 PM;,Sat: 10:00 AM-5:00 PM,Sun: 11:00 AM-4:00 PM,,,,,,,,,,,,,,,,,,,,
1010325,Chautauqua Mall Farmers Market,http://www.simon.com,http://www.simon.com,https://www.facebook.com/chautauquamall.com,https://www.facebook.com/chautauquamall.com,https://twitter.com/chautauquamall,https://twitter.com/chautauquamall,www.youtube.com/chautauquamall,,www.instagram.com/chautauquamall,www.instagram.com/chautauquamall,06/03/2015 to 08/26/2015,2015-06-03,2015-08-26,Wed: 11:00 AM-4:00 PM;,Wed: 11:00 AM-4:00 PM,,,,,,,,,,,,,,,,,,,,,,,,,,,,,,,,
1012273,Chazy Orchards Farm Market,http://www.chazy.com,http://www.chazy.com,https://www.facebook.com/ChazyOrchardsInc,https://www.facebook.com/ChazyOrchardsInc,,,,,,,09/06/2016 to 12/24/2016,2016-09-06,2016-12-24,Mon: 8:00 AM-5:00 PM;Tue: 8:00 AM-5:00 PM;Wed: 8:00 AM-5:00 PM;Thu: 8:00 AM-5:00 PM;Fri: 8:00 AM-5:00 PM;Sat: 8:00 AM-4:00 PM;Sun: 8:00 AM-4:00 PM;,Mon: 8:00 AM-5:00 PM,Tue: 8:00 AM-5:00 PM,Wed: 8:00 AM-5:00 PM,Thu: 8:00 AM-5:00 PM,Fri: 8:00 AM-5:00 PM,Sat: 8:00 AM-4:00 PM,Sun: 8:00 AM-4:00 PM,,,,,,,,,,,,,,,,,,,,,,,,,,
1004684,Cheboygan Farmers Market,http://www.msue.msu.edu/cheboygan,http://www.msue.msu.edu/cheboygan,,,,,,,,,,,,,,,,,,,,,,,,,,,,,,,,,,,,,,,,,,,,,
1006635,Cheery Street Farmers Market - Wednesday Market On Brookside,https://www.cherrystreetfarmersmarket.com,https://www.cherrystreetfarmersmarket.com,https://www.facebook.com/cherrystreetfarmersmarketassociation,https://www.facebook.com/cherrystreetfarmersmarketassociation,https://twitter.com/CSFMTulsa,https://twitter.com/CSFMTulsa,www.youtube.com/user/cherrystreetfarmers,,http://instagram.com/cherrystreetfarmersmarket,http://instagram.com/cherrystreetfarmersmarket,05/07/2014 to 10/15/2014,2014-05-07,2014-10-15,Wed: 7:30 AM-11:00 AM;,Wed: 7:30 AM-11:00 AM,,,,,,,11/08/2014 to 03/28/2015,11/8/14, 03/28/2015,Sat: 8:30 AM-11:00 AM;,Sat: 8:30 AM-11:00 AM,,,,,,,,,,,,,,,,,,,,,
1006231,Chelan Valley Farmers Market,,,,,,,,,,,,,,,,,,,,,,,,,,,,,,,,,,,,,,,,,,,,,,,
1004463,Chelmsford Agway Winter Farmers Market,http://chelmsfordagwayfarmersmarket.blogspot.com/,http://chelmsfordagwayfarmersmarket.blogspot.com/,https://www.facebook.com/chelmsfordagwayfarmersmarket,https://www.facebook.com/chelmsfordagwayfarmersmarket,https://twitter.com/chelmsfordagway,https://twitter.com/chelmsfordagway,,,https://www.instagram.com/chelmsfordagway/,https://www.instagram.com/chelmsfordagway/,11/05/2016 to 02/25/2017,2016-11-05,2017-02-25,Sat: 10:00 AM-2:00 PM;,Sat: 10:00 AM-2:00 PM,,,,,,,,,,,,,,,,,,,,,,,,,,,,,,,,
1009812,Chelmsford Farmers Market,,,https://www.facebook.com/chelmsfordfarmersmarket,https://www.facebook.com/chelmsfordfarmersmarket,,,,,,,06/19/2014 to 10/02/2014,2014-06-19,2014-10-02,Thu: 2:00 PM-6:30 PM;,Thu: 2:00 PM-6:30 PM,,,,,,,,,,,,,,,,,,,,,,,,,,,,,,,,
1007606,Chelsea Community Farmers Market,,,,,,,,,,,,,,,,,,,,,,,,,,,,,,,,,,,,,,,,,,,,,,,
1002601,Chelsea Farmers Market,http://www.chelseafarmersmkt.org,http://www.chelseafarmersmkt.org,https://www.facebook.com/chelseafarmersmkt?ref=hl,https://www.facebook.com/chelseafarmersmkt?ref=hl,,,,,http://www.realtimefarms.com/market/chelsea-farmers-market,http://www.realtimefarms.com/market/chelsea-farmers-market,05/04/2013 to 10/26/2013,2013-05-04,2013-10-26,Sat: 8:00 AM-12:00 PM;,Sat: 8:00 AM-12:00 PM,,,,,,,,,,,,,,,,,,,,,,,,,,,,,,,,
1004754,Chelsea Farmers Market,http://www.chelseafarmersmarket.org,http://www.chelseafarmersmarket.org,https://www.facebook.com/chelseafarmersmarket,https://www.facebook.com/chelseafarmersmarket,,,,,www.instagram.com/chelseafarmersmarket,www.instagram.com/chelseafarmersmarket,05/20/2016 to 09/30/2016,2016-05-20,2016-09-30,Fri: 3:00 PM-6:00 PM;,Fri: 3:00 PM-6:00 PM,,,,,,,,,,,,,,,,,,,,,,,,,,,,,,,,
1009894,Chelseas Down To Earth Farmers Market,http://downtoearthmarkets.com/markets?region=Manhattan&market=Chelsea+Farmers+Market,http://downtoearthmarkets.com/markets?region=Manhattan&market=Chelsea+Farmers+Market,https://www.facebook.com/DowntoEarthMarkets,https://www.facebook.com/DowntoEarthMarkets,https://twitter.com/DowntoEarthMkts,https://twitter.com/DowntoEarthMkts,,,http://downtoearthmarkets.tumblr.com/,http://downtoearthmarkets.tumblr.com/,05/21/2016 to 12/17/2016,2016-05-21,2016-12-17,Sat: 9:00 AM-5:00 PM;,Sat: 9:00 AM-5:00 PM,,,,,,,,,,,,,,,,,,,,,,,,,,,,,,,,
1000247,Chenango County Farmers Market,,,,,,,,,,,,,,,,,,,,,,,,,,,,,,,,,,,,,,,,,,,,,,,
1011319,Chenchitas Communty Farmer Market,,,,,,,,,,,07/18/2015 to 11/21/2015,2015-07-18,2015-11-21,Sat: 8:00 AM-4:00 PM;,Sat: 8:00 AM-4:00 PM,,,,,,,,,,,,,,,,,,,,,,,,,,,,,,,,
1005110,Cheney Farmers Market,http://www.cheneyfarmersmarket.com,http://www.cheneyfarmersmarket.com,,,,,,,,,06/11/2013 to 09/24/2013,2013-06-11,2013-09-24,Tue: 2:00 PM-7:00 PM;,Tue: 2:00 PM-7:00 PM,,,,,,,,,,,,,,,,,,,,,,,,,,,,,,,,
1006834,Cheney Farmers Market,,,https://www.facebook.com/cheneyfarmersmarket,https://www.facebook.com/cheneyfarmersmarket,,,,,,,05/25/2013 to 10/05/2013,2013-05-25,2013-10-05,Sat: 8:00 AM-11:00 AM;,Sat: 8:00 AM-11:00 AM,,,,,,,,,,,,,,,,,,,,,,,,,,,,,,,,
1001432,Cheraw Farmers Market,,,https://www.facebook.com/CHERAWFAMERSMARKET,https://www.facebook.com/CHERAWFAMERSMARKET,,,,,,,,,,,,,,,,,,,,,,,,,,,,,,,,,,,,,,,,,,,
1007269,Cheriton Farmers Maket,,,,,,,,,,,,,,,,,,,,,,,,,,,,,,,,,,,,,,,,,,,,,,,
1012393,Cherokee County Farmers Market,,,,,,,,,,,06/16/2016 to 10/07/2016,2016-06-16,2016-10-07,Mon: 4:00 PM-6:00 PM;Thu: 7:00 AM-10:00 AM;,Mon: 4:00 PM-6:00 PM,Thu: 7:00 AM-10:00 AM,,,,,,,,,,,,,,,,,,,,,,,,,,,,,,,
1005556,Cherokee Farmers Tailgate Market,,,,,,,,,,,,,,,,,,,,,,,,,,,,,,,,,,,,,,,,,,,,,,,
1002353,Cherokee Street International Farmers Market,http://www.cherokeemarket.org,http://www.cherokeemarket.org,https://www.facebook.com/CherokeeStreetInternationalFarmersMarket,https://www.facebook.com/CherokeeStreetInternationalFarmersMarket,https://twitter.com/STLCherokeeMkt,https://twitter.com/STLCherokeeMkt,,,,,5/23/14,2014-05-23,,Fri: 4:00 PM-7:00 PM;,Fri: 4:00 PM-7:00 PM,,,,,,,,,,,,,,,,,,,,,,,,,,,,,,,,
1008241,Cherry County Farmers Market,,,,,,,,,,,08/03/2013 to 10/26/2013,2013-08-03,2013-10-26,Sat: 8:00 AM-1:00 PM;,Sat: 8:00 AM-1:00 PM,,,,,,,,,,,,,,,,,,,,,,,,,,,,,,,,
1011055,Cherry Creek Fresh Market,http://coloradofreshmarkets.com,http://coloradofreshmarkets.com,Colorado Fresh Markets,,ColoradoFreshMarkets@COfreshmarkets,,,,,,05/02/2015 to 06/13/2015,2015-05-02,2015-06-13,Sat: 8:00 AM-1:00 PM;,Sat: 8:00 AM-1:00 PM,,,,,,,06/17/2015 to 10/03/2015,6/17/15, 10/03/2015,Wed: 9:00 AM-1:00 PM;Sat: 8:00 AM-1:00 PM;,Wed: 9:00 AM-1:00 PM,Sat: 8:00 AM-1:00 PM,,,,,,10/10/15, 10/31/2015,Sat: 8:00 AM-1:00 PM;,Sat: 8:00 AM-1:00 PM,,,,,,,,,,,
1005243,Cherry Hills Farmers Market,,,https://www.facebook.com/pages/Cherry-Hills-Farmers-Market/271647742864400,https://www.facebook.com/pages/Cherry-Hills-Farmers-Market/271647742864400,,,,,,,01/01/2014 to 12/31/2014,2014-01-01,2014-12-31,Fri: 9:00 AM-1:00 PM;,Fri: 9:00 AM-1:00 PM,,,,,,,,,,,,,,,,,,,,,,,,,,,,,,,,
1006636,Cherry Street Farmers Market,https://www.cherrystreetfarmersmarket.com,https://www.cherrystreetfarmersmarket.com,https://www.facebook.com/cherrystreetfarmersmarketassociation,https://www.facebook.com/cherrystreetfarmersmarketassociation,https://twitter.com/CSFMTulsa,https://twitter.com/CSFMTulsa,www.youtube.com/user/cherrystreetfarmers,,http://instagram.com/cherrystreetfarmersmarket,http://instagram.com/cherrystreetfarmersmarket,04/05/2014 to 10/25/2014,2014-04-05,2014-10-25,Sat: 7:00 AM-11:00 AM;,Sat: 7:00 AM-11:00 AM,,,,,,,,,,,,,,,,,,,,,,,,,,,,,,,,
1010252,Chesaning Market Off Broad,http://www.broadstreetevents.org,http://www.broadstreetevents.org,https://www.facebook.com/bsechesaning,https://www.facebook.com/bsechesaning,,,,,,,07/23/2016 to 10/15/2016,2016-07-23,2016-10-15,Sat: 9:00 AM-1:00 PM;,Sat: 9:00 AM-1:00 PM,,,,,,,,,,,,,,,,,,,,,,,,,,,,,,,,
1005700,Chesapeake Farmers Market,,,https://www.facebook.com/farmtrails,https://www.facebook.com/farmtrails,,,,,,,June to November,2010-06-01,2010-11-30,Wed:8:00 AM - 1:00 PM;Sat:8:00 AM - 1:00 PM;,Wed:8:00 AM - 1:00 PM,Sat:8:00 AM - 1:00 PM,,,,,,,,,,,,,,,,,,,,,,,,,,,,,,,
1002216,Chester Farmers Market,http://www.howard-county.com,http://www.howard-county.com,,,,,,,,,,,,,,,,,,,,,,,,,,,,,,,,,,,,,,,,,,,,,
1003676,Chester Farmers Market,,,,,,,,,,,May to October,2010-05-01,2010-10-31,sun:11:00 am - 2:00 pm;,sun:11:00 am - 2:00 pm,,,,,,,,,,,,,,,,,,,,,,,,,,,,,,,,
1005339,Chester Farmers Market,http://www.chesterfarmersmarket.com/,http://www.chesterfarmersmarket.com/,,,,,,,,,04/04/2015 to 09/19/2015,2015-04-04,2015-09-19,Sat: 8:30 AM-12:30 PM;,Sat: 8:30 AM-12:30 PM,,,,,,,,,,,,,,,,,,,,,,,,,,,,,,,,
1005515,Chester Farmers Market,http://www.chesternjfarmersmarket.org,http://www.chesternjfarmersmarket.org,https://www.facebook.com/pages/Chester-NJ-Farmers-Market/611841392173324,https://www.facebook.com/pages/Chester-NJ-Farmers-Market/611841392173324,,,,,,,06/22/2014 to 10/05/2014,2014-06-22,2014-10-05,Sun: 10:00 AM-3:00 PM;,Sun: 10:00 AM-3:00 PM,,,,,,,,,,,,,,,,,,,,,,,,,,,,,,,,
1007674,Chester Sunday Farmers’ Market,http://www.chestersundaymarket.com,http://www.chestersundaymarket.com,,,,,,,,,,,,,,,,,,,,,,,,,,,,,,,,,,,,,,,,,,,,,
1008606,Chesterfield County Farmers Market,,,https://www.facebook.com/CFitFarmersMarket,https://www.facebook.com/CFitFarmersMarket,,,,,,,05/20/2015 to 09/16/2015,2015-05-20,2015-09-16,Wed: 3:00 PM-6:00 PM;,Wed: 3:00 PM-6:00 PM,,,,,,,,,,,,,,,,,,,,,,,,,,,,,,,,
1003022,Chesterfield Farmers Market,http://www.chesterfieldfarmersmarket.blogspot.com,http://www.chesterfieldfarmersmarket.blogspot.com,,,,,,,,,May to October,2010-05-01,2010-10-31,Tue:10:00 AM - 6:00 PM;Wed:10:00 AM - 6:00 PM;Thu:10:00 AM - 6:00 PM;Fri:10:00 AM - 6:00 PM;Sat:8:00 AM - 4:00 PM;,Tue:10:00 AM - 6:00 PM,Wed:10:00 AM - 6:00 PM,Thu:10:00 AM - 6:00 PM,Fri:10:00 AM - 6:00 PM,Sat:8:00 AM - 4:00 PM,,,November to April,November , April,Tue:10:00 AM - 6:00 PM;Wed:10:00 AM - 6:00 PM;Thu:10:00 AM - 6:00 PM;Thu:10:00 AM - 6:00 PM;Fri:10:00 AM - 6:00 PM;Sat:10:00 AM - 6:00 PM;,Tue:10:00 AM - 6:00 PM,Wed:10:00 AM - 6:00 PM,Thu:10:00 AM - 6:00 PM,Thu:10:00 AM - 6:00 PM,Fri:10:00 AM - 6:00 PM,Sat:10:00 AM - 6:00 PM,,,,,,,,,,,,,,,,
1004611,Chestertons European Market,http://www.chestertonseuropeanmarket.com,http://www.chestertonseuropeanmarket.com,,,,,,,,,May to October,2010-05-01,2010-10-31,Sat:8:00 AM - 2:00 PM;,Sat:8:00 AM - 2:00 PM,,,,,,,,,,,,,,,,,,,,,,,,,,,,,,,,
1000944,Chestertown Farmers Market,http://www.chestertownfarmersmarket.com,http://www.chestertownfarmersmarket.com,https://www.facebook.com/chestertownfarmersmarket,https://www.facebook.com/chestertownfarmersmarket,,,,,,,06/18/2014 to 09/24/2014,2014-06-18,2014-09-24,Wed: 10:00 AM-2:00 PM;,Wed: 10:00 AM-2:00 PM,,,,,,,,,,,,,,,,,,,,,,,,,,,,,,,,
1002187,Chestertown Farmers Market,http://www.chestertown.com/market/index.php,http://www.chestertown.com/market/index.php,https://www.facebook.com/ChestertownFarmersMarketMD,https://www.facebook.com/ChestertownFarmersMarketMD,,,,,,,01/01/2014 to 04/01/2014,2014-01-01,2014-04-01,Sat: 8:00 AM-12:00 PM;,Sat: 8:00 AM-12:00 PM,,,,,,,,,,,,,,,,,,,,,,,,,,,,,,,,
1008483,Chestnut Hill Farmers Market,http://www.farmtocity.org/FarmersMarkets.asp,http://www.farmtocity.org/FarmersMarkets.asp,https://www.facebook.com/ChestnutHillFarmersMarket/,https://www.facebook.com/ChestnutHillFarmersMarket/,https://twitter.com/FarmtoCity,https://twitter.com/FarmtoCity,,,,,01/01/2016 to 12/31/2016,2016-01-01,2016-12-31,Sat: 9:30 AM-1:30 PM;,Sat: 9:30 AM-1:30 PM,,,,,,,,,,,,,,,,,,,,,,,,,,,,,,,,
1002874,Cheverly Community Market,http://www.cheverlycommunitymarket.com,http://www.cheverlycommunitymarket.com,https://www.facebook.com/pages/Cheverly-Community-Market/341178705916835,https://www.facebook.com/pages/Cheverly-Community-Market/341178705916835,https://twitter.com/cheverlymarket,https://twitter.com/cheverlymarket,,,http://www.cheverlycommunitymarket.blogspot.com,http://www.cheverlycommunitymarket.blogspot.com,,,,,,,,,,,,,,,,,,,,,,,,,,,,,,,,,,,,,
1005302,Chew And E. Pleasant Farmers Market,http://thefoodtrust.org/farmers-markets/market/chew-and-east-pleasant,http://thefoodtrust.org/farmers-markets/market/chew-and-east-pleasant,,,,,,,,,06/01/2015 to 11/15/2015,2015-06-01,2015-11-15,Wed: 2:00 PM-6:00 PM;,Wed: 2:00 PM-6:00 PM,,,,,,,,,,,,,,,,,,,,,,,,,,,,,,,,
1012146,Chewelah Farmers Market,http://www.chewelahfarmersmarket.com,http://www.chewelahfarmersmarket.com,Chewelah Farmers Market,,,,,,,,05/13/2016 to 10/28/2016,2016-05-13,2016-10-28,Fri: 11:30 AM-5:30 PM;,Fri: 11:30 AM-5:30 PM,,,,,,,,,,,,,,,,,,,,,,,,,,,,,,,,
1002241,Cheyenne County Farmers Market,,,,,,,,,,,,,,,,,,,,,,,,,,,,,,,,,,,,,,,,,,,,,,,
1010203,Cheyenne Farmers Market,http://www.calc.net,http://www.calc.net,https://www.facebook.com/CheyenneFarmersMarket,https://www.facebook.com/CheyenneFarmersMarket,,,,,,,08/02/2014 to 10/04/2014,2014-08-02,2014-10-04,Sat: 7:30 AM-1:00 PM;,Sat: 7:30 AM-1:00 PM,,,,,,,,,,,,,,,,,,,,,,,,,,,,,,,,
1009643,Cheyenne Tuesday Farmers Market,http://www.tuesdaymarket.org,http://www.tuesdaymarket.org,https://www.facebook.com/cheyennetuesday.farmersmarket,https://www.facebook.com/cheyennetuesday.farmersmarket,,,,,,,06/24/2014 to 10/13/2015,2014-06-24,2015-10-13,Tue: 3:00 PM-6:30 PM;,Tue: 3:00 PM-6:30 PM,,,,,,,,,,,,,,,,,,,,,,,,,,,,,,,,
1003524,Cheyenne Winter Farmers Market,,,https://www.facebook.com/Cheyennewintermarket,https://www.facebook.com/Cheyennewintermarket,,,,,,,01/01/2015 to 12/31/2015,2015-01-01,2015-12-31,Sat: 10:00 AM-2:00 PM;,Sat: 10:00 AM-2:00 PM,,,,,,,,,,,,,,,,,,,,,,,,,,,,,,,,
1009159,Cheyennes Road Market,http://www.localharvest.org/cheyennes-road-market-M36408,http://www.localharvest.org/cheyennes-road-market-M36408,,,,,,,,,,,,,,,,,,,,,,,,,,,,,,,,,,,,,,,,,,,,,
1009499,Cheyennes Country Thangs,http://www.cheyennescountrythangsinc.com/,http://www.cheyennescountrythangsinc.com/,,,,,,,,,,,,,,,,,,,,,,,,,,,,,,,,,,,,,,,,,,,,,
1000561,Chicago Heights Corner Market,http://www.chcornermarket.com,http://www.chcornermarket.com,https://www.facebook.com/pages/Chicago-Heights-Corner-Market/126181414128350,https://www.facebook.com/pages/Chicago-Heights-Corner-Market/126181414128350,,,,,,,06/07/2014 to 09/27/2014,2014-06-07,2014-09-27,Sat: 9:00 AM-1:00 PM;,Sat: 9:00 AM-1:00 PM,,,,,,,,,,,,,,,,,,,,,,,,,,,,,,,,
1004401,Chicago Street Farmers Market,http://www.visitfoley.org,http://www.visitfoley.org,https://www.facebook.com/VisitFoley,https://www.facebook.com/VisitFoley,,,,,,,05/03/2013 to 06/28/2013,2013-05-03,2013-06-28,Fri: 3:00 PM-6:00 PM;,Fri: 3:00 PM-6:00 PM,,,,,,,,,,,,,,,,,,,,,,,,,,,,,,,,
1012379,Chicago-nettelhorst French Market,http://www.bensidounmidwestmarkets.com/,http://www.bensidounmidwestmarkets.com/,facebook.com/Nettelhorstfrenchmarket,,https://twitter.com/BensidounMarket,https://twitter.com/BensidounMarket,,,https://www.instagram.com/bensidounfrenchmarket/,https://www.instagram.com/bensidounfrenchmarket/,04/23/2016 to 11/05/2016,2016-04-23,2016-11-05,Sat: 8:00 AM-2:00 PM;,Sat: 8:00 AM-2:00 PM,,,,,,,,,,,,,,,,,,,,,,,,,,,,,,,,
1001261,Chickasha Farmers Market,,,https://www.facebook.com/ChickashaFarmersMarket,https://www.facebook.com/ChickashaFarmersMarket,,,,,,,05/02/2013 to 10/31/2013,2013-05-02,2013-10-31,Tue: 7:00 AM-12:00 PM;Thu: 4:00 PM-7:00 PM;Sat: 7:00 AM-12:00 PM;,Tue: 7:00 AM-12:00 PM,Thu: 4:00 PM-7:00 PM,Sat: 7:00 AM-12:00 PM,,,,,,,,,,,,,,,,,,,,,,,,,,,,,,
1001989,Chico Cfm In Paradise,,,,,,,,,,,,,,,,,,,,,,,,,,,,,,,,,,,,,,,,,,,,,,,
1000531,Chico Wednesday Farmers Market,,,,,,,,,,,,,,,,,,,,,,,,,,,,,,,,,,,,,,,,,,,,,,,
1004079,Chicopee Farmers Market,,,,,,,,,,,07/03/2013 to 09/04/2013,2013-07-03,2013-09-04,Wed: 10:30 AM-2:30 PM;,Wed: 10:30 AM-2:30 PM,,,,,,,,,,,,,,,,,,,,,,,,,,,,,,,,
1003878,Childrens Hospital Farmers Market,http://www.iatp.org/minimarkets,http://www.iatp.org/minimarkets,,,,,,,,,June to September,2010-06-01,2010-09-30,Wed:10:30 am - 2:00 pm;,Wed:10:30 am - 2:00 pm,,,,,,,,,,,,,,,,,,,,,,,,,,,,,,,,
1007752,Chilhowee Main Street Farmers Market,http://www.mainstreetfarmersmarket.webs.com,http://www.mainstreetfarmersmarket.webs.com,,,,,,,,,May to November,2010-05-01,2010-11-30,Sat:8:00 AM - 12:00 PM;,Sat:8:00 AM - 12:00 PM,,,,,,,,,,,,,,,,,,,,,,,,,,,,,,,,
1001763,Chilhowie Farmers Market,http://www.chilhowie.org,http://www.chilhowie.org,,,,,,,,,04/17/2014 to 10/23/2014,2014-04-17,2014-10-23,Thu: 3:00 PM-6:00 PM;,Thu: 3:00 PM-6:00 PM,,,,,,,,,,,,,,,,,,,,,,,,,,,,,,,,
1007297,Chili Farmers Market,,,https://www.facebook.com/pages/Airport-Farmers-and-Flea-Market/212219902247327,https://www.facebook.com/pages/Airport-Farmers-and-Flea-Market/212219902247327,,,,,,,,,,,,,,,,,,,,,,,,,,,,,,,,,,,,,,,,,,,
1001701,Chillicothe Farmers Market,,,https://www.facebook.com/chillicothefarmersmarketmo?ref=hl,https://www.facebook.com/chillicothefarmersmarketmo?ref=hl,,,,,,,05/07/2016 to 10/29/2016,2016-05-07,2016-10-29,Sat: 8:00 AM-12:00 PM;,Sat: 8:00 AM-12:00 PM,,,,,,,,,,,,,,,,,,,,,,,,,,,,,,,,
1010226,Chillicothe Farmers Market Association,http://www.chillicothefarmersmarket.org,http://www.chillicothefarmersmarket.org,https://www.facebook.com/#!/ChillicotheFarmersMarket,,,,,,,,,,,Sat: 8:00 AM-12:00 PM;,Sat: 8:00 AM-12:00 PM,,,,,,,,,,,,,,,,,,,,,,,,,,,,,,,,
1007057,Chiloquin Farm And Craft Market,,,,,,,,,,,,,,,,,,,,,,,,,,,,,,,,,,,,,,,,,,,,,,,
1002160,Chilton Farmers Market,,,,,,,,,,,June to October,2010-06-01,2010-10-31,Fri:12:00 PM - 5:00 PM;,Fri:12:00 PM - 5:00 PM,,,,,,,,,,,,,,,,,,,,,,,,,,,,,,,,
1005739,Chimacum Farmers Market,http://www.chimacum.org,http://www.chimacum.org,,,,,,,,,,,,,,,,,,,,,,,,,,,,,,,,,,,,,,,,,,,,,
1009284,Chimney Rock Farms,http://www.chimneyrockfarms.com/,http://www.chimneyrockfarms.com/,,,,,,,,,,,,,,,,,,,,,,,,,,,,,,,,,,,,,,,,,,,,,
1001590,China Grove Farmers Market,http://www.hist-society-srowan.com,http://www.hist-society-srowan.com,,,,,,,,,05/03/2013 to 09/27/2013,2013-05-03,2013-09-27,Fri: 4:00 PM-7:00 PM;,Fri: 4:00 PM-7:00 PM,,,,,,,,,,,,,,,,,,,,,,,,,,,,,,,,
1000877,Chincoteague Island Farmers Market,http://www.chincoteagueculturalalliance.org,http://www.chincoteagueculturalalliance.org,,,,,,,,,04/12/2014 to 10/25/2014,2014-04-12,2014-10-25,Wed: 8:00 AM-12:00 PM;Sat: 8:00 AM-12:00 PM;,Wed: 8:00 AM-12:00 PM,Sat: 8:00 AM-12:00 PM,,,,,,09/01/2011 to 10/31/2011,9/1/11, 10/31/2011,,,,,,,,,,,,,,,,,,,,,,,
1001499,Chino Cfm,,,,,,,,,,,,,,,,,,,,,,,,,,,,,,,,,,,,,,,,,,,,,,,
1000316,Chino Valley Farmers Market,http://prescottfarmersmarket.org/,http://prescottfarmersmarket.org/,https://www.facebook.com/prescottfarmersmarket,https://www.facebook.com/prescottfarmersmarket,https://twitter.com/prescottfarmers,https://twitter.com/prescottfarmers,,,http://instagram.com/prescottfarmersmarket,http://instagram.com/prescottfarmersmarket,06/04/2015 to,2015-06-04,,Thu: 3:00 PM-6:00 PM;,Thu: 3:00 PM-6:00 PM,,,,,,,,,,,,,,,,,,,,,,,,,,,,,,,,
1003596,Chipley Farmers Market,,,,,,,,,,,,,,,,,,,,,,,,,,,,,,,,,,,,,,,,,,,,,,,
1008409,Chippewa Falls Farmers Market,http://www.chippewafallsmainst.org/Farmers_Market.html,http://www.chippewafallsmainst.org/Farmers_Market.html,,,,,,,,,06/06/2013 to 10/17/2013,2013-06-06,2013-10-17,Thu: 12:00 PM-5:30 PM;,Thu: 12:00 PM-5:30 PM,,,,,,,,,,,,,,,,,,,,,,,,,,,,,,,,
1009309,Chippewa Farmers Market,http://www.localharvest.org/chippewa-farmers-market-M57814,http://www.localharvest.org/chippewa-farmers-market-M57814,,,,,,,,,,,,,,,,,,,,,,,,,,,,,,,,,,,,,,,,,,,,,
1000886,Chisago City Farmers Market,http://www.chisagocityfarmersmarket.com,http://www.chisagocityfarmersmarket.com,https://www.facebook.com/chisagocityfarmersmarket,https://www.facebook.com/chisagocityfarmersmarket,https://twitter.com/ChisagoCFarmersMkt,https://twitter.com/ChisagoCFarmersMkt,https://instagram.com/ChisagoCityFarmersMarket/,https://instagram.com/ChisagoCityFarmersMarket/,,,05/20/2016 to 10/28/2016,2016-05-20,2016-10-28,Fri: 2:00 PM-6:30 PM;,Fri: 2:00 PM-6:30 PM,,,,,,,,,,,,,,,,,,,,,,,,,,,,,,,,
1009755,Choctaw County Farmers Market,,,,,,,,,,,06/07/2014 to,2014-06-07,,,,,,,,,,,,,,,,,,,,,,,,,,,,,,,,,,,
1003015,Chowchilla Farmers Market,,,,,,,,,,,,,,,,,,,,,,,,,,,,,,,,,,,,,,,,,,,,,,,
1004972,"Christian ""shan"" Hendricks Vegetable Market",,,,,,,,,,,,,,,,,,,,,,,,,,,,,,,,,,,,,,,,,,,,,,,
1010704,Christian County Farmers Market,http://agrimissouri.com/mo-grown/grodetail.php?type=mo-grown&ID=584,http://agrimissouri.com/mo-grown/grodetail.php?type=mo-grown&ID=584,,,,,,,,,04/03/2014 to 10/30/2014,2014-04-03,2014-10-30,Thu: 5:00 PM-8:00 PM;,Thu: 5:00 PM-8:00 PM,,,,,,,,,,,,,,,,,,,,,,,,,,,,,,,,
1011161,Christiansburg Farmers Market,http://www.christiansburg.org/farmersmarket,http://www.christiansburg.org/farmersmarket,http://www.facebook.com/ChristiansburgFarmersMarket,http://www.facebook.com/ChristiansburgFarmersMarket,,,,,,,05/07/2015 to 10/15/2015,2015-05-07,2015-10-15,Thu: 3:00 PM-7:00 PM;,Thu: 3:00 PM-7:00 PM,,,,,,,,,,,,,,,,,,,,,,,,,,,,,,,,
1000578,Chubbuck Farmers Market,http://www.chubbuckfarmersmarket.com,http://www.chubbuckfarmersmarket.com,,,,,,,,,,,,,,,,,,,,,,,,,,,,,,,,,,,,,,,,,,,,,
1003227,Chula Vista Farmers Market,,,,,,,,,,,,,,,,,,,,,,,,,,,,,,,,,,,,,,,,,,,,,,,
1004650,Chula Vista Otay Ranch Certified Farmers Market,http://www.otayranchtowncenter.com,http://www.otayranchtowncenter.com,,,,,,,,,,,,,,,,,,,,,,,,,,,,,,,,,,,,,,,,,,,,,
1012610,Church + Main Market,http://churchmain.com,http://churchmain.com,,,,,,,,,09/03/2016 to 12/31/2016,2016-09-03,2016-12-31,Mon: 8:00 AM-12:00 PM;,Mon: 8:00 AM-12:00 PM,,,,,,,,,,,,,,,,,,,,,,,,,,,,,,,,
1003966,Church Run Farmers Market,,,,,,,,,,,,,,,,,,,,,,,,,,,,,,,,,,,,,,,,,,,,,,,
1004360,Church Street Farmers Market,,,,,,,,,,,05/04/2013 to 10/26/2013,2013-05-04,2013-10-26,Wed: 8:00 AM-12:00 PM;Sat: 8:00 AM-12:00 PM;,Wed: 8:00 AM-12:00 PM,Sat: 8:00 AM-12:00 PM,,,,,,,,,,,,,,,,,,,,,,,,,,,,,,,
1011307,Cibolo Grange Farmers Market,,,https://www.facebook.com/CiboloGrangeFarmersMarket,https://www.facebook.com/CiboloGrangeFarmersMarket,,,,,,,01/01/2015 to 12/31/2015,2015-01-01,2015-12-31,Thu: 2:00 PM-6:00 PM;,Thu: 2:00 PM-6:00 PM,,,,,,,,,,,,,,,,,,,,,,,,,,,,,,,,
1000704,Cicero Farmers Market,,,,,,,,,,,,,,,,,,,,,,,,,,,,,,,,,,,,,,,,,,,,,,,
1011042,Cicero Farmers Market,http://www.nopl.org/cicero-farmers-market/,http://www.nopl.org/cicero-farmers-market/,https://www.facebook.com/CiceroFarmersMarketCNY?fref=ts,https://www.facebook.com/CiceroFarmersMarketCNY?fref=ts,,,,,,,05/26/2015 to 09/08/2015,2015-05-26,2015-09-08,Tue: 3:00 PM-7:00 PM;,Tue: 3:00 PM-7:00 PM,,,,,,,,,,,,,,,,,,,,,,,,,,,,,,,,
1006360,Cincinnatus Farmers Market,,,,,,,,,,,,,,,,,,,,,,,,,,,,,,,,,,,,,,,,,,,,,,,
1006613,Circle Farmers Market,,,,,,,,,,,,,,,,,,,,,,,,,,,,,,,,,,,,,,,,,,,,,,,
1001334,Circle Square Commons Farmers Market,http://www.circlesquarecommonsfarmersmarket.com,http://www.circlesquarecommonsfarmersmarket.com,,,,,,,,,,,,,,,,,,,,,,,,,,,,,,,,,,,,,,,,,,,,,
1002809,City Centre Market,,,,,,,,,,,,,,,,,,,,,,,,,,,,,,,,,,,,,,,,,,,,,,,
1007101,City County Building Farmers Market,,,,,,,,,,,,,,,,,,,,,,,,,,,,,,,,,,,,,,,,,,,,,,,
1009474,City Farmers Market Fair Haven,http://www.cityseed.org/,http://www.cityseed.org/,,,,,,,,,,,,,,,,,,,,,,,,,,,,,,,,,,,,,,,,,,,,,
1004177,City Hall Farmers Market,,,,,,,,,,,January to December,2010-01-01,2010-12-31,Wed:12:00 pm - 0:00 pm;,Wed:12:00 pm - 0:00 pm,,,,,,,,,,,,,,,,,,,,,,,,,,,,,,,,
1001485,City Hall Farmers Market,http://www.houstontx.gov/specialevents/,http://www.houstontx.gov/specialevents/,,,,,,,,,,,,,,,,,,,,,,,,,,,,,,,,,,,,,,,,,,,,,
1007218,City Hall Farmers Market,,,,,,,,,,,,,,,,,,,,,,,,,,,,,,,,,,,,,,,,,,,,,,,
1000067,City Hall Park Greenmarket,http://www.grownyc.org,http://www.grownyc.org,https://www.facebook.com/ManhattanGreenmarkets,https://www.facebook.com/ManhattanGreenmarkets,,,,,,,03/12/2013 to 12/24/2013,2013-03-12,2013-12-24,Tue: 8:00 AM-4:00 PM;Fri: 8:00 AM-4:00 PM;,Tue: 8:00 AM-4:00 PM,Fri: 8:00 AM-4:00 PM,,,,,,,,,,,,,,,,,,,,,,,,,,,,,,,
1005250,City Hall Parking Lot Deck (peoples Open Market),http://www.honolulu.gov/parks/programs/pom,http://www.honolulu.gov/parks/programs/pom,,,,,,,,,01/01/2015 to 12/31/2015,2015-01-01,2015-12-31,Mon: 11:30 AM-12:30 PM;,Mon: 11:30 AM-12:30 PM,,,,,,,,,,,,,,,,,,,,,,,,,,,,,,,,
1004051,City Hall Plaza Farmers Market,http://www.downtownnashua.org/?page_id=58,http://www.downtownnashua.org/?page_id=58,,,,,,,,,June to September,2010-06-01,2010-09-30,Fri:12:00 PM - 6:00 PM;,Fri:12:00 PM - 6:00 PM,,,,,,,,,,,,,,,,,,,,,,,,,,,,,,,,
1010123,City Heights Certified Farmers Market,http://www.sdfarmbureau.org,http://www.sdfarmbureau.org,https://www.facebook.com/CityHeightsFarmersMarket,https://www.facebook.com/CityHeightsFarmersMarket,,,,,,,01/01/2016 to 12/31/2016,2016-01-01,2016-12-31,Sat: 9:00 AM-1:00 PM;,Sat: 9:00 AM-1:00 PM,,,,,,,,,,,,,,,,,,,,,,,,,,,,,,,,
1000246,City Market,http://www.webrewstarbucks.com/CityMarket.html,http://www.webrewstarbucks.com/CityMarket.html,,,,,,,,,,,,,,,,,,,,,,,,,,,,,,,,,,,,,,,,,,,,,
1011386,City Market - Kansas City - Winter Market,http://www.thecitymarket.org,http://www.thecitymarket.org,,,,,,,,,11/01/2015 to 02/29/2016,2015-11-01,2016-02-29,Sat: 7:00 AM-3:00 PM;Sun: 8:00 AM-3:00 PM;,Sat: 7:00 AM-3:00 PM,Sun: 8:00 AM-3:00 PM,,,,,,,,,,,,,,,,,,,,,,,,,,,,,,,
1012712,City Market Kansas City- Year-round,http://thecitymarket.org,http://thecitymarket.org,https://www.facebook.com/TheCityMarketKansasCity/,https://www.facebook.com/TheCityMarketKansasCity/,https://twitter.com/TheCityMarketKC,https://twitter.com/TheCityMarketKC,https://www.youtube.com/user/citymarketkansascity,https://www.youtube.com/user/citymarketkansascity,,,,,,Sat: 7:00 AM-3:00 PM;Sun: 7:00 AM-3:00 PM;,Sat: 7:00 AM-3:00 PM,Sun: 7:00 AM-3:00 PM,,,,,,05/11/2016 to 09/28/2016,5/11/16, 09/28/2016,Wed: 4:00 PM-7:00 PM;,Wed: 4:00 PM-7:00 PM,,,,,,,,,,,,,,,,,,,,,
1004302,City Of Albertville Farmers Market,http://www.cityofalbertville.com,http://www.cityofalbertville.com,,,,,,,,,04/01/2013 to 10/31/2013,2013-04-01,2013-10-31,,,,,,,,,,,,,,,,,,,,,,,,,,,,,,,,,,
1000354,City Of Au Gres Downtown Farmers Market,,,,,,,,,,,,,,,,,,,,,,,,,,,,,,,,,,,,,,,,,,,,,,,
1008616,City Of Barnwell Farmers Market,http://www.cityofbarnwell.com,http://www.cityofbarnwell.com,https://www.facebook.com/pages/City-of-Barnwell-Parks-Recreation-Department/210794655667183,https://www.facebook.com/pages/City-of-Barnwell-Parks-Recreation-Department/210794655667183,,,,,,,05/27/2014 to 10/04/2014,2014-05-27,2014-10-04,Tue: 8:00 AM-2:00 PM;Sat: 8:00 AM-2:00 PM;,Tue: 8:00 AM-2:00 PM,Sat: 8:00 AM-2:00 PM,,,,,,,,,,,,,,,,,,,,,,,,,,,,,,,
1003086,City Of Cortland Farmers Market,,,,,,,,,,,,,,,,,,,,,,,,,,,,,,,,,,,,,,,,,,,,,,,
1005809,City Of Cuba,,,,,,,,,,,06/04/2014 to 10/29/2014,2014-06-04,2014-10-29,Wed: 7:00 AM-12:00 PM;Sun: 12:00 PM-;,Wed: 7:00 AM-12:00 PM,Sun: 12:00 PM-,,,,,,,,,,,,,,,,,,,,,,,,,,,,,,,
1010079,City Of Evans Farmers Market,http://www.evanscolorado.gov,http://www.evanscolorado.gov,https://www.facebook.com/cityofevans,https://www.facebook.com/cityofevans,,,,,,,,,,,,,,,,,,,,,,,,,,,,,,,,,,,,,,,,,,,
1012088,City Of Everett Farmers Market,http://Www.cityofeverett.com,http://Www.cityofeverett.com,,,,,,,,,06/15/2016 to 10/19/2016,2016-06-15,2016-10-19,Wed: 12:00 PM-6:00 PM;,Wed: 12:00 PM-6:00 PM,,,,,,,,,,,,,,,,,,,,,,,,,,,,,,,,
1000921,City Of Galax Farmers Market,,,,,,,,,,,,,,,,,,,,,,,,,,,,,,,,,,,,,,,,,,,,,,,
1009000,City Of Galax Farmers Market,http://www.galaxfarmersmarket.com,http://www.galaxfarmersmarket.com,https://www.facebook.com/pages/Galax-Farmers-Market/436987119716502,https://www.facebook.com/pages/Galax-Farmers-Market/436987119716502,,,,,,,05/17/2013 to 10/04/2013,2013-05-17,2013-10-04,Fri: 8:00 AM-1:00 PM;Sat: 8:00 AM-12:00 PM;,Fri: 8:00 AM-1:00 PM,Sat: 8:00 AM-12:00 PM,,,,,,,,,,,,,,,,,,,,,,,,,,,,,,,
1005719,City Of Grand Blanc Farmers Market,http://www.cityofgrandblanc.com/NewsEvents/FarmersMarket/tabid/5439/Default.aspx,http://www.cityofgrandblanc.com/NewsEvents/FarmersMarket/tabid/5439/Default.aspx,https://www.facebook.com/grandblanc.farmersmarket,https://www.facebook.com/grandblanc.farmersmarket,https://twitter.com/GBFarmersMarket,https://twitter.com/GBFarmersMarket,,,,,05/18/2014 to 10/26/2014,2014-05-18,2014-10-26,Wed: 4:00 PM-7:00 PM;Sun: 10:00 AM-3:00 PM;,Wed: 4:00 PM-7:00 PM,Sun: 10:00 AM-3:00 PM,,,,,,,,,,,,,,,,,,,,,,,,,,,,,,,
1001680,City Of Grayling Farm Market,http://www.cityofgrayling.org,http://www.cityofgrayling.org,,,,,,,,,June to October,2010-06-01,2010-10-31,Sat:9:00 AM - 1:00 PM;,Sat:9:00 AM - 1:00 PM,,,,,,,,,,,,,,,,,,,,,,,,,,,,,,,,
1001681,City Of Grayling Farm Market,http://www.cityofgrayling.org,http://www.cityofgrayling.org,,,,,,,,,May to September,2010-05-01,2010-09-30,Thu:2:00 PM - 6:00 PM;,Thu:2:00 PM - 6:00 PM,,,,,,,,,,,,,,,,,,,,,,,,,,,,,,,,
1001234,City Of Gulfport Farmers Market,,,,,,,,,,,,,,,,,,,,,,,,,,,,,,,,,,,,,,,,,,,,,,,
1008416,City Of Holyoke Farmers Market,,,https://www.facebook.com/HolyokeFarmersMarket,https://www.facebook.com/HolyokeFarmersMarket,https://twitter.com/holyokemarket,https://twitter.com/holyokemarket,,,Instagram @holyokemarket,http://www.instagram.com/holyokemarket,05/02/2013 to 10/31/2013,2013-05-02,2013-10-31,Thu: 11:00 AM-3:00 PM;,Thu: 11:00 AM-3:00 PM,,,,,,,,,,,,,,,,,,,,,,,,,,,,,,,,
1003131,City Of Independence Farmers Market,,,,,,,,,,,05/02/2015 to 10/31/2015,2015-05-02,2015-10-31,Sat: 6:00 AM-1:00 PM;,Sat: 6:00 AM-1:00 PM,,,,,,,06/03/2015 to 10/28/2015,6/3/15, 10/28/2015,Wed: 6:00 AM-1:00 PM;,Wed: 6:00 AM-1:00 PM,,,,,,,,,,,,,,,,,,,,,
1005491,City Of Lake Forest Farmers Market,http://www.cityoflakeforest.com,http://www.cityoflakeforest.com,,,,,,,,,,,,Sat: 8:00 AM-1:00 PM;,Sat: 8:00 AM-1:00 PM,,,,,,,,,,,,,,,,,,,,,,,,,,,,,,,,
1004255,City Of Loveland Farmers Market,http://www.cityofloveland.org/farmersmarket,http://www.cityofloveland.org/farmersmarket,https://www.facebook.com/cityoflovelandfarmersmarket,https://www.facebook.com/cityoflovelandfarmersmarket,https://twitter.com/NoCOFarmersMrkt,https://twitter.com/NoCOFarmersMrkt,,,,,06/28/2015 to 09/27/2015,2015-06-28,2015-09-27,Sun: 9:00 AM-1:30 PM;,Sun: 9:00 AM-1:30 PM,,,,,,,,,,,,,,,,,,,,,,,,,,,,,,,,
1008434,City Of Manassas Farmers Market- Saturday,http://media.visitmanassas.org/farmersmarket,http://media.visitmanassas.org/farmersmarket,https://www.facebook.com/manassas,https://www.facebook.com/manassas,https://twitter.com/visitmanassas,https://twitter.com/visitmanassas,,,,,04/13/2013 to 11/09/2013,2013-04-13,2013-11-09,Sat: 7:30 AM-1:00 PM;,Sat: 7:30 AM-1:00 PM,,,,,,,11/16/2013 to 12/31/2013,11/16/13, 12/31/2013,Sat: 10:00 AM-1:00 PM;,Sat: 10:00 AM-1:00 PM,,,,,,,,,,,,,,,,,,,,,
1008428,City Of Manassas Farmers Market- Thursday,http://media.visitmanassas.org/farmersmarket,http://media.visitmanassas.org/farmersmarket,https://www.facebook.com/manassas,https://www.facebook.com/manassas,https://twitter.com/visitmanassas,https://twitter.com/visitmanassas,,,,,04/11/2013 to 11/07/2013,2013-04-11,2013-11-07,Thu: 7:30 AM-1:00 PM;,Thu: 7:30 AM-1:00 PM,,,,,,,,,,,,,,,,,,,,,,,,,,,,,,,,
1002814,City Of Mebane Parks And Recreation Farmers Markeet,,,,,,,,,,,,,,,,,,,,,,,,,,,,,,,,,,,,,,,,,,,,,,,
1009719,City Of Momence,http://www.cityofmomence.com,http://www.cityofmomence.com,https://www.facebook.com/pages/Momence-Farmers-Market/142817159068999,https://www.facebook.com/pages/Momence-Farmers-Market/142817159068999,,,,,,,07/16/2014 to 10/15/2014,2014-07-16,2014-10-15,Wed: 3:30 PM-;,Wed: 3:30 PM-,,,,,,,,,,,,,,,,,,,,,,,,,,,,,,,,
1011481,City Of North Adams Farmers Market,http://explorenorthadams.com/THINGS-TO-DO/Events/Farmers-Market.aspx,http://explorenorthadams.com/THINGS-TO-DO/Events/Farmers-Market.aspx,https://www.facebook.com/pages/North-Adams-Farmers-Market/158627517541046,https://www.facebook.com/pages/North-Adams-Farmers-Market/158627517541046,,,,,,,06/13/2015 to 10/24/2015,2015-06-13,2015-10-24,Sat: 9:00 AM-1:00 PM;,Sat: 9:00 AM-1:00 PM,,,,,,,,,,,,,,,,,,,,,,,,,,,,,,,,
1004618,City Of Otsego Farmers Market,http://www.otsegochamber.org,http://www.otsegochamber.org,,,,,,,,,,,,,,,,,,,,,,,,,,,,,,,,,,,,,,,,,,,,,
1010007,"City Of Papillion, Farmers Market",http://www.papillionfarmersmarket.com,http://www.papillionfarmersmarket.com,https://www.facebook.com/papillionfarmersmarket,https://www.facebook.com/papillionfarmersmarket,,,,,,,06/18/2014 to 09/17/2014,2014-06-18,2014-09-17,Wed: 5:00 PM-8:00 PM;,Wed: 5:00 PM-8:00 PM,,,,,,,,,,,,,,,,,,,,,,,,,,,,,,,,
1000303,City Of Plymouth Farmers Market,http://www.plymouthmn.gov,http://www.plymouthmn.gov,,,,,,,,,06/19/2013 to 10/02/2013,2013-06-19,2013-10-02,Wed: 2:30 PM-6:30 PM;,Wed: 2:30 PM-6:30 PM,,,,,,,,,,,,,,,,,,,,,,,,,,,,,,,,
1006746,City Of Sherrill Farmers Market,http://www.sherrillny.org,http://www.sherrillny.org,,,,,,,,,05/17/2016 to 09/20/2016,2016-05-17,2016-09-20,Tue: 3:00 PM-7:00 PM;,Tue: 3:00 PM-7:00 PM,,,,,,,,,,,,,,,,,,,,,,,,,,,,,,,,
1008488,City Of Union Farmers Market,http://www.unionmissouri.org/farmersmarket,http://www.unionmissouri.org/farmersmarket,,,,,,,http://agrimissouri.com/mo-grown/grodetail.php?type=mo-grown&ID=871,http://agrimissouri.com/mo-grown/grodetail.php?type=mo-grown&ID=871,04/03/2013 to 10/30/2013,2013-04-03,2013-10-30,Wed: 3:30 PM-5:30 PM;Sat: 6:00 AM-11:00 AM;,Wed: 3:30 PM-5:30 PM,Sat: 6:00 AM-11:00 AM,,,,,,,,,,,,,,,,,,,,,,,,,,,,,,,
1010429,City Of Union Farmers Market,http://www.unionmissouri.org/farmersmarket,http://www.unionmissouri.org/farmersmarket,,,,,,,,,04/01/2014 to 10/31/2014,2014-04-01,2014-10-31,Sat: 6:00 AM-11:00 AM;,Sat: 6:00 AM-11:00 AM,,,,,,,,,,,,,,,,,,,,,,,,,,,,,,,,
1003687,City Of Uticas Farmers Market,,,,,,,,,,,,,,,,,,,,,,,,,,,,,,,,,,,,,,,,,,,,,,,
1004160,City Of Walled Lake Farmers Market,,,,,,,,,,,May to October,2010-05-01,2010-10-31,Wed:7:00 AM - 1:00 PM;,Wed:7:00 AM - 1:00 PM,,,,,,,,,,,,,,,,,,,,,,,,,,,,,,,,
1008491,City Of Warrenton Farmers Market,http://www.warrenton-mo.org/,,,,,,,,http://agrimissouri.com/mo-grown/grodetail.php?type=mo-grown&ID=1122,http://agrimissouri.com/mo-grown/grodetail.php?type=mo-grown&ID=1122,,,,,,,,,,,,,,,,,,,,,,,,,,,,,,,,,,,,,
1005502,City Of Wayne Farmers Market,http://www.waynefarmersmarket.net,http://www.waynefarmersmarket.net,,,,,,,,,,,,,,,,,,,,,,,,,,,,,,,,,,,,,,,,,,,,,
1000157,City Of West Burlington Open Air Market,,,,,,,,,,,,,,,,,,,,,,,,,,,,,,,,,,,,,,,,,,,,,,,
1006460,City Of White Bear Lake Farmers Market,http://www.whitebearlake.org,http://www.whitebearlake.org,,,,,,,,,06/27/2014 to 10/31/2014,2014-06-27,2014-10-31,Fri: 8:00 AM-12:00 PM;,Fri: 8:00 AM-12:00 PM,,,,,,,,,,,,,,,,,,,,,,,,,,,,,,,,
1008493,City Of Windsor Farmers Market,http://agrimissouri.com/mo-grown/grodetail.php?type=mo-grown&ID=2016,http://agrimissouri.com/mo-grown/grodetail.php?type=mo-grown&ID=2016,,,,,,,,,,,,,,,,,,,,,,,,,,,,,,,,,,,,,,,,,,,,,
1007679,City Of Zachary Farmers Market,http://www.cityofzachary.org,http://www.cityofzachary.org,,,,,,,,,,,,,,,,,,,,,,,,,,,,,,,,,,,,,,,,,,,,,
1006368,City Of Zions Farmers Market,http://www.cityofzion.com/farmersmarket,http://www.cityofzion.com/farmersmarket,https://www.facebook.com/pages/City-of-Zion-Farmers-Market/112314668796329?ref=br_tf,https://www.facebook.com/pages/City-of-Zion-Farmers-Market/112314668796329?ref=br_tf,https://twitter.com/ZionFarmersMarket,https://twitter.com/ZionFarmersMarket,,,,,06/19/2014 to 09/25/2014,2014-06-19,2014-09-25,Thu: 11:00 AM-7:00 PM;,Thu: 11:00 AM-7:00 PM,,,,,,,,,,,,,,,,,,,,,,,,,,,,,,,,
1011057,City Park Esplanade Fresh Market,http://coloradofreshmarkets.com,http://coloradofreshmarkets.com,Colorado Fresh Markets,,ColoradoFreshMarkets@COfreshmarkets,,,,,,06/07/2015 to 11/01/2015,2015-06-07,2015-11-01,Sun: 9:00 AM-1:00 PM;,Sun: 9:00 AM-1:00 PM,,,,,,,,,,,,,,,,,,,,,,,,,,,,,,,,
1012758,City Soul Market,,,,,,,,,,,,,,Sat: 10:00 AM-2:00 PM;,Sat: 10:00 AM-2:00 PM,,,,,,,,,,,,,,,,,,,,,,,,,,,,,,,,
1005940,Cityseed Edgewood Park Farmers Market,http://www.cityseed.org/edgewood-park,http://www.cityseed.org/edgewood-park,https://www.facebook.com/cityseed/,https://www.facebook.com/cityseed/,@CitySeedNH,@CitySeedNH,,,instagram: @cityseedhaven,instagram: @cityseedhaven,05/08/2016 to 12/18/2016,2016-05-08,2016-12-18,Sun: 10:00 AM-1:00 PM;,Sun: 10:00 AM-1:00 PM,,,,,,,,,,,,,,,,,,,,,,,,,,,,,,,,
1005941,Cityseed Fair Haven Farmers Market,http://www.cityseed.org,http://www.cityseed.org,https://www.facebook.com/cityseed,https://www.facebook.com/cityseed,@CitySeedNH,@CitySeedNH,,,instagram: @cityseedhaven,instagram: @cityseedhaven,07/07/2016 to 10/27/2016,2016-07-07,2016-10-27,Thu: 3:00 PM-6:00 PM;,Thu: 3:00 PM-6:00 PM,,,,,,,,,,,,,,,,,,,,,,,,,,,,,,,,
1005943,Cityseed Wooster Square Farmers Market,http://www.cityseed.org,http://www.cityseed.org,https://www.facebook.com/cityseed/,https://www.facebook.com/cityseed/,@CitySeedNH,@CitySeedNH,,,instagram: @cityseedhaven,instagram: @cityseedhaven,04/02/2016 to 12/17/2016,2016-04-02,2016-12-17,Sat: 9:00 AM-1:00 PM;,Sat: 9:00 AM-1:00 PM,,,,,,,,,,,,,,,,,,,,,,,,,,,,,,,,
1007587,Civista Medical Center Farmers Market,,,,,,,,,,,,,,,,,,,,,,,,,,,,,,,,,,,,,,,,,,,,,,,
1000545,Cjs Vegetable Market,,,,,,,,,,,January to December,2010-01-01,2010-12-31,Wed:7:00 pm - 6:00 pm;Fri:7:00 pm - 6:00 pm;Sat:7:00 pm - 12:00 pm;,Wed:7:00 pm - 6:00 pm,Fri:7:00 pm - 6:00 pm,Sat:7:00 pm - 12:00 pm,,,,,,,,,,,,,,,,,,,,,,,,,,,,,,
1002042,Clackamas Sunnyside Grange Farmers And Artists Market,http://www.windancemarkets.com,http://www.windancemarkets.com,,,,,,,,,04/06/2014 to 10/26/2014,2014-04-06,2014-10-26,Sun: 11:30 AM-3:30 PM;,Sun: 11:30 AM-3:30 PM,,,,,,,,,,,,,,,,,,,,,,,,,,,,,,,,
1011036,Clairemont Certified Farmers Market At Madison High School,http://www.ClairemontFarmersMarket.com,http://www.ClairemontFarmersMarket.com,Clairemont Farmers Market,,@clairemontfm,@clairemontfm,,,instagram @clairemontfarmersmarket,instagram @clairemontfarmersmarket,,,,Sat: 9:00 AM-3:00 PM;,Sat: 9:00 AM-3:00 PM,,,,,,,,,,,,,,,,,,,,,,,,,,,,,,,,
1002915,Clare Main Street Farm And Arts Market,http://www.clearlyclaremi.com,http://www.clearlyclaremi.com,,,,,,,,,June to September,2010-06-01,2010-09-30,Thu:4:00 PM - 8:00 PM;,Thu:4:00 PM - 8:00 PM,,,,,,,,,,,,,,,,,,,,,,,,,,,,,,,,
1002106,Claremont Farmers And Artisans Market,http://www.claremontforum.org,http://www.claremontforum.org,https://www.facebook.com/pages/Claremont-Farmers-Artisans-Market/148040805240200?fref=ts,https://www.facebook.com/pages/Claremont-Farmers-Artisans-Market/148040805240200?fref=ts,,,,,,,01/01/2015 to 12/31/2015,2015-01-01,2015-12-31,Sun: 8:00 AM-1:00 PM;,Sun: 8:00 AM-1:00 PM,,,,,,,,,,,,,,,,,,,,,,,,,,,,,,,,
1004216,Claremont Farmers And Artisans Market,,,,,,,,,,,June to September,2010-06-01,2010-09-30,Thu:4:00 PM - 7:00 PM;,Thu:4:00 PM - 7:00 PM,,,,,,,,,,,,,,,,,,,,,,,,,,,,,,,,
1008938,Claremont Tailgate Market,http://www.cityofclaremont.org,http://www.cityofclaremont.org,https://www.facebook.com/cityofclaremont,https://www.facebook.com/cityofclaremont,https://twitter.com/ClaremontNC,https://twitter.com/ClaremontNC,,,,,05/03/2013 to 09/27/2013,2013-05-03,2013-09-27,Fri: 3:00 PM-6:00 PM;,Fri: 3:00 PM-6:00 PM,,,,,,,05/23/2014 to 09/26/2014,5/23/14, 09/26/2014,Fri: 3:00 PM-6:00 PM;,Fri: 3:00 PM-6:00 PM,,,,,,,,,,,,,,,,,,,,,
1007053,Claremore Farmers Market,,,,,,,,,,,,,,,,,,,,,,,,,,,,,,,,,,,,,,,,,,,,,,,
1000579,Clarence Hollow Farmers Market,http://www.clarencefarmersmarket.com,http://www.clarencefarmersmarket.com,https://www.facebook.com/clarencehollowfm,https://www.facebook.com/clarencehollowfm,,,,,,,06/07/2014 to 10/25/2014,2014-06-07,2014-10-25,Sat: 8:00 AM-1:00 PM;,Sat: 8:00 AM-1:00 PM,,,,,,,,,,,,,,,,,,,,,,,,,,,,,,,,
1007374,Clarendon Farmers Market,http://clarendon.org/farmersmarket/,http://clarendon.org/farmersmarket/,,,,,,,,,04/16/2014 to 12/17/2014,2014-04-16,2014-12-17,Wed: 3:00 PM-7:00 PM;,Wed: 3:00 PM-7:00 PM,,,,,,,,,,,,,,,,,,,,,,,,,,,,,,,,
1006482,Clarinda Farmers Market,,,,,,,,,,,,,,,,,,,,,,,,,,,,,,,,,,,,,,,,,,,,,,,
1006181,Clarion County Farmers Market,,,,,,,,,,,,,,,,,,,,,,,,,,,,,,,,,,,,,,,,,,,,,,,
1001837,Clarion Farmers Market,,,,,,,,,,,June to October,2010-06-01,2010-10-31,Sat:10:00 AM - 12:00 PM;,Sat:10:00 AM - 12:00 PM,,,,,,,,,,,,,,,,,,,,,,,,,,,,,,,,
1003497,Clark County Farmers Market,,,,,,,,,,,,,,,,,,,,,,,,,,,,,,,,,,,,,,,,,,,,,,,
1000406,Clark Fork Market,http://www.clarkforkmarket.com,http://www.clarkforkmarket.com,https://www.facebook.com/clarkforkmarket,https://www.facebook.com/clarkforkmarket,,,http://www.youtube.com/watch?v=E6zktHiUMv0,http://www.youtube.com/watch?v=E6zktHiUMv0,,,05/07/2016 to 10/29/2016,2016-05-07,2016-10-29,Sat: 8:00 AM-1:00 PM;,Sat: 8:00 AM-1:00 PM,,,,,,,,,,,,,,,,,,,,,,,,,,,,,,,,
1011959,Clark Park Farmers Market,http://www.clarkparkfarmersmarket.com,http://www.clarkparkfarmersmarket.com,https://www.facebook.com/tempemarket/,https://www.facebook.com/tempemarket/,@clarkparkmarket,@clarkparkmarket,,,Instagram clarkparkfarmersmarket,Instagram clarkparkfarmersmarket,10/01/2016 to 05/07/2016,2016-10-01,2016-05-07,Sat: 8:00 AM-12:00 PM;,Sat: 8:00 AM-12:00 PM,,,,,,,01/01/2017 to 05/01/2017,1/1/17, 05/01/2017,Sat: 9:00 AM-1:00 PM;,Sat: 9:00 AM-1:00 PM,,,,,,,,,,,,,,,,,,,,,
1005296,Clark Park Farmers Market,http://thefoodtrust.org/farmers-markets/market/clark-park,http://thefoodtrust.org/farmers-markets/market/clark-park,,,,,,,,,01/01/2015 to 12/31/2015,2015-01-01,2015-12-31,Thu: 3:00 PM-7:00 PM;Sun: 10:00 AM-2:00 PM;,Thu: 3:00 PM-7:00 PM,Sun: 10:00 AM-2:00 PM,,,,,,,,,,,,,,,,,,,,,,,,,,,,,,,
1000257,Clark Produce Auction Llc,,,,,,,,,,,,,,,,,,,,,,,,,,,,,,,,,,,,,,,,,,,,,,,
1007037,Clark Valley Farmers Market,,,,,,,,,,,,,,,,,,,,,,,,,,,,,,,,,,,,,,,,,,,,,,,
1002242,Clarke County Farmers Market,,,,,,,,,,,,,,,,,,,,,,,,,,,,,,,,,,,,,,,,,,,,,,,
1006489,Clarke County Farmers Market,http://www.clarkecountyfarmersmarket.com,http://www.clarkecountyfarmersmarket.com,,,,,,,,,,,,,,,,,,,,,,,,,,,,,,,,,,,,,,,,,,,,,
1008001,Clarkesville Farmers Market,http://www.clarkesvillefarmersmarket.com,http://www.clarkesvillefarmersmarket.com,www.facebook.com/clarkesvillefarmersmarket,,,,,,,,05/04/2013 to 10/26/2013,2013-05-04,2013-10-26,Sat: 9:00 AM-12:00 PM;,Sat: 9:00 AM-12:00 PM,,,,,,,,,,,,,,,,,,,,,,,,,,,,,,,,
1011268,Clarksburg Farmers Market,http://clarksburgwvfarmersmarket.org/index.html,http://clarksburgwvfarmersmarket.org/index.html,Clarksburg Farmers Market,,,,,,,,01/01/2015 to 12/31/2015,2015-01-01,2015-12-31,Sat: 9:00 AM-1:00 PM;,Sat: 9:00 AM-1:00 PM,,,,,,,,,,,,,,,,,,,,,,,,,,,,,,,,
1004851,Clarksburg Town Center Farmers Market,http://WWW.CLARKSBURGFARMERSMARKET.COM,,,,,,,,,,June to October,2010-06-01,2010-10-31,sun:10:00 AM - 1:00 PM;,sun:10:00 AM - 1:00 PM,,,,,,,,,,,,,,,,,,,,,,,,,,,,,,,,
1007681,Clarksdale Farmers Market,http://www.clarksdale.locallygrown.net/,http://www.clarksdale.locallygrown.net/,,,,,,,,,,,,,,,,,,,,,,,,,,,,,,,,,,,,,,,,,,,,,
1002473,Clarkston Farmers Market,http://www.clarkstonfarmersmarket.org;,,,,,,,,,,,,,,,,,,,,,,,,,,,,,,,,,,,,,,,,,,,,,,
1004198,Clarkston Farmers Market,http://www.clarkstonfarmersmarket.com,http://www.clarkstonfarmersmarket.com,https://www.facebook.com/clarkstonfarmersmarket,https://www.facebook.com/clarkstonfarmersmarket,https://twitter.com/ClarkstonMarket,https://twitter.com/ClarkstonMarket,,,,,04/27/2014 to 11/02/2014,2014-04-27,2014-11-02,Sun: 10:00 AM-2:00 PM;,Sun: 10:00 AM-2:00 PM,,,,,,,,,,,,,,,,,,,,,,,,,,,,,,,,
1000893,Clarksville Farmers Market,,,,,,,,,,,,,,,,,,,,,,,,,,,,,,,,,,,,,,,,,,,,,,,
1004721,Clawson Farmers Market,http://www.cityofclawson.com/,http://www.cityofclawson.com/,https://www.facebook.com/pages/Clawson-Farmers-Market/156582121049116,https://www.facebook.com/pages/Clawson-Farmers-Market/156582121049116,,,,,,,07/13/2014 to 09/28/2014,2014-07-13,2014-09-28,Sun: 9:00 AM-1:00 PM;,Sun: 9:00 AM-1:00 PM,,,,,,,,,,,,,,,,,,,,,,,,,,,,,,,,
1004978,Clay Center Farmers’,,,,,,,,,,,,,,,,,,,,,,,,,,,,,,,,,,,,,,,,,,,,,,,
1002395,Clay County Farmers Market,http://www.weast@aces.edu,http://www.weast@aces.edu,,,,,,,,,,,,,,,,,,,,,,,,,,,,,,,,,,,,,,,,,,,,,
1007197,Clay County Farmers Market,,,,,,,,,,,,,,,,,,,,,,,,,,,,,,,,,,,,,,,,,,,,,,,
1009507,Claysburg Farmers Market,http://www.localharvest.org/claysburg-farmers-market-M56905,http://www.localharvest.org/claysburg-farmers-market-M56905,,,,,,,,,,,,,,,,,,,,,,,,,,,,,,,,,,,,,,,,,,,,,
1010564,Clayton Farm And Community Market,http://www.cfcmnc.org,http://www.cfcmnc.org,https://www.facebook.com/CFCMNC,https://www.facebook.com/CFCMNC,https://www.twitter.com/ClaytonFarmMkt,https://www.twitter.com/ClaytonFarmMkt,,,,,04/05/2014 to 10/25/2014,2014-04-05,2014-10-25,Sat: 9:00 AM-1:00 PM;,Sat: 9:00 AM-1:00 PM,,,,,,,11/08/2014 to 03/28/2015,11/8/14, 03/28/2015,Sat: 10:00 AM-1:00 PM;,Sat: 10:00 AM-1:00 PM,,,,,,,4/4/15, 10/31/2015,Sat: 9:00 AM-1:00 PM;,Sat: 9:00 AM-1:00 PM,,,,,,,,,,,
1004282,Clayton Farmers Market,,,,,,,,,,,,,,,,,,,,,,,,,,,,,,,,,,,,,,,,,,,,,,,
1006953,Clayton Farmers Market,,,,,,,,,,,,,,,,,,,,,,,,,,,,,,,,,,,,,,,,,,,,,,,
1004202,Clayton Farmers Market And Small Farm Animals,http://www.ClaytonCommunityFair.com/claytonfarmersmarket,http://www.ClaytonCommunityFair.com/claytonfarmersmarket,Clayton Farmers Market and Small Farm Animals,,,,,,,,06/07/2015 to 09/27/2015,2015-06-07,2015-09-27,Sun: 12:00 PM-4:00 PM;,Sun: 12:00 PM-4:00 PM,,,,,,,,,,,,,,,,,,,,,,,,,,,,,,,,
1010706,Clayton Farmers Market,http://www.claytonfarmersmarket.com,http://www.claytonfarmersmarket.com,,,,,,,,,05/07/2015 to 10/29/2015,2015-05-07,2015-10-29,Thu: 4:30 AM-7:30 PM;,Thu: 4:30 AM-7:30 PM,,,,,,,,,,,,,,,,,,,,,,,,,,,,,,,,
1011350,Clayton Farmers Market,http://www.pcfma.org,http://www.pcfma.org,https://www.facebook.com/ClaytonMarket,https://www.facebook.com/ClaytonMarket,,,,,,,05/09/2015 to 09/19/2015,2015-05-09,2015-09-19,Sat: 8:00 AM-12:00 PM;,Sat: 8:00 AM-12:00 PM,,,,,,,,,,,,,,,,,,,,,,,,,,,,,,,,
1004533,Clayton-five State Producer Growers Market,,,,,,,,,,,,,,,,,,,,,,,,,,,,,,,,,,,,,,,,,,,,,,,
1007411,Clear Lake Farmers Market,,,,,,,,,,,,,,,,,,,,,,,,,,,,,,,,,,,,,,,,,,,,,,,
1001923,Clear Valley Ltd.,,,,,,,,,,,,,,,,,,,,,,,,,,,,,,,,,,,,,,,,,,,,,,,
1005686,Clearfield County Farmers Market,,,,,,,,,,,,,,,,,,,,,,,,,,,,,,,,,,,,,,,,,,,,,,,
1006871,Clearlake Farmers Market,,,,,,,,,,,,,,,,,,,,,,,,,,,,,,,,,,,,,,,,,,,,,,,
1002048,Clearlake Friday Night Fm,,,,,,,,,,,,,,Fri: 5:00 PM-8:00 PM;,Fri: 5:00 PM-8:00 PM,,,,,,,,,,,,,,,,,,,,,,,,,,,,,,,,
1009203,Clearwater Gateway Farmers Market,http://www.myclearwatermarket.com/,http://www.myclearwatermarket.com/,,,,,,,,,,,,,,,,,,,,,,,,,,,,,,,,,,,,,,,,,,,,,
1000613,Cleburne County Farmers Market,,,,,,,,,,,07/08/2014 to,2014-07-08,,Tue: 7:00 AM-;Thu: 1:00 PM-;,Tue: 7:00 AM-,Thu: 1:00 PM-,,,,,,,,,,,,,,,,,,,,,,,,,,,,,,,
1004696,Cleburne County Growers Market,,,,,,,,,,,,,,,,,,,,,,,,,,,,,,,,,,,,,,,,,,,,,,,
1012527,Clement St. Farmers Market,http://www.agriculturalinstitute.org,http://www.agriculturalinstitute.org,https://www.facebook.com/ClementStreetFarmersMarket/,https://www.facebook.com/ClementStreetFarmersMarket/,,,,,,,01/01/2016 to 12/31/2016,2016-01-01,2016-12-31,Sun: 9:00 AM-2:00 PM;,Sun: 9:00 AM-2:00 PM,,,,,,,,,,,,,,,,,,,,,,,,,,,,,,,,
1009428,Clemson Area Food Exchange (cafe),http://www.clemsonareafoodexchange.com/,http://www.clemsonareafoodexchange.com/,,,,,,,,,,,,,,,,,,,,,,,,,,,,,,,,,,,,,,,,,,,,,
1006806,Clemson Farm-fresh Market,http://www.clemson.edu/cafls/farm_fresh_market/,http://www.clemson.edu/cafls/farm_fresh_market/,https://www.facebook.com/CUFarmFresh,https://www.facebook.com/CUFarmFresh,https://twitter.com/CUFarmFresh,https://twitter.com/CUFarmFresh,,,,,04/02/2014 to 04/23/2014,2014-04-02,2014-04-23,Wed: 11:00 AM-2:00 PM;,Wed: 11:00 AM-2:00 PM,,,,,,,,,,,,,,,,,,,,,,,,,,,,,,,,
1002596,Clemson Farmers Market,http://www.clemsonfarmersmarket.org,http://www.clemsonfarmersmarket.org,,,,,,,,,June to November,2010-06-01,2010-11-30,Fri:3:30 PM - 6:30 PM;,Fri:3:30 PM - 6:30 PM,,,,,,,,,,,,,,,,,,,,,,,,,,,,,,,,
1010192,Clermont Farmers Market,,,https://www.facebook.com/pages/Clermont-Farmers-Market/368075276576854,https://www.facebook.com/pages/Clermont-Farmers-Market/368075276576854,,,,,,,07/10/2014 to 09/25/2014,2014-07-10,2014-09-25,Thu: 3:00 PM-6:30 PM;,Thu: 3:00 PM-6:30 PM,,,,,,,,,,,,,,,,,,,,,,,,,,,,,,,,
1005812,Cleveland Farmers Market,,,,,,,,,,,,,,,,,,,,,,,,,,,,,,,,,,,,,,,,,,,,,,,
1006670,Cleveland Farmers Market,http://www.clevelandfarmersmarket.com,http://www.clevelandfarmersmarket.com,,,,,,,,,April to November,2010-04-01,2010-11-30,Wed:4:00 PM - 6:00 PM;,Wed:4:00 PM - 6:00 PM,,,,,,,,,,,,,,,,,,,,,,,,,,,,,,,,
1006671,Cleveland Farmers Market,http://www.clevelandfarmersmarket.com,http://www.clevelandfarmersmarket.com,,,,,,,,,April to November,2010-04-01,2010-11-30,Sat:8:00 AM - 12:00 PM;,Sat:8:00 AM - 12:00 PM,,,,,,,,,,,,,,,,,,,,,,,,,,,,,,,,
1007401,Clifton Farmers Market,,,,,,,,,,,,,,,,,,,,,,,,,,,,,,,,,,,,,,,,,,,,,,,
1005524,Clifton Park Farmers Market,http://www.cliftonparkfarmersmarket.org,http://www.cliftonparkfarmersmarket.org,https://www.facebook.com/pages/Clifton-Park-Farmers-Market/440138679349915,https://www.facebook.com/pages/Clifton-Park-Farmers-Market/440138679349915,,,,,,,07/03/2014 to 10/30/2014,2014-07-03,2014-10-30,Thu: 2:00 PM-5:00 PM;,Thu: 2:00 PM-5:00 PM,,,,,,,,,,,,,,,,,,,,,,,,,,,,,,,,
1006518,Clifton Springs Farmers Market,http://www.info@cliftonspringschamber.com,http://www.info@cliftonspringschamber.com,,,,,,,,,June to October,2010-06-01,2010-10-31,Fri:4:00 pm - 8:00 pm;,Fri:4:00 pm - 8:00 pm,,,,,,,,,,,,,,,,,,,,,,,,,,,,,,,,
1003017,Clinch River Farmers Market,,,,,,,,,,,May to October,2010-05-01,2010-10-31,Wed:2:00 AM - 5:00 PM;Sat:8:00 AM - 1:00 PM;,Wed:2:00 AM - 5:00 PM,Sat:8:00 AM - 1:00 PM,,,,,,,,,,,,,,,,,,,,,,,,,,,,,,,
1001450,Clinica Sierra Vista (delano),,,,,,,,,,,,,,,,,,,,,,,,,,,,,,,,,,,,,,,,,,,,,,,
1001451,Clinica Sierra Vista (lamont),,,,,,,,,,,,,,,,,,,,,,,,,,,,,,,,,,,,,,,,,,,,,,,
1008982,Clinton Area Farmers And Artisans Market,http://www.clintonilchamber.com/events.htm,http://www.clintonilchamber.com/events.htm,,,,,,,,,05/03/2014 to 10/11/2014,2014-05-03,2014-10-11,Sat: 8:00 AM-12:00 PM;,Sat: 8:00 AM-12:00 PM,,,,,,,,,,,,,,,,,,,,,,,,,,,,,,,,
1001850,Clinton County Farmers Market,http://www.clintoncountyfarmersmarket.com,http://www.clintoncountyfarmersmarket.com,https://www.facebook.com/pages/Clinton-County-Farmers-Market/95151956999,https://www.facebook.com/pages/Clinton-County-Farmers-Market/95151956999,,,,,,,06/07/2014 to 10/31/2014,2014-06-07,2014-10-31,Wed: 4:00 PM-7:00 PM;Sat: 8:30 AM-12:00 PM;,Wed: 4:00 PM-7:00 PM,Sat: 8:30 AM-12:00 PM,,,,,,,,,,,,,,,,,,,,,,,,,,,,,,,
1007566,Clinton County Farmers Market,,,,,,,,,,,,,,,,,,,,,,,,,,,,,,,,,,,,,,,,,,,,,,,
1011266,Clinton Ct Farmers Market,http://www.clintonctfarmersmarket.weebly.com,http://www.clintonctfarmersmarket.weebly.com,www.facebook.com/clintonctfarmersmarket,,,,,,www.instagram.com/clintonctfarmersmarket,www.instagram.com/clintonctfarmersmarket,06/18/2015 to 09/10/2015,2015-06-18,2015-09-10,Thu: 4:00 PM-7:00 PM;,Thu: 4:00 PM-7:00 PM,,,,,,,,,,,,,,,,,,,,,,,,,,,,,,,,
1000389,Clinton Farmers Market,http://www.clintonnychamber.org,http://www.clintonnychamber.org,https://www.facebook.com/clintonnychamber,https://www.facebook.com/clintonnychamber,https://twitter.com/ClintonCCNY,https://twitter.com/ClintonCCNY,,,www.instagram.com/clintonnychamber,www.instagram.com/clintonnychamber,06/02/2016 to 10/06/2016,2016-06-02,2016-10-06,Thu: 10:00 AM-4:00 PM;,Thu: 10:00 AM-4:00 PM,,,,,,,,,,,,,,,,,,,,,,,,,,,,,,,,
1006930,Clinton Farmers Market,,,,,,,,,,,,,,,,,,,,,,,,,,,,,,,,,,,,,,,,,,,,,,,
1010876,Clinton Farmers Market,,,https://www.facebook.com/pages/Clinton-Farmers-Market/115933728485071,https://www.facebook.com/pages/Clinton-Farmers-Market/115933728485071,,,,,,,05/03/2015 to 11/01/2015,2015-05-03,2015-11-01,Sun: 9:00 AM-1:00 PM;,Sun: 9:00 AM-1:00 PM,,,,,,,,,,,,,,,,,,,,,,,,,,,,,,,,
1009348,Clintons Olde Towne Market,http://www.localharvest.org/clintons-olde-towne-market-M34924,http://www.localharvest.org/clintons-olde-towne-market-M34924,,,,,,,,,,,,,,,,,,,,,,,,,,,,,,,,,,,,,,,,,,,,,
1012118,Clintonville Farmers Market,http://www.clintonvillefarmersmarket.org,http://www.clintonvillefarmersmarket.org,www.facebook.com/clintonvillefarmersmarket,,,,,,Instagram @clintonvillefarmersmarket,http://www.instagram.com/clintonvillefarmersmarket,04/30/2016 to 11/19/2016,2016-04-30,2016-11-19,Sat: 9:00 AM-12:00 PM;,Sat: 9:00 AM-12:00 PM,,,,,,,07/06/2016 to 09/28/2016,7/6/16, 09/28/2016,Wed: 4:00 PM-7:00 PM;,Wed: 4:00 PM-7:00 PM,,,,,,,,,,,,,,,,,,,,,
1001123,Clintwood Farmers Market,,,,,,,,,,,,,,,,,,,,,,,,,,,,,,,,,,,,,,,,,,,,,,,
1000360,Clio Area Farmers Market,,,,,,,,,,,,,,,,,,,,,,,,,,,,,,,,,,,,,,,,,,,,,,,
1000549,Clio Market,,,,,,,,,,,01/01/2015 to 12/31/2015,2015-01-01,2015-12-31,Wed: 10:00 AM-1:00 PM;,Wed: 10:00 AM-1:00 PM,,,,,,,,,,,,,,,,,,,,,,,,,,,,,,,,
1010330,Cliveden Park Farmers Market,,,,,,,,,,,,,,,,,,,,,,,,,,,,,,,,,,,,,,,,,,,,,,,
1010561,Cloudcroft Farmers Market,,,cloudmarket,,,,,,,,07/18/2014 to 10/19/2014,2014-07-18,2014-10-19,Fri: 5:00 PM-6:00 PM;Sun: 11:00 AM-12:00 PM;,Fri: 5:00 PM-6:00 PM,Sun: 11:00 AM-12:00 PM,,,,,,,,,,,,,,,,,,,,,,,,,,,,,,,
1002385,Clover Fields,http://www.Cloverfields.org,http://www.Cloverfields.org,,,,,,,,,,,,,,,,,,,,,,,,,,,,,,,,,,,,,,,,,,,,,
1010707,Clover Leaf Market,http://agrimissouri.com/mo-grown/grodetail.php?type=mo-grown&ID=1700,http://agrimissouri.com/mo-grown/grodetail.php?type=mo-grown&ID=1700,,,,,,,,,04/05/2014 to 10/25/2014,2014-04-05,2014-10-25,Sat: 8:00 AM-12:00 PM;,Sat: 8:00 AM-12:00 PM,,,,,,,,,,,,,,,,,,,,,,,,,,,,,,,,
1011903,Clover Leaf Marketplace,,,https://www.facebook.com/97479CloverLeafMktpl,https://www.facebook.com/97479CloverLeafMktpl,,,,,,,04/30/2016 to 10/29/2016,2016-04-30,2016-10-29,Sat: 9:00 AM-2:00 PM;,Sat: 9:00 AM-2:00 PM,,,,,,,,,,,,,,,,,,,,,,,,,,,,,,,,
1002895,Cloverdale Certified Farmers Market,http://www.cloverdalefarmersmarket.com,http://www.cloverdalefarmersmarket.com,https://www.facebook.com/pages/Cloverdale-Certified-Farmers-Market/120845221449110,https://www.facebook.com/pages/Cloverdale-Certified-Farmers-Market/120845221449110,,,,,,,05/31/2013 to 08/30/2013,2013-05-31,2013-08-30,Fri: 6:00 PM-9:00 PM;,Fri: 6:00 PM-9:00 PM,,,,,,,,,,,,,,,,,,,,,,,,,,,,,,,,
1004780,Clovis Farmers Market,http://farmersmarketsnm.org/Shoppers/FindMarket/find.php,http://farmersmarketsnm.org/Shoppers/FindMarket/find.php,,,,,,,,,06/28/2014 to 10/28/2014,2014-06-28,2014-10-28,Tue: 5:00 PM-7:00 PM;Sat: 8:00 AM-12:00 PM;,Tue: 5:00 PM-7:00 PM,Sat: 8:00 AM-12:00 PM,,,,,,,,,,,,,,,,,,,,,,,,,,,,,,,
1006877,Clovis Old Town Farmers Market,http://www.OldTownClovis.com,http://www.OldTownClovis.com,,,,,,,,,,,,,,,,,,,,,,,,,,,,,,,,,,,,,,,,,,,,,
1003498,Clyde Farmers Market,,,,,,,,,,,,,,,,,,,,,,,,,,,,,,,,,,,,,,,,,,,,,,,
1005901,Clyde Farmers Market,http://www.ClydeKansas.org,http://www.ClydeKansas.org,,,,,,,,,,,,,,,,,,,,,,,,,,,,,,,,,,,,,,,,,,,,,
1002808,Cms Farmers Market,,,,,,,,,,,06/04/2015 to 09/24/2015,2015-06-04,2015-09-24,Thu: 10:30 AM-1:30 PM;,Thu: 10:30 AM-1:30 PM,,,,,,,,,,,,,,,,,,,,,,,,,,,,,,,,
1001390,Co-op Farmers Market,http://www.newarknaturalfoods.com/farmers-market/,http://www.newarknaturalfoods.com/farmers-market/,https://www.facebook.com/coopfarmersmarket,https://www.facebook.com/coopfarmersmarket,https://twitter.com/coop_farmer_mkt,https://twitter.com/coop_farmer_mkt,,,,,05/03/2015 to 11/22/2015,2015-05-03,2015-11-22,Sun: 9:30 AM-2:00 PM;,Sun: 9:30 AM-2:00 PM,,,,,,,,,,,,,,,,,,,,,,,,,,,,,,,,
1010609,Coarsegold Farmers Market,,,,,,,,,,,,,,Sun: 11:00 AM-2:00 PM;,Sun: 11:00 AM-2:00 PM,,,,,,,,,,,,,,,,,,,,,,,,,,,,,,,,
1001739,Coastal Growers Farmers Market,http://www.coastalmarket.org,http://www.coastalmarket.org,https://www.facebook.com/CoastalGrowers/,https://www.facebook.com/CoastalGrowers/,https://twitter.com/CoastalMarketRI,https://twitter.com/CoastalMarketRI,,,https://www.instagram.com/coastalmarketri/,https://www.instagram.com/coastalmarketri/,05/07/2016 to 10/29/2016,2016-05-07,2016-10-29,Sat: 8:30 AM-12:30 PM;,Sat: 8:30 AM-12:30 PM,,,,,,,,,,,,,,,,,,,,,,,,,,,,,,,,
1001740,Coastal Growers Farmers Market,http://www.coastalmarket.org,http://www.coastalmarket.org,https://www.facebook.com/CoastalGrowers,https://www.facebook.com/CoastalGrowers,,,,,,,11/01/2014 to 05/09/2015,2014-11-01,2015-05-09,Sat: 10:00 AM-1:00 PM;,Sat: 10:00 AM-1:00 PM,,,,,,,,,,,,,,,,,,,,,,,,,,,,,,,,
1000324,Coastside Farmers Market In Half Moon Bay,http://www.coastsidefarmersmarket.org,http://www.coastsidefarmersmarket.org,,,,,,,,,May to December,2010-05-01,2010-12-31,Sat:9:00 AM - 1:00 PM;,Sat:9:00 AM - 1:00 PM,,,,,,,,,,,,,,,,,,,,,,,,,,,,,,,,
1000325,Coastside Farmers Market Of Pacifica - Rockaway Beach,http://www.coastsidefarmersmarket.org/,http://www.coastsidefarmersmarket.org/,https://www.facebook.com/pages/Coastside-Farmers-Market-in-Pacifica/112386032145910,https://www.facebook.com/pages/Coastside-Farmers-Market-in-Pacifica/112386032145910,,,,,,,05/01/2012 to 12/31/2012,2012-05-01,2012-12-31,,,,,,,,,,,,,,,,,,,,,,,,,,,,,,,,,,
1003957,Cobb Market,,,,,,,,,,,,,,,,,,,,,,,,,,,,,,,,,,,,,,,,,,,,,,,
1010390,Cobblestone Farmers Market,http://www.cobblestonefarmersmarket.com/,http://www.cobblestonefarmersmarket.com/,,,,,,,Instagram: cobblestonefarmersmarket,Instagram: cobblestonefarmersmarket,04/09/2016 to 11/19/2016,2016-04-09,2016-11-19,Wed: 3:00 PM-6:00 PM;Sat: 9:00 AM-12:00 PM;,Wed: 3:00 PM-6:00 PM,Sat: 9:00 AM-12:00 PM,,,,,,,,,,,,,,,,,,,,,,,,,,,,,,,
1009041,Cobblestone Farmers Market,http://www.cobblestonefarmmarket.com/,http://www.cobblestonefarmmarket.com/,https://www.facebook.com/CobblestoneFarmMarket,https://www.facebook.com/CobblestoneFarmMarket,,,,,,,05/26/2015 to 10/20/2015,2015-05-26,2015-10-20,Tue: 4:00 PM-7:00 PM;,Tue: 4:00 PM-7:00 PM,,,,,,,,,,,,,,,,,,,,,,,,,,,,,,,,
1009208,Cochran Farmers Market,http://www.localharvest.org/cochran-farmers-market-M44572,http://www.localharvest.org/cochran-farmers-market-M44572,,,,,,,,,,,,,,,,,,,,,,,,,,,,,,,,,,,,,,,,,,,,,
1007224,Cocoa Beach Farmers Market,http://www.brevardfarmersmarkets.com,http://www.brevardfarmersmarkets.com,,,,,,,,,,,,,,,,,,,,,,,,,,,,,,,,,,,,,,,,,,,,,
1006392,Coconut Grove Farmers Market,http://www.glaserorganicfarms.com,http://www.glaserorganicfarms.com,,,,,,,,,,,,,,,,,,,,,,,,,,,,,,,,,,,,,,,,,,,,,
1010515,Coconut Point Farmers Market,http://BuyLocalLee.com,http://BuyLocalLee.com,Facebook.com/CoconutPointFarmersMarket,,LocalRootsFM,,,,,,10/06/2016 to 04/27/2017,2016-10-06,2017-04-27,Thu: 9:00 AM-1:00 PM;,Thu: 9:00 AM-1:00 PM,,,,,,,,,,,,,,,,,,,,,,,,,,,,,,,,
1002563,Codman Square Farmers Market,https://codmancouncil.wordpress.com/codman-square-farmers-market/,https://codmancouncil.wordpress.com/codman-square-farmers-market/,https://www.facebook.com/CodmanSquareFarmersMarket,https://www.facebook.com/CodmanSquareFarmersMarket,@codmansqmarket,@codmansqmarket,,,@codmansquaremarket,@codmansquaremarket,06/18/2016 to 10/22/2016,2016-06-18,2016-10-22,Sat: 10:00 AM-3:00 PM;,Sat: 10:00 AM-3:00 PM,,,,,,,,,,,,,,,,,,,,,,,,,,,,,,,,
1012079,Coeburn Farmers Market,,,,,,,,,,,,,,Sat: 1:00 PM-4:30 PM;,Sat: 1:00 PM-4:30 PM,,,,,,,,,,,,,,,,,,,,,,,,,,,,,,,,
1001359,Coffe County Farmers Market,,,,,,,,,,,,,,,,,,,,,,,,,,,,,,,,,,,,,,,,,,,,,,,
1004677,Coffeyville Farmers Market,,,,,,,,,,,,,,,,,,,,,,,,,,,,,,,,,,,,,,,,,,,,,,,
1002594,Coffo Harvest Farmers Market,http://www.coffo.inc@coffo.org,http://www.coffo.inc@coffo.org,,,,,,,,,January to December,2010-01-01,2010-12-31,Sat:9:00 AM - 2:00 PM;,Sat:9:00 AM - 2:00 PM,,,,,,,,,,,,,,,,,,,,,,,,,,,,,,,,
1002595,Coffo Harvest Farmers Market,http://www.coffo.inc@coffo.org,http://www.coffo.inc@coffo.org,,,,,,,,,January to December,2010-01-01,2010-12-31,sun:9:00 AM - 2:00 PM;,sun:9:00 AM - 2:00 PM,,,,,,,,,,,,,,,,,,,,,,,,,,,,,,,,
1002525,Cohasset Farmers Market,http://www.cohassetfarmersmarket.com,http://www.cohassetfarmersmarket.com,,,,,,,,,,,,,,,,,,,,,,,,,,,,,,,,,,,,,,,,,,,,,
1001896,Cohoes Farmers Market,http://www.cohoesfarmersmarket.com,http://www.cohoesfarmersmarket.com,,,,,,,,,June to October,2010-06-01,2010-10-31,Fri:4:00 pm - 7:00 pm;,Fri:4:00 pm - 7:00 pm,,,,,,,,,,,,,,,,,,,,,,,,,,,,,,,,
1002011,Colbert County Farmers Market,,,,,,,,,,,,,,,,,,,,,,,,,,,,,,,,,,,,,,,,,,,,,,,
1007503,Colchester Farmers’ Market,,,,,,,,,,,,,,,,,,,,,,,,,,,,,,,,,,,,,,,,,,,,,,,
1007424,Cold Spring Farmers Market,,,,,,,,,,,,,,,,,,,,,,,,,,,,,,,,,,,,,,,,,,,,,,,
1006440,Cold Springs Farmers Market,http://www.csfarmmarket.org,http://www.csfarmmarket.org,,,,,,,,,,,,,,,,,,,,,,,,,,,,,,,,,,,,,,,,,,,,,
1009166,Colden Community Farmers Market,http://www.localharvest.org/colden-community-farmers-market-M59229,http://www.localharvest.org/colden-community-farmers-market-M59229,,,,,,,,,,,,,,,,,,,,,,,,,,,,,,,,,,,,,,,,,,,,,
1008764,Cole County Farmers Market,http://agrimissouri.com/productdetail.php?type=mo-made&ID=66,http://agrimissouri.com/productdetail.php?type=mo-made&ID=66,,,,,,,,,04/13/2013 to 10/26/2013,2013-04-13,2013-10-26,Tue: 4:00 AM-4:00 PM;Fri: 6:00 AM-6:00 PM;Sun: 2:00 AM-4:00 AM;,Tue: 4:00 AM-4:00 PM,Fri: 6:00 AM-6:00 PM,Sun: 2:00 AM-4:00 AM,,,,,,,,,,,,,,,,,,,,,,,,,,,,,,
1003173,Colebrook Farmers Market,,,,,,,,,,,,,,,,,,,,,,,,,,,,,,,,,,,,,,,,,,,,,,,
1000956,Colesburg Farmers Market,,,,,,,,,,,,,,,,,,,,,,,,,,,,,,,,,,,,,,,,,,,,,,,
1000656,Colfax Farmers Market,http://www.foothillfarmersmarket.com,http://www.foothillfarmersmarket.com,,,,,,,,,,,,,,,,,,,,,,,,,,,,,,,,,,,,,,,,,,,,,
1001876,College Hill Farm Market,http://www.CollegeHillFarmMarket.org,http://www.CollegeHillFarmMarket.org,https://www.facebook.com/groups/69791386959/?fref=ts,https://www.facebook.com/groups/69791386959/?fref=ts,,,,,,,05/01/2014 to 10/31/2014,2014-05-01,2014-10-31,Thu: 3:00 PM-6:30 PM;,Thu: 3:00 PM-6:30 PM,,,,,,,,,,,,,,,,,,,,,,,,,,,,,,,,
1011528,College Hill Farmers Market,,,College Hill Farmers Market,,,,,,,,06/04/2015 to 10/29/2015,2015-06-04,2015-10-29,Thu: 4:00 PM-6:00 PM;,Thu: 4:00 PM-6:00 PM,,,,,,,,,,,,,,,,,,,,,,,,,,,,,,,,
1011495,College Of San Mateo Certified Farmers Market,http://pcfma.org,http://pcfma.org,facebook.com/CollegeofSanMateoFarmersMarket,,twitter.com/PacCoastFarmers,,,,instagram.com/pcfma,instagram.com/pcfma,01/01/2015 to 12/31/2015,2015-01-01,2015-12-31,Sat: 9:00 AM-1:00 PM;,Sat: 9:00 AM-1:00 PM,,,,,,,,,,,,,,,,,,,,,,,,,,,,,,,,
1011387,College Of The Ozarks Farmers Market,,,,,,,,,,,,,,Fri: 7:00 AM-11:00 AM;,Fri: 7:00 AM-11:00 AM,,,,,,,,,,,,,,,,,,,,,,,,,,,,,,,,
1002053,College Park City Hall Farmers Market,,,,,,,,,,,April to November,2010-04-01,2010-11-30,sun:9:00 AM - 2:00 PM;,sun:9:00 AM - 2:00 PM,,,,,,,,,,,,,,,,,,,,,,,,,,,,,,,,
1002054,College Park Farmers Market,,,,,,,,,,,May to November,2010-05-01,2010-11-30,Sat:7:00 AM - 12:00 PM;,Sat:7:00 AM - 12:00 PM,,,,,,,,,,,,,,,,,,,,,,,,,,,,,,,,
1002316,Colleton Farmers Market,http://www.colletonmuseum.com/farmersmarket.aspx,http://www.colletonmuseum.com/farmersmarket.aspx,,,,,,,,,May to October,2010-05-01,2010-10-31,Tue:2:00 PM - 6:00 PM;Sat:10:00 AM - 2:00 PM;,Tue:2:00 PM - 6:00 PM,Sat:10:00 AM - 2:00 PM,,,,,,,,,,,,,,,,,,,,,,,,,,,,,,,
1008162,Collier County Government Complex Farmers Market,http://www.doh.state.fl.us/chdcollier/smartgrowth/,http://www.doh.state.fl.us/chdcollier/smartgrowth/,,,,,,,,,01/01/2014 to 12/31/2014,2014-01-01,2014-12-31,Fri: 11:00 AM-2:00 PM;,Fri: 11:00 AM-2:00 PM,,,,,,,,,,,,,,,,,,,,,,,,,,,,,,,,
1003470,Collierville Farmers Market,http://www.colliervillefarmersmarket.org,http://www.colliervillefarmersmarket.org,https://www.facebook.com/pages/Collierville-Farmers-Market/113213532050578,https://www.facebook.com/pages/Collierville-Farmers-Market/113213532050578,,,,,,,05/16/2013 to 10/17/2013,2013-05-16,2013-10-17,Thu: 8:00 AM-1:00 PM;,Thu: 8:00 AM-1:00 PM,,,,,,,,,,,,,,,,,,,,,,,,,,,,,,,,
1001711,Collingswood Farmers Market,http://www.collingswoodmarket.com,http://www.collingswoodmarket.com,,,,,,,,,,,,,,,,,,,,,,,,,,,,,,,,,,,,,,,,,,,,,
1002417,Collins Farmers Market,,,,,,,,,,,,,,,,,,,,,,,,,,,,,,,,,,,,,,,,,,,,,,,
1003545,Collins Park Sunday Market,http://www.themarketcompany.org,http://www.themarketcompany.org,,,,,,,,,,,,,,,,,,,,,,,,,,,,,,,,,,,,,,,,,,,,,
1001290,Collinsville Farmers Market,http://www.collinsvillefarmersmarket.org,http://www.collinsvillefarmersmarket.org,https://www.facebook.com/collinsvillefarmersmarket1,https://www.facebook.com/collinsvillefarmersmarket1,@CollinsvilleFM,@CollinsvilleFM,,,,,06/28/2015 to 10/25/2015,2015-06-28,2015-10-25,Sun: 10:00 AM-1:00 PM;,Sun: 10:00 AM-1:00 PM,,,,,,,,,,,,,,,,,,,,,,,,,,,,,,,,
1006646,Collinsville Farmers Market,,,,,,,,,,,,,,,,,,,,,,,,,,,,,,,,,,,,,,,,,,,,,,,
1006253,Colo Farmers Market,http://www.colo-iowa.org/farmers.pdf,http://www.colo-iowa.org/farmers.pdf,,,,,,,,,May to September,2010-05-01,2010-09-30,Thu:5:00 PM - 7:00 PM;,Thu:5:00 PM - 7:00 PM,,,,,,,,,,,,,,,,,,,,,,,,,,,,,,,,
1010977,Colonial Beach Farmers Market,http://growrva.com/,http://growrva.com/,https://www.facebook.com/GrowRVA,https://www.facebook.com/GrowRVA,https://twitter.com/growrva,https://twitter.com/growrva,,,https://instagram.com/growrva/,https://instagram.com/growrva/,06/04/2015 to 08/27/2015,2015-06-04,2015-08-27,Thu: 4:00 PM-7:00 PM;,Thu: 4:00 PM-7:00 PM,,,,,,,,,,,,,,,,,,,,,,,,,,,,,,,,
1001446,Colonial Village Farmers Market,,,,,,,,,,,,,,,,,,,,,,,,,,,,,,,,,,,,,,,,,,,,,,,
1000210,Colorado Farm And Art Market,http://www.farmandartmarket.com,http://www.farmandartmarket.com,https://www.facebook.com/farmandartmarket,https://www.facebook.com/farmandartmarket,https://twitter.com/cofarmartmarket,https://twitter.com/cofarmartmarket,,,,,06/11/2016 to 10/08/2016,2016-06-11,2016-10-08,Sat: 9:00 AM-1:00 PM;,Sat: 9:00 AM-1:00 PM,,,,,,,,,,,,,,,,,,,,,,,,,,,,,,,,
1009656,Colorado Farm And Art Market,http://www.farmandartmarket.com,http://www.farmandartmarket.com,https://www.facebook.com/farmandartmarket,https://www.facebook.com/farmandartmarket,https://twitter.com/cofarmartmarket,https://twitter.com/cofarmartmarket,,,,,06/15/2016 to 10/12/2016,2016-06-15,2016-10-12,Wed: 3:00 PM-7:00 PM;,Wed: 3:00 PM-7:00 PM,,,,,,,,,,,,,,,,,,,,,,,,,,,,,,,,
1009382,Colton Farmers And Crafters Market,http://www.coltonfarmerscraftersmarket.weebly.com/,http://www.coltonfarmerscraftersmarket.weebly.com/,,,,,,,,,,,,,,,,,,,,,,,,,,,,,,,,,,,,,,,,,,,,,
1008496,Columbia Center For Urban Agriculture,http://www.ColumbiaUrbanAg.org,http://www.ColumbiaUrbanAg.org,,,,,,,http://agrimissouri.com/mo-grown/grodetail.php?type=mo-grown&ID=1363,http://agrimissouri.com/mo-grown/grodetail.php?type=mo-grown&ID=1363,,,,,,,,,,,,,,,,,,,,,,,,,,,,,,,,,,,,,
1004166,Columbia City Farmers Market,http://www.seattlefarmersmarkets.org,http://www.seattlefarmersmarkets.org,https://www.facebook.com/ColumbiaCityFarmersMarket,https://www.facebook.com/ColumbiaCityFarmersMarket,https://twitter.com/seattlefarmmkts,https://twitter.com/seattlefarmmkts,,,,,05/04/2016 to 10/12/2016,2016-05-04,2016-10-12,Wed: 3:00 PM-7:00 PM;,Wed: 3:00 PM-7:00 PM,,,,,,,,,,,,,,,,,,,,,,,,,,,,,,,,
1002375,Columbia County Homegrown Market Association,,,,,,,,,,,,,,,,,,,,,,,,,,,,,,,,,,,,,,,,,,,,,,,
1012373,Columbia Falls Community Market,http://cfcommunitymarket.com,http://cfcommunitymarket.com,https://www.facebook.com/columbiafallscommunitymarket/?fref=ts,https://www.facebook.com/columbiafallscommunitymarket/?fref=ts,,,,,,,05/19/2016 to 09/22/2016,2016-05-19,2016-09-22,Thu: 5:00 PM-8:00 PM;,Thu: 5:00 PM-8:00 PM,,,,,,,,,,,,,,,,,,,,,,,,,,,,,,,,
1000794,Columbia Farmers Market,http://www.columbiafarmersmarket.org,http://www.columbiafarmersmarket.org,https://www.facebook.com/ColumbiaFarmersMarket,https://www.facebook.com/ColumbiaFarmersMarket,https://twitter.com/comofarmers,https://twitter.com/comofarmers,,,https://www.instagram.com/columbiafarmersmarket/,https://www.instagram.com/columbiafarmersmarket/,05/05/2016 to 10/27/2016,2016-05-05,2016-10-27,Thu: 3:00 PM-6:00 PM;,Thu: 3:00 PM-6:00 PM,,,,,,,,,,,,,,,,,,,,,,,,,,,,,,,,
1000795,Columbia Farmers Market,http://www.columbiafarmersmarket.org,http://www.columbiafarmersmarket.org,https://www.facebook.com/ColumbiaFarmersMarket,https://www.facebook.com/ColumbiaFarmersMarket,https://twitter.com/comofarmers,https://twitter.com/comofarmers,,,https://www.instagram.com/columbiafarmersmarket/,https://www.instagram.com/columbiafarmersmarket/,11/05/2016 to 03/25/2017,2016-11-05,2017-03-25,Sun: 9:00 AM-12:00 PM;,Sun: 9:00 AM-12:00 PM,,,,,,,,,,,,,,,,,,,,,,,,,,,,,,,,
1011118,Columbia Farmers Market,http://columbiafarmersmarket.org,http://columbiafarmersmarket.org,https://www.facebook.com/ColumbiaFarmersMarket,https://www.facebook.com/ColumbiaFarmersMarket,https://twitter.com/comofarmers,https://twitter.com/comofarmers,,,https://instagram.com/columbiafarmersmarket/,https://instagram.com/columbiafarmersmarket/,04/04/2015 to 10/31/2015,2015-04-04,2015-10-31,Sat: 8:00 AM-12:00 PM;,Sat: 8:00 AM-12:00 PM,,,,,,,05/06/2015 to 10/28/2015,5/6/15, 10/28/2015,Wed: 4:00 PM-6:00 PM;,Wed: 4:00 PM-6:00 PM,,,,,,,,,,,,,,,,,,,,,
1010062,Columbia Fresh Farmers Market,http://columbiafarmersfreshmarket.com,http://columbiafarmersfreshmarket.com,columbiafarmersfreshmarket,,,,,,,,06/07/2014 to 10/25/2014,2014-06-07,2014-10-25,Tue: 7:00 AM-12:00 PM;Thu: 7:00 AM-12:00 PM;Sat: 7:00 AM-12:00 PM;,Tue: 7:00 AM-12:00 PM,Thu: 7:00 AM-12:00 PM,Sat: 7:00 AM-12:00 PM,,,,,,,,,,,,,,,,,,,,,,,,,,,,,,
1011224,Columbia Heights Farmers Market,http://www.community-foodworks.org/,,https://www.facebook.com/CHFestivus/,https://www.facebook.com/CHFestivus/,https://twitter.com/CoHeightsMarket,https://twitter.com/CoHeightsMarket,,,,,04/16/2016 to 12/17/2016,2016-04-16,2016-12-17,Wed: 4:00 PM-7:30 PM;Sun: 9:00 AM-1:00 PM;,Wed: 4:00 PM-7:30 PM,Sun: 9:00 AM-1:00 PM,,,,,,,,,,,,,,,,,,,,,,,,,,,,,,,
1008316,Columbia Pike Farmers Market,http://www.columbiapike.org,http://www.columbiapike.org,www.facebook.com/pages/Columbia-Pike-Farmers-Marke,,,,,,,,05/03/2015 to 11/22/2015,2015-05-03,2015-11-22,Sun: 9:00 AM-1:00 PM;,Sun: 9:00 AM-1:00 PM,,,,,,,11/29/2015 to 12/20/2015,11/29/15, 12/20/2015,Sun: 9:00 AM-1:00 PM;,Sun: 9:00 AM-1:00 PM,,,,,,,1/10/16, 04/24/2016,Sun: 10:00 AM-1:00 PM;,Sun: 10:00 AM-1:00 PM,,,,,,,,,,,
1000068,Columbia University Greenmarket,http://www.grownyc.org,http://www.grownyc.org,https://www.facebook.com/ManhattanGreenmarkets,https://www.facebook.com/ManhattanGreenmarkets,,,,,,,,,,Thu: 8:00 AM-5:00 PM;Sun: 8:00 AM-5:00 PM;,Thu: 8:00 AM-5:00 PM,Sun: 8:00 AM-5:00 PM,,,,,,,,,,,,,,,,,,,,,,,,,,,,,,,
1006811,Columbia-pacific Farmers Market,http://www.longbeachwa.gov/farmersmarket/,http://www.longbeachwa.gov/farmersmarket/,,,,,,,,,May to September,2010-05-01,2010-09-30,Fri:3:00 PM - 6:00 PM;,Fri:3:00 PM - 6:00 PM,,,,,,,,,,,,,,,,,,,,,,,,,,,,,,,,
1003006,Columbinana Farmers Market,,,,,,,,,,,,,,,,,,,,,,,,,,,,,,,,,,,,,,,,,,,,,,,
1006705,Columbus City Farmers Market,,,https://www.facebook.com/pages/Columbus-City-Farmers-Market/347949301937000,https://www.facebook.com/pages/Columbus-City-Farmers-Market/347949301937000,,,,,,,06/01/2013 to 09/28/2013,2013-06-01,2013-09-28,Sat: 9:00 AM-12:30 PM;,Sat: 9:00 AM-12:30 PM,,,,,,,,,,,,,,,,,,,,,,,,,,,,,,,,
1005087,"Columbus County Community Farmers Market, Inc.",http://www.columbuscountyfarmersmarket.com/,http://www.columbuscountyfarmersmarket.com/,https://www.facebook.com/pages/Columbus-County-Community-Farmers-Market-Inc/95369263724,https://www.facebook.com/pages/Columbus-County-Community-Farmers-Market-Inc/95369263724,https://twitter.com/ccfarmersmarket,https://twitter.com/ccfarmersmarket,,,https://www.instagram.com/cccfm/,https://www.instagram.com/cccfm/,05/14/2016 to 12/10/2016,2016-05-14,2016-12-10,Sat: 7:00 AM-12:00 PM;,Sat: 7:00 AM-12:00 PM,,,,,,,,,,,,,,,,,,,,,,,,,,,,,,,,
1005830,Columbus Downtown Farmers Market,,,,,,,,,,,June to October,2010-06-01,2010-10-31,,,,,,,,,,,,,,,,,,,,,,,,,,,,,,,,,,
1006091,"Columbus Farmers Market, Columbus, Indiana",http://www.columbusfarmersmarket.org/,http://www.columbusfarmersmarket.org/,,,,,,,,,June to September,2010-06-01,2010-09-30,sun:9:00 AM - 12:30 PM;,sun:9:00 AM - 12:30 PM,,,,,,,,,,,,,,,,,,,,,,,,,,,,,,,,
1007015,Columbus Farmers Market,,,,,,,,,,,January to December,2010-01-01,2010-12-31,Thu:6:00 am - 8:00 pm;Fri:6:00 pm - 8:00 pm;Sat:6:00 pm - 8:00 pm;sun:6:00 pm - 8:00 pm;,Thu:6:00 am - 8:00 pm,Fri:6:00 pm - 8:00 pm,Sat:6:00 pm - 8:00 pm,sun:6:00 pm - 8:00 pm,,,,,,,,,,,,,,,,,,,,,,,,,,,,,
1010010,Columbus Farmers Market,http://www.columbusnedowntown.com/FarmerMarket/farmersmarket.html,http://www.columbusnedowntown.com/FarmerMarket/farmersmarket.html,,,,,,,,,05/03/2014 to 10/25/2014,2014-05-03,2014-10-25,Sat: 7:30 AM-12:00 PM;,Sat: 7:30 AM-12:00 PM,,,,,,,,,,,,,,,,,,,,,,,,,,,,,,,,
1003996,Columbus Farmers Market,http://www.polkcountyfarms.org/farmers-markets,http://www.polkcountyfarms.org/farmers-markets,https://www.facebook.com/polkcountyfarms,https://www.facebook.com/polkcountyfarms,https://twitter.com/polkcountyfarms,https://twitter.com/polkcountyfarms,http://www.youtube.com/user/polkcountyfarms,http://www.youtube.com/user/polkcountyfarms,,,04/12/2014 to 11/22/2014,2014-04-12,2014-11-22,Sun: 8:00 AM-12:00 PM;,Sun: 8:00 AM-12:00 PM,,,,,,,,,,,,,,,,,,,,,,,,,,,,,,,,
1012035,Columbus Farmers Market,,,,,,,,,,,07/21/2016 to 09/08/2016,2016-07-21,2016-09-08,Thu: 4:00 PM-6:30 PM;,Thu: 4:00 PM-6:30 PM,,,,,,,,,,,,,,,,,,,,,,,,,,,,,,,,
1003893,Columbus Junction Farmers Market,http://columbusjunctioniowa.org,http://columbusjunctioniowa.org,https://www.facebook.com/home.php#!/profile.php?id=100000752813941,,,,,,,,05/08/2015 to 10/09/2015,2015-05-08,2015-10-09,Fri: 4:30 PM-6:30 PM;,Fri: 4:30 PM-6:30 PM,,,,,,,,,,,,,,,,,,,,,,,,,,,,,,,,
1006256,Columbus Public Health Urban Farmers Market,,,,,,,,,,,,,,,,,,,,,,,,,,,,,,,,,,,,,,,,,,,,,,,
1002562,Columbus State Farmers Market,,,,,,,,,,,,,,,,,,,,,,,,,,,,,,,,,,,,,,,,,,,,,,,
1000865,Columbus Winter Farmers Market,http://www.columbuswinterfarmersmarket.com,http://www.columbuswinterfarmersmarket.com,,,,,,,,,November to March,2010-11-01,2010-03-31,Sat:10:00 AM - 1:00 PM;,Sat:10:00 AM - 1:00 PM,,,,,,,,,,,,,,,,,,,,,,,,,,,,,,,,
1004424,Colusa Farmers Market,,,,,,,,,,,,,,,,,,,,,,,,,,,,,,,,,,,,,,,,,,,,,,,
1003218,Colville Farmers Market,,,,,,,,,,,,,,,,,,,,,,,,,,,,,,,,,,,,,,,,,,,,,,,
1011003,Colwells Farmers Market,,,https://www.facebook.com/colwellmarket,https://www.facebook.com/colwellmarket,,,,,,,04/01/2015 to 11/01/2015,2015-04-01,2015-11-01,Mon: 9:00 AM-5:30 PM;Tue: 9:00 AM-5:30 PM;Wed: 9:00 AM-5:30 PM;Thu: 9:00 AM-5:30 PM;Fri: 9:00 AM-5:30 PM;Sat: 9:00 AM-5:30 PM;Sun: 10:00 AM-4:00 PM;,Mon: 9:00 AM-5:30 PM,Tue: 9:00 AM-5:30 PM,Wed: 9:00 AM-5:30 PM,Thu: 9:00 AM-5:30 PM,Fri: 9:00 AM-5:30 PM,Sat: 9:00 AM-5:30 PM,Sun: 10:00 AM-4:00 PM,,,,,,,,,,,,,,,,,,,,,,,,,,
1004237,Comfort Area Farmers Market,http://www.comfortchamberofcommerce.com/,http://www.comfortchamberofcommerce.com/,,,,,,,,,April to August,2010-04-01,2010-08-31,Sat:8:00 AM - 12:00 PM;,Sat:8:00 AM - 12:00 PM,,,,,,,,,,,,,,,,,,,,,,,,,,,,,,,,
1002940,Common Ground Farmers Market,http://riverside-farmers-market.org/,,,,,,,,,,,,,,,,,,,,,,,,,,,,,,,,,,,,,,,,,,,,,,
1010964,Common Ground Marketplace,http://thefoodtrust.org/farmers-markets/market/broad-and-mtvernon,http://thefoodtrust.org/farmers-markets/market/broad-and-mtvernon,,,,,,,,,05/17/2015 to 11/29/2015,2015-05-17,2015-11-29,Sun: 12:00 PM-4:00 PM;,Sun: 12:00 PM-4:00 PM,,,,,,,,,,,,,,,,,,,,,,,,,,,,,,,,
1012754,Community Congregational Farmers Market,http://www. 41markets.com,,www.facebook.com/c3farmersmarket,,,,,,,,10/08/2016 to 04/29/2017,2016-10-08,2017-04-29,Sat: 9:00 AM-2:00 PM;,Sat: 9:00 AM-2:00 PM,,,,,,,,,,,,,,,,,,,,,,,,,,,,,,,,
1006090,Community Farmers Market,,,,,,,,,,,,,,,,,,,,,,,,,,,,,,,,,,,,,,,,,,,,,,,
1009973,Community Farmers Market,http://www.hwy7farmersmarket.com,http://www.hwy7farmersmarket.com,http://www.facebook.com/hwy7farmersmarket,http://www.facebook.com/hwy7farmersmarket,,,,,,,,,,Fri: 9:00 AM-12:00 PM;,Fri: 9:00 AM-12:00 PM,,,,,,,,,,,,,,,,,,,,,,,,,,,,,,,,
1003272,Community Farmers Market At Brookland Baptist Church,http://www.prosperityforall.org,http://www.prosperityforall.org,,,,,,,,,06/02/2013 to 11/24/2013,2013-06-02,2013-11-24,Sun: 10:00 AM-3:00 PM;,Sun: 10:00 AM-3:00 PM,,,,,,,,,,,,,,,,,,,,,,,,,,,,,,,,
1012415,Community Farmers Market Bowling Green,http://www.communityfarmersmarketbg.com/,http://www.communityfarmersmarketbg.com/,https://www.facebook.com/Community-Farmers-Market-Bowling-Green-143986732333279/,https://www.facebook.com/Community-Farmers-Market-Bowling-Green-143986732333279/,https://twitter.com/CommunityFarmer/,https://twitter.com/CommunityFarmer/,,,https://www.instagram.com/cfmbgky/,https://www.instagram.com/cfmbgky/,01/01/2016 to 12/31/2016,2016-01-01,2016-12-31,Tue: 2:00 PM-6:00 PM;Sat: 8:00 AM-1:00 PM;,Tue: 2:00 PM-6:00 PM,Sat: 8:00 AM-1:00 PM,,,,,,,,,,,,,,,,,,,,,,,,,,,,,,,
1001329,Community Farmers Market Of Boynton Beach,http://www.communityfarmersmarketsofsouthflorida.com,http://www.communityfarmersmarketsofsouthflorida.com,,,,,,,,,January to December,2010-01-01,2010-12-31,Sat:9:00 AM - 2:00 PM;,Sat:9:00 AM - 2:00 PM,,,,,,,,,,,,,,,,,,,,,,,,,,,,,,,,
1001331,Community Farmers Market Of Plantation,,,,,,,,,,,January to December,2010-01-01,2010-12-31,Sat:8:00 AM - 2:00 PM;,Sat:8:00 AM - 2:00 PM,,,,,,,,,,,,,,,,,,,,,,,,,,,,,,,,
1001330,Community Farmers Market Of Tamarac,,,,,,,,,,,January to December,2010-01-01,2010-12-31,sun:9:00 AM - 2:00 PM;,sun:9:00 AM - 2:00 PM,,,,,,,,,,,,,,,,,,,,,,,,,,,,,,,,
1011616,Community Farmers Market- Downtown,http://www.carbondalemarket.com,http://www.carbondalemarket.com,https://www.facebook.com/communityfarmersmarket/,https://www.facebook.com/communityfarmersmarket/,@carbondalemarket,@carbondalemarket,,,,,,,,Wed: 3:00 PM-6:00 PM;,Wed: 3:00 PM-6:00 PM,,,,,,,,,,,,,,,,,,,,,,,,,,,,,,,,
1008708,Community Farmers Market Of Garrard County,http://www.localharvest.org/community-farmers-market-M58324,http://www.localharvest.org/community-farmers-market-M58324,https://www.facebook.com/garrardcommunityfarmersmarket?ref=hl,https://www.facebook.com/garrardcommunityfarmersmarket?ref=hl,,,,,,,04/03/2014 to 10/09/2014,2014-04-03,2014-10-09,Thu: 3:00 PM-6:00 PM;,Thu: 3:00 PM-6:00 PM,,,,,,,,,,,,,,,,,,,,,,,,,,,,,,,,
1012132,Community Food Bank Farm Stand,http://www.communityfoodbank.org,http://www.communityfoodbank.org,https://www.facebook.com/SantaCruzRiverFarmersMarket/,https://www.facebook.com/SantaCruzRiverFarmersMarket/,https://twitter.com/SantaCruzRiver,https://twitter.com/SantaCruzRiver,,,,,01/01/2016 to 12/31/2016,2016-01-01,2016-12-31,Tue: 8:00 AM-12:00 PM;,Tue: 8:00 AM-12:00 PM,,,,,,,,,,,,,,,,,,,,,,,,,,,,,,,,
1002190,Community Garden,,,,,,,,,,,,,,,,,,,,,,,,,,,,,,,,,,,,,,,,,,,,,,,
1009853,Community Market Of Blacksburg,http://www.thecommunityfarmersmarket.com,http://www.thecommunityfarmersmarket.com,https://www.facebook.com/TCFMB,https://www.facebook.com/TCFMB,https://twitter.com/burgslocalfoods,https://twitter.com/burgslocalfoods,,,,,05/17/2014 to 12/20/2014,2014-05-17,2014-12-20,Tue: 9:00 AM-2:00 PM;Sat: 8:00 AM-2:00 PM;,Tue: 9:00 AM-2:00 PM,Sat: 8:00 AM-2:00 PM,,,,,,,,,,,,,,,,,,,,,,,,,,,,,,,
1001263,Community Roots Market,http://www.peachlocal.com,http://www.peachlocal.com,,,,,,,,,,,,,,,,,,,,,,,,,,,,,,,,,,,,,,,,,,,,,
1010233,Compton Blue Line Farmers Market,,,,,,,,,,,05/29/2014 to 10/30/2014,2014-05-29,2014-10-30,Thu: 11:00 AM-7:00 PM;,Thu: 11:00 AM-7:00 PM,,,,,,,,,,,,,,,,,,,,,,,,,,,,,,,,
1002010,Concho Farmers Market,http://www.conchofarmersmarket.org,http://www.conchofarmersmarket.org,,,,,,,,,,,,,,,,,,,,,,,,,,,,,,,,,,,,,,,,,,,,,
1007154,Concho Valley Farmers Market,,,,,,,,,,,,,,,,,,,,,,,,,,,,,,,,,,,,,,,,,,,,,,,
1011785,Concord Farmers Market Association,http://www.concordfarmersmarket.com,http://www.concordfarmersmarket.com,,,,,,,,,05/07/2016 to 10/28/2016,2016-05-07,2016-10-28,Sat: 8:30 AM-12:00 PM;,Sat: 8:30 AM-12:00 PM,,,,,,,,,,,,,,,,,,,,,,,,,,,,,,,,
1011343,Concord Farmers Market,http://www.pcfma.org,http://www.pcfma.org,https://www.facebook.com/ConcordFarmersMarket,https://www.facebook.com/ConcordFarmersMarket,,,,,,,01/01/2015 to 12/31/2015,2015-01-01,2015-12-31,Tue: 9:00 AM-1:00 PM;,Tue: 9:00 AM-1:00 PM,,,,,,,,,,,,,,,,,,,,,,,,,,,,,,,,
1005916,Concord Market,,,,,,,,,,,,,,,,,,,,,,,,,,,,,,,,,,,,,,,,,,,,,,,
1001337,Concordia Farmers Market,,,,,,,,,,,,,,,,,,,,,,,,,,,,,,,,,,,,,,,,,,,,,,,
1001336,Concordia Farmers’,,,,,,,,,,,,,,,,,,,,,,,,,,,,,,,,,,,,,,,,,,,,,,,
1002749,Condon Community Farmers Market,http://www.condonchamber.org/CondonCommunityFarmersMarket.htm,http://www.condonchamber.org/CondonCommunityFarmersMarket.htm,https://www.facebook.com/pages/Condon-Community-Farmers-Market/463077227050262,https://www.facebook.com/pages/Condon-Community-Farmers-Market/463077227050262,,,,,,,07/05/2014 to 10/04/2014,2014-07-05,2014-10-04,Sat: 10:00 AM-2:00 PM;,Sat: 10:00 AM-2:00 PM,,,,,,,,,,,,,,,,,,,,,,,,,,,,,,,,
1000276,Conecuh County Farmers Market,,,,,,,,,,,May to September,2010-05-01,2010-09-30,Tue:3:00 PM - 6:00 PM;,Tue:3:00 PM - 6:00 PM,,,,,,,,,,,,,,,,,,,,,,,,,,,,,,,,
1007317,Coney Island Farmers Market,,,,,,,,,,,06/15/2014 to 10/26/2014,2014-06-15,2014-10-26,Sun: 8:00 AM-3:30 PM;,Sun: 8:00 AM-3:30 PM,,,,,,,,,,,,,,,,,,,,,,,,,,,,,,,,
1006216,Coney Island Hospital Market,,,,,,,,,,,,,,,,,,,,,,,,,,,,,,,,,,,,,,,,,,,,,,,
1009300,Congerville Farmers Market,http://www.congervillefarmersmarket.blogspot.com/,http://www.congervillefarmersmarket.blogspot.com/,,,,,,,,,,,,,,,,,,,,,,,,,,,,,,,,,,,,,,,,,,,,,
1010773,Conifer Farmers Market,http://www.conifersummermarket.com,http://www.conifersummermarket.com,https://www.facebook.com/ConiferFarmersMarket,https://www.facebook.com/ConiferFarmersMarket,,,,,,,06/11/2016 to 09/10/2016,2016-06-11,2016-09-10,Sat: 9:00 AM-2:00 PM;,Sat: 9:00 AM-2:00 PM,,,,,,,,,,,,,,,,,,,,,,,,,,,,,,,,
1004621,Conneaut Farmers Market Inc.,,,,,,,,,,,,,,,,,,,,,,,,,,,,,,,,,,,,,,,,,,,,,,,
1007995,Connellsville Farmers Market,,,,,,,,,,,,,,,,,,,,,,,,,,,,,,,,,,,,,,,,,,,,,,,
1000706,Connersville/fayette County Farmers Market,,,,,,,,,,,,,,,,,,,,,,,,,,,,,,,,,,,,,,,,,,,,,,,
1011548,Connor Farm,,,,,,,,,,,,,,,,,,,,,,,,,,,,,,,,,,,,,,,,,,,,,,,
1003308,Conover Farmers Market,http://www.conoverfarmersmarket.org,http://www.conoverfarmersmarket.org,https://www.facebook.com/ConoverFarmersMarket,https://www.facebook.com/ConoverFarmersMarket,,,,,,,04/27/2013 to 10/26/2013,2013-04-27,2013-10-26,Sun: 7:30 AM-12:00 PM;,Sun: 7:30 AM-12:00 PM,,,,,,,,,,,,,,,,,,,,,,,,,,,,,,,,
1003244,Conshohocken,http://www.headhousemarket.org,http://www.headhousemarket.org,,,,,,,,,,,,,,,,,,,,,,,,,,,,,,,,,,,,,,,,,,,,,
1009076,Contoocook Farmers Market (summer),,,https://www.FaceBook.com/contoocookFarmersMarket,https://www.FaceBook.com/contoocookFarmersMarket,,,,,,,06/07/2014 to 10/25/2014,2014-06-07,2014-10-25,Sat: 9:00 AM-12:00 PM;,Sat: 9:00 AM-12:00 PM,,,,,,,,,,,,,,,,,,,,,,,,,,,,,,,,
1001284,Contoocook Farmers Market Winter,,,https://www.FaceBook.com/contoocookFarmersMarket,https://www.FaceBook.com/contoocookFarmersMarket,,,,,,,06/07/2014 to 10/25/2014,2014-06-07,2014-10-25,Sat: 9:00 AM-12:00 PM;,Sat: 9:00 AM-12:00 PM,,,,,,,11/01/2014 to 05/30/2015,11/1/14, 05/30/2015,Sat: 10:00 AM-1:00 PM;,Sat: 10:00 AM-1:00 PM,,,,,,,,,,,,,,,,,,,,,
1006204,Conuco Farmers Market,,,,,,,,,,,,,,,,,,,,,,,,,,,,,,,,,,,,,,,,,,,,,,,
1003204,Conway County Farmers Market,,,,,,,,,,,,,,,,,,,,,,,,,,,,,,,,,,,,,,,,,,,,,,,
1008705,Conway Farmers Market,,,https://www.facebook.com/pages/Conway-Arkansas-Farmers-Market/156108827846178,https://www.facebook.com/pages/Conway-Arkansas-Farmers-Market/156108827846178,,,,,,,05/11/2013 to 11/02/2013,2013-05-11,2013-11-02,Tue: 6:30 AM-12:00 PM;Thu: 6:30 AM-12:00 PM;Sat: 6:30 AM-12:00 PM;,Tue: 6:30 AM-12:00 PM,Thu: 6:30 AM-12:00 PM,Sat: 6:30 AM-12:00 PM,,,,,,,,,,,,,,,,,,,,,,,,,,,,,,
1009865,Conway Farmers Market,,,https://www.facebook.com/pages/Conway-Arkansas-Farmers-Market/156108827846178,https://www.facebook.com/pages/Conway-Arkansas-Farmers-Market/156108827846178,,,,,,,05/03/2014 to 05/24/2014,2014-05-03,2014-05-24,Sat: 6:30 AM-12:00 PM;,Sat: 6:30 AM-12:00 PM,,,,,,,05/27/2014 to 08/16/2014,5/27/14, 08/16/2014,Tue: 6:30 AM-12:00 PM;Sat: 6:30 AM-12:00 PM;,Tue: 6:30 AM-12:00 PM,Sat: 6:30 AM-12:00 PM,,,,,,8/16/14, 11/01/2014,Sat: 6:30 AM-12:00 PM;,Sat: 6:30 AM-12:00 PM,,,,,,,,,,,
1012030,Conway Farmers Market,http://waccamawmarkets.org/,http://waccamawmarkets.org/,https://www.facebook.com/WaccamawMarketCooperative/,https://www.facebook.com/WaccamawMarketCooperative/,,,,,,,05/07/2016 to 10/29/2016,2016-05-07,2016-10-29,Sat: 8:00 AM-1:00 PM;,Sat: 8:00 AM-1:00 PM,,,,,,,,,,,,,,,,,,,,,,,,,,,,,,,,
1002022,Conway Farmers Market,,,,,,,,,,,,,,,,,,,,,,,,,,,,,,,,,,,,,,,,,,,,,,,
1008480,Conway Locally Grown,http://www.conway.locallygrown.net,http://www.conway.locallygrown.net,https://www.facebook.com/pages/Conway-Locally-Grown/146991555352846?ref=ts&fref=ts,https://www.facebook.com/pages/Conway-Locally-Grown/146991555352846?ref=ts&fref=ts,,,,,,,01/01/2013 to 12/31/2013,2013-01-01,2013-12-31,Fri: 4:00 PM-6:00 PM;,Fri: 4:00 PM-6:00 PM,,,,,,,,,,,,,,,,,,,,,,,,,,,,,,,,
1003198,Cook Area Farmers Market,,,,,,,,,,,,,,,,,,,,,,,,,,,,,,,,,,,,,,,,,,,,,,,
1000809,Cook County Farm And Craft Market,,,,,,,,,,,,,,,,,,,,,,,,,,,,,,,,,,,,,,,,,,,,,,,
1006825,Cookeville Farmers Market,,,,,,,,,,,,,,,,,,,,,,,,,,,,,,,,,,,,,,,,,,,,,,,
1000197,Cool Spring Farmers Market,http://www.westendnh.org,http://www.westendnh.org,,,,,,,,,June to October,2010-06-01,2010-10-31,Thu:3:00 PM - 8:00 PM;,Thu:3:00 PM - 8:00 PM,,,,,,,,,,,,,,,,,,,,,,,,,,,,,,,,
1003608,Coon Rapids Farmers Market,http://www.coonrapidsiowa.com,http://www.coonrapidsiowa.com,,,,,,,,,,,,,,,,,,,,,,,,,,,,,,,,,,,,,,,,,,,,,
1006210,Coop City Market,,,,,,,,,,,,,,,,,,,,,,,,,,,,,,,,,,,,,,,,,,,,,,,
1007697,Cooper Park Farmers Market,http://www.downtoearthmarkets.com,http://www.downtoearthmarkets.com,https://www.facebook.com/DowntoEarthMarkets,https://www.facebook.com/DowntoEarthMarkets,https://twitter.com/DowntoEarthMkts,https://twitter.com/DowntoEarthMkts,,,Instagram DowntoEarthMkts,Instagram DowntoEarthMkts,05/26/2013 to 11/24/2013,2013-05-26,2013-11-24,Sun: 11:00 AM-4:00 PM;,Sun: 11:00 AM-4:00 PM,,,,,,,,,,,,,,,,,,,,,,,,,,,,,,,,
1010400,Cooper Young Community Farmers Market,http://cycfarmersmarket.org,http://cycfarmersmarket.org,https://www.facebook.com/cycfarmersmarket,https://www.facebook.com/cycfarmersmarket,@cycfarmersmkt,@cycfarmersmkt,,,instagram: @cyfarmersmarket,instagram: @cyfarmersmarket,01/01/2014 to 12/31/2014,2014-01-01,2014-12-31,Sat: 8:00 AM-1:00 PM;,Sat: 8:00 AM-1:00 PM,,,,,,,,,,,,,,,,,,,,,,,,,,,,,,,,
1011235,Cooperativa Orgánica Madre Tierra,http://www.coopmadretierra.org,http://www.coopmadretierra.org,https://www.facebook.com/cooperativa.tierra?fref=ts,https://www.facebook.com/cooperativa.tierra?fref=ts,,,,,,,01/01/2015 to 12/31/2015,2015-01-01,2015-12-31,Sun: 8:00 AM-2:00 PM;,Sun: 8:00 AM-2:00 PM,,,,,,,,,,,,,,,,,,,,,,,,,,,,,,,,
1006258,"Cooperative Community Food Compact, Inc.",http://www.farmtocity.org,http://www.farmtocity.org,,,,,,,,,January to December,2010-01-01,2010-12-31,Wed:4:00 PM - 7:00 PM;,Wed:4:00 PM - 7:00 PM,,,,,,,,,,,,,,,,,,,,,,,,,,,,,,,,
1009404,Cooperative Farmers Market Of Scranton,http://www.coopfarmersmarket.com/,http://www.coopfarmersmarket.com/,,,,,,,,,,,,,,,,,,,,,,,,,,,,,,,,,,,,,,,,,,,,,
1001788,Cooperstown Farmers Market,,,,,,,,,,,,,,,,,,,,,,,,,,,,,,,,,,,,,,,,,,,,,,,
1002967,Cooperstown Farmers Market,http://www.otsego2000.org/cooperstown-farmers-market-and-agriculture/,http://www.otsego2000.org/cooperstown-farmers-market-and-agriculture/,https://www.facebook.com/CooperstownFarmersMarket,https://www.facebook.com/CooperstownFarmersMarket,,,,,,,05/02/2015 to 08/29/2015,2015-05-02,2015-08-29,Tue: 12:00 PM-5:00 PM;Sat: 8:00 AM-2:00 PM;,Tue: 12:00 PM-5:00 PM,Sat: 8:00 AM-2:00 PM,,,,,,09/05/2015 to 12/26/2015,9/5/15, 12/26/2015,Sat: 9:00 AM-2:00 PM;,Sat: 9:00 AM-2:00 PM,,,,,,,1/2/16, 04/30/2016,Sat: 10:00 AM-2:00 PM;,Sat: 10:00 AM-2:00 PM,,,,,,,,,,,
1004123,Coopersville Farmers Market,http://www.coopersville.com/farmer.htm,http://www.coopersville.com/farmer.htm,,,,,,,,,,,,,,,,,,,,,,,,,,,,,,,,,,,,,,,,,,,,,
1006766,Coos Bay Downtown Farmers Market,http://www.coosbaydowntown.org,http://www.coosbaydowntown.org,https://www.facebook.com/CoosBayFarmersMarket,https://www.facebook.com/CoosBayFarmersMarket,,,,,https://www.instagram.com/coosbayfarmersmarket/,https://www.instagram.com/coosbayfarmersmarket/,05/04/2016 to 10/26/2016,2016-05-04,2016-10-26,Wed: 9:00 AM-2:00 PM;,Wed: 9:00 AM-2:00 PM,,,,,,,,,,,,,,,,,,,,,,,,,,,,,,,,
1012194,Copake Hillsdale Farmers Market,http://www.copakehillsdalefarmersmarket.com,http://www.copakehillsdalefarmersmarket.com,facebook.com/copakehillsdalefarmersmarket,,,,,,,,05/01/2016 to 10/01/2016,2016-05-01,2016-10-01,Sun: 9:00 AM-1:00 PM;,Sun: 9:00 AM-1:00 PM,,,,,,,,,,,,,,,,,,,,,,,,,,,,,,,,
1009869,Copiah County Farmers Market,,,,,,,,,,,05/01/2014 to 10/01/2014,2014-05-01,2014-10-01,Sat: 8:00 AM-1:00 PM;,Sat: 8:00 AM-1:00 PM,,,,,,,,,,,,,,,,,,,,,,,,,,,,,,,,
1009367,Copley Creekside Farmers Market,http://www.localharvest.org/copley-creekside-farmers-market-M54066,http://www.localharvest.org/copley-creekside-farmers-market-M54066,,,,,,,,,,,,,,,,,,,,,,,,,,,,,,,,,,,,,,,,,,,,,
1012265,Copley Creekside Farmers Market,http://copleyfarmersmarket.com/,http://copleyfarmersmarket.com/,https://www.facebook.com/CopleyCreeksideFarmersMarket/,https://www.facebook.com/CopleyCreeksideFarmersMarket/,https://twitter.com/copleyfm,https://twitter.com/copleyfm,,,https://www.instagram.com/copleymarket/,https://www.instagram.com/copleymarket/,05/26/2016 to 10/06/2016,2016-05-26,2016-10-06,Thu: 3:00 PM-6:00 PM;,Thu: 3:00 PM-6:00 PM,,,,,,,,,,,,,,,,,,,,,,,,,,,,,,,,
1012476,Copley Square Farmers Market,http://www.massfarmersmarkets.org,http://www.massfarmersmarkets.org,www.facebook.com/CopleySquareFarmersMarket,,@MAFarmMarkets,@MAFarmMarkets,,,,,05/10/2016 to 11/22/2016,2016-05-10,2016-11-22,Tue: 11:00 AM-6:00 PM;Fri: 11:00 AM-6:00 PM;,Tue: 11:00 AM-6:00 PM,Fri: 11:00 AM-6:00 PM,,,,,,,,,,,,,,,,,,,,,,,,,,,,,,,
1000158,Coppell Farmers Market,http://www.coppellfarmersmarket.org,http://www.coppellfarmersmarket.org,https://www.facebook.com/pages/Coppell-Farmers-Market/112423382177?ref=br_tf,https://www.facebook.com/pages/Coppell-Farmers-Market/112423382177?ref=br_tf,https://twitter.com/coppellfm,https://twitter.com/coppellfm,,,https://www.instagram.com/coppellfarmersmarket/,https://www.instagram.com/coppellfarmersmarket/,04/04/2015 to 11/30/2016,2015-04-04,2016-11-30,Sat: 8:00 AM-12:00 PM;,Sat: 8:00 AM-12:00 PM,,,,,,,12/05/2015 to,12/5/15,,Sat: 8:00 AM-12:00 PM;,Sat: 8:00 AM-12:00 PM,,,,,,,,,,,,,,,,,,,,,
1006999,Copper Ridge And Fairhaven Farmers Market,,,,,,,,,,,,,,,,,,,,,,,,,,,,,,,,,,,,,,,,,,,,,,,
1000982,Copper Valley Community Market,,,,,,,,,,,,,,,,,,,,,,,,,,,,,,,,,,,,,,,,,,,,,,,
1007004,Copperas Cove Farmers Market,,,,,,,,,,,01/01/2014 to 12/31/2014,2014-01-01,2014-12-31,Wed: 3:00 PM-6:00 PM;Sat: 10:00 AM-2:00 PM;,Wed: 3:00 PM-6:00 PM,Sat: 10:00 AM-2:00 PM,,,,,,,,,,,,,,,,,,,,,,,,,,,,,,,
1007058,Coquille Farmers Market,,,,,,,,,,,,,,,,,,,,,,,,,,,,,,,,,,,,,,,,,,,,,,,
1005372,Coral Gables Farmers Market,http://www.gablesrecreation.com,http://www.gablesrecreation.com,,,,,,,,,January to March,2010-01-01,2010-03-31,Sat:8:00 AM - 1:00 PM;,Sat:8:00 AM - 1:00 PM,,,,,,,,,,,,,,,,,,,,,,,,,,,,,,,,
1000899,Coral Gables Museum Market On The Plaza,http://www.coralgablesmuseum.org,http://www.coralgablesmuseum.org,,,,,,,,,March to December,2010-03-01,2010-12-31,Sat:8:00 AM - 2:00 PM;,Sat:8:00 AM - 2:00 PM,,,,,,,,,,,,,,,,,,,,,,,,,,,,,,,,
1006525,Coralville Farmers Market,http://www.coralville.org/farmersmarket,http://www.coralville.org/farmersmarket,https://www.facebook.com/coralvillefarmersmarket,https://www.facebook.com/coralvillefarmersmarket,,,,,,,05/02/2016 to 10/03/2016,2016-05-02,2016-10-03,Mon: 5:00 PM-7:00 PM;,Mon: 5:00 PM-7:00 PM,,,,,,,,,,,,,,,,,,,,,,,,,,,,,,,,
1001825,Corapopolis Farmers Market,,,,,,,,,,,,,,,,,,,,,,,,,,,,,,,,,,,,,,,,,,,,,,,
1001072,Cordele State Farmers Market,,,,,,,,,,,,,,,,,,,,,,,,,,,,,,,,,,,,,,,,,,,,,,,
1009614,Corey Avenue Sunday Fresh Market,http://www.CoreySundayMarket.com,http://www.CoreySundayMarket.com,https://www.facebook.com/CoreyAvenueSundayFreshMarket,https://www.facebook.com/CoreyAvenueSundayFreshMarket,https://twitter.com/CoreyMarket,https://twitter.com/CoreyMarket,,,,,01/05/2014 to 05/25/2014,2014-01-05,2014-05-25,Sun: 9:00 AM-2:00 PM;,Sun: 9:00 AM-2:00 PM,,,,,,,10/05/2014 to 05/31/2015,10/5/14, 05/31/2015,Sun: 9:00 AM-2:00 PM;,Sun: 9:00 AM-2:00 PM,,,,,,,,,,,,,,,,,,,,,
1005779,Corey Fresh Market,http://www.coreyave.com,http://www.coreyave.com,,,,,,,,,10/06/2013 to 05/25/2014,2013-10-06,2014-05-25,Sun: 9:00 AM-2:00 PM;,Sun: 9:00 AM-2:00 PM,,,,,,,,,,,,,,,,,,,,,,,,,,,,,,,,
1003998,Corinth Farmers Market,,,,,,,,,,,,,,,,,,,,,,,,,,,,,,,,,,,,,,,,,,,,,,,
1010366,Corn Crib Main Street Market,,,Corn Crib Main Street Market,,,,,,,,01/01/2014 to 12/31/2014,2014-01-01,2014-12-31,Sat: 8:00 AM-2:00 PM;,Sat: 8:00 AM-2:00 PM,,,,,,,,,,,,,,,,,,,,,,,,,,,,,,,,
1002944,Corn On The Curb Farmers Market,,,,,,,,,,,,,,,,,,,,,,,,,,,,,,,,,,,,,,,,,,,,,,,
1000834,Corning Farmers Market,,,,,,,,,,,,,,,,,,,,,,,,,,,,,,,,,,,,,,,,,,,,,,,
1003013,Corning Farmers Market,,,,,,,,,,,,,,,,,,,,,,,,,,,,,,,,,,,,,,,,,,,,,,,
1006920,Cornish Farmers Market,,,,,,,,,,,,,,,,,,,,,,,,,,,,,,,,,,,,,,,,,,,,,,,
1003462,Cornucopia Farmers Market,,,,,,,,,,,,,,,,,,,,,,,,,,,,,,,,,,,,,,,,,,,,,,,
1012309,Cornville Farmers Market,http://cornvilleaz.org,http://cornvilleaz.org,,,,,,,,,05/16/2016 to 10/10/2016,2016-05-16,2016-10-10,Mon: 4:00 PM-7:00 PM;,Mon: 4:00 PM-7:00 PM,,,,,,,,,,,,,,,,,,,,,,,,,,,,,,,,
1012535,Cornwall Farmers Market,http://cornwallny.gov,http://cornwallny.gov,Town of Cornwall Farmers Market,,,,,,,,05/01/2016 to 10/31/2016,2016-05-01,2016-10-31,,,,,,,,,,,,,,,,,,,,,,,,,,,,,,,,,,
1007442,Cornwall Farmers’ Market,,,,,,,,,,,,,,,,,,,,,,,,,,,,,,,,,,,,,,,,,,,,,,,
1007244,Corona Del Mar Farmers Market,,,,,,,,,,,,,,,,,,,,,,,,,,,,,,,,,,,,,,,,,,,,,,,
1000088,Corona Greenmarket,http://www.grownyc.org,http://www.grownyc.org,https://www.facebook.com/QueensGreenmarkets,https://www.facebook.com/QueensGreenmarkets,,,,,,,07/05/2013 to 11/22/2013,2013-07-05,2013-11-22,Fri: 8:00 AM-3:00 PM;,Fri: 8:00 AM-3:00 PM,,,,,,,,,,,,,,,,,,,,,,,,,,,,,,,,
1001318,Coronacfm,http://www.myfarmersmarkets.com,http://www.myfarmersmarkets.com,https://www.facebook.com/coronafarmersmarket,https://www.facebook.com/coronafarmersmarket,,,,,,,01/01/2013 to 12/31/2013,2013-01-01,2013-12-31,Sat: 8:30 AM-12:30 PM;,Sat: 8:30 AM-12:30 PM,,,,,,,,,,,,,,,,,,,,,,,,,,,,,,,,
1003859,Coronado Certified Farmers Market,,,,,,,,,,,01/01/2014 to 12/01/2014,2014-01-01,2014-12-01,Tue: 2:30 PM-6:00 PM;,Tue: 2:30 PM-6:00 PM,,,,,,,,,,,,,,,,,,,,,,,,,,,,,,,,
1009650,Corpus Christi Downtown Farmers Market,http://www.ccdowntownfm.com,http://www.ccdowntownfm.com,https://www.facebook.com/CorpusChristiDowntownFarmersMarket,https://www.facebook.com/CorpusChristiDowntownFarmersMarket,https://twitter.com/ccdowntownfm,https://twitter.com/ccdowntownfm,,,,,01/01/2014 to 12/31/2014,2014-01-01,2014-12-31,Wed: 5:00 PM-7:00 PM;,Wed: 5:00 PM-7:00 PM,,,,,,,,,,,,,,,,,,,,,,,,,,,,,,,,
1012666,Corpus Christi Downtown Farmers Market,http://www.ccdowntownfm.com,http://www.ccdowntownfm.com,https://www.facebook.com/CorpusChristiDowntownFarmersMarket/,https://www.facebook.com/CorpusChristiDowntownFarmersMarket/,https://twitter.com/ccdowntownfm,https://twitter.com/ccdowntownfm,https://www.youtube.com/channel/UCYbRpp3vuRs5xLsbrB1ospA,https://www.youtube.com/channel/UCYbRpp3vuRs5xLsbrB1ospA,https://www.instagram.com/ccdowntownfm/,https://www.instagram.com/ccdowntownfm/,01/01/2016 to 12/31/2016,2016-01-01,2016-12-31,Wed: 5:00 PM-8:00 PM;,Wed: 5:00 PM-8:00 PM,,,,,,,,,,,,,,,,,,,,,,,,,,,,,,,,
1003758,Corpus Christi Southside Farmers Market,http://www.farmersmarketcc.org,http://www.farmersmarketcc.org,https://www.facebook.com/CCFarmersMarket,https://www.facebook.com/CCFarmersMarket,,,,,,,01/01/2015 to 12/31/2015,2015-01-01,2015-12-31,Sat: 9:00 AM-12:00 PM;,Sat: 9:00 AM-12:00 PM,,,,,,,,,,,,,,,,,,,,,,,,,,,,,,,,
1004776,Corrales Growers Market,http://www.corralesgrowersmarket.com,http://www.corralesgrowersmarket.com,https://www.facebook.com/pages/The-Corrales-Growers-Market/106068612768135,https://www.facebook.com/pages/The-Corrales-Growers-Market/106068612768135,,,,,www.FarmersMarketsNM.org,www.FarmersMarketsNM.org,04/27/2014 to 10/26/2014,2014-04-27,2014-10-26,Sun: 9:00 AM-12:00 PM;,Sun: 9:00 AM-12:00 PM,,,,,,,07/09/2014 to 10/01/2014,7/9/14, 10/01/2014,Wed: 3:00 PM-6:00 PM;,Wed: 3:00 PM-6:00 PM,,,,,,,,,,,,,,,,,,,,,
1006387,Correctionville Farm And Fun,,,,,,,,,,,,,,,,,,,,,,,,,,,,,,,,,,,,,,,,,,,,,,,
1012808,Corte Bella Farmers Market,http://www.azFarmersMarkets.US,,,,,,,,,,09/14/2016 to 04/15/2017,2016-09-14,2017-04-15,Wed: 10:00 AM-1:00 PM;,Wed: 10:00 AM-1:00 PM,,,,,,,,,,,,,,,,,,,,,,,,,,,,,,,,
1009741,Corte Bella Farmers Market,http://www.azFarmersMarkets.US,,,,,,,,,,10/09/2013 to 05/14/2014,2013-10-09,2014-05-14,Wed: 10:00 AM-1:00 PM;,Wed: 10:00 AM-1:00 PM,,,,,,,,,,,,,,,,,,,,,,,,,,,,,,,,
1002978,Corte Madera Farmers Market,,,,,,,,,,,,,,,,,,,,,,,,,,,,,,,,,,,,,,,,,,,,,,,
1000103,Cortelyou Greenmarket,,,https://www.facebook.com/BrooklynGreenmarkets,https://www.facebook.com/BrooklynGreenmarkets,,,,,,,,,,Sun: 8:00 AM-4:00 PM;,Sun: 8:00 AM-4:00 PM,,,,,,,,,,,,,,,,,,,,,,,,,,,,,,,,
1008959,Cortez Farmers Market,http://www.cortezfarmmarket.com,http://www.cortezfarmmarket.com,https://www.facebook.com/groups/265957719169/admins/?order=default,https://www.facebook.com/groups/265957719169/admins/?order=default,,,,,,,06/04/2016 to 10/29/2016,2016-06-04,2016-10-29,Sat: 7:30 AM-12:00 PM;,Sat: 7:30 AM-12:00 PM,,,,,,,,,,,,,,,,,,,,,,,,,,,,,,,,
1002575,Cortland Farmers Market,http://www.cortlandne.com,http://www.cortlandne.com,,,,,,,,,,,,,,,,,,,,,,,,,,,,,,,,,,,,,,,,,,,,,
1003986,Cortland Farmers Market,,,,,,,,,,,,,,,,,,,,,,,,,,,,,,,,,,,,,,,,,,,,,,,
1009760,Corvallis Farmers Market,http://www.locallygrown.org,http://www.locallygrown.org,https://www.facebook.com/Corvallis.Albany.Farmers.Markets,https://www.facebook.com/Corvallis.Albany.Farmers.Markets,https://twitter.com/RebeccaCAFM,https://twitter.com/RebeccaCAFM,http://www.youtube.com/watch?v=eRuyyJq5o6w,http://www.youtube.com/watch?v=eRuyyJq5o6w,www.flickr.com/photos/50026834@N04/sets/,www.flickr.com/photos/50026834@N04/sets/,04/16/2016 to 11/23/2016,2016-04-16,2016-11-23,Wed: 9:00 AM-1:00 PM;Sat: 9:00 AM-1:00 PM;,Wed: 9:00 AM-1:00 PM,Sat: 9:00 AM-1:00 PM,,,,,,,,,,,,,,,,,,,,,,,,,,,,,,,
1000236,Corvallis Indoor Winter Market,,,https://www.facebook.com/Corvallis.Indoor.Winter.Market,https://www.facebook.com/Corvallis.Indoor.Winter.Market,,,,,,,01/14/2017 to 04/08/2017,2017-01-14,2017-04-08,Sat: 9:00 AM-1:00 PM;,Sat: 9:00 AM-1:00 PM,,,,,,,,,,,,,,,,,,,,,,,,,,,,,,,,
1003752,Coshocton Farmers Market Association,http://www.coshoctonfarmersmarket.com,http://www.coshoctonfarmersmarket.com,,,,,,,,,05/04/2013 to 10/26/2013,2013-05-04,2013-10-26,Sat: 8:30 AM-12:00 PM;,Sat: 8:30 AM-12:00 PM,,,,,,,,,,,,,,,,,,,,,,,,,,,,,,,,
1005600,Costa Mesa Certified Farmers Market,http://www.orange.cfbf.com,http://www.orange.cfbf.com,https://www.facebook.com/ocfarmbureaufarmersmarkets,https://www.facebook.com/ocfarmbureaufarmersmarkets,,,,,,,01/01/2015 to 12/31/2015,2015-01-01,2015-12-31,Thu: 9:00 AM-1:00 PM;,Thu: 9:00 AM-1:00 PM,,,,,,,,,,,,,,,,,,,,,,,,,,,,,,,,
1003346,Cotati Farmers Market,http://www.cotati.org,http://www.cotati.org,www.facebook.com/CotatiFarmersMarket,,,,,,,,06/06/2013 to 08/29/2013,2013-06-06,2013-08-29,Thu: 4:30 PM-7:30 PM;,Thu: 4:30 PM-7:30 PM,,,,,,,,,,,,,,,,,,,,,,,,,,,,,,,,
1009400,Coteau Hills Farmers Market,,,https://www.facebook.com/coteauhills,https://www.facebook.com/coteauhills,,,,,,,,,,,,,,,,,,,,,,,,,,,,,,,,,,,,,,,,,,,
1005408,Coto De Caza Farmers Market,,,,,,,,,,,,,,,,,,,,,,,,,,,,,,,,,,,,,,,,,,,,,,,
1009282,Cotopaxi Farmers Market,http://www.localharvest.org/cotopaxi-farmers-market-M57956,http://www.localharvest.org/cotopaxi-farmers-market-M57956,,,,,,,,,,,,,,,,,,,,,,,,,,,,,,,,,,,,,,,,,,,,,
1008398,Cottage Grove Growers Market,,,https://www.facebook.com/CoastForkFarmStand,https://www.facebook.com/CoastForkFarmStand,,,,,,,05/21/2014 to 10/15/2014,2014-05-21,2014-10-15,Wed: 4:00 PM-7:00 PM;,Wed: 4:00 PM-7:00 PM,,,,,,,,,,,,,,,,,,,,,,,,,,,,,,,,
1010975,Cottage House Youth Market,,,,,,,,,,,03/25/2015 to 12/30/2015,2015-03-25,2015-12-30,Wed: 2:00 PM-4:00 PM;,Wed: 2:00 PM-4:00 PM,,,,,,,,,,,,,,,,,,,,,,,,,,,,,,,,
1004147,Cotter Farmers Market,,,,,,,,,,,,,,,,,,,,,,,,,,,,,,,,,,,,,,,,,,,,,,,
1004382,Cottins Hardware Farmers Market,http://www.cottinshardware.com/farmersmarket/,http://www.cottinshardware.com/farmersmarket/,https://www.facebook.com/pages/Cottins-Hardware-Farmers-Market/130797680335852,https://www.facebook.com/pages/Cottins-Hardware-Farmers-Market/130797680335852,@cottins,@cottins,,,,,05/05/2016 to 09/29/2016,2016-05-05,2016-09-29,Thu: 4:00 PM-6:30 PM;,Thu: 4:00 PM-6:30 PM,,,,,,,10/06/2016 to 04/27/2017,10/6/16, 04/27/2017,Thu: 4:00 PM-6:00 PM;,Thu: 4:00 PM-6:00 PM,,,,,,,,,,,,,,,,,,,,,
1005715,Cotton Mill Farmers Market,http://www.cottonmillfarmersmarket.org,http://www.cottonmillfarmersmarket.org,https://www.facebook.com/pages/Cotton-Mill-Farmers-Market/185331531504819,https://www.facebook.com/pages/Cotton-Mill-Farmers-Market/185331531504819,,,,,,,04/16/2016 to 10/29/2016,2016-04-16,2016-10-29,Sat: 8:00 AM-12:00 PM;,Sat: 8:00 AM-12:00 PM,,,,,,,,,,,,,,,,,,,,,,,,,,,,,,,,
1001222,Cottonwood Creek Watershed Cfm,,,,,,,,,,,,,,,,,,,,,,,,,,,,,,,,,,,,,,,,,,,,,,,
1004834,Cottonwood Farmers Market And Jamboree,,,,,,,,,,,July to September,2010-07-01,2010-09-30,,,,,,,,,,,,,,,,,,,,,,,,,,,,,,,,,,
1005766,Country Club Hills Farmers Market,http://www.countyclubhill.org,http://www.countyclubhill.org,,,,,,,,,,,,,,,,,,,,,,,,,,,,,,,,,,,,,,,,,,,,,
1007280,Country Fair Farmers Market In Champaign,,,,,,,,,,,06/19/2013 to 10/30/2013,2013-06-19,2013-10-30,Wed: 7:00 AM-1:00 PM;,Wed: 7:00 AM-1:00 PM,,,,,,,,,,,,,,,,,,,,,,,,,,,,,,,,
1003033,Country Farm And Craft Market Paso Park,http://www.countryfarmandcraftmarket.com,http://www.countryfarmandcraftmarket.com,,,,,,,,,January to December,2010-01-01,2010-12-31,Sat:9:00 AM - 1:00 PM;,Sat:9:00 AM - 1:00 PM,,,,,,,,,,,,,,,,,,,,,,,,,,,,,,,,
1003034,Country Farm And Craft Market Paso Park,http://www.countryfarmandcraftmarket.com,http://www.countryfarmandcraftmarket.com,,,,,,,,,May to September,2010-05-01,2010-09-30,Fri:4:00 pm - 7:00 pm;,Fri:4:00 pm - 7:00 pm,,,,,,,,,,,,,,,,,,,,,,,,,,,,,,,,
1003035,Country Farm And Craft Market Paso Park,http://www.countryfarmandcraftmarket.com,http://www.countryfarmandcraftmarket.com,,,,,,,,,May to September,2010-05-01,2010-09-30,Thu:3:00 PM - 6:00 PM;,Thu:3:00 PM - 6:00 PM,,,,,,,,,,,,,,,,,,,,,,,,,,,,,,,,
1010810,Country Farmers Market,http://countrymarketpierre.com,http://countrymarketpierre.com,Country Farmers Market,,,,,,,,05/01/2015 to 10/01/2015,2015-05-01,2015-10-01,Sat: 8:30 AM-12:00 PM;,Sat: 8:30 AM-12:00 PM,,,,,,,,,,,,,,,,,,,,,,,,,,,,,,,,
1000868,Country Fresh Meats And Farmers Market,,,,,,,,,,,01/01/2015 to 12/31/2015,2015-01-01,2015-12-31,Mon: 6:00 AM-6:00 PM;Tue: 6:00 AM-6:00 PM;Wed: 6:00 AM-6:00 PM;Thu: 6:00 AM-6:00 PM;Fri: 6:00 AM-6:00 PM;Sat: 7:00 AM-5:00 PM;Sun: 10:00 AM-2:00 PM;,Mon: 6:00 AM-6:00 PM,Tue: 6:00 AM-6:00 PM,Wed: 6:00 AM-6:00 PM,Thu: 6:00 AM-6:00 PM,Fri: 6:00 AM-6:00 PM,Sat: 7:00 AM-5:00 PM,Sun: 10:00 AM-2:00 PM,,,,,,,,,,,,,,,,,,,,,,,,,,
1000368,Country Lane Farmers Market,,,,,,,,,,,06/19/2014 to 10/02/2014,2014-06-19,2014-10-02,Thu: 2:00 PM-8:00 PM;,Thu: 2:00 PM-8:00 PM,,,,,,,,,,,,,,,,,,,,,,,,,,,,,,,,
1004367,Country Market,,,,,,,,,,,,,,,,,,,,,,,,,,,,,,,,,,,,,,,,,,,,,,,
1011866,Countryside Farmers Markets At Highland Square,http://www.cvcountryside.org,http://www.cvcountryside.org,https://www.facebook.com/CVCountryside/,https://www.facebook.com/CVCountryside/,https://twitter.com/CVCountryside,https://twitter.com/CVCountryside,,,,,05/19/2016 to 09/29/2016,2016-05-19,2016-09-29,Thu: 4:00 PM-7:00 PM;,Thu: 4:00 PM-7:00 PM,,,,,,,,,,,,,,,,,,,,,,,,,,,,,,,,
1011868,Countryside Farmers Markets At Howe Meadow,http://www.cvcountryside.org,http://www.cvcountryside.org,https://www.facebook.com/CVCountryside/,https://www.facebook.com/CVCountryside/,https://twitter.com/CVCountryside,https://twitter.com/CVCountryside,,,,,05/07/2016 to 10/29/2016,2016-05-07,2016-10-29,Sat: 9:00 AM-12:00 PM;,Sat: 9:00 AM-12:00 PM,,,,,,,,,,,,,,,,,,,,,,,,,,,,,,,,
1004748,Countryside Farmers Markets At Old Trail School,http://www.cvcountryside.org,http://www.cvcountryside.org,https://www.facebook.com/pages/Countryside-Conservancy/49888208986,https://www.facebook.com/pages/Countryside-Conservancy/49888208986,https://twitter.com/CVCountryside,https://twitter.com/CVCountryside,https://www.youtube.com/user/Countrysidechix,https://www.youtube.com/user/Countrysidechix,http://instagram.com/countrysideconservancy,http://instagram.com/countrysideconservancy,11/07/2015 to 04/23/2016,2015-11-07,2016-04-23,Sat: 9:00 AM-12:00 PM;,Sat: 9:00 AM-12:00 PM,,,,,,,,,,,,,,,,,,,,,,,,,,,,,,,,
1012713,Coupeville Farmers Market,,,https://www.facebook.com/Coupeville-Farmers-Market-115641631824425/,https://www.facebook.com/Coupeville-Farmers-Market-115641631824425/,,,,,,,04/02/2016 to 10/08/2016,2016-04-02,2016-10-08,Sat: 10:00 AM-2:00 PM;,Sat: 10:00 AM-2:00 PM,,,,,,,,,,,,,,,,,,,,,,,,,,,,,,,,
1001845,Coushatta Farmers Market,,,,,,,,,,,10/05/2013 to 06/07/2014,2013-10-05,2014-06-07,Sat: 7:30 AM-12:00 PM;,Sat: 7:30 AM-12:00 PM,,,,,,,,,,,,,,,,,,,,,,,,,,,,,,,,
1003715,Coventry Farmers Market,,,,,,,,,,,,,,,,,,,,,,,,,,,,,,,,,,,,,,,,,,,,,,,
1007304,Coventry Regional Farmers Market,http://www.coventryfarmersmarket.com,http://www.coventryfarmersmarket.com,https://www.facebook.com/CoventryFarmersMarket,https://www.facebook.com/CoventryFarmersMarket,,,,,,,06/01/2014 to 10/26/2014,2014-06-01,2014-10-26,Sun: 11:00 AM-2:00 PM;,Sun: 11:00 AM-2:00 PM,,,,,,,11/23/2014 to 02/22/2015,11/23/14, 02/22/2015,Sun: 11:00 AM-2:00 PM;,Sun: 11:00 AM-2:00 PM,,,,,,,,,,,,,,,,,,,,,
1004976,Coventry Village Farmers Market,,,,,,,,,,,,,,,,,,,,,,,,,,,,,,,,,,,,,,,,,,,,,,,
1005902,Covered Bridge Farmers Market,http://www.stmarysohio.org,http://www.stmarysohio.org,,,,,,,,,June to August,2010-06-01,2010-08-31,Sat:8:00 AM - 12:00 PM;,Sat:8:00 AM - 12:00 PM,,,,,,,,,,,,,,,,,,,,,,,,,,,,,,,,
1001500,Covina Cfm,,,,,,,,,,,,,,,,,,,,,,,,,,,,,,,,,,,,,,,,,,,,,,,
1001981,Covington Farmers Market,http://www.covingtonfarmersmarket.com,http://www.covingtonfarmersmarket.com,,,,,,,,,05/18/2013 to 10/19/2013,2013-05-18,2013-10-19,Sat: 8:00 AM-1:00 PM;,Sat: 8:00 AM-1:00 PM,,,,,,,,,,,,,,,,,,,,,,,,,,,,,,,,
1004112,Covington Farmers Market,,,,,,,,,,,,,,,,,,,,,,,,,,,,,,,,,,,,,,,,,,,,,,,
1012036,Cowee Farmers Market,,,Cowee Farmers Market NC,,,,,,,,05/24/2016 to 10/25/2016,2016-05-24,2016-10-25,Tue: 3:30 PM-6:00 PM;,Tue: 3:30 PM-6:00 PM,,,,,,,,,,,,,,,,,,,,,,,,,,,,,,,,
1005405,Coweta Farmers Market,http://www.cowetaok.com,http://www.cowetaok.com,,,,,,,,,,,,,,,,,,,,,,,,,,,,,,,,,,,,,,,,,,,,,
1001975,Cowlitz County Community Farmers Market I,http://www.cowlitzcountyfarmersmarket.com,http://www.cowlitzcountyfarmersmarket.com,,,,,,,,,,,,,,,,,,,,,,,,,,,,,,,,,,,,,,,,,,,,,
1001974,Cowlitz County Community Farmers Market Ii,http://www.cowlitzcountyfarmersmarket.com,http://www.cowlitzcountyfarmersmarket.com,,,,,,,,,,,,,,,,,,,,,,,,,,,,,,,,,,,,,,,,,,,,,
1004089,Cowtown Farmers Market,,,,,,,,,,,,,,,,,,,,,,,,,,,,,,,,,,,,,,,,,,,,,,,
1012552,Cowtown Farmers Market,http://www.cowtownmarket.com,http://www.cowtownmarket.com,,,,,,,,,01/01/2016 to 12/31/2016,2016-01-01,2016-12-31,Sat: 8:00 AM-12:00 PM;,Sat: 8:00 AM-12:00 PM,,,,,,,06/01/2016 to 09/28/2016,6/1/16, 09/28/2016,Wed: 8:00 AM-12:00 PM;,Wed: 8:00 AM-12:00 PM,,,,,,,,,,,,,,,,,,,,,
1011769,Coxsackie Farmers Market,,,,,,,,,,,05/25/2016 to 09/28/2016,2016-05-25,2016-09-28,Wed: 4:00 PM-7:00 PM;,Wed: 4:00 PM-7:00 PM,,,,,,,,,,,,,,,,,,,,,,,,,,,,,,,,
1006230,Coyote Farm And Home Market,,,,,,,,,,,04/01/2012 to 10/31/2012,2012-04-01,2012-10-31,Thu: 3:00 AM-6:00 AM;,Thu: 3:00 AM-6:00 AM,,,,,,,05/01/2014 to 10/30/2014,5/1/14, 10/30/2014,Thu: 3:00 AM-6:30 AM;,Thu: 3:00 AM-6:30 AM,,,,,,,,,,,,,,,,,,,,,
1003633,Cozad Farmers Market,,,,,,,,,,,,,,,,,,,,,,,,,,,,,,,,,,,,,,,,,,,,,,,
1009993,Cozad Grand Generation Center,,,https://www.facebook.com/pages/Cozad-Haymaker-Grand-Generation-Center/581875038530338,https://www.facebook.com/pages/Cozad-Haymaker-Grand-Generation-Center/581875038530338,,,,,,,06/25/2014 to 10/29/2014,2014-06-25,2014-10-29,Wed: 4:00 PM-7:00 PM;,Wed: 4:00 PM-7:00 PM,,,,,,,,,,,,,,,,,,,,,,,,,,,,,,,,
1012492,Craftsbury Farmers Market,http://craftsburyfarmersmarket.com/,http://craftsburyfarmersmarket.com/,https://www.facebook.com/CraftsburyFarmersMarket/,https://www.facebook.com/CraftsburyFarmersMarket/,,,,,,,05/28/2016 to 10/08/2016,2016-05-28,2016-10-08,Sat: 10:00 AM-1:00 PM;,Sat: 10:00 AM-1:00 PM,,,,,,,,,,,,,,,,,,,,,,,,,,,,,,,,
1000756,Craig Farmers Market,,,,,,,,,,,,,,,,,,,,,,,,,,,,,,,,,,,,,,,,,,,,,,,
1006995,Cranberry Mall Farmers Market,,,,,,,,,,,,,,,,,,,,,,,,,,,,,,,,,,,,,,,,,,,,,,,
1008501,Crane Creek Market,http://agrimissouri.com/mo-grown/grodetail.php?type=mo-grown&ID=659,http://agrimissouri.com/mo-grown/grodetail.php?type=mo-grown&ID=659,,,,,,,,,,,,,,,,,,,,,,,,,,,,,,,,,,,,,,,,,,,,,
1005007,Crawfordsville Farmers Market,,,https://www.facebook.com/crawfordsvillefarmersmarket,https://www.facebook.com/crawfordsvillefarmersmarket,,,,,,,04/18/2015 to 10/31/2015,2015-04-18,2015-10-31,Sat: 8:00 AM-2:00 PM;,Sat: 8:00 AM-2:00 PM,,,,,,,,,,,,,,,,,,,,,,,,,,,,,,,,
1003039,Creedmoor Farmers Market,,,,,,,,,,,,,,,,,,,,,,,,,,,,,,,,,,,,,,,,,,,,,,,
1004064,Creekside Gahanna Farmers Market,,,,,,,,,,,,,,,,,,,,,,,,,,,,,,,,,,,,,,,,,,,,,,,
1011595,Creekside Park Farmers Market,http://www.archdaleparks.com,http://www.archdaleparks.com,www.facebook.com/archdaleparks,,www.twitter.com/archdaleparks,,,,,,06/01/2015 to 09/03/2015,2015-06-01,2015-09-03,Tue: 7:30 AM-12:30 PM;Thu: 3:00 PM-7:00 PM;,Tue: 7:30 AM-12:30 PM,Thu: 3:00 PM-7:00 PM,,,,,,,,,,,,,,,,,,,,,,,,,,,,,,,
1006397,Creighton Farmers Market,,,,,,,,,,,,,,,,,,,,,,,,,,,,,,,,,,,,,,,,,,,,,,,
1007430,Crenshaw County Farmers Market,,,,,,,,,,,,,,,,,,,,,,,,,,,,,,,,,,,,,,,,,,,,,,,
1001714,Crenshaw Farmers Market,http://www.seela.org,http://www.seela.org,https://www.facebook.com/pages/Crenshaw-Farmers-Market/298496636834537,https://www.facebook.com/pages/Crenshaw-Farmers-Market/298496636834537,,,,,,,,,,,,,,,,,,,,,,,,,,,,,,,,,,,,,,,,,,,
1009841,Creole Market,,,https://www.facebook.com/CreoleMarket,https://www.facebook.com/CreoleMarket,https://twitter.com/CreoleMarket,https://twitter.com/CreoleMarket,,,,,01/01/2014 to 12/31/2014,2014-01-01,2014-12-31,Sat: 8:00 AM-12:00 PM;,Sat: 8:00 AM-12:00 PM,,,,,,,,,,,,,,,,,,,,,,,,,,,,,,,,
1000263,Crescent City Farmers Market,http://www.crescentcityfarmersmarket.org,http://www.crescentcityfarmersmarket.org,https://www.facebook.com/pages/Crescent-City-Farmers-Market/12780011170,https://www.facebook.com/pages/Crescent-City-Farmers-Market/12780011170,https://twitter.com/ccfmtweets,https://twitter.com/ccfmtweets,,,instagram: @crescentcityfarmersmkt,instagram: @crescentcityfarmersmkt,01/01/2016 to 12/31/2016,2016-01-01,2016-12-31,Tue: 9:00 AM-1:00 PM;,Tue: 9:00 AM-1:00 PM,,,,,,,,,,,,,,,,,,,,,,,,,,,,,,,,
1000264,Crescent City Farmers Market,http://www.crescentcityfarmersmarket.org,http://www.crescentcityfarmersmarket.org,https://www.facebook.com/pages/Crescent-City-Farmers-Market/12780011170,https://www.facebook.com/pages/Crescent-City-Farmers-Market/12780011170,https://twitter.com/ccfmtweets,https://twitter.com/ccfmtweets,,,instagram: @crescentcityfarmersmkt,instagram: @crescentcityfarmersmkt,01/01/2016 to 12/31/2016,2016-01-01,2016-12-31,Thu: 3:00 PM-7:00 PM;,Thu: 3:00 PM-7:00 PM,,,,,,,,,,,,,,,,,,,,,,,,,,,,,,,,
1000265,Crescent City Farmers Market,http://www.crescentcityfarmersmarket.org,http://www.crescentcityfarmersmarket.org,https://www.facebook.com/pages/Crescent-City-Farmers-Market/12780011170,https://www.facebook.com/pages/Crescent-City-Farmers-Market/12780011170,https://twitter.com/ccfmtweets,https://twitter.com/ccfmtweets,,,instagram: @crescentcityfarmersmkt,instagram: @crescentcityfarmersmkt,01/01/2016 to 12/31/2016,2016-01-01,2016-12-31,Sat: 8:00 AM-12:00 PM;,Sat: 8:00 AM-12:00 PM,,,,,,,,,,,,,,,,,,,,,,,,,,,,,,,,
1001949,Crescent City Farmers Market,http://www.crescentcity-fl.com,,,,,,,,,,January to December,2010-01-01,2010-12-31,Sat:9:00 AM - 2:00 PM;,Sat:9:00 AM - 2:00 PM,,,,,,,,,,,,,,,,,,,,,,,,,,,,,,,,
1004409,Crescent City Farmers Market,http://www.northerncalifornia.net,http://www.northerncalifornia.net,,,,,,,,,,,,,,,,,,,,,,,,,,,,,,,,,,,,,,,,,,,,,
1012106,Crescent City Farmers Market,http://www.crescentcityfarmersmarket.org/,http://www.crescentcityfarmersmarket.org/,https://www.facebook.com/Crescent-City-Farmers-Market-12780011170/?ref=bookmarks,https://www.facebook.com/Crescent-City-Farmers-Market-12780011170/?ref=bookmarks,https://twitter.com/ccfmtweets,https://twitter.com/ccfmtweets,,,instagram: @crescentcityfarmersmkt,instagram: @crescentcityfarmersmkt,01/01/2016 to 07/13/2016,2016-01-01,2016-07-13,Wed: 1:00 PM-5:00 PM;,Wed: 1:00 PM-5:00 PM,,,,,,,10/12/2016 to 12/31/2016,10/12/16, 12/31/2016,Wed: 1:00 PM-5:00 PM;,Wed: 1:00 PM-5:00 PM,,,,,,,,,,,,,,,,,,,,,
1012059,Crescent Ridge Farmers Market,http://crescentridgefarmersmarket.com,http://crescentridgefarmersmarket.com,,,,,,,,,06/11/2016 to 10/22/2016,2016-06-11,2016-10-22,Sat: 10:00 AM-2:00 PM;,Sat: 10:00 AM-2:00 PM,,,,,,,,,,,,,,,,,,,,,,,,,,,,,,,,
1006723,Cresco Farmers Market,,,,,,,,,,,,,,,,,,,,,,,,,,,,,,,,,,,,,,,,,,,,,,,
1012177,Cresco Farmers Market,http://www.howard-county.com,http://www.howard-county.com,,,,,,,,,,,,Tue: 2:30 PM-5:30 PM;Fri: 2:30 PM-5:30 PM;,Tue: 2:30 PM-5:30 PM,Fri: 2:30 PM-5:30 PM,,,,,,,,,,,,,,,,,,,,,,,,,,,,,,,
1005035,Crested Butte Farmers Market,http://www.cbfarmersmarket.org,http://www.cbfarmersmarket.org,,,,,,,,,June to October,2010-06-01,2010-10-31,sun:10:00 AM - 2:00 PM;,sun:10:00 AM - 2:00 PM,,,,,,,,,,,,,,,,,,,,,,,,,,,,,,,,
1001193,Creston Farmers Market,,,,,,,,,,,,,,,,,,,,,,,,,,,,,,,,,,,,,,,,,,,,,,,
1001508,Crestview Farmers Market,,,,,,,,,,,,,,,,,,,,,,,,,,,,,,,,,,,,,,,,,,,,,,,
1000262,Creswell Farmers Market,http://www.creswellfarmersmarket.wordpress.com,http://www.creswellfarmersmarket.wordpress.com,https://www.facebook.com/CreswellFarmersMkt,https://www.facebook.com/CreswellFarmersMkt,,,,,,,05/06/2014 to 10/28/2014,2014-05-06,2014-10-28,Tue: 4:00 PM-6:00 PM;,Tue: 4:00 PM-6:00 PM,,,,,,,,,,,,,,,,,,,,,,,,,,,,,,,,
1002243,Crete European Market,,,,,,,,,,,,,,,,,,,,,,,,,,,,,,,,,,,,,,,,,,,,,,,
1007270,Crete Farmers Market,,,,,,,,,,,,,,,,,,,,,,,,,,,,,,,,,,,,,,,,,,,,,,,
1011390,Creve Coeur Farmers Market,http://www.creve-coeur.org/market,http://www.creve-coeur.org/market,,,,,,,,,05/01/2015 to 10/01/2015,2015-05-01,2015-10-01,Sat: 8:00 AM-12:00 PM;,Sat: 8:00 AM-12:00 PM,,,,,,,,,,,,,,,,,,,,,,,,,,,,,,,,
1008650,Crisp! Catholic Charities,http://www.crispgrocery.com,http://www.crispgrocery.com,,,,,,,,,08/01/2014 to 08/31/2014,2014-08-01,2014-08-31,Fri: 4:00 PM-5:00 PM;,Fri: 4:00 PM-5:00 PM,,,,,,,,,,,,,,,,,,,,,,,,,,,,,,,,
1008666,Crisp! Mobile Farmers Market,http://www.crispgrocery.com,http://www.crispgrocery.com,https://www.facebook.com/crisp.produce.5,https://www.facebook.com/crisp.produce.5,https://twitter.com/crispgrocery,https://twitter.com/crispgrocery,,,,,03/31/2014 to 03/31/2015,2014-03-31,2015-03-31,Mon: 9:00 AM-6:00 PM;Tue: 9:00 AM-6:00 PM;Wed: 9:00 AM-6:00 PM;Thu: 9:00 AM-6:00 PM;Fri: 9:00 AM-6:00 PM;Sat: 9:00 AM-3:00 PM;Sun: 9:00 AM-3:00 PM;,Mon: 9:00 AM-6:00 PM,Tue: 9:00 AM-6:00 PM,Wed: 9:00 AM-6:00 PM,Thu: 9:00 AM-6:00 PM,Fri: 9:00 AM-6:00 PM,Sat: 9:00 AM-3:00 PM,Sun: 9:00 AM-3:00 PM,,,,,,,,,,,,,,,,,,,,,,,,,,
1008520,Crocker Farms Llc,http://agrimissouri.com/mo-grown/grodetail.php?type=mo-grown&ID=1426,http://agrimissouri.com/mo-grown/grodetail.php?type=mo-grown&ID=1426,,,,,,,,,,,,,,,,,,,,,,,,,,,,,,,,,,,,,,,,,,,,,
1006612,Crockett Farmers Market At Maury City,,,,,,,,,,,,,,,,,,,,,,,,,,,,,,,,,,,,,,,,,,,,,,,
1012748,Crofton Farmers Market,http://www.croftonfarmersmarket.com,http://www.croftonfarmersmarket.com,https://www.facebook.com/croftonfarmersmarket/,https://www.facebook.com/croftonfarmersmarket/,https://twitter.com/croftonfarmmkt,https://twitter.com/croftonfarmmkt,,,https://www.instagram.com/croftonfarmersmarket/,https://www.instagram.com/croftonfarmersmarket/,05/11/2016 to 10/26/2016,2016-05-11,2016-10-26,Wed: 3:00 PM-7:00 PM;,Wed: 3:00 PM-7:00 PM,,,,,,,,,,,,,,,,,,,,,,,,,,,,,,,,
1011308,Cromwell Farmers’ Market,http://www.cromwellfarmersmerkate.org,http://www.cromwellfarmersmerkate.org,cromwellfarmersmarket,,CromwellFarmersMRKT,,,,,,,,,Fri: 4:00 PM-7:00 PM;,Fri: 4:00 PM-7:00 PM,,,,,,,,,,,,,,,,,,,,,,,,,,,,,,,,
1006445,Crookston Farmers Market I,,,,,,,,,,,,,,,,,,,,,,,,,,,,,,,,,,,,,,,,,,,,,,,
1006446,Crookston Farmers Market Ii,,,,,,,,,,,,,,,,,,,,,,,,,,,,,,,,,,,,,,,,,,,,,,,
1006109,Crosby Farmers Market,,,,,,,,,,,,,,,,,,,,,,,,,,,,,,,,,,,,,,,,,,,,,,,
1010419,Cross Community Centers Farmers Market,,,,,,,,,,,05/17/2014 to 09/13/2014,2014-05-17,2014-09-13,Tue: 8:00 AM-11:00 AM;Sat: 8:00 AM-11:00 AM;,Tue: 8:00 AM-11:00 AM,Sat: 8:00 AM-11:00 AM,,,,,,,,,,,,,,,,,,,,,,,,,,,,,,,
1007226,Cross County Farmers Market,,,,,,,,,,,05/14/2016 to 11/05/2016,2016-05-14,2016-11-05,Tue: 8:00 AM-5:00 PM;Thu: 8:00 AM-5:00 PM;Sat: 7:00 AM-12:00 PM;,Tue: 8:00 AM-5:00 PM,Thu: 8:00 AM-5:00 PM,Sat: 7:00 AM-12:00 PM,,,,,,,,,,,,,,,,,,,,,,,,,,,,,,
1005857,Cross Mills Farmers Market,http://www.crossmillsfarmersmarket.com,http://www.crossmillsfarmersmarket.com,,,,,,,,,May to October,2010-05-01,2010-10-31,Sat:9:00 AM - 1:00 PM;,Sat:9:00 AM - 1:00 PM,,,,,,,,,,,,,,,,,,,,,,,,,,,,,,,,
1011771,Cross Plains Parkway Market,,,https://www.facebook.com/Cross-Plains-Parkway-Farmers-Market-1591408087770075/,https://www.facebook.com/Cross-Plains-Parkway-Farmers-Market-1591408087770075/,,,,,,,06/01/2016 to 09/28/2016,2016-06-01,2016-09-28,Wed: 4:00 PM-7:00 PM;,Wed: 4:00 PM-7:00 PM,,,,,,,,,,,,,,,,,,,,,,,,,,,,,,,,
1006197,Cross Timbers Food Cooperative,http://www.crosstimbers.locallygrown.net,http://www.crosstimbers.locallygrown.net,,,,,,,,,,,,,,,,,,,,,,,,,,,,,,,,,,,,,,,,,,,,,
1010987,Crossett Farmers Market,http://www.cityofcrossett-ar.com,,www.facebook.com/cityofcrossett,,,,,,,,01/01/2015 to 12/31/2015,2015-01-01,2015-12-31,Mon: 7:00 AM-;Tue: 7:00 AM-;Wed: 7:00 AM-;Thu: 7:00 AM-;Fri: 7:00 AM-;Sat: 7:00 AM-;,Mon: 7:00 AM-,Tue: 7:00 AM-,Wed: 7:00 AM-,Thu: 7:00 AM-,Fri: 7:00 AM-,Sat: 7:00 AM-,,,,,,,,,,,,,,,,,,,,,,,,,,,
1005184,Crossroad Farmers Market,,,,,,,,,,,05/24/2014 to 10/11/2014,2014-05-24,2014-10-11,Sat: 9:00 AM-1:00 PM;,Sat: 9:00 AM-1:00 PM,,,,,,,,,,,,,,,,,,,,,,,,,,,,,,,,
1000988,Crossroad Orchard,,,,,,,,,,,,,,,,,,,,,,,,,,,,,,,,,,,,,,,,,,,,,,,
1005469,Crossroads Bellevue Farmers Market,http://www.crossroadsbellevue.com,http://www.crossroadsbellevue.com,https://www.facebook.com/Crossroads.Bellevue.Farmers.Market,https://www.facebook.com/Crossroads.Bellevue.Farmers.Market,,,,,,,05/27/2014 to 10/07/2014,2014-05-27,2014-10-07,Tue: 12:00 PM-6:30 PM;,Tue: 12:00 PM-6:30 PM,,,,,,,,,,,,,,,,,,,,,,,,,,,,,,,,
1006650,Crossroads Farm At Grossmanns,,,https://www.facebook.com/crossroadsfarmatgrossmanns,https://www.facebook.com/crossroadsfarmatgrossmanns,,,,,,,05/01/2013 to 05/01/2014,2013-05-01,2014-05-01,Tue: 11:00 AM-6:00 PM;Wed: 11:00 AM-6:00 PM;Thu: 11:00 AM-6:00 PM;Fri: 11:00 AM-6:00 PM;Sat: 9:00 AM-6:00 PM;Sun: 10:00 AM-5:00 PM;,Tue: 11:00 AM-6:00 PM,Wed: 11:00 AM-6:00 PM,Thu: 11:00 AM-6:00 PM,Fri: 11:00 AM-6:00 PM,Sat: 9:00 AM-6:00 PM,Sun: 10:00 AM-5:00 PM,,,,,,,,,,,,,,,,,,,,,,,,,,,
1002948,Crossroads Farmers Market,,,,,,,,,,,June to October,2010-06-01,2010-10-31,Thu:2:00 PM - 6:00 PM;,Thu:2:00 PM - 6:00 PM,,,,,,,,,,,,,,,,,,,,,,,,,,,,,,,,
1004055,Crossroads Farmers Market,http://www.longislandfarmersmarkets.com,http://www.longislandfarmersmarkets.com,https://www.facebook.com/pages/GG-LI-Winter-Farmers-Market/,https://www.facebook.com/pages/GG-LI-Winter-Farmers-Market/,https://twitter.com/GGWinterMarkets,https://twitter.com/GGWinterMarkets,,,,,06/01/2012 to 10/31/2012,2012-06-01,2012-10-31,Thu: 10:00 AM-4:00 PM;,Thu: 10:00 AM-4:00 PM,,,,,,,,,,,,,,,,,,,,,,,,,,,,,,,,
1012365,Crossroads Farmers Market,https://www.crossroadscommunityfoodnetwork.org/farmers-market/,https://www.crossroadscommunityfoodnetwork.org/farmers-market/,https://www.facebook.com/CrossroadsFarmersMarket/,https://www.facebook.com/CrossroadsFarmersMarket/,@CrossroadsNtwk,@CrossroadsNtwk,https://www.youtube.com/channel/UCm23V5zJ2FZV7vC57i8OASQ,https://www.youtube.com/channel/UCm23V5zJ2FZV7vC57i8OASQ,Instagram: @CrossroadsNtwk,Instagram: @CrossroadsNtwk,06/01/2016 to 11/16/2016,2016-06-01,2016-11-16,Wed: 11:00 AM-3:00 PM;,Wed: 11:00 AM-3:00 PM,,,,,,,,,,,,,,,,,,,,,,,,,,,,,,,,
1008846,Crossroads Farmers Market: A Project Of Mississippi Delta Council,http://crossroadsfarmersmarket.org,http://crossroadsfarmersmarket.org,https://www.facebook.com/CrossroadsFamersMarket,https://www.facebook.com/CrossroadsFamersMarket,https://twitter.com/MDCXRoadsMarket,https://twitter.com/MDCXRoadsMarket,,,,,07/20/2013 to 11/09/2013,2013-07-20,2013-11-09,Sat: 7:00 AM-1:00 PM;,Sat: 7:00 AM-1:00 PM,,,,,,,,,,,,,,,,,,,,,,,,,,,,,,,,
1004447,Crosstown Freeway Farmers Market,http://www.stocktonfarmersmarket.org,http://www.stocktonfarmersmarket.org,,,,,,,,,January to December,2010-01-01,2010-12-31,Sat:6:30 AM - 11:00 AM;,Sat:6:30 AM - 11:00 AM,,,,,,,,,,,,,,,,,,,,,,,,,,,,,,,,
1010953,Croton-on-hudsons Down To Earth Farmers Market,http://DowntoEarthMarkets.com,http://DowntoEarthMarkets.com,www.facebook.com/DowntoEarthMarkets,,https://twitter.com/DowntoEarthMkts,https://twitter.com/DowntoEarthMkts,,,https://instagram.com/downtoearthmkts/,https://instagram.com/downtoearthmkts/,05/08/2016 to 11/20/2016,2016-05-08,2016-11-20,Sun: 9:00 AM-2:00 PM;,Sun: 9:00 AM-2:00 PM,,,,,,,,,,,,,,,,,,,,,,,,,,,,,,,,
1001674,Crouch Farmers Market,,,,,,,,,,,June to October,2010-06-01,2010-10-31,Sat:9:00 AM - 12:00 PM;,Sat:9:00 AM - 12:00 PM,,,,,,,,,,,,,,,,,,,,,,,,,,,,,,,,
1003438,Crown Point Farmers Market,http://www.crownpoint.in.gov,http://www.crownpoint.in.gov,,,,,,,,,,,,,,,,,,,,,,,,,,,,,,,,,,,,,,,,,,,,,
1008522,Crown Valley Champagne,http://www.crownvalleyfarmersmarket.posterous.com,http://www.crownvalleyfarmersmarket.posterous.com,,,,,,,http://agrimissouri.com/mo-grown/grodetail.php?type=mo-grown&ID=98,http://agrimissouri.com/mo-grown/grodetail.php?type=mo-grown&ID=98,,,,,,,,,,,,,,,,,,,,,,,,,,,,,,,,,,,,,
1005792,Crozet Farmers Market,,,,,,,,,,,,,,,,,,,,,,,,,,,,,,,,,,,,,,,,,,,,,,,
1010708,Crystal City Farmers Market,http://agrimissouri.com/mo-grown/grodetail.php?type=mo-grown&ID=337,http://agrimissouri.com/mo-grown/grodetail.php?type=mo-grown&ID=337,,,,,,,,,05/06/2015 to 10/28/2015,2015-05-06,2015-10-28,Wed: 4:00 PM-7:00 PM;,Wed: 4:00 PM-7:00 PM,,,,,,,,,,,,,,,,,,,,,,,,,,,,,,,,
1006802,Crystal City Freshfarm Market,http://www.freshfarmmarkets.org/markets/crystal_city.html,http://www.freshfarmmarkets.org/markets/crystal_city.html,,,,,,,,,May to November,2010-05-01,2010-11-30,Tue:3:00 PM - 7:00 PM;,Tue:3:00 PM - 7:00 PM,,,,,,,,,,,,,,,,,,,,,,,,,,,,,,,,
1006686,Crystal Falsh Energy Farmers Market,,,,,,,,,,,,,,,,,,,,,,,,,,,,,,,,,,,,,,,,,,,,,,,
1001223,Crystal Farmers Market,,,,,,,,,,,,,,,,,,,,,,,,,,,,,,,,,,,,,,,,,,,,,,,
1001869,Crystal Lake Farmers Market,http://www.downtowncl.org,http://www.downtowncl.org,www.facebook.com/CrystalLakeFarmersMarket,,,,,,,,06/04/2016 to 10/15/2016,2016-06-04,2016-10-15,Sat: 8:00 AM-1:00 PM;,Sat: 8:00 AM-1:00 PM,,,,,,,,,,,,,,,,,,,,,,,,,,,,,,,,
1001005,Crystal Springs Farmers Market,http://crystalspringstomatofestival.blogspot.com,http://crystalspringstomatofestival.blogspot.com,,,,,,,,,06/29/2013 to 06/29/2013,2013-06-29,2013-06-29,Sun: 8:00 AM-3:00 PM;,Sun: 8:00 AM-3:00 PM,,,,,,,,,,,,,,,,,,,,,,,,,,,,,,,,
1002293,Csa Farmers Market,http://www.csafarmersmarket.com,http://www.csafarmersmarket.com,,,,,,,,,01/01/2013 to 12/31/2013,2013-01-01,2013-12-31,,,,,,,,,,,,,,,,,,,,,,,,,,,,,,,,,,
1006861,"Cuba, New Mexico Farmers Market",,,,,,,,,,,May to October,2010-05-01,2010-10-31,Sat:9:00 AM - 12:00 PM;,Sat:9:00 AM - 12:00 PM,,,,,,,,,,,,,,,,,,,,,,,,,,,,,,,,
1007201,Cudahy Farmers Market,,,,,,,,,,,,,,,,,,,,,,,,,,,,,,,,,,,,,,,,,,,,,,,
1007146,Cuero Farmers Market,,,,,,,,,,,,,,,,,,,,,,,,,,,,,,,,,,,,,,,,,,,,,,,
1012074,Cuesa Jack London Square Farmers Market,http://www.cuesa.org,http://www.cuesa.org,https://www.facebook.com/jacklondonsqfm/,https://www.facebook.com/jacklondonsqfm/,@cuesa,@cuesa,,,,,01/01/2016 to 12/31/2016,2016-01-01,2016-12-31,Sun: 9:00 AM-2:00 PM;,Sun: 9:00 AM-2:00 PM,,,,,,,,,,,,,,,,,,,,,,,,,,,,,,,,
1003606,Cuivre River Farmers Market,http://www.cuivreriverfarmersmarket.org,http://www.cuivreriverfarmersmarket.org,https://www.facebook.com/CuivreRiverFarmersMarket,https://www.facebook.com/CuivreRiverFarmersMarket,,,,,,,05/07/2016 to 10/29/2016,2016-05-07,2016-10-29,Sat: 9:00 AM-1:00 PM;,Sat: 9:00 AM-1:00 PM,,,,,,,,,,,,,,,,,,,,,,,,,,,,,,,,
1003892,Culinary Kids Farmers Market I,http://www.culinarykidsdaycamp.org,http://www.culinarykidsdaycamp.org,https://www.facebook.com/pages/Culinary-Kids-Day-Camp/123734797690303,https://www.facebook.com/pages/Culinary-Kids-Day-Camp/123734797690303,https://twitter.com/Culinary_Kids,https://twitter.com/Culinary_Kids,Culinary Kidz,,Instagram: Culinary Kids Farms,Instagram: Culinary Kids Farms,07/05/2014 to 09/27/2014,2014-07-05,2014-09-27,Sat: 10:00 AM-3:00 PM;,Sat: 10:00 AM-3:00 PM,,,,,,,,,,,,,,,,,,,,,,,,,,,,,,,,
1002327,Culinary Kids Farmers Market Ii,,,,,,,,,,,,,,,,,,,,,,,,,,,,,,,,,,,,,,,,,,,,,,,
1005624,Culpeper Farmers Market,,,,,,,,,,,,,,,,,,,,,,,,,,,,,,,,,,,,,,,,,,,,,,,
1005403,Culver City Farmers Market,http://www.farmernet.com,http://www.farmernet.com,,,,,,,,,,,,,,,,,,,,,,,,,,,,,,,,,,,,,,,,,,,,,
1005687,Cumberland County Farmers Market,,,,,,,,,,,,,,,,,,,,,,,,,,,,,,,,,,,,,,,,,,,,,,,
1002821,Cumberland Farmers Market,http://www.cumberland-wisconsin.com,,,,,,,,,,07/26/2014 to 09/27/2014,2014-07-26,2014-09-27,Sat: 8:00 AM-12:00 PM;,Sat: 8:00 AM-12:00 PM,,,,,,,,,,,,,,,,,,,,,,,,,,,,,,,,
1009750,Cumberland Farmers Market,http://www.cumberlandfarmersmarketassociation.org,http://www.cumberlandfarmersmarketassociation.org,https://www.facebook.com/pages/Cumberland-Farmers-Market-Association-CFMA/198538805238?ref=br_tf,https://www.facebook.com/pages/Cumberland-Farmers-Market-Association-CFMA/198538805238?ref=br_tf,,,,,,,05/17/2014 to,2014-05-17,,Sat: 9:00 AM-12:00 PM;,Sat: 9:00 AM-12:00 PM,,,,,,,,,,,,,,,,,,,,,,,,,,,,,,,,
1011893,Cumberland Farmers Market,http://www.town.cumberland.in.us/department/index.php?structureid=5,http://www.town.cumberland.in.us/department/index.php?structureid=5,https://www.facebook.com/CumberlandINFM/?fref=ts,https://www.facebook.com/CumberlandINFM/?fref=ts,,,,,,,05/07/2016 to 10/29/2016,2016-05-07,2016-10-29,Sat: 8:00 AM-12:00 PM;,Sat: 8:00 AM-12:00 PM,,,,,,,,,,,,,,,,,,,,,,,,,,,,,,,,
1003647,Cumc Farmers Market,,,,,,,,,,,,,,,,,,,,,,,,,,,,,,,,,,,,,,,,,,,,,,,
1012001,Cummins Farmers Market,,,,,,,,,,,06/08/2016 to 10/12/2016,2016-06-08,2016-10-12,Wed: 3:00 PM-5:30 PM;,Wed: 3:00 PM-5:30 PM,,,,,,,,,,,,,,,,,,,,,,,,,,,,,,,,
1003650,Curtis Farmers Market,,,,,,,,,,,,,,,,,,,,,,,,,,,,,,,,,,,,,,,,,,,,,,,
1001743,Cushing Farmers Market,http://www.downtowncushing.com,http://www.downtowncushing.com,,,,,,,,,,,,,,,,,,,,,,,,,,,,,,,,,,,,,,,,,,,,,
1001426,Custer Farmers Market,,,,,,,,,,,06/07/2014 to 10/11/2014,2014-06-07,2014-10-11,Sat: 8:00 AM-12:30 PM;,Sat: 8:00 AM-12:30 PM,,,,,,,,,,,,,,,,,,,,,,,,,,,,,,,,
1002290,Cutler Bay Farmers Market,,,,,,,,,,,,,,,,,,,,,,,,,,,,,,,,,,,,,,,,,,,,,,,
1009889,Cuyahoga Falls Farmers Market (farmers Market In The Falls),http://cfo.cityofcf.com/web/parks-and-recreation/farmers-market-falls,http://cfo.cityofcf.com/web/parks-and-recreation/farmers-market-falls,,,,,,,,,06/20/2014 to 10/03/2014,2014-06-20,2014-10-03,Fri: 3:00 PM-6:00 PM;,Fri: 3:00 PM-6:00 PM,,,,,,,,,,,,,,,,,,,,,,,,,,,,,,,,
1006504,Cynthiana-harrison County Farmers Market,,,https://www.facebook.com/chfmky,https://www.facebook.com/chfmky,,,,,,,05/02/2015 to 09/26/2015,2015-05-02,2015-09-26,Tue: 9:00 AM-1:00 PM;Fri: 9:00 AM-1:00 PM;Sat: 9:00 AM-1:00 PM;,Tue: 9:00 AM-1:00 PM,Fri: 9:00 AM-1:00 PM,Sat: 9:00 AM-1:00 PM,,,,,,,,,,,,,,,,,,,,,,,,,,,,,,
1004723,Cypress Center Farmers Market,,,,,,,,,,,05/08/2013 to 10/30/2013,2013-05-08,2013-10-30,Wed: 2:00 PM-5:30 PM;,Wed: 2:00 PM-5:30 PM,,,,,,,,,,,,,,,,,,,,,,,,,,,,,,,,
1008921,Cypress Hills Ym,http://www.grownyc.org,http://www.grownyc.org,https://www.facebook.com/BrooklynGreenmarkets,https://www.facebook.com/BrooklynGreenmarkets,,,,,,,07/12/2013 to 11/22/2013,2013-07-12,2013-11-22,Fri: 2:00 PM-6:00 PM;,Fri: 2:00 PM-6:00 PM,,,,,,,,,,,,,,,,,,,,,,,,,,,,,,,,
1005689,Diberville Farmers Market,,,,,,,,,,,,,,,,,,,,,,,,,,,,,,,,,,,,,,,,,,,,,,,
1000069,Dag Hammarskjold Plaza Greenmarket,http://www.grownyc.org,http://www.grownyc.org,https://www.facebook.com/ManhattanGreenmarkets,https://www.facebook.com/ManhattanGreenmarkets,,,,,,,01/01/2013 to 12/31/2013,2013-01-01,2013-12-31,Wed: 8:00 AM-4:00 PM;,Wed: 8:00 AM-4:00 PM,,,,,,,,,,,,,,,,,,,,,,,,,,,,,,,,
1009476,Dag Hammerskjold Plaza Greenmarket,http://www.grownyc.org/greenmarket-site/manhattan/dag-hammarskjold-greenmarket,http://www.grownyc.org/greenmarket-site/manhattan/dag-hammarskjold-greenmarket,,,,,,,,,,,,,,,,,,,,,,,,,,,,,,,,,,,,,,,,,,,,,
1004545,Dahlonega Farmers Market,http://www.dahlonegadda.org,http://www.dahlonegadda.org,https://www.facebook.com/DahlonegaFarmersMarket,https://www.facebook.com/DahlonegaFarmersMarket,,,,,,,05/03/2014 to 10/11/2014,2014-05-03,2014-10-11,Tue: 8:00 AM-12:00 PM;Sat: 8:00 AM-12:00 PM;,Tue: 8:00 AM-12:00 PM,Sat: 8:00 AM-12:00 PM,,,,,,,,,,,,,,,,,,,,,,,,,,,,,,,
1009167,Daily Harvest Market,http://www.dailyharvestmarket.com/,http://www.dailyharvestmarket.com/,,,,,,,,,,,,,,,,,,,,,,,,,,,,,,,,,,,,,,,,,,,,,
1002148,Dairymel Farms,,,,,,,,,,,,,,,,,,,,,,,,,,,,,,,,,,,,,,,,,,,,,,,
1010752,Dakotahs Indoor Farmers Market,,,www.facebook.com/dakotahsfarmersmarket,,,,,,,,11/08/2014 to 03/28/2015,2014-11-08,2015-03-28,Sat: 9:00 AM-3:00 PM;,Sat: 9:00 AM-3:00 PM,,,,,,,,,,,,,,,,,,,,,,,,,,,,,,,,
1001717,Dale City Farmers Market,http://www.pwcparks.org/farmersmarket/,http://www.pwcparks.org/farmersmarket/,,,,,,,,,04/06/2014 to 12/07/2014,2014-04-06,2014-12-07,Sun: 8:00 AM-1:00 PM;,Sun: 8:00 AM-1:00 PM,,,,,,,12/14/2014 to 03/29/2015,12/14/14, 03/29/2015,Sun: 10:00 AM-1:00 PM;,Sun: 10:00 AM-1:00 PM,,,,,,,,,,,,,,,,,,,,,
1003695,Dales Saturday Market,,,,,,,,,,,,,,,,,,,,,,,,,,,,,,,,,,,,,,,,,,,,,,,
1005871,Daleville Farmers Market,,,,,,,,,,,06/06/2013 to 07/25/2013,2013-06-06,2013-07-25,Thu: 2:00 PM-5:30 PM;,Thu: 2:00 PM-5:30 PM,,,,,,,,,,,,,,,,,,,,,,,,,,,,,,,,
1002493,Daley Plaza Chicago Farmers Market,http://www.cityofchicago.org/specialevents,http://www.cityofchicago.org/specialevents,,,,,,,,,,,,,,,,,,,,,,,,,,,,,,,,,,,,,,,,,,,,,
1012749,Dallas Farmers Market,http://www.dallasfarmersmarket.org,http://www.dallasfarmersmarket.org,https://www.facebook.com/DFMDallasFarmersMarket/,https://www.facebook.com/DFMDallasFarmersMarket/,https://twitter.com/dallasfarmer,https://twitter.com/dallasfarmer,,,https://www.instagram.com/dallasfarmersmarket/,https://www.instagram.com/dallasfarmersmarket/,01/01/2016 to,2016-01-01,,Fri: 10:00 AM-5:00 PM;Sat: 8:00 AM-5:00 PM;Sun: 10:00 AM-5:00 PM;,Fri: 10:00 AM-5:00 PM,Sat: 8:00 AM-5:00 PM,Sun: 10:00 AM-5:00 PM,,,,,01/01/2016 to 12/31/2016,1/1/16, 12/31/2016,Mon: 10:00 AM-6:00 PM;Tue: 10:00 AM-6:00 PM;Wed: 10:00 AM-6:00 PM;Thu: 10:00 AM-6:00 PM;Fri: 10:00 AM-6:00 PM;Sat: 10:00 AM-6:00 PM;Sun: 10:00 AM-6:00 PM;,Mon: 10:00 AM-6:00 PM,Tue: 10:00 AM-6:00 PM,Wed: 10:00 AM-6:00 PM,Thu: 10:00 AM-6:00 PM,Fri: 10:00 AM-6:00 PM,Sat: 10:00 AM-6:00 PM,Sun: 10:00 AM-6:00 PM,,,,,,,,,,,,,,,
1002514,Dallas Farmers Market,,,,,,,,,,,07/05/2013 to 09/27/2013,2013-07-05,2013-09-27,Fri: 4:00 PM-8:00 PM;,Fri: 4:00 PM-8:00 PM,,,,,,,,,,,,,,,,,,,,,,,,,,,,,,,,
1002739,Daly City Certified Farmers Market At Serramonte Center,http://www.cafarmersmkts.com/markets/category/daly-city,http://www.cafarmersmkts.com/markets/category/daly-city,https://www.Facebook.com/DCFarmersMkt,https://www.Facebook.com/DCFarmersMkt,https://twitter.com/cafarmersmkts,https://twitter.com/cafarmersmkts,,,http://www.pinterest.com/cafarmersmkts/,http://www.pinterest.com/cafarmersmkts/,01/01/2016 to 12/31/2016,2016-01-01,2016-12-31,Thu: 9:00 AM-1:00 PM;,Thu: 9:00 AM-1:00 PM,,,,,,,01/01/2014 to 12/01/2014,1/1/14, 12/01/2014,Sat: 9:00 AM-1:00 PM;,Sat: 9:00 AM-1:00 PM,,,,,,,,,,,,,,,,,,,,,
1012115,Damariscotta Farmers Market,http://www.damariscottafarmersmarket.org,http://www.damariscottafarmersmarket.org,https://www.facebook.com/damariscottafarmersmarket/,https://www.facebook.com/damariscottafarmersmarket/,@DamaFarmerMkt,@DamaFarmerMkt,Damariscotta Farmers Market,,Instagram: @damariscottafarmers,Instagram: @damariscottafarmers,05/13/2016 to 10/28/2016,2016-05-13,2016-10-28,Fri: 9:00 AM-12:00 PM;,Fri: 9:00 AM-12:00 PM,,,,,,,06/01/2016 to 09/01/2016,6/1/16, 09/01/2016,Mon: 3:00 PM-6:00 PM;,Mon: 3:00 PM-6:00 PM,,,,,,,,,,,,,,,,,,,,,
1011002,Damascus Farmers Market,http://damascusfarmersmarket.org,http://damascusfarmersmarket.org,https://business.facebook.com/Damascus-Farmers-Market-230160453775285/?ref=bookmarks&business_id=415212535270075,https://business.facebook.com/Damascus-Farmers-Market-230160453775285/?ref=bookmarks&business_id=415212535270075,,,,,,,05/26/2016 to 09/29/2016,2016-05-26,2016-09-29,Thu: 3:00 PM-7:00 PM;,Thu: 3:00 PM-7:00 PM,,,,,,,,,,,,,,,,,,,,,,,,,,,,,,,,
1006028,Danbury Farmers Market,,,,,,,,,,,,,,,,,,,,,,,,,,,,,,,,,,,,,,,,,,,,,,,
1004516,Danbury Farmers Market,http://www.danburyfarmersmarket.org,http://www.danburyfarmersmarket.org,,,,,,,,,06/25/2016 to 10/22/2016,2016-06-25,2016-10-22,Sat: 10:00 AM-2:00 PM;,Sat: 10:00 AM-2:00 PM,,,,,,,,,,,,,,,,,,,,,,,,,,,,,,,,
1010428,Danbury Winter Market,http://blazingstargrange.org,http://blazingstargrange.org,,,,,,,,,11/01/2014 to 05/02/2015,2014-11-01,2015-05-02,Sat: 9:00 AM-1:00 PM;,Sat: 9:00 AM-1:00 PM,,,,,,,,,,,,,,,,,,,,,,,,,,,,,,,,
1001594,Dandridge Farmers Market,http://www.mainstreetdandridge.com,http://www.mainstreetdandridge.com,https://www.facebook.com/DandridgeFarmersMarket,https://www.facebook.com/DandridgeFarmersMarket,,,,,,,05/24/2014 to 10/25/2014,2014-05-24,2014-10-25,Sat: 9:00 AM-12:00 PM;,Sat: 9:00 AM-12:00 PM,,,,,,,,,,,,,,,,,,,,,,,,,,,,,,,,
1005176,Dane County Farmers Market - Holiday Market,http://www.dcfm.org,http://www.dcfm.org,,,,,,,,,11/19/2016 to 12/31/2016,2016-11-19,2016-12-31,Sat: 7:30 AM-12:00 PM;,Sat: 7:30 AM-12:00 PM,,,,,,,,,,,,,,,,,,,,,,,,,,,,,,,,
1005177,Dane County Farmers Market - Wednesday Market,http://www.dcfm.org,http://www.dcfm.org,,,,,,,,,04/20/2016 to 11/09/2016,2016-04-20,2016-11-09,Wed: 8:30 AM-2:00 PM;,Wed: 8:30 AM-2:00 PM,,,,,,,,,,,,,,,,,,,,,,,,,,,,,,,,
1005175,Dane County Farmers Market - Winter Market,,,https://www.facebook.com/StBMarket,https://www.facebook.com/StBMarket,,,,,,,01/07/2017 to 04/15/2017,2017-01-07,2017-04-15,Sat: 7:30 AM-12:00 PM;,Sat: 7:30 AM-12:00 PM,,,,,,,,,,,,,,,,,,,,,,,,,,,,,,,,
1005178,Dane County Farmers Market I,http://www.dcfm.org,http://www.dcfm.org,https://www.facebook.com/DaneCoFM/,https://www.facebook.com/DaneCoFM/,,,,,https://www.instagram.com/danecofm/?hl=en,https://www.instagram.com/danecofm/?hl=en,04/16/2016 to 11/12/2016,2016-04-16,2016-11-12,Sat: 6:30 AM-2:00 PM;,Sat: 6:30 AM-2:00 PM,,,,,,,,,,,,,,,,,,,,,,,,,,,,,,,,
1001314,Daniels Farmstead,http://www.danielsfarmstead.org,http://www.danielsfarmstead.org,https://www.facebook.com/pages/Daniels-Farmstead-Farmers-Market/342201325857571,https://www.facebook.com/pages/Daniels-Farmstead-Farmers-Market/342201325857571,,,,,,,07/06/2014 to 10/05/2014,2014-07-06,2014-10-05,Sun: 11:00 AM-3:00 PM;,Sun: 11:00 AM-3:00 PM,,,,,,,,,,,,,,,,,,,,,,,,,,,,,,,,
1007766,Danielson Farmers Market,http://www.nectfarmersmarket.org,http://www.nectfarmersmarket.org,,,,,,,,,,,,,,,,,,,,,,,,,,,,,,,,,,,,,,,,,,,,,
1001339,Dansville Farmers Market,,,,,,,,,,,,,,,,,,,,,,,,,,,,,,,,,,,,,,,,,,,,,,,
1011974,Danvers Farmers Market,http://www.danversfarmersmarket.org/,http://www.danversfarmersmarket.org/,https://www.facebook.com/danversfarmersmarket,https://www.facebook.com/danversfarmersmarket,,,,,,,06/08/2016 to 10/05/2016,2016-06-08,2016-10-05,Wed: 4:00 PM-7:00 PM;,Wed: 4:00 PM-7:00 PM,,,,,,,,,,,,,,,,,,,,,,,,,,,,,,,,
1000044,Danville Auction,,,,,,,,,,,,,,,,,,,,,,,,,,,,,,,,,,,,,,,,,,,,,,,
1003908,Danville Chamber Of Commerce Farmers Market,http://www.danvillechamber.org,http://www.danvillechamber.org,https://www.facebook.com/DCOCFarmmarket/info,https://www.facebook.com/DCOCFarmmarket/info,,,,,,,05/09/2015 to 09/12/2015,2015-05-09,2015-09-12,Sat: 8:00 AM-12:00 PM;,Sat: 8:00 AM-12:00 PM,,,,,,,,,,,,,,,,,,,,,,,,,,,,,,,,
1003654,Danville Farmers Market,http://www.sites.google.com/site/caledoniafarmersmarket/,http://www.sites.google.com/site/caledoniafarmersmarket/,,,,,,,,,,,,,,,,,,,,,,,,,,,,,,,,,,,,,,,,,,,,,
1010818,Danville Farmers Market,http://www.playdanvilleva.com,http://www.playdanvilleva.com,,,,,,,,,05/02/2015 to 10/31/2015,2015-05-02,2015-10-31,Sat: 7:30 AM-12:00 PM;,Sat: 7:30 AM-12:00 PM,,,,,,,07/01/2015 to 08/01/2015,7/1/15, 08/01/2015,Wed: 3:00 PM-6:00 PM;,Wed: 3:00 PM-6:00 PM,,,,,,,,,,,,,,,,,,,,,
1011345,Danville Farmers Market,http://www.pcfma.org,http://www.pcfma.org,https://www.facebook.com/DanvilleFarmersMarket,https://www.facebook.com/DanvilleFarmersMarket,,,,,,,01/01/2015 to 12/31/2015,2015-01-01,2015-12-31,Sun: 9:00 AM-1:00 PM;,Sun: 9:00 AM-1:00 PM,,,,,,,,,,,,,,,,,,,,,,,,,,,,,,,,
1004993,Darby Farmers Market,,,,,,,,,,,05/01/2016 to 10/25/2016,2016-05-01,2016-10-25,Tue: 12:00 PM-5:00 PM;,Tue: 12:00 PM-5:00 PM,,,,,,,,,,,,,,,,,,,,,,,,,,,,,,,,
1007703,Darien Farmers Market,http://www.darienfarmersmarket.net,http://www.darienfarmersmarket.net,,,,,,,,,,,,,,,,,,,,,,,,,,,,,,,,,,,,,,,,,,,,,
1009648,Darien Farmers Market,http://www.merrillsmarkets.com,http://www.merrillsmarkets.com,,,,,,,,,06/11/2014 to 10/08/2014,2014-06-11,2014-10-08,Wed: 3:00 PM-7:00 PM;,Wed: 3:00 PM-7:00 PM,,,,,,,,,,,,,,,,,,,,,,,,,,,,,,,,
1012505,Darlington Farmers Market,,,,,,,,,,,05/01/2016 to 10/01/2016,2016-05-01,2016-10-01,Sat: 8:00 AM-12:00 PM;,Sat: 8:00 AM-12:00 PM,,,,,,,,,,,,,,,,,,,,,,,,,,,,,,,,
1002568,Dartmouth Farmers Market,,,https://www.facebook.com/pages/Dartmouth-Farmers-Market-in-Padanaram-Village/436513176369216,https://www.facebook.com/pages/Dartmouth-Farmers-Market-in-Padanaram-Village/436513176369216,,,,,,,06/01/2012 to 09/31/2012,2012-06-01,,,,,,,,,,,,,,,,,,,,,,,,,,,,,,,,,,,
1001775,Dauphin Island Market,,,,,,,,,,,,,,,,,,,,,,,,,,,,,,,,,,,,,,,,,,,,,,,
1008435,Davenport Farmers Market,,,,,,,,,,,06/27/2013 to 10/03/2013,2013-06-27,2013-10-03,Thu: 5:00 PM-7:00 PM;,Thu: 5:00 PM-7:00 PM,,,,,,,,,,,,,,,,,,,,,,,,,,,,,,,,
1004156,Davenport Farmers Market,http://www.mvgrowers.com,http://www.mvgrowers.com,,,,,,,,,05/02/2015 to 10/31/2015,2015-05-02,2015-10-31,Wed: 8:00 AM-12:00 PM;Sat: 8:00 AM-12:00 PM;,Wed: 8:00 AM-12:00 PM,Sat: 8:00 AM-12:00 PM,,,,,,,,,,,,,,,,,,,,,,,,,,,,,,,
1003088,David City Farmers Market,http://www.davidcityne.com,http://www.davidcityne.com,,,,,,,,,,,,,,,,,,,,,,,,,,,,,,,,,,,,,,,,,,,,,
1001883,Davis County Farmers Market,http://www.bloomfieldmainstreet.com/Farmer'sMarket.htm,,,,,,,,,,05/18/2013 to 10/19/2013,2013-05-18,2013-10-19,Tue: 3:00 PM-6:00 PM;Sat: 8:30 AM-11:30 AM;,Tue: 3:00 PM-6:00 PM,Sat: 8:30 AM-11:30 AM,,,,,,,,,,,,,,,,,,,,,,,,,,,,,,,
1009868,Davis Farmers Market,http://www.davisfarmersmarket.org,http://www.davisfarmersmarket.org,https://www.facebook.com/DavisFarmersMarket,https://www.facebook.com/DavisFarmersMarket,,,,,,,01/01/2014 to 12/31/2014,2014-01-01,2014-12-31,,,,,,,,,,,,,,,,,,,,,,,,,,,,,,,,,,
1003589,Davison Downtown Farmers Market,http://www.cityofdavison.org/farmers.htm,http://www.cityofdavison.org/farmers.htm,,,,,,,,,,,,,,,,,,,,,,,,,,,,,,,,,,,,,,,,,,,,,
1003563,Dawson County Farmers Market,http://www.caes.uga.edu/extension/dawson/DawsonCountyFarmersMarket.html,http://www.caes.uga.edu/extension/dawson/DawsonCountyFarmersMarket.html,,,,,,,,,07/03/2013 to 09/28/2013,2013-07-03,2013-09-28,Wed: 7:30 AM-10:30 AM;Sat: 7:30 AM-10:30 AM;,Wed: 7:30 AM-10:30 AM,Sat: 7:30 AM-10:30 AM,,,,,,,,,,,,,,,,,,,,,,,,,,,,,,,
1012254,Dawson Farmers Market,,,dawson madison farmers market,,,,,,,,06/30/2016 to 10/13/2016,2016-06-30,2016-10-13,Thu: 4:00 PM-6:00 PM;,Thu: 4:00 PM-6:00 PM,,,,,,,,,,,,,,,,,,,,,,,,,,,,,,,,
1001090,Dayton Farmers Market,http://www.daytonfarmersmarket.com,http://www.daytonfarmersmarket.com,,,,,,,,,,,,,,,,,,,,,,,,,,,,,,,,,,,,,,,,,,,,,
1003500,Dayton Farmers Market,,,,,,,,,,,04/01/2016 to 10/01/2016,2016-04-01,2016-10-01,Mon: 7:00 AM-5:00 PM;Tue: 7:00 AM-5:00 PM;Wed: 7:00 AM-5:00 PM;Thu: 7:00 AM-5:00 PM;Fri: 7:00 AM-5:00 PM;,Mon: 7:00 AM-5:00 PM,Tue: 7:00 AM-5:00 PM,Wed: 7:00 AM-5:00 PM,Thu: 7:00 AM-5:00 PM,Fri: 7:00 AM-5:00 PM,,,,,,,,,,,,,,,,,,,,,,,,,,,,
1008492,Dayton Farmers Market,,,,,,,,,,,06/12/2014 to 09/25/2014,2014-06-12,2014-09-25,Thu: 3:00 AM-6:00 PM;,Thu: 3:00 AM-6:00 PM,,,,,,,,,,,,,,,,,,,,,,,,,,,,,,,,
1011946,Daytona Beach Downtown Farmers Market,http://www.riverfrontshopsofdaytona.com/daytona-beach-downtown-farmers-market/,http://www.riverfrontshopsofdaytona.com/daytona-beach-downtown-farmers-market/,http://www.facebook.com/search/top/?q=daytona%20beach%20downtown%20farmers%20market,http://www.facebook.com/search/top/?q=daytona%20beach%20downtown%20farmers%20market,,,,,,,01/01/2016 to 12/31/2016,2016-01-01,2016-12-31,Sat: 7:00 AM-1:00 PM;,Sat: 7:00 AM-1:00 PM,,,,,,,,,,,,,,,,,,,,,,,,,,,,,,,,
1002451,Dayville Mercantile,,,,,,,,,,,,,,,,,,,,,,,,,,,,,,,,,,,,,,,,,,,,,,,
1004358,Dc Farmers Market,,,,,,,,,,,,,,,,,,,,,,,,,,,,,,,,,,,,,,,,,,,,,,,
1007204,De Pere Farmer Market,,,,,,,,,,,,,,,,,,,,,,,,,,,,,,,,,,,,,,,,,,,,,,,
1010622,De Soto Farmers Market,http://gethealthydesoto.org,http://gethealthydesoto.org,DeSoto-Farmers-Market,,,,,,,,05/03/2014 to 10/25/2014,2014-05-03,2014-10-25,Sat: 8:00 AM-12:00 PM;,Sat: 8:00 AM-12:00 PM,,,,,,,,,,,,,,,,,,,,,,,,,,,,,,,,
1007151,Deaf Smith Chamber Of Commerce Farmers Market,,,,,,,,,,,,,,,,,,,,,,,,,,,,,,,,,,,,,,,,,,,,,,,
1001317,Deale Farmers Market,,,,,,,,,,,07/03/2014 to 10/30/2014,2014-07-03,2014-10-30,Thu: 3:00 PM-6:00 PM;,Thu: 3:00 PM-6:00 PM,,,,,,,,,,,,,,,,,,,,,,,,,,,,,,,,
1001847,Dean Street Farmers Market,,,,,,,,,,,,,,,,,,,,,,,,,,,,,,,,,,,,,,,,,,,,,,,
1009395,Deans Farm Market,http://www.deansfarmmarket.com/,http://www.deansfarmmarket.com/,,,,,,,,,,,,,,,,,,,,,,,,,,,,,,,,,,,,,,,,,,,,,
1005735,Decatur Farmers Market,http://www.decaturindianafarmersmarket.com/default.aspx,http://www.decaturindianafarmersmarket.com/default.aspx,,,,,,,,,June to October,2010-06-01,2010-10-31,Thu:3:30 PM - 6:30 PM;,Thu:3:30 PM - 6:30 PM,,,,,,,,,,,,,,,,,,,,,,,,,,,,,,,,
1003044,Decatur Farmers Market,,,,,,,,,,,,,,,,,,,,,,,,,,,,,,,,,,,,,,,,,,,,,,,
1012495,Decatur Farmers Market,http://cfmatl.org,http://cfmatl.org,https://www.facebook.com/DecaturFarmersMarkets/,https://www.facebook.com/DecaturFarmersMarkets/,,,,,,,01/01/2016 to 12/31/2016,2016-01-01,2016-12-31,Wed: 4:00 PM-7:00 PM;Sat: 9:00 AM-1:00 PM;,Wed: 4:00 PM-7:00 PM,Sat: 9:00 AM-1:00 PM,,,,,,,,,,,,,,,,,,,,,,,,,,,,,,,
1008296,Dedham Farmers Market,http://www.dedhamfarmersmarket.org,http://www.dedhamfarmersmarket.org,https://www.facebook.com/DedhamFarmersMarket,https://www.facebook.com/DedhamFarmersMarket,https://twitter.com/dedhamfarmers,https://twitter.com/dedhamfarmers,,,,,06/15/2016 to 10/26/2016,2016-06-15,2016-10-26,Wed: 3:00 PM-7:00 PM;,Wed: 3:00 PM-7:00 PM,,,,,,,,,,,,,,,,,,,,,,,,,,,,,,,,
1007458,Deep River Farmers Market,,,,,,,,,,,,,,,,,,,,,,,,,,,,,,,,,,,,,,,,,,,,,,,
1012303,"Deer Lodge Community Garden ""u Pick"" Farmers Market",,,Deeer Lodge Community Garden,,,,,,,,08/13/2016 to 09/17/2016,2016-08-13,2016-09-17,Sat: 9:00 AM-12:00 PM;,Sat: 9:00 AM-12:00 PM,,,,,,,,,,,,,,,,,,,,,,,,,,,,,,,,
1000260,Deer Park Farmers Market,,,,,,,,,,,,,,,,,,,,,,,,,,,,,,,,,,,,,,,,,,,,,,,
1002025,Deerfield Farmers Market,http://www.farmersmarket.deerfield-nh.us/,,,,,,,,,,06/14/2013 to 09/20/2013,2013-06-14,2013-09-20,Fri: 3:30 PM-6:30 PM;,Fri: 3:30 PM-6:30 PM,,,,,,,11/09/2013 to 03/15/2014,11/9/13, 03/15/2014,Sun: 1:00 PM-4:00 PM;,Sun: 1:00 PM-4:00 PM,,,,,,,,,,,,,,,,,,,,,
1003098,Deerfield Farmers Market,http://www.deerfield.il.us/residents/farmers_market,http://www.deerfield.il.us/residents/farmers_market,,,,,,,,,06/13/2015 to 10/10/2015,2015-06-13,2015-10-10,Sat: 7:00 AM-12:30 PM;,Sat: 7:00 AM-12:30 PM,,,,,,,,,,,,,,,,,,,,,,,,,,,,,,,,
1003733,Deerfield Twp Farmers Market,,,,,,,,,,,,,,,,,,,,,,,,,,,,,,,,,,,,,,,,,,,,,,,
1006190,Defiance County Farmers Markets,http://www.defiance.osu.edu,http://www.defiance.osu.edu,,,,,,,,,May to October,2010-05-01,2010-10-31,Tue:4:00 PM - 7:00 PM;Thu:12:00 PM - 4:00 PM;Sat:8:00 AM - 12:00 PM;,Tue:4:00 PM - 7:00 PM,Thu:12:00 PM - 4:00 PM,Sat:8:00 AM - 12:00 PM,,,,,,,,,,,,,,,,,,,,,,,,,,,,,,
1006191,Defiance County Farmers Markets,http://www.defiance.osu.edu,http://www.defiance.osu.edu,,,,,,,,,May to October,2010-05-01,2010-10-31,Tue:7:30 AM - 11:30 AM;Fri:3:00 PM - 7:00 PM;,Tue:7:30 AM - 11:30 AM,Fri:3:00 PM - 7:00 PM,,,,,,,,,,,,,,,,,,,,,,,,,,,,,,,
1006192,Defiance County Farmers Markets,http://www.defiance.osu.edu,http://www.defiance.osu.edu,,,,,,,,,May to September,2010-05-01,2010-09-30,Fri:9:00 AM - 12:00 PM;,Fri:9:00 AM - 12:00 PM,,,,,,,,,,,,,,,,,,,,,,,,,,,,,,,,
1012296,Deforest Area Farmers Market,http://www.vi.deforest.wi.us/index.asp?Type=B_BASIC&SEC={38A90127-1135-4F1B-99D2-5AC8EE5AF484},,https://www.facebook.com/DeFoFarmersMarket/,https://www.facebook.com/DeFoFarmersMarket/,,,,,,,05/24/2016 to 10/26/2016,2016-05-24,2016-10-26,Tue: 3:00 PM-6:00 PM;,Tue: 3:00 PM-6:00 PM,,,,,,,,,,,,,,,,,,,,,,,,,,,,,,,,
1005914,Deitchs Frm Market,,,,,,,,,,,,,,,,,,,,,,,,,,,,,,,,,,,,,,,,,,,,,,,
1001995,Dekalb County Farmers Market,,,,,,,,,,,,,,,,,,,,,,,,,,,,,,,,,,,,,,,,,,,,,,,
1010030,Dekalb Farmers Market,http://dekalbcofarmersmarket.com,http://dekalbcofarmersmarket.com,https://www.facebook.com/dekalbcofarmersmarket,https://www.facebook.com/dekalbcofarmersmarket,,,,,,,04/01/2014 to 11/01/2014,2014-04-01,2014-11-01,Sat: 6:00 AM-1:00 PM;,Sat: 6:00 AM-1:00 PM,,,,,,,,,,,,,,,,,,,,,,,,,,,,,,,,
1010240,Dekalb Farmers Market,,,https://www.facebook.com/DeKalbNYFarmersMarket,https://www.facebook.com/DeKalbNYFarmersMarket,,,,,,,05/07/2014 to 10/15/2014,2014-05-07,2014-10-15,Wed: 1:00 PM-6:00 PM;,Wed: 1:00 PM-6:00 PM,,,,,,,,,,,,,,,,,,,,,,,,,,,,,,,,
1011103,Dekalb Farmers Market,http://www.downtowndekalb.org,http://www.downtowndekalb.org,https://www.facebook.com/dekalbfarmersmarket?ref=hl,https://www.facebook.com/dekalbfarmersmarket?ref=hl,https://twitter.com/FarmShopDeKalb,https://twitter.com/FarmShopDeKalb,,,,,06/04/2015 to 09/24/2015,2015-06-04,2015-09-24,Thu: 10:00 AM-2:00 PM;,Thu: 10:00 AM-2:00 PM,,,,,,,,,,,,,,,,,,,,,,,,,,,,,,,,
1000038,Del Mar Farmers Market,,,,,,,,,,,,,,,,,,,,,,,,,,,,,,,,,,,,,,,,,,,,,,,
1002536,Del Monte Farmers Markets At Del Monte Shopping Center,http://www.montereybayfarmers.org,http://www.montereybayfarmers.org,https://www.facebook.com/pages/Monterey-Bay-Certified-Farmers-Markets/112446802152723,https://www.facebook.com/pages/Monterey-Bay-Certified-Farmers-Markets/112446802152723,https://twitter.com/MBFarmersMarket,https://twitter.com/MBFarmersMarket,,,www.edibleparadise.com,www.edibleparadise.com,05/11/2014 to 10/26/2014,2014-05-11,2014-10-26,Sun: 8:00 AM-12:00 PM;,Sun: 8:00 AM-12:00 PM,,,,,,,,,,,,,,,,,,,,,,,,,,,,,,,,
1004841,Del Paso Heights Community Cfm,,,,,,,,,,,,,,,,,,,,,,,,,,,,,,,,,,,,,,,,,,,,,,,
1008571,Del Ray Farmers Market,http://delrayfarmersmarket.com/,http://delrayfarmersmarket.com/,https://www.facebook.com/pages/Del-Ray-Farmers-Market/141370742562263,https://www.facebook.com/pages/Del-Ray-Farmers-Market/141370742562263,https://twitter.com/DelRayFarmMkt,https://twitter.com/DelRayFarmMkt,,,,,01/01/2013 to 12/31/2013,2013-01-01,2013-12-31,Sat: 8:00 AM-12:00 PM;,Sat: 8:00 AM-12:00 PM,,,,,,,,,,,,,,,,,,,,,,,,,,,,,,,,
1006343,Delafield Farmes Market,,,,,,,,,,,,,,,,,,,,,,,,,,,,,,,,,,,,,,,,,,,,,,,
1008057,Delano Community Farmers Market,http://www.historicdelano.com/market,http://www.historicdelano.com/market,https://www.facebook.com/DelanoMarket,https://www.facebook.com/DelanoMarket,,,,,,,05/07/2014 to 10/29/2014,2014-05-07,2014-10-29,Wed: 5:00 PM-7:00 PM;,Wed: 5:00 PM-7:00 PM,,,,,,,,,,,,,,,,,,,,,,,,,,,,,,,,
1000998,Delano Farmers Market,,,,,,,,,,,,,,,,,,,,,,,,,,,,,,,,,,,,,,,,,,,,,,,
1002829,Delano Farmers Market,,,,,,,,,,,,,,,,,,,,,,,,,,,,,,,,,,,,,,,,,,,,,,,
1005210,Delavan Fresh Market,,,https://www.facebook.com/pages/Delavan-Fresh-Market/137861759574760?ref=hl,https://www.facebook.com/pages/Delavan-Fresh-Market/137861759574760?ref=hl,,,,,,,06/05/2014 to 09/25/2014,2014-06-05,2014-09-25,Thu: 3:00 PM-6:00 PM;,Thu: 3:00 PM-6:00 PM,,,,,,,,,,,,,,,,,,,,,,,,,,,,,,,,
1003691,Delaware Area Neighborhood Farmers Market,,,,,,,,,,,,,,,,,,,,,,,,,,,,,,,,,,,,,,,,,,,,,,,
1010264,Delaware Avenue Farmers Market,http://delawareave.wordpress.com/,http://delawareave.wordpress.com/,https://www.facebook.com/pages/Delaware-Avenue-Farmers-Market/253512674785530,https://www.facebook.com/pages/Delaware-Avenue-Farmers-Market/253512674785530,,,,,,,05/01/2014 to 09/01/2014,2014-05-01,2014-09-01,Tue: 4:00 PM-7:30 PM;,Tue: 4:00 PM-7:30 PM,,,,,,,,,,,,,,,,,,,,,,,,,,,,,,,,
1011731,Delaware Bounty,http://www.delawarebounty.com,http://www.delawarebounty.com,https://www.facebook.com/Delaware-Bounty-Fresh-Local-Food-726223644139439,https://www.facebook.com/Delaware-Bounty-Fresh-Local-Food-726223644139439,,,,,,,01/01/2015 to 12/31/2015,2015-01-01,2015-12-31,Tue: 12:00 PM-5:00 PM;Wed: 12:00 PM-5:00 PM;Thu: 12:00 PM-5:00 PM;Fri: 12:00 PM-5:00 PM;Sat: 10:00 AM-2:00 PM;,Tue: 12:00 PM-5:00 PM,Wed: 12:00 PM-5:00 PM,Thu: 12:00 PM-5:00 PM,Fri: 12:00 PM-5:00 PM,Sat: 10:00 AM-2:00 PM,,,,,,,,,,,,,,,,,,,,,,,,,,,,
1002719,Delaware County Farmers Market,http://www.delawarecountyfair.com,http://www.delawarecountyfair.com,,,,,,,,,,,,,,,,,,,,,,,,,,,,,,,,,,,,,,,,,,,,,
1001002,Delaware Valley College Farmers Market,http://www.delawarevalleycollege.com,http://www.delawarevalleycollege.com,,,,,,,,,,,,,,,,,,,,,,,,,,,,,,,,,,,,,,,,,,,,,
1010841,Delcambre Seafood And Farmers Market,http://www.DelcambreMarket.org,http://www.DelcambreMarket.org,www.facebook.com/DelcambreMarket,,@DelcambreMarket,@DelcambreMarket,,,www.Facebook.com/DelcambreMarket,www.Facebook.com/DelcambreMarket,03/05/2016 to 12/03/2016,2016-03-05,2016-12-03,Sat: 9:00 AM-1:00 PM;,Sat: 9:00 AM-1:00 PM,,,,,,,,,,,,,,,,,,,,,,,,,,,,,,,,
1001356,Delhi Farmers Market,,,,,,,,,,,06/04/2014 to 09/24/2014,2014-06-04,2014-09-24,Wed: 9:00 AM-2:00 PM;,Wed: 9:00 AM-2:00 PM,,,,,,,,,,,,,,,,,,,,,,,,,,,,,,,,
1011285,Delmar Farmers Market,http://delmarmarket.org,http://delmarmarket.org,https://www.facebook.com/SaturdayDelmarFarmersMarket?ref=hl,https://www.facebook.com/SaturdayDelmarFarmersMarket?ref=hl,@DelmarFarmerMkt,@DelmarFarmerMkt,,,,,05/07/2016 to,2016-05-07,,Sat: 9:00 AM-1:00 PM;,Sat: 9:00 AM-1:00 PM,,,,,,,,,,,,,,,,,,,,,,,,,,,,,,,,
1002914,Delray Green Market,http://www.delraygreenmarket.com,http://www.delraygreenmarket.com,www.facebook.com/DelrayGreenMarket,,https://twitter.com/DelrayGreenMrkt,https://twitter.com/DelrayGreenMrkt,,,www.delraygreenmarketwordpress.com,www.delraygreenmarketwordpress.com,01/01/2013 to,2013-01-01,,Sat: 9:00 AM-2:00 PM;,Sat: 9:00 AM-2:00 PM,,,,,,,,,,,,,,,,,,,,,,,,,,,,,,,,
1009389,Delta Farmers Market,,,https://www.facebook.com/deltafarmermarket,https://www.facebook.com/deltafarmermarket,,,,,,,,,,,,,,,,,,,,,,,,,,,,,,,,,,,,,,,,,,,
1011747,Delta Regional Mule Train Market And Museum,,,,,,,,,,,,,,Fri: 9:00 AM-3:00 PM;Sat: 9:00 AM-3:00 PM;,Fri: 9:00 AM-3:00 PM,Sat: 9:00 AM-3:00 PM,,,,,,,,,,,,,,,,,,,,,,,,,,,,,,,
1001062,Deltaville Farmers Market,http://www.deltavilleva.com/MuseumPark/FarmersMarket.aspx,http://www.deltavilleva.com/MuseumPark/FarmersMarket.aspx,,,,,,,,,,,,,,,,,,,,,,,,,,,,,,,,,,,,,,,,,,,,,
1005891,Demopolis Farmers Market,,,,,,,,,,,,,,,,,,,,,,,,,,,,,,,,,,,,,,,,,,,,,,,
1001904,Denali Farmers Market,,,,,,,,,,,,,,,,,,,,,,,,,,,,,,,,,,,,,,,,,,,,,,,
1003126,Denios Farmers Market,http://www.deniosmarket.com,http://www.deniosmarket.com,https://www.facebook.com/Denios,https://www.facebook.com/Denios,,,,,,,01/01/2014 to 12/31/2014,2014-01-01,2014-12-31,Fri: 9:00 AM-2:00 PM;Sat: 7:00 AM-3:30 PM;Sun: 7:00 AM-5:00 PM;,Fri: 9:00 AM-2:00 PM,Sat: 7:00 AM-3:30 PM,Sun: 7:00 AM-5:00 PM,,,,,,,,,,,,,,,,,,,,,,,,,,,,,,
1002830,Denison Farmers Market,http://www.dloftus@cdcia.org,http://www.dloftus@cdcia.org,,,,,,,,,,,,,,,,,,,,,,,,,,,,,,,,,,,,,,,,,,,,,
1009013,Denton Community Market,http://www.dentonmarket.org,http://www.dentonmarket.org,https://www.facebook.com/DentonCommunityMarket,https://www.facebook.com/DentonCommunityMarket,https://twitter.com/DentonMarket,https://twitter.com/DentonMarket,,,http://instagram.com/communitymarket,http://instagram.com/communitymarket,04/06/2013 to 11/30/2013,2013-04-06,2013-11-30,Sat: 9:00 AM-1:00 PM;,Sat: 9:00 AM-1:00 PM,,,,,,,04/05/2014 to 11/29/2014,4/5/14, 11/29/2014,Sat: 9:00 AM-1:00 PM;,Sat: 9:00 AM-1:00 PM,,,,,,,4/4/15, 11/28/2015,Sat: 9:00 AM-1:00 PM;,Sat: 9:00 AM-1:00 PM,,,,,,,,,,,
1002512,Denton Main Street Farmers Market,http://www.downtowndenton.com,http://www.downtowndenton.com,,,,,,,,,May to September,2010-05-01,2010-09-30,Wed:9:30 AM - 2:00 PM;Fri:9:30 AM - 2:00 PM;,Wed:9:30 AM - 2:00 PM,Fri:9:30 AM - 2:00 PM,,,,,,,,,,,,,,,,,,,,,,,,,,,,,,,
1007588,Denton St. Lukes Farmers Market,,,,,,,,,,,,,,,,,,,,,,,,,,,,,,,,,,,,,,,,,,,,,,,
1004069,Denver Urban Homesteading Farmers Market,http://www.denverurbanhomesteading.com,http://www.denverurbanhomesteading.com,,,,,,,,,01/01/2014 to 12/31/2014,2014-01-01,2014-12-31,Tue: 9:00 AM-3:00 PM;Thu: 1:00 PM-7:00 PM;Fri: 1:00 AM-7:00 PM;Sat: 9:00 AM-3:00 PM;,Tue: 9:00 AM-3:00 PM,Thu: 1:00 PM-7:00 PM,Fri: 1:00 AM-7:00 PM,Sat: 9:00 AM-3:00 PM,,,,,,,,,,,,,,,,,,,,,,,,,,,,,
1004366,Denville Farmers Market,http://www.denvillefarmersmarket.com,http://www.denvillefarmersmarket.com,https://www.facebook.com/pages/Denville-Farmers-Market/125676414129318,https://www.facebook.com/pages/Denville-Farmers-Market/125676414129318,,,,,,,06/14/2015 to 11/22/2015,2015-06-14,2015-11-22,Sun: 8:30 AM-1:00 PM;,Sun: 8:30 AM-1:00 PM,,,,,,,12/07/2014 to 06/12/2016,12/7/14, 06/12/2016,Sun: 10:00 AM-1:00 PM;,Sun: 10:00 AM-1:00 PM,,,,,,,,,,,,,,,,,,,,,
1007219,Depere Market At Festival Foods,,,,,,,,,,,,,,,,,,,,,,,,,,,,,,,,,,,,,,,,,,,,,,,
1004257,Deposit Farmers Market,http://www.ccedelaware.org,http://www.ccedelaware.org,,,,,,,,,08/18/2016 to 09/15/2016,2016-08-18,2016-09-15,Thu: 10:00 AM-2:00 PM;,Thu: 10:00 AM-2:00 PM,,,,,,,,,,,,,,,,,,,,,,,,,,,,,,,,
1009667,Depot Park Market,http://www.depotparkmarket.org,http://www.depotparkmarket.org,https://www.facebook.com/depotparkmarket,https://www.facebook.com/depotparkmarket,https://twitter.com/depotparkmarket,https://twitter.com/depotparkmarket,,,,,05/01/2014 to 10/31/2014,2014-05-01,2014-10-31,Thu: 3:30 PM-7:00 PM;,Thu: 3:30 PM-7:00 PM,,,,,,,,,,,,,,,,,,,,,,,,,,,,,,,,
1011827,Depot Street Farmers Market,http://www.depotstreetfarmersmarket.com,http://www.depotstreetfarmersmarket.com,https://www.facebook.com/depotstreetfarmersmarket/,https://www.facebook.com/depotstreetfarmersmarket/,,,,,,,05/14/2016 to 10/29/2016,2016-05-14,2016-10-29,Sat: 8:00 AM-12:00 PM;,Sat: 8:00 AM-12:00 PM,,,,,,,,,,,,,,,,,,,,,,,,,,,,,,,,
1006900,Deridder Farmers Market,,,,,,,,,,,,,,,,,,,,,,,,,,,,,,,,,,,,,,,,,,,,,,,
1001742,Derry Nh Farmers Market,http://www.derry-nh.org,http://www.derry-nh.org,www.facebook.com/derryfarmersmarket,,,,,,,,06/19/2013 to 09/25/2013,2013-06-19,2013-09-25,Wed: 3:00 AM-7:00 PM;,Wed: 3:00 AM-7:00 PM,,,,,,,,,,,,,,,,,,,,,,,,,,,,,,,,
1007255,Des Moines Waterfront Farmers Market,http://www.DMFM.org,http://www.DMFM.org,https://www.facebook.com/pages/Des-Moines-Waterfront-Farmers-Market/112845878735116?ref=hl,https://www.facebook.com/pages/Des-Moines-Waterfront-Farmers-Market/112845878735116?ref=hl,,,,,,,,,,Sat: 10:00 AM-2:00 PM;,Sat: 10:00 AM-2:00 PM,,,,,,,,,,,,,,,,,,,,,,,,,,,,,,,,
1000261,Desert Hot Springs Farmers Market,http://www.desertlocalnews.com,http://www.desertlocalnews.com,,,,,,,,,,,,,,,,,,,,,,,,,,,,,,,,,,,,,,,,,,,,,
1012122,Desoto Community Farmers Market,,,https://www.facebook.com/DCFM62924/,https://www.facebook.com/DCFM62924/,,,,,,,06/07/2016 to 10/25/2016,2016-06-07,2016-10-25,Tue: 3:00 PM-6:00 PM;,Tue: 3:00 PM-6:00 PM,,,,,,,,,,,,,,,,,,,,,,,,,,,,,,,,
1000917,Desoto Farmers Market,,,,,,,,,,,05/11/2013 to 06/29/2013,2013-05-11,2013-06-29,Sat: 8:00 AM-11:00 AM;,Sat: 8:00 AM-11:00 AM,,,,,,,,,,,,,,,,,,,,,,,,,,,,,,,,
1011529,Desotos Indoor Farmers Market,,,,,,,,,,,07/12/2015 to 12/27/2015,2015-07-12,2015-12-27,Sun: 10:00 AM-3:00 PM;,Sun: 10:00 AM-3:00 PM,,,,,,,,,,,,,,,,,,,,,,,,,,,,,,,,
1005374,Devils Lake Community Market,http://www.devilslakecommunitymarket.netfirms.com,http://www.devilslakecommunitymarket.netfirms.com,,,,,,,,,,,,,,,,,,,,,,,,,,,,,,,,,,,,,,,,,,,,,
1009423,Devon Community Market,http://www.cityofchicago.org/city/en/depts/dca/supp_info/farmers_market3.html,http://www.cityofchicago.org/city/en/depts/dca/supp_info/farmers_market3.html,https://www.facebook.com/pages/Chicago-Farmers-Markets/19988198547?sid=4c2c43d8cfa7095a22e0d9f9c19d26c3&ref=search,https://www.facebook.com/pages/Chicago-Farmers-Markets/19988198547?sid=4c2c43d8cfa7095a22e0d9f9c19d26c3&ref=search,,,,,,,,,,,,,,,,,,,,,,,,,,,,,,,,,,,,,,,,,,,
1006732,Dewey Humboldt Farmers Market,,,,,,,,,,,,,,,,,,,,,,,,,,,,,,,,,,,,,,,,,,,,,,,
1012167,Dewey Square Farmers Market,https://bostonpublicmarket.org/,https://bostonpublicmarket.org/,https://www.facebook.com/BostonPublicMarket,https://www.facebook.com/BostonPublicMarket,BosPublicMarket,,,,Instagram - @BostonPublicMarket,Instagram - @BostonPublicMarket,05/17/2016 to 11/22/2016,2016-05-17,2016-11-22,Tue: 11:30 AM-6:30 PM;Thu: 11:30 AM-6:30 PM;,Tue: 11:30 AM-6:30 PM,Thu: 11:30 AM-6:30 PM,,,,,,,,,,,,,,,,,,,,,,,,,,,,,,,
1005910,Dewitt Farmers Market,http://www.dewittfarmersmarket.com/,http://www.dewittfarmersmarket.com/,,,,,,,,,,,,,,,,,,,,,,,,,,,,,,,,,,,,,,,,,,,,,
1007399,Dewitt Farmers Market,,,,,,,,,,,,,,,,,,,,,,,,,,,,,,,,,,,,,,,,,,,,,,,
1003628,Dexter Farmers Market,http://www.dextermi.gov,http://www.dextermi.gov,,,,,,,,,05/03/2014 to 10/25/2014,2014-05-03,2014-10-25,Tue: 2:00 PM-6:00 PM;Sat: 8:00 AM-1:00 PM;,Tue: 2:00 PM-6:00 PM,Sat: 8:00 AM-1:00 PM,,,,,,,,,,,,,,,,,,,,,,,,,,,,,,,
1012066,Dexter Farmers Market,,,,,,,,,,,05/21/2016 to 10/29/2016,2016-05-21,2016-10-29,Sat: 10:00 AM-2:00 PM;,Sat: 10:00 AM-2:00 PM,,,,,,,,,,,,,,,,,,,,,,,,,,,,,,,,
1007704,Dexter Lake Farmers Market,http://www.DexterLakeFarmersMarket.org,http://www.DexterLakeFarmersMarket.org,,,,,,,,,,,,,,,,,,,,,,,,,,,,,,,,,,,,,,,,,,,,,
1002740,Diablo Valley Certified Farmers Market,http://www.cafarmersmkts.com/markets/category/diablo-valley,http://www.cafarmersmkts.com/markets/category/diablo-valley,https://www.Facebook.com/DVFarmersMkt,https://www.Facebook.com/DVFarmersMkt,https://twitter.com/,https://twitter.com/,,,http://www.pinterest.com/cafarmersmkts/,http://www.pinterest.com/cafarmersmkts/,01/01/2016 to 12/31/2016,2016-01-01,2016-12-31,Sat: 9:00 AM-1:00 PM;,Sat: 9:00 AM-1:00 PM,,,,,,,,,,,,,,,,,,,,,,,,,,,,,,,,
1006035,Diamond Bar Farmers Market,http://www.farmernet.com,http://www.farmernet.com,,,,,,,,,,,,,,,,,,,,,,,,,,,,,,,,,,,,,,,,,,,,,
1008546,Dickinson Square Farmers Market,http://www.farmtocity.org/FarmersMarkets.asp,http://www.farmtocity.org/FarmersMarkets.asp,https://www.facebook.com/DSPFarmersMarket/?fref=ts,https://www.facebook.com/DSPFarmersMarket/?fref=ts,https://twitter.com/FarmtoCity,https://twitter.com/FarmtoCity,,,,,05/01/2016 to 11/20/2016,2016-05-01,2016-11-20,Sun: 10:00 AM-2:00 PM;,Sun: 10:00 AM-2:00 PM,,,,,,,,,,,,,,,,,,,,,,,,,,,,,,,,
1010066,Dickson County Farmers Market,http://www.dicksoncountyfarmersmarket.com/,http://www.dicksoncountyfarmersmarket.com/,https://www.facebook.com/dicksonfarmersmarket/,https://www.facebook.com/dicksonfarmersmarket/,,,,,,,06/18/2016 to 09/24/2016,2016-06-18,2016-09-24,Wed: 8:00 AM-12:00 PM;Sat: 8:00 AM-12:00 PM;,Wed: 8:00 AM-12:00 PM,Sat: 8:00 AM-12:00 PM,,,,,,10/01/2016 to 06/10/2017,10/1/16, 06/10/2017,Sat: 10:00 AM-12:00 PM;,Sat: 10:00 AM-12:00 PM,,,,,,,,,,,,,,,,,,,,,
1004146,Dietrichs Farm Market,,,,,,,,,,,,,,,,,,,,,,,,,,,,,,,,,,,,,,,,,,,,,,,
2000002,Dig It!,http://www.thresholdpa.org,http://www.thresholdpa.org,,,,,,,,,,,,,,,,,,,,,,,,,,,,,,,,,,,,,,,,,,,,,
1002348,Dillingham Farmers Market,,,,,,,,,,,,,,,,,,,,,,,,,,,,,,,,,,,,,,,,,,,,,,,
1010129,Dillon Farmers Market,http://www.dillonfarmersmarket.blogspot.com,http://www.dillonfarmersmarket.blogspot.com,https://www.facebook.com/dillon-farmers-market,https://www.facebook.com/dillon-farmers-market,,,,,,,06/28/2014 to 09/27/2014,2014-06-28,2014-09-27,Sat: 9:00 AM-1:00 PM;,Sat: 9:00 AM-1:00 PM,,,,,,,,,,,,,,,,,,,,,,,,,,,,,,,,
1001118,Dillon Farmers Market,,,https://www.facebook.com/pages/Pulaski-County-Farmers-Market/126926763989161,https://www.facebook.com/pages/Pulaski-County-Farmers-Market/126926763989161,,,,,,,June to September,2010-06-01,2010-09-30,Fri:9:00 AM - 2:00 PM;,Fri:9:00 AM - 2:00 PM,,,,,,,,,,,,,,,,,,,,,,,,,,,,,,,,
1012662,Dillsburg Farmers Market,http://dillsburgfarmersma.wix.com/dbgfarmersmarket,http://dillsburgfarmersma.wix.com/dbgfarmersmarket,facebook.com/DillsburgFarmersMarket/,,twitter.com/dbgfarmers,,youtube.com/channel/UCut3qwS3znzDQ63WGVMnQ0A/feed,,instagram.com/dbgfarmers,instagram.com/dbgfarmers,05/21/2016 to 10/08/2016,2016-05-21,2016-10-08,Sat: 8:00 AM-12:00 PM;,Sat: 8:00 AM-12:00 PM,,,,,,,10/22/2016 to 11/19/2016,10/22/16, 11/19/2016,Sat: 9:00 AM-12:00 PM;,Sat: 9:00 AM-12:00 PM,,,,,,,,,,,,,,,,,,,,,
1001815,Dimondale Farmers Market,http://www.villageofdimondale.org,http://www.villageofdimondale.org,https://www.facebook.com/pages/Dimondale-Farmers-Market/59619558738,https://www.facebook.com/pages/Dimondale-Farmers-Market/59619558738,,,,,Facebook,Facebook,06/04/2015 to 10/29/2015,2015-06-04,2015-10-29,Thu: 3:00 PM-7:00 PM;,Thu: 3:00 PM-7:00 PM,,,,,,,,,,,,,,,,,,,,,,,,,,,,,,,,
1001225,Dinsmore Farmers Market,,,,,,,,,,,,,,,,,,,,,,,,,,,,,,,,,,,,,,,,,,,,,,,
1005161,Dinuba Farmers Market,,,,,,,,,,,,,,,,,,,,,,,,,,,,,,,,,,,,,,,,,,,,,,,
1004099,Discover Sycamores Farmers Market,http://www.sycamorechamber.com,http://www.sycamorechamber.com,,,,,,,,,,,,,,,,,,,,,,,,,,,,,,,,,,,,,,,,,,,,,
1004814,Divide Farm Exchange,,,,,,,,,,,,,,,,,,,,,,,,,,,,,,,,,,,,,,,,,,,,,,,
1011426,Divisadero Certified Farmers Market,http://pcfma.org,http://pcfma.org,facebook.com/DivisaderoFarmersMarket,,twitter.com/PacCoastFarmers,,,,instagram.com/pcfma,instagram.com/pcfma,01/01/2015 to 12/31/2015,2015-01-01,2015-12-31,Sun: 10:00 AM-2:00 PM;,Sun: 10:00 AM-2:00 PM,,,,,,,,,,,,,,,,,,,,,,,,,,,,,,,,
1006582,Divisidero Certified Farmers Market,http://www.pcfma.com/market_home.php?market_id=63,http://www.pcfma.com/market_home.php?market_id=63,,,,,,,,,January to December,2010-01-01,2010-12-31,sun:10:00 AM - 2:00 PM;,sun:10:00 AM - 2:00 PM,,,,,,,,,,,,,,,,,,,,,,,,,,,,,,,,
1002504,Division Street Chicago Farmers Market,,,,,,,,,,,,,,,,,,,,,,,,,,,,,,,,,,,,,,,,,,,,,,,
1004217,Dixboro Farmers Market,http://www.dixborofarmersmarket.org,http://www.dixborofarmersmarket.org,https://www.facebook.com/pages/Dixboro-Farmers-Market/372563842791981,https://www.facebook.com/pages/Dixboro-Farmers-Market/372563842791981,,,,,,,05/20/2016 to,2016-05-20,,Fri: 3:00 PM-7:00 PM;,Fri: 3:00 PM-7:00 PM,,,,,,,,,,,,,,,,,,,,,,,,,,,,,,,,
1003376,Dixie Lee Farmers Market,http://www.dixieleefarmersmarket.com/,http://www.dixieleefarmersmarket.com/,https://www.facebook.com/dixieleefarmersmarket,https://www.facebook.com/dixieleefarmersmarket,,,,,,,05/03/2014 to 11/01/2014,2014-05-03,2014-11-01,Sat: 9:00 AM-12:00 PM;,Sat: 9:00 AM-12:00 PM,,,,,,,,,,,,,,,,,,,,,,,,,,,,,,,,
1004778,Dixon Farmers Market,http://www.dixonfarmersmarket.com,http://www.dixonfarmersmarket.com,https://www.facebook.com/DixonFarmersMarket,https://www.facebook.com/DixonFarmersMarket,,,,,http://farmersmarketsnm.org/,http://farmersmarketsnm.org/,06/11/2014 to 10/15/2014,2014-06-11,2014-10-15,Wed: 8:30 AM-6:30 PM;,Wed: 8:30 AM-6:30 PM,,,,,,,,,,,,,,,,,,,,,,,,,,,,,,,,
1001935,Dixon Park District Farmers Market,http://www.dixonparks.com,http://www.dixonparks.com,,,,,,,,,May to October,2010-05-01,2010-10-31,Wed:7:00 AM - 12:00 PM;Sat:7:00 AM - 12:00 PM;,Wed:7:00 AM - 12:00 PM,Sat:7:00 AM - 12:00 PM,,,,,,,,,,,,,,,,,,,,,,,,,,,,,,,
1009316,Dlb Law Market In The Park,http://www.washingtonpark.org/event/farmers-market-2/2013-07-15/,http://www.washingtonpark.org/event/farmers-market-2/2013-07-15/,,,,,,,,,,,,,,,,,,,,,,,,,,,,,,,,,,,,,,,,,,,,,
1004459,Dnr Farmers Market,http://www.aaedc.org,http://www.aaedc.org,https://www.facebook.com/pages/Dnr-Farmers-Market/558261570903806,https://www.facebook.com/pages/Dnr-Farmers-Market/558261570903806,,,,,,,06/05/2014 to 09/04/2014,2014-06-05,2014-09-04,Thu: 3:00 PM-6:00 PM;,Thu: 3:00 PM-6:00 PM,,,,,,,,,,,,,,,,,,,,,,,,,,,,,,,,
1010026,Dobson Farmers Market,,,https://www.facebook.com/pages/Surry-County-Farmers-Market/,https://www.facebook.com/pages/Surry-County-Farmers-Market/,,,,,,,04/21/2016 to 10/27/2016,2016-04-21,2016-10-27,Thu: 3:00 PM-6:00 PM;,Thu: 3:00 PM-6:00 PM,,,,,,,,,,,,,,,,,,,,,,,,,,,,,,,,
1000920,Doddridge County Ffa Farmers Market,,,,,,,,,,,,,,,,,,,,,,,,,,,,,,,,,,,,,,,,,,,,,,,
1006185,Dodge City Farmers Market,,,,,,,,,,,,,,,,,,,,,,,,,,,,,,,,,,,,,,,,,,,,,,,
1012462,Dodgeville Farmers Market,http://dodgeville.locallygrown.net,http://dodgeville.locallygrown.net,,,,,,,,,05/14/2016 to 10/29/2016,2016-05-14,2016-10-29,Sat: 8:00 AM-11:00 AM;,Sat: 8:00 AM-11:00 AM,,,,,,,,,,,,,,,,,,,,,,,,,,,,,,,,
1012333,Dogtown Farmers Market,http://dogtownfarmersmarket.com,http://dogtownfarmersmarket.com,dogtownfarmersmarketNLR,,,,,,,,04/23/2016 to 10/22/2016,2016-04-23,2016-10-22,Sat: 7:00 AM-12:00 PM;,Sat: 7:00 AM-12:00 PM,,,,,,,,,,,,,,,,,,,,,,,,,,,,,,,,
1000417,Doherty High School Farmers Market,,,,,,,,,,,,,,,,,,,,,,,,,,,,,,,,,,,,,,,,,,,,,,,
1005692,Dolgeville Farmers Market,http://farmmarket.herkimerhealthnet.com/dolgeville.html,http://farmmarket.herkimerhealthnet.com/dolgeville.html,Dolgville Farmers Market,,,,,,,,05/17/2014 to 10/25/2014,2014-05-17,2014-10-25,Sat: 8:00 AM-12:00 PM;,Sat: 8:00 AM-12:00 PM,,,,,,,,,,,,,,,,,,,,,,,,,,,,,,,,
1007017,Doña Ana Farmers Market,,,,,,,,,,,,,,,,,,,,,,,,,,,,,,,,,,,,,,,,,,,,,,,
1000635,Donnellson Farmers Market,,,,,,,,,,,,,,,,,,,,,,,,,,,,,,,,,,,,,,,,,,,,,,,
1008532,Dora Farmers Market,http://agrimissouri.com/mo-grown/grodetail.php?type=mo-grown&ID=318,http://agrimissouri.com/mo-grown/grodetail.php?type=mo-grown&ID=318,,,,,,,,,04/06/2013 to 10/26/2013,2013-04-06,2013-10-26,Sat: 8:00 AM-12:00 PM;,Sat: 8:00 AM-12:00 PM,,,,,,,,,,,,,,,,,,,,,,,,,,,,,,,,
1003991,Dorchester Fields Corner Farmers Market,,,,,,,,,,,July to October,2010-07-01,2010-10-31,Sat:9:00 AM - 11:30 AM;,Sat:9:00 AM - 11:30 AM,,,,,,,,,,,,,,,,,,,,,,,,,,,,,,,,
1010285,Dorchester Winter Farmers Market,http://www.dotcomcoop.wordpress.com,http://www.dotcomcoop.wordpress.com,https://www.facebook.com/DorchesterWinterFarmersMarket,https://www.facebook.com/DorchesterWinterFarmersMarket,https://twitter.com/dotcommcoop,https://twitter.com/dotcommcoop,,,,,01/04/2015 to 03/29/2015,2015-01-04,2015-03-29,Sun: 12:00 PM-4:00 PM;,Sun: 12:00 PM-4:00 PM,,,,,,,,,,,,,,,,,,,,,,,,,,,,,,,,
1006484,Dorchester/dorchester House Farmers Market,http://www.dorchesterhouse.org,http://www.dorchesterhouse.org,,,,,,,,,06/25/2013 to 10/15/2013,2013-06-25,2013-10-15,Tue: 11:30 AM-1:30 PM;,Tue: 11:30 AM-1:30 PM,,,,,,,,,,,,,,,,,,,,,,,,,,,,,,,,
1006972,Dorchester/grove Hall,,,,,,,,,,,,,,,,,,,,,,,,,,,,,,,,,,,,,,,,,,,,,,,
1012301,Douglas Farmers Market,http://www.douglasfarmersmarket.org,http://www.douglasfarmersmarket.org,https://www.facebook.com/douglasfarmers/?fref=ts,https://www.facebook.com/douglasfarmers/?fref=ts,,,,,https://www.pinterest.com/dfmdouglas/pins/follow/?guid=sBaF_fjNueeh,https://www.pinterest.com/dfmdouglas/pins/follow/?guid=sBaF_fjNueeh,06/18/2016 to 10/01/2016,2016-06-18,2016-10-01,Sat: 9:00 AM-12:00 PM;,Sat: 9:00 AM-12:00 PM,,,,,,,,,,,,,,,,,,,,,,,,,,,,,,,,
1000300,Douglass Farmers Market,http://www.douglassfarmersmarket.wordpress.com,http://www.douglassfarmersmarket.wordpress.com,https://www.facebook.com/pages/Fair-Food-Matters/113123338709080,https://www.facebook.com/pages/Fair-Food-Matters/113123338709080,https://twitter.com/FFMKzoo,https://twitter.com/FFMKzoo,,,,,06/04/2013 to 09/24/2013,2013-06-04,2013-09-24,Tue: 3:00 PM-6:00 PM;,Tue: 3:00 PM-6:00 PM,,,,,,,,,,,,,,,,,,,,,,,,,,,,,,,,
1010834,Douglass Loop Farmers Market,http://www.douglassloopfarmersmarket.com,http://www.douglassloopfarmersmarket.com,www.facebook.com/douglassloopfarmersmarket,,,,,,,,03/14/2015 to 12/05/2015,2015-03-14,2015-12-05,Sat: 10:00 AM-2:00 PM;,Sat: 10:00 AM-2:00 PM,,,,,,,,,,,,,,,,,,,,,,,,,,,,,,,,
1010893,Douglasville Farmers And Artisans Market,,,https://www.facebook.com/DouglasvilleFarmersAndArtisansMarket,https://www.facebook.com/DouglasvilleFarmersAndArtisansMarket,,,,,,,04/15/2015 to 11/11/2015,2015-04-15,2015-11-11,Wed: 4:00 PM-7:00 PM;,Wed: 4:00 PM-7:00 PM,,,,,,,,,,,,,,,,,,,,,,,,,,,,,,,,
1003046,Dousman Farmers Market,http://www.dousmanchamber.org/farmers_market.html,http://www.dousmanchamber.org/farmers_market.html,https://www.facebook.com/DousmanFarmersMarket,https://www.facebook.com/DousmanFarmersMarket,,,,,,,05/01/2015 to 10/21/2015,2015-05-01,2015-10-21,Wed: 2:00 PM-6:00 PM;,Wed: 2:00 PM-6:00 PM,,,,,,,,,,,,,,,,,,,,,,,,,,,,,,,,
1011289,Dover Cove Farmers Market,,,https://www.facebook.com/DoverCoveFarmersMarket?fref=ts,https://www.facebook.com/DoverCoveFarmersMarket?fref=ts,,,,,,,05/23/2015 to 10/24/2015,2015-05-23,2015-10-24,Tue: 2:00 PM-6:00 PM;Sat: 9:00 AM-1:00 PM;,Tue: 2:00 PM-6:00 PM,Sat: 9:00 AM-1:00 PM,,,,,,,,,,,,,,,,,,,,,,,,,,,,,,,
1009829,Dover Farmers Market,http://www.seacoastgrowers.org,http://www.seacoastgrowers.org,https://www.facebook.com/Market03820,https://www.facebook.com/Market03820,https://twitter.com/market03820,https://twitter.com/market03820,,,,,06/03/2015 to 10/07/2015,2015-06-03,2015-10-07,Wed: 2:30 PM-6:00 PM;,Wed: 2:30 PM-6:00 PM,,,,,,,,,,,,,,,,,,,,,,,,,,,,,,,,
1006655,Downey Cfm,,,,,,,,,,,,,,,,,,,,,,,,,,,,,,,,,,,,,,,,,,,,,,,
1010809,Downs Village Market,,,,,,,,,,,06/03/2015 to 09/30/2015,2015-06-03,2015-09-30,Wed: 4:00 PM-6:00 PM;,Wed: 4:00 PM-6:00 PM,,,,,,,,,,,,,,,,,,,,,,,,,,,,,,,,
1009391,Downtown 3rd Farmers Market,,,https://www.facebook.com/Downtown3rdFarmersMarket,https://www.facebook.com/Downtown3rdFarmersMarket,,,,,,,,,,,,,,,,,,,,,,,,,,,,,,,,,,,,,,,,,,,
1000570,Downtown Albany Farmers Market,,,,,,,,,,,,,,,,,,,,,,,,,,,,,,,,,,,,,,,,,,,,,,,
1009043,Downtown Allen Park Farmers Market,http://www.allenparkdowntown.com,http://www.allenparkdowntown.com,https://www.facebook.com/allenpark.dda?sk=wall,https://www.facebook.com/allenpark.dda?sk=wall,,,,,,,06/05/2015 to 10/30/2015,2015-06-05,2015-10-30,Fri: 2:00 AM-7:00 AM;,Fri: 2:00 AM-7:00 AM,,,,,,,,,,,,,,,,,,,,,,,,,,,,,,,,
1006153,Downtown Amory Farmers Market,,,,,,,,,,,,,,,,,,,,,,,,,,,,,,,,,,,,,,,,,,,,,,,
1010455,Downtown Anaheim Certified Farmers Market,http://www.anaheimfarmersmarkets.com,http://www.anaheimfarmersmarkets.com,https://www.facebook.com/AnaheimFarmersMarket,https://www.facebook.com/AnaheimFarmersMarket,twitter.com/downtownanaheim,,,,instagram.com/downtownanaheim,instagram.com/downtownanaheim,01/01/2016 to 12/31/2016,2016-01-01,2016-12-31,Thu: 11:00 AM-4:00 PM;,Thu: 11:00 AM-4:00 PM,,,,,,,,,,,,,,,,,,,,,,,,,,,,,,,,
1000432,Downtown Appleton Indoor Winter Farm Market,http://www.appletondowntown.org,http://www.appletondowntown.org,https://www.facebook.com/downtownappletonfarmmarket,https://www.facebook.com/downtownappletonfarmmarket,,,,,,,11/01/2016 to 05/27/2017,2016-11-01,2017-05-27,Sat: 9:00 AM-12:30 PM;,Sat: 9:00 AM-12:30 PM,,,,,,,,,,,,,,,,,,,,,,,,,,,,,,,,
1008815,Downtown Arlington Farmers Market,http://WWW.downtownarlingtonfarmersmarket.com,http://WWW.downtownarlingtonfarmersmarket.com,https://www.facebook.com/downtownarlingtonfarmersmarket,https://www.facebook.com/downtownarlingtonfarmersmarket,,,,,,,01/01/2013 to 12/31/2013,2013-01-01,2013-12-31,Fri: 8:00 AM-1:00 PM;Sat: 8:00 AM-1:00 PM;,Fri: 8:00 AM-1:00 PM,Sat: 8:00 AM-1:00 PM,,,,,,01/02/2014 to 12/31/2014,1/2/14, 12/31/2014,Fri: 8:00 AM-1:00 PM;Sat: 8:00 AM-1:00 PM;,Fri: 8:00 AM-1:00 PM,Sat: 8:00 AM-1:00 PM,,,,,,,,,,,,,,,,,,,,
1009355,Downtown Ashtabula Farmers Market,http://www.localharvest.org/downtown-ashtabula-farmers-market-M59118,http://www.localharvest.org/downtown-ashtabula-farmers-market-M59118,,,,,,,,,,,,,,,,,,,,,,,,,,,,,,,,,,,,,,,,,,,,,
1000439,Downtown Batavia Public Market,http://www.downtownbataviany.com,http://www.downtownbataviany.com,,,,,,,,,,,,,,,,,,,,,,,,,,,,,,,,,,,,,,,,,,,,,
1004124,Downtown Bay City Farmers Market,http://www.downtownbaycityfarmersmarket.org,http://www.downtownbaycityfarmersmarket.org,https://www.facebook.com/pages/Downtown-Bay-City-Farmers-Market/200900103265896,https://www.facebook.com/pages/Downtown-Bay-City-Farmers-Market/200900103265896,,,,,,,06/04/2015 to 10/22/2015,2015-06-04,2015-10-22,Thu: 10:00 AM-3:00 PM;,Thu: 10:00 AM-3:00 PM,,,,,,,,,,,,,,,,,,,,,,,,,,,,,,,,
1005160,Downtown Beaufort Farmers Market,,,https://www.facebook.com/Downtownbftfarmersmarket/?fref=ts,https://www.facebook.com/Downtownbftfarmersmarket/?fref=ts,,,,,,,05/04/2016 to 10/26/2016,2016-05-04,2016-10-26,Wed: 2:00 PM-6:00 PM;,Wed: 2:00 PM-6:00 PM,,,,,,,,,,,,,,,,,,,,,,,,,,,,,,,,
1012298,Downtown Bedford Farmers Market,http://www.downtownbedford.com,http://www.downtownbedford.com,https://www.facebook.com/DowntownBedford/?fref=ts,https://www.facebook.com/DowntownBedford/?fref=ts,,,,,,,05/18/2016 to 10/26/2016,2016-05-18,2016-10-26,Wed: 9:00 AM-1:00 PM;,Wed: 9:00 AM-1:00 PM,,,,,,,,,,,,,,,,,,,,,,,,,,,,,,,,
1003643,Downtown Beloit Farmers Market,http://www.downtownbeloit.com,http://www.downtownbeloit.com,https://www.facebook.com/BeloitFarmersMarket?ref=hl,https://www.facebook.com/BeloitFarmersMarket?ref=hl,,,,,,,05/07/2016 to 10/29/2016,2016-05-07,2016-10-29,Sat: 8:00 AM-1:00 PM;,Sat: 8:00 AM-1:00 PM,,,,,,,,,,,,,,,,,,,,,,,,,,,,,,,,
1001026,Downtown Berkeley Farmers Market,http://ecologycenter.org/fm,http://ecologycenter.org/fm,,,https://twitter.com/ecbfm,https://twitter.com/ecbfm,,,,,01/01/2014 to 12/31/2014,2014-01-01,2014-12-31,Sat: 10:00 AM-3:00 PM;,Sat: 10:00 AM-3:00 PM,,,,,,,,,,,,,,,,,,,,,,,,,,,,,,,,
1009172,Downtown Big Rapids Farmers Market,,,https://www.facebook.com/pages/Downtown-Big-Rapids-Farmers-Market/152427584813743,https://www.facebook.com/pages/Downtown-Big-Rapids-Farmers-Market/152427584813743,,,,,,,,,,,,,,,,,,,,,,,,,,,,,,,,,,,,,,,,,,,
1000288,Downtown Binghamton Farmers Market,http://www.binghamtonfarmersmarket.com,http://www.binghamtonfarmersmarket.com,https://www.facebook.com/BinghamtonFarmersMarket,https://www.facebook.com/BinghamtonFarmersMarket,,,,,,,,,,,,,,,,,,,,,,,,,,,,,,,,,,,,,,,,,,,
1012323,Downtown Bloomington Association Farmers Market,http://downtownbloomington.org/farmers-market/,http://downtownbloomington.org/farmers-market/,https://www.facebook.com/DBAFarmersMarket/,https://www.facebook.com/DBAFarmersMarket/,DBFarmersMarket,,,,,,05/07/2016 to 10/29/2016,2016-05-07,2016-10-29,Sat: 7:30 AM-12:00 PM;,Sat: 7:30 AM-12:00 PM,,,,,,,,,,,,,,,,,,,,,,,,,,,,,,,,
1012331,Downtown Bloomington Farmers Market- Indoor,http://www.downtownbloomington.org/farmers-market/,http://www.downtownbloomington.org/farmers-market/,DBAFarmersMarket,,DBFarmersMarket,,,,,,11/19/2016 to 04/15/2017,2016-11-19,2017-04-15,Sat: 10:00 AM-12:00 PM;,Sat: 10:00 AM-12:00 PM,,,,,,,,,,,,,,,,,,,,,,,,,,,,,,,,
1004524,Downtown Bowling Green Farmers Market,http://www.downtownbgohio.org/farmersmarket,http://www.downtownbgohio.org/farmersmarket,,,,,,,,,05/21/2014 to 10/15/2014,2014-05-21,2014-10-15,Wed: 4:00 PM-7:00 PM;,Wed: 4:00 PM-7:00 PM,,,,,,,,,,,,,,,,,,,,,,,,,,,,,,,,
1009176,Downtown Buda Farmers Market,,,https://www.facebook.com/dbfma,https://www.facebook.com/dbfma,,,,,,,,,,,,,,,,,,,,,,,,,,,,,,,,,,,,,,,,,,,
1004276,Downtown Buffalo Country Market,http://www.buffaloplace.com,http://www.buffaloplace.com,,,,,,,,,May to October,2010-05-01,2010-10-31,Tue:8:00 AM - 2:30 PM;Thu:8:00 AM - 2:30 PM;,Tue:8:00 AM - 2:30 PM,Thu:8:00 AM - 2:30 PM,,,,,,,,,,,,,,,,,,,,,,,,,,,,,,,
1000769,Downtown Burlington Farmers Market,http://www.burlingtonwifarmersmarket.com,http://www.burlingtonwifarmersmarket.com,,,,,,,,,05/02/2013 to 10/31/2013,2013-05-02,2013-10-31,Thu: 3:00 PM-7:00 PM;,Thu: 3:00 PM-7:00 PM,,,,,,,,,,,,,,,,,,,,,,,,,,,,,,,,
1010230,Downtown Casper Community Farmers Market,http://www.casperfarmersmarket.com,http://www.casperfarmersmarket.com,https://www.facebook.com/caspermarket,https://www.facebook.com/caspermarket,,,,,,,07/15/2014 to 09/16/2014,2014-07-15,2014-09-16,Tue: 5:00 PM-7:30 PM;,Tue: 5:00 PM-7:30 PM,,,,,,,,,,,,,,,,,,,,,,,,,,,,,,,,
1006427,Downtown Chico Thursday Night Market,http://www.downtownchico.com/events/dcbaevents/tnm,http://www.downtownchico.com/events/dcbaevents/tnm,,,,,,,,,04/03/2014 to 09/25/2014,2014-04-03,2014-09-25,Thu: 6:00 PM-9:00 PM;,Thu: 6:00 PM-9:00 PM,,,,,,,,,,,,,,,,,,,,,,,,,,,,,,,,
1001410,Downtown City Market,http://www.dsfair.com,http://www.dsfair.com,,,,,,,,,,,,,,,,,,,,,,,,,,,,,,,,,,,,,,,,,,,,,
1005013,Downtown Clearfield Farmers Market,http://www.clearfieldcity.org,http://www.clearfieldcity.org,,,,,,,,,,,,,,,,,,,,,,,,,,,,,,,,,,,,,,,,,,,,,
1008507,Downtown Clearwater Farmers Market,http://www.downtownclearwaterfarmersmarket.com,http://www.downtownclearwaterfarmersmarket.com,https://www.facebook.com/CWFarmersMarket,https://www.facebook.com/CWFarmersMarket,,,,,,,,,,,,,,,,,,,,,,,,,,,,,,,,,,,,,,,,,,,
1000589,Downtown Clermont Farmers Market,http://www.clermontdowntownpartnership.org,http://www.clermontdowntownpartnership.org,,,,,,,,,,,,,,,,,,,,,,,,,,,,,,,,,,,,,,,,,,,,,
1010837,Downtown Cleveland Farmers Market,http://www.downtownclevelandmarket.org/,http://www.downtownclevelandmarket.org/,https://www.facebook.com/downtownclevelandmarket?ref=tn_tnmn,https://www.facebook.com/downtownclevelandmarket?ref=tn_tnmn,https://twitter.com/DFMPublicSquare,https://twitter.com/DFMPublicSquare,,,https://instagram.com/downtownclemarket/,https://instagram.com/downtownclemarket/,01/01/2015 to 12/31/2015,2015-01-01,2015-12-31,Fri: 11:00 AM-2:00 PM;,Fri: 11:00 AM-2:00 PM,,,,,,,,,,,,,,,,,,,,,,,,,,,,,,,,
1005112,Downtown Columbus Farmers Market,,,,,,,,,,,June to October,2010-06-01,2010-10-31,Wed:3:00 pm - 6:00 pm;,Wed:3:00 pm - 6:00 pm,,,,,,,,,,,,,,,,,,,,,,,,,,,,,,,,
1007589,Downtown Cumberland,,,,,,,,,,,,,,,,,,,,,,,,,,,,,,,,,,,,,,,,,,,,,,,
1012519,Downtown Dalton Farmers Market,http://www.downtowndalton.com,http://www.downtowndalton.com,Downtown Dalton Farmers Market,,,,,,,,05/07/2016 to 08/27/2016,2016-05-07,2016-08-27,Tue: 4:00 PM-7:00 PM;Sat: 8:00 AM-12:00 PM;,Tue: 4:00 PM-7:00 PM,Sat: 8:00 AM-12:00 PM,,,,,,,,,,,,,,,,,,,,,,,,,,,,,,,
1002641,Downtown Danville Farmers Market,http://www.downtowndanville.org,http://www.downtowndanville.org,https://www.facebook.com/DanvilleFM,https://www.facebook.com/DanvilleFM,https://twitter.com/DanvilleFM,https://twitter.com/DanvilleFM,,,,,05/17/2014 to 10/04/2014,2014-05-17,2014-10-04,Tue: 2:00 PM-7:00 PM;Sat: 8:00 AM-1:00 PM;,Tue: 2:00 PM-7:00 PM,Sat: 8:00 AM-1:00 PM,,,,,,,,,,,,,,,,,,,,,,,,,,,,,,,
1000841,Downtown Denison Farmers Market,http://www.downtowndenisonfarmersmarket.com,http://www.downtowndenisonfarmersmarket.com,https://www.facebook.com/denison.farmermarket?fref=ts,https://www.facebook.com/denison.farmermarket?fref=ts,,,,,Downtown Denison Farmers Market (FaceBook business page),Downtown Denison Farmers Market (FaceBook business page),04/27/2013 to 10/26/2013,2013-04-27,2013-10-26,Wed: 3:00 PM-6:00 PM;Sat: 9:00 AM-12:00 PM;,Wed: 3:00 PM-6:00 PM,Sat: 9:00 AM-12:00 PM,,,,,,,,,,,,,,,,,,,,,,,,,,,,,,,
1001616,Downtown Downers Grove Market,http://www.indianboundaryymca.org/downtownmarket,http://www.indianboundaryymca.org/downtownmarket,,,,,,,,,05/11/2013 to 10/19/2013,2013-05-11,2013-10-19,Sat: 7:00 AM-12:30 PM;,Sat: 7:00 AM-12:30 PM,,,,,,,,,,,,,,,,,,,,,,,,,,,,,,,,
1012192,Downtown El Cajon Farmers Market,,,https://www.facebook.com/DowntownElCajonFarmersMarket/,https://www.facebook.com/DowntownElCajonFarmersMarket/,,,,,,,07/07/2016 to 08/25/2016,2016-07-07,2016-08-25,Thu: 3:00 PM-7:00 PM;,Thu: 3:00 PM-7:00 PM,,,,,,,09/01/2016 to 12/01/2016,9/1/16, 12/01/2016,Thu: 3:00 AM-6:00 PM;,Thu: 3:00 AM-6:00 PM,,,,,,,1/1/16, 05/26/2016,Thu: 3:00 PM-6:00 PM;,Thu: 3:00 PM-6:00 PM,,,,,,,,,,,
1003413,Downtown Elgin Harvest Market,http://www.elginharvestmarket.com,http://www.elginharvestmarket.com,https://www.facebook.com/ElginHarvestMarket,https://www.facebook.com/ElginHarvestMarket,,,,,,,06/02/2016 to 10/06/2016,2016-06-02,2016-10-06,Thu: 9:00 AM-2:00 PM;,Thu: 9:00 AM-2:00 PM,,,,,,,,,,,,,,,,,,,,,,,,,,,,,,,,
1010769,Downtown Evanston Farmers Market,http://cityofevanston.org,http://cityofevanston.org,Evanston farmers markets,,,,,,,,05/09/2015 to 11/07/2015,2015-05-09,2015-11-07,Sat: 7:30 AM-1:00 PM;,Sat: 7:30 AM-1:00 PM,,,,,,,,,,,,,,,,,,,,,,,,,,,,,,,,
1008853,Downtown Evansville Farmers Market,http://www.downtownevansvillefarmersmarket.com,http://www.downtownevansvillefarmersmarket.com,https://www.facebook.com/VanderburghCountyFarmBureauFarmersMarket,https://www.facebook.com/VanderburghCountyFarmBureauFarmersMarket,,,,,,,05/16/2014 to 09/26/2014,2014-05-16,2014-09-26,Fri: 8:00 AM-1:00 PM;,Fri: 8:00 AM-1:00 PM,,,,,,,,,,,,,,,,,,,,,,,,,,,,,,,,
1004470,Downtown Farmerington Farmers Market,http://www.ci.farmington.mn.us,http://www.ci.farmington.mn.us,,,,,,,,,,,,,,,,,,,,,,,,,,,,,,,,,,,,,,,,,,,,,
1000140,Downtown Farmers And Produce Market,http://www.tallahasseedowntown.com,http://www.tallahasseedowntown.com,,,,,,,,,,,,,,,,,,,,,,,,,,,,,,,,,,,,,,,,,,,,,
1001931,Downtown Farmers Market,,,,,,,,,,,,,,,,,,,,,,,,,,,,,,,,,,,,,,,,,,,,,,,
1002400,Downtown Farmers Market,http://www.murraymainstreet.org,http://www.murraymainstreet.org,https://www.facebook.com/satmarket,https://www.facebook.com/satmarket,https://twitter.com/murraymainst,https://twitter.com/murraymainst,,,,,05/21/2016 to 10/29/2016,2016-05-21,2016-10-29,Sat: 7:00 AM-12:00 PM;,Sat: 7:00 AM-12:00 PM,,,,,,,,,,,,,,,,,,,,,,,,,,,,,,,,
1002635,Downtown Farmers Market,,,,,,,,,,,,,,,,,,,,,,,,,,,,,,,,,,,,,,,,,,,,,,,
1010080,Downtown Farmers Market,http://downtownwallawalla.com/downtownfarmersmarket/,http://downtownwallawalla.com/downtownfarmersmarket/,,,,,,,,,05/03/2014 to 10/25/2014,2014-05-03,2014-10-25,Sat: 9:00 AM-1:00 PM;,Sat: 9:00 AM-1:00 PM,,,,,,,06/05/2014 to 09/25/2014,6/5/14, 09/25/2014,Thu: 4:00 PM-7:30 PM;,Thu: 4:00 PM-7:30 PM,,,,,,,,,,,,,,,,,,,,,
1006820,Downtown Farmers Market Sponsored By West Liberty Chamber Of Commerce,http://www.westlibertyiowa.com,http://www.westlibertyiowa.com,https://www.facebook.com/westlibertydowntownfm/,https://www.facebook.com/westlibertydowntownfm/,,,,,,,05/04/2016 to 10/26/2016,2016-05-04,2016-10-26,Wed: 4:00 PM-7:00 PM;,Wed: 4:00 PM-7:00 PM,,,,,,,,,,,,,,,,,,,,,,,,,,,,,,,,
1002946,Downtown Farmers Market - Racine,,,,,,,,,,,,,,,,,,,,,,,,,,,,,,,,,,,,,,,,,,,,,,,
1000039,Downtown Farmers Market Arts And Crafts Mercado,,,,,,,,,,,,,,,,,,,,,,,,,,,,,,,,,,,,,,,,,,,,,,,
1003759,Downtown Farmers Market At Ancestor Square,http://www.farmersmarketdowntown.com,http://www.farmersmarketdowntown.com,https://www.facebook.com/downtownfarmersmarketstgeorge,https://www.facebook.com/downtownfarmersmarketstgeorge,,,,,,,05/09/2015 to 10/31/2015,2015-05-09,2015-10-31,Sat: 8:00 AM-12:00 PM;,Sat: 8:00 AM-12:00 PM,,,,,,,,,,,,,,,,,,,,,,,,,,,,,,,,
1002184,Downtown Farmers Market At Riverside,http://www.riversideca.gov/arts/farmers-market.asp,http://www.riversideca.gov/arts/farmers-market.asp,https://www.facebook.com/DowntownFarmersMarketRiverside?fref=ts,https://www.facebook.com/DowntownFarmersMarketRiverside?fref=ts,,,,,,,,,,Sat: 8:00 AM-1:00 PM;,Sat: 8:00 AM-1:00 PM,,,,,,,,,,,,,,,,,,,,,,,,,,,,,,,,
1001987,Downtown Farmers Market I,,,,,,,,,,,,,,,,,,,,,,,,,,,,,,,,,,,,,,,,,,,,,,,
1004902,Downtown Farmers Market I,,,,,,,,,,,,,,,,,,,,,,,,,,,,,,,,,,,,,,,,,,,,,,,
1004901,Downtown Farmers Market Ii,,,,,,,,,,,,,,,,,,,,,,,,,,,,,,,,,,,,,,,,,,,,,,,
1006931,Downtown Farmers Market Ii,,,,,,,,,,,,,,,,,,,,,,,,,,,,,,,,,,,,,,,,,,,,,,,
1004900,Downtown Farmers Market Iii,,,,,,,,,,,,,,,,,,,,,,,,,,,,,,,,,,,,,,,,,,,,,,,
1010854,Downtown Farmers Market,http://www.downtownduluth.com,http://www.downtownduluth.com,,,GDCduluth,,,,,,07/14/2015 to 09/29/2015,2015-07-14,2015-09-29,Tue: 11:00 AM-1:00 PM;,Tue: 11:00 AM-1:00 PM,,,,,,,,,,,,,,,,,,,,,,,,,,,,,,,,
1012608,Downtown Farmers Market - Des Moines,http://www.desmoinesfarmersmarket.com/,http://www.desmoinesfarmersmarket.com/,https://www.facebook.com/DowntownFarmersMarket/,https://www.facebook.com/DowntownFarmersMarket/,https://twitter.com/DTFarmersMarket,https://twitter.com/DTFarmersMarket,https://www.youtube.com/user/Downtown50309,https://www.youtube.com/user/Downtown50309,,,05/07/2016 to 09/24/2016,2016-05-07,2016-09-24,Sat: 7:00 AM-12:00 PM;,Sat: 7:00 AM-12:00 PM,,,,,,,10/01/2016 to 10/29/2016,10/1/16, 10/29/2016,Sat: 8:00 AM-12:00 PM;,Sat: 8:00 AM-12:00 PM,,,,,,,,,,,,,,,,,,,,,
1006081,"Downtown Farmers Market Of Fort Pierce, Inc.",http://www.fortpiercefarmersmarket.com/,http://www.fortpiercefarmersmarket.com/,https://www.facebook.com/pages/Fort-Pierce-Farmers-Market/298599473536315,https://www.facebook.com/pages/Fort-Pierce-Farmers-Market/298599473536315,,,,,,,01/01/2014 to 12/31/2014,2014-01-01,2014-12-31,Sat: 8:00 AM-12:00 PM;,Sat: 8:00 AM-12:00 PM,,,,,,,,,,,,,,,,,,,,,,,,,,,,,,,,
1011952,Downtown Farmers Market Victoria,http://Downtownfarmersmarketvictoria.org,http://Downtownfarmersmarketvictoria.org,VictoriaDowntownFarmersMarket,,VictoriaDTFM,,,,IG: VictoriaDTFM,IG: VictoriaDTFM,04/09/2016 to 11/19/2016,2016-04-09,2016-11-19,Sat: 9:00 AM-1:00 PM;,Sat: 9:00 AM-1:00 PM,,,,,,,10/01/2016 to 07/21/2017,10/1/16, 07/21/2017,Sat: 9:00 AM-1:00 PM;,Sat: 9:00 AM-1:00 PM,,,,,,,,,,,,,,,,,,,,,
1002706,Downtown Festival Market,,,,,,,,,,,,,,,,,,,,,,,,,,,,,,,,,,,,,,,,,,,,,,,
